Correct the test code delimited by ***** according to the error messages delimited by ##### and generate another complete code in JUnit 4 format. The response must contain only Java code in JUnit 4 format.

Keep these five instructions for this generated test code:

Instruction 1: Keet this package line to generated test code file:
package org.restscs;

Instruction 2: Keep the following Java imports to generated test code file:
import  org.junit.AfterClass;
import  org.junit.BeforeClass;
import  org.junit.Before;
import  org.junit.Test;
import static org.junit.Assert.*;
import  java.util.Map;
import  java.util.List;
import static org.evomaster.client.java.controller.api.EMTestUtils.*;
import  org.evomaster.client.java.controller.SutHandler;
import  io.restassured.RestAssured;
import static io.restassured.RestAssured.given;
import  io.restassured.response.ValidatableResponse;
import static org.hamcrest.Matchers.*;
import  io.restassured.config.JsonConfig;
import  io.restassured.path.json.config.JsonPathConfig;
import static io.restassured.config.RedirectConfig.redirectConfig;
import static org.evomaster.client.java.controller.contentMatchers.NumberMatcher.*;
import static org.evomaster.client.java.controller.contentMatchers.StringMatcher.*;
import static org.evomaster.client.java.controller.contentMatchers.SubStringMatcher.*;
import static org.evomaster.client.java.controller.expect.ExpectationHandler.expectationHandler;
import  org.evomaster.client.java.controller.expect.ExpectationHandler;
import  io.restassured.path.json.JsonPath;
import  java.util.Arrays;

Instruction 3: Keep the same class name in this point (between the imports at instruction 2 and instruction 4)

Instruction 4: Keep these variables in the generated test code:
private static final SutHandler controller = new em.embedded.org.restscs.EmbeddedEvoMasterController();
private static String baseUrlOfSut;

Instruction 5: Keep the following setup and teardown methods in generated test code file:
@BeforeClass
public static void initClass() {
    controller.setupForGeneratedTest();
    baseUrlOfSut = controller.startSut();
    controller.registerOrExecuteInitSqlCommandsIfNeeded();
    assertNotNull(baseUrlOfSut);
    RestAssured.enableLoggingOfRequestAndResponseIfValidationFails();
    RestAssured.useRelaxedHTTPSValidation();
    RestAssured.urlEncodingEnabled = false;
    RestAssured.config = RestAssured.config()
        .jsonConfig(JsonConfig.jsonConfig().numberReturnType(JsonPathConfig.NumberReturnType.DOUBLE))
        .redirect(redirectConfig().followRedirects(false));
}


@AfterClass
public static void tearDown() {
    controller.stopSut();
}


@Before
public void initTest() {
    controller.resetStateOfSUT();
}


*****

package org.restscs;

import org.junit.AfterClass;
import org.junit.BeforeClass;
import org.junit.Before;
import org.junit.Test;
import static org.junit.Assert.*;
import java.util.Map;
import java.util.List;
import static org.evomaster.client.java.controller.api.EMTestUtils.*;
import org.evomaster.client.java.controller.SutHandler;
import io.restassured.RestAssured;
import static io.restassured.RestAssured.given;
import io.restassured.response.ValidatableResponse;
import static org.hamcrest.Matchers.*;
import io.restassured.config.JsonConfig;
import io.restassured.path.json.config.JsonPathConfig;
import static io.restassured.config.RedirectConfig.redirectConfig;
import static org.evomaster.client.java.controller.contentMatchers.NumberMatcher.*;
import static org.evomaster.client.java.controller.contentMatchers.StringMatcher.*;
import static org.evomaster.client.java.controller.contentMatchers.SubStringMatcher.*;
import static org.evomaster.client.java.controller.expect.ExpectationHandler.expectationHandler;
import org.evomaster.client.java.controller.expect.ExpectationHandler;
import io.restassured.path.json.JsonPath;
import java.util.Arrays;

public class v3_gpt4turbo_run01_CostfunsTest {

    private static final SutHandler controller = new em.embedded.org.restscs.EmbeddedEvoMasterController();
    private static String baseUrlOfSut;

    @BeforeClass
    public static void initClass() {
        controller.setupForGeneratedTest();
        baseUrlOfSut = controller.startSut();
        controller.registerOrExecuteInitSqlCommandsIfNeeded();
        assertNotNull(baseUrlOfSut);
        RestAssured.enableLoggingOfRequestAndResponseIfValidationFails();
        RestAssured.useRelaxedHTTPSValidation();
        RestAssured.urlEncodingEnabled = false;
        RestAssured.config = RestAssured.config()
            .jsonConfig(JsonConfig.jsonConfig().numberReturnType(JsonPathConfig.NumberReturnType.DOUBLE))
            .redirect(redirectConfig().followRedirects(false));
    }

    @AfterClass
    public static void tearDown() {
        controller.stopSut();
    }

    @Before
    public void initTest() {
        controller.resetStateOfSUT();
    }

    @Test
    public void testSubjectWithIEquals5() {
        given().pathParam("i", 5).pathParam("s", "baab")
            .when().get(baseUrlOfSut + "/api/costfuns/{i}/{s}")
            .then().statusCode(200)
            .body(equalTo("1"));
    }

    @Test
    public void testSubjectWithILessThanMinus444() {
        given().pathParam("i", -445).pathParam("s", "baab")
            .when().get(baseUrlOfSut + "/api/costfuns/{i}/{s}")
            .then().statusCode(200)
            .body(equalTo("2"));
    }

    @Test
    public void testSubjectWithIGreaterThan666() {
        given().pathParam("i", 667).pathParam("s", "baab")
            .when().get(baseUrlOfSut + "/api/costfuns/{i}/{s}")
            .then().statusCode(200)
            .body(equalTo("4"));
    }

    @Test
    public void testSubjectWithIEqualsMinus4() {
        given().pathParam("i", -4).pathParam("s", "baab")
            .when().get(baseUrlOfSut + "/api/costfuns/{i}/{s}")
            .then().statusCode(200)
            .body(equalTo("0"));  // Assuming the default case is returned '0' when all conditions fail.
    }

    @Test
    public void testSubjectWithInvalidInput() {
        given().pathParam("i", "invalid").pathParam("s", "baab")
            .when().get(baseUrlOfSut + "/api/costfuns/{i}/{s}")
            .then().statusCode(500);
    }

    @Test
    public void testSubjectWithBoundaryValue() {
        given().pathParam("i", Integer.MAX_VALUE).pathParam("s", "baab")
            .when().get(baseUrlOfSut + "/api/costfuns/{i}/{s}")
            .then().statusCode(200)
            .body(anyOf(equalTo("4"), equalTo("5")));
    }

    @Test
    public void testSubjectWithSpecialCharactersInString() {
        given().pathParam("i", 5).pathParam("s", "ba@#$$%^&*()ab")
            .when().get(baseUrlOfSut + "/api/costfuns/{i}/{s}")
            .then().statusCode(200)
            .body(equalTo("1"));
    }
}

*****
#####
[[1;34mINFO[m] Scanning for projects...
[[1;34mINFO[m] 
[[1;34mINFO[m] [1m------< [0;36morg.evomaster:evomaster-benchmark-cs-rest-artificial-scs[0;1m >------[m
[[1;34mINFO[m] [1mBuilding evomaster-benchmark-cs-rest-artificial-scs 3.0.0[m
[[1;34mINFO[m] [1m--------------------------------[ jar ]---------------------------------[m
[[1;34mINFO[m] 
[[1;34mINFO[m] [1m--- [0;32mmaven-clean-plugin:2.5:clean[m [1m(default-clean)[m @ [36mevomaster-benchmark-cs-rest-artificial-scs[0;1m ---[m
[[1;34mINFO[m] Deleting /media/rincon/63999417195/eclipse-workspace/EMB-master/jdk_8_maven/cs/rest/artificial/scs/target
[[1;34mINFO[m] 
[[1;34mINFO[m] [1m--- [0;32mjacoco-maven-plugin:0.8.7:prepare-agent[m [1m(default)[m @ [36mevomaster-benchmark-cs-rest-artificial-scs[0;1m ---[m
[[1;34mINFO[m] argLine set to -javaagent:/home/rincon/.m2/repository/org/jacoco/org.jacoco.agent/0.8.7/org.jacoco.agent-0.8.7-runtime.jar=destfile=/media/rincon/63999417195/eclipse-workspace/EMB-master/jdk_8_maven/cs/rest/artificial/scs/target/jacoco.exec
[[1;34mINFO[m] 
[[1;34mINFO[m] [1m--- [0;32mmaven-resources-plugin:2.6:resources[m [1m(default-resources)[m @ [36mevomaster-benchmark-cs-rest-artificial-scs[0;1m ---[m
[[1;34mINFO[m] Using 'UTF-8' encoding to copy filtered resources.
[[1;34mINFO[m] skip non existing resourceDirectory /media/rincon/63999417195/eclipse-workspace/EMB-master/jdk_8_maven/cs/rest/artificial/scs/src/main/resources
[[1;34mINFO[m] 
[[1;34mINFO[m] [1m--- [0;32mmaven-compiler-plugin:3.8.0:compile[m [1m(default-compile)[m @ [36mevomaster-benchmark-cs-rest-artificial-scs[0;1m ---[m
[[1;34mINFO[m] Changes detected - recompiling the module!
[[1;34mINFO[m] Compiling 14 source files to /media/rincon/63999417195/eclipse-workspace/EMB-master/jdk_8_maven/cs/rest/artificial/scs/target/classes
[[1;34mINFO[m] 
[[1;34mINFO[m] [1m--- [0;32mjacoco-maven-plugin:0.8.7:prepare-agent[m [1m(default)[m @ [36mevomaster-benchmark-cs-rest-artificial-scs[0;1m ---[m
[[1;34mINFO[m] argLine set to -javaagent:/home/rincon/.m2/repository/org/jacoco/org.jacoco.agent/0.8.7/org.jacoco.agent-0.8.7-runtime.jar=destfile=/media/rincon/63999417195/eclipse-workspace/EMB-master/jdk_8_maven/cs/rest/artificial/scs/target/jacoco.exec
[[1;34mINFO[m] 
[[1;34mINFO[m] [1m--- [0;32mmaven-resources-plugin:2.6:resources[m [1m(default-resources)[m @ [36mevomaster-benchmark-cs-rest-artificial-scs[0;1m ---[m
[[1;34mINFO[m] Using 'UTF-8' encoding to copy filtered resources.
[[1;34mINFO[m] skip non existing resourceDirectory /media/rincon/63999417195/eclipse-workspace/EMB-master/jdk_8_maven/cs/rest/artificial/scs/src/main/resources
[[1;34mINFO[m] 
[[1;34mINFO[m] [1m--- [0;32mmaven-compiler-plugin:3.8.0:compile[m [1m(default-compile)[m @ [36mevomaster-benchmark-cs-rest-artificial-scs[0;1m ---[m
[[1;34mINFO[m] Changes detected - recompiling the module!
[[1;34mINFO[m] Compiling 14 source files to /media/rincon/63999417195/eclipse-workspace/EMB-master/jdk_8_maven/cs/rest/artificial/scs/target/classes
[[1;34mINFO[m] 
[[1;34mINFO[m] [1m--- [0;32mmaven-resources-plugin:2.6:testResources[m [1m(default-testResources)[m @ [36mevomaster-benchmark-cs-rest-artificial-scs[0;1m ---[m
[[1;34mINFO[m] Using 'UTF-8' encoding to copy filtered resources.
[[1;34mINFO[m] skip non existing resourceDirectory /media/rincon/63999417195/eclipse-workspace/EMB-master/jdk_8_maven/cs/rest/artificial/scs/src/test/resources
[[1;34mINFO[m] 
[[1;34mINFO[m] [1m--- [0;32mmaven-compiler-plugin:3.8.0:testCompile[m [1m(default-testCompile)[m @ [36mevomaster-benchmark-cs-rest-artificial-scs[0;1m ---[m
[[1;34mINFO[m] Changes detected - recompiling the module!
[[1;34mINFO[m] Compiling 1 source file to /media/rincon/63999417195/eclipse-workspace/EMB-master/jdk_8_maven/cs/rest/artificial/scs/target/test-classes
[[1;34mINFO[m] 
[[1;34mINFO[m] [1m--- [0;32mjacoco-maven-plugin:0.8.7:prepare-agent[m [1m(default)[m @ [36mevomaster-benchmark-cs-rest-artificial-scs[0;1m ---[m
[[1;34mINFO[m] argLine set to -javaagent:/home/rincon/.m2/repository/org/jacoco/org.jacoco.agent/0.8.7/org.jacoco.agent-0.8.7-runtime.jar=destfile=/media/rincon/63999417195/eclipse-workspace/EMB-master/jdk_8_maven/cs/rest/artificial/scs/target/jacoco.exec
[[1;34mINFO[m] 
[[1;34mINFO[m] [1m--- [0;32mmaven-resources-plugin:2.6:resources[m [1m(default-resources)[m @ [36mevomaster-benchmark-cs-rest-artificial-scs[0;1m ---[m
[[1;34mINFO[m] Using 'UTF-8' encoding to copy filtered resources.
[[1;34mINFO[m] skip non existing resourceDirectory /media/rincon/63999417195/eclipse-workspace/EMB-master/jdk_8_maven/cs/rest/artificial/scs/src/main/resources
[[1;34mINFO[m] 
[[1;34mINFO[m] [1m--- [0;32mmaven-compiler-plugin:3.8.0:compile[m [1m(default-compile)[m @ [36mevomaster-benchmark-cs-rest-artificial-scs[0;1m ---[m
[[1;34mINFO[m] Changes detected - recompiling the module!
[[1;34mINFO[m] Compiling 14 source files to /media/rincon/63999417195/eclipse-workspace/EMB-master/jdk_8_maven/cs/rest/artificial/scs/target/classes
[[1;34mINFO[m] 
[[1;34mINFO[m] [1m--- [0;32mmaven-resources-plugin:2.6:testResources[m [1m(default-testResources)[m @ [36mevomaster-benchmark-cs-rest-artificial-scs[0;1m ---[m
[[1;34mINFO[m] Using 'UTF-8' encoding to copy filtered resources.
[[1;34mINFO[m] skip non existing resourceDirectory /media/rincon/63999417195/eclipse-workspace/EMB-master/jdk_8_maven/cs/rest/artificial/scs/src/test/resources
[[1;34mINFO[m] 
[[1;34mINFO[m] [1m--- [0;32mmaven-compiler-plugin:3.8.0:testCompile[m [1m(default-testCompile)[m @ [36mevomaster-benchmark-cs-rest-artificial-scs[0;1m ---[m
[[1;34mINFO[m] Nothing to compile - all classes are up to date
[[1;34mINFO[m] 
[[1;34mINFO[m] [1m--- [0;32mmaven-surefire-plugin:2.22.0:test[m [1m(default-test)[m @ [36mevomaster-benchmark-cs-rest-artificial-scs[0;1m ---[m
[[1;34mINFO[m] 
[[1;34mINFO[m] -------------------------------------------------------
[[1;34mINFO[m]  T E S T S
[[1;34mINFO[m] -------------------------------------------------------
[[1;34mINFO[m] Running org.restscs.[1mv3_gpt4turbo_run01_CostfunsTest[m

  .   ____          _            __ _ _
 /\\ / ___'_ __ _ _(_)_ __  __ _ \ \ \ \
( ( )\___ | '_ | '_| | '_ \/ _` | \ \ \ \
 \\/  ___)| |_)| | | | | || (_| |  ) ) ) )
  '  |____| .__|_| |_|_| |_\__, | / / / /
 =========|_|==============|___/=/_/_/_/
 :: Spring Boot ::        (v2.0.3.RELEASE)

2024-09-10 17:10:45.341  INFO 50523 --- [           main] o.a.maven.surefire.booter.ForkedBooter   : Starting ForkedBooter v2.22.0 on IFTO-PROBOOK with PID 50523 (started by rincon in /media/rincon/63999417195/eclipse-workspace/EMB-master/jdk_8_maven/cs/rest/artificial/scs)
2024-09-10 17:10:45.348  INFO 50523 --- [           main] o.a.maven.surefire.booter.ForkedBooter   : No active profile set, falling back to default profiles: default
2024-09-10 17:10:45.969  INFO 50523 --- [           main] ConfigServletWebServerApplicationContext : Refreshing org.springframework.boot.web.servlet.context.AnnotationConfigServletWebServerApplicationContext@77896335: startup date [Tue Sep 10 17:10:45 BRT 2024]; root of context hierarchy
2024-09-10 17:10:47.395  INFO 50523 --- [           main] f.a.AutowiredAnnotationBeanPostProcessor : JSR-330 'javax.inject.Inject' annotation found and supported for autowiring
2024-09-10 17:10:47.885  INFO 50523 --- [           main] o.s.b.w.embedded.tomcat.TomcatWebServer  : Tomcat initialized with port(s): 0 (http)
2024-09-10 17:10:47.929  INFO 50523 --- [           main] o.apache.catalina.core.StandardService   : Starting service [Tomcat]
2024-09-10 17:10:47.929  INFO 50523 --- [           main] org.apache.catalina.core.StandardEngine  : Starting Servlet Engine: Apache Tomcat/8.5.31
2024-09-10 17:10:47.940  INFO 50523 --- [ost-startStop-1] o.a.catalina.core.AprLifecycleListener   : The APR based Apache Tomcat Native library which allows optimal performance in production environments was not found on the java.library.path: [/usr/java/packages/lib/amd64:/usr/lib64:/lib64:/lib:/usr/lib]
2024-09-10 17:10:48.039  INFO 50523 --- [ost-startStop-1] o.a.c.c.C.[Tomcat].[localhost].[/]       : Initializing Spring embedded WebApplicationContext
2024-09-10 17:10:48.039  INFO 50523 --- [ost-startStop-1] o.s.web.context.ContextLoader            : Root WebApplicationContext: initialization completed in 2074 ms
2024-09-10 17:10:48.142  INFO 50523 --- [ost-startStop-1] o.s.b.w.servlet.ServletRegistrationBean  : Servlet dispatcherServlet mapped to [/]
2024-09-10 17:10:48.147  INFO 50523 --- [ost-startStop-1] o.s.b.w.servlet.FilterRegistrationBean   : Mapping filter: 'characterEncodingFilter' to: [/*]
2024-09-10 17:10:48.147  INFO 50523 --- [ost-startStop-1] o.s.b.w.servlet.FilterRegistrationBean   : Mapping filter: 'hiddenHttpMethodFilter' to: [/*]
2024-09-10 17:10:48.147  INFO 50523 --- [ost-startStop-1] o.s.b.w.servlet.FilterRegistrationBean   : Mapping filter: 'httpPutFormContentFilter' to: [/*]
2024-09-10 17:10:48.148  INFO 50523 --- [ost-startStop-1] o.s.b.w.servlet.FilterRegistrationBean   : Mapping filter: 'requestContextFilter' to: [/*]
2024-09-10 17:10:48.581  INFO 50523 --- [           main] s.w.s.m.m.a.RequestMappingHandlerMapping : Mapped "{[/api/pat/{txt}],methods=[GET]}" onto public org.springframework.http.ResponseEntity<java.lang.String> org.restscs.ScsRest.regex(java.lang.String)
2024-09-10 17:10:48.582  INFO 50523 --- [           main] s.w.s.m.m.a.RequestMappingHandlerMapping : Mapped "{[/api/title/{sex}/{title}],methods=[GET]}" onto public org.springframework.http.ResponseEntity<java.lang.String> org.restscs.ScsRest.title(java.lang.String,java.lang.String)
2024-09-10 17:10:48.583  INFO 50523 --- [           main] s.w.s.m.m.a.RequestMappingHandlerMapping : Mapped "{[/api/calc/{op}/{arg1}/{arg2}],methods=[GET]}" onto public org.springframework.http.ResponseEntity<java.lang.String> org.restscs.ScsRest.calc(java.lang.String,double,double)
2024-09-10 17:10:48.584  INFO 50523 --- [           main] s.w.s.m.m.a.RequestMappingHandlerMapping : Mapped "{[/api/cookie/{name}/{val}/{site}],methods=[GET]}" onto public org.springframework.http.ResponseEntity<java.lang.String> org.restscs.ScsRest.cookie(java.lang.String,java.lang.String,java.lang.String)
2024-09-10 17:10:48.585  INFO 50523 --- [           main] s.w.s.m.m.a.RequestMappingHandlerMapping : Mapped "{[/api/filesuffix/{directory}/{file}],methods=[GET]}" onto public org.springframework.http.ResponseEntity<java.lang.String> org.restscs.ScsRest.fileSuffix(java.lang.String,java.lang.String)
2024-09-10 17:10:48.585  INFO 50523 --- [           main] s.w.s.m.m.a.RequestMappingHandlerMapping : Mapped "{[/api/notypevar/{i}/{s}],methods=[GET]}" onto public org.springframework.http.ResponseEntity<java.lang.String> org.restscs.ScsRest.notyPevar(java.lang.Integer,java.lang.String)
2024-09-10 17:10:48.586  INFO 50523 --- [           main] s.w.s.m.m.a.RequestMappingHandlerMapping : Mapped "{[/api/ordered4/{w}/{x}/{z}/{y}],methods=[GET]}" onto public org.springframework.http.ResponseEntity<java.lang.String> org.restscs.ScsRest.ordered4(java.lang.String,java.lang.String,java.lang.String,java.lang.String)
2024-09-10 17:10:48.587  INFO 50523 --- [           main] s.w.s.m.m.a.RequestMappingHandlerMapping : Mapped "{[/api/pat/{txt}/{pat}],methods=[GET]}" onto public org.springframework.http.ResponseEntity<java.lang.String> org.restscs.ScsRest.pat(java.lang.String,java.lang.String)
2024-09-10 17:10:48.588  INFO 50523 --- [           main] s.w.s.m.m.a.RequestMappingHandlerMapping : Mapped "{[/api/text2txt/{word1}/{word2}/{word3}],methods=[GET]}" onto public org.springframework.http.ResponseEntity<java.lang.String> org.restscs.ScsRest.text2txt(java.lang.String,java.lang.String,java.lang.String)
2024-09-10 17:10:48.588  INFO 50523 --- [           main] s.w.s.m.m.a.RequestMappingHandlerMapping : Mapped "{[/api/costfuns/{i}/{s}],methods=[GET]}" onto public org.springframework.http.ResponseEntity<java.lang.String> org.restscs.ScsRest.costfuns(java.lang.Integer,java.lang.String)
2024-09-10 17:10:48.589  INFO 50523 --- [           main] s.w.s.m.m.a.RequestMappingHandlerMapping : Mapped "{[/api/dateparse/{dayname}/{monthname}],methods=[GET]}" onto public org.springframework.http.ResponseEntity<java.lang.String> org.restscs.ScsRest.dateParse(java.lang.String,java.lang.String)
2024-09-10 17:10:48.595  INFO 50523 --- [           main] s.w.s.m.m.a.RequestMappingHandlerMapping : Mapped "{[/swagger-resources]}" onto public org.springframework.http.ResponseEntity<java.util.List<springfox.documentation.swagger.web.SwaggerResource>> springfox.documentation.swagger.web.ApiResourceController.swaggerResources()
2024-09-10 17:10:48.596  INFO 50523 --- [           main] s.w.s.m.m.a.RequestMappingHandlerMapping : Mapped "{[/swagger-resources/configuration/ui]}" onto public org.springframework.http.ResponseEntity<springfox.documentation.swagger.web.UiConfiguration> springfox.documentation.swagger.web.ApiResourceController.uiConfiguration()
2024-09-10 17:10:48.597  INFO 50523 --- [           main] s.w.s.m.m.a.RequestMappingHandlerMapping : Mapped "{[/swagger-resources/configuration/security]}" onto public org.springframework.http.ResponseEntity<springfox.documentation.swagger.web.SecurityConfiguration> springfox.documentation.swagger.web.ApiResourceController.securityConfiguration()
2024-09-10 17:10:48.602  INFO 50523 --- [           main] s.w.s.m.m.a.RequestMappingHandlerMapping : Mapped "{[/error],produces=[text/html]}" onto public org.springframework.web.servlet.ModelAndView org.springframework.boot.autoconfigure.web.servlet.error.BasicErrorController.errorHtml(javax.servlet.http.HttpServletRequest,javax.servlet.http.HttpServletResponse)
2024-09-10 17:10:48.603  INFO 50523 --- [           main] s.w.s.m.m.a.RequestMappingHandlerMapping : Mapped "{[/error]}" onto public org.springframework.http.ResponseEntity<java.util.Map<java.lang.String, java.lang.Object>> org.springframework.boot.autoconfigure.web.servlet.error.BasicErrorController.error(javax.servlet.http.HttpServletRequest)
2024-09-10 17:10:48.766  INFO 50523 --- [           main] pertySourcedRequestMappingHandlerMapping : Mapped URL path [/v2/api-docs] onto method [public org.springframework.http.ResponseEntity<springfox.documentation.spring.web.json.Json> springfox.documentation.swagger2.web.Swagger2Controller.getDocumentation(java.lang.String,javax.servlet.http.HttpServletRequest)]
2024-09-10 17:10:48.850  INFO 50523 --- [           main] o.s.w.s.handler.SimpleUrlHandlerMapping  : Mapped URL path [/**/favicon.ico] onto handler of type [class org.springframework.web.servlet.resource.ResourceHttpRequestHandler]
2024-09-10 17:10:49.003  INFO 50523 --- [           main] s.w.s.m.m.a.RequestMappingHandlerAdapter : Looking for @ControllerAdvice: org.springframework.boot.web.servlet.context.AnnotationConfigServletWebServerApplicationContext@77896335: startup date [Tue Sep 10 17:10:45 BRT 2024]; root of context hierarchy
2024-09-10 17:10:49.068  INFO 50523 --- [           main] o.s.w.s.handler.SimpleUrlHandlerMapping  : Mapped URL path [/webjars/**] onto handler of type [class org.springframework.web.servlet.resource.ResourceHttpRequestHandler]
2024-09-10 17:10:49.068  INFO 50523 --- [           main] o.s.w.s.handler.SimpleUrlHandlerMapping  : Mapped URL path [/**] onto handler of type [class org.springframework.web.servlet.resource.ResourceHttpRequestHandler]
2024-09-10 17:10:49.307  INFO 50523 --- [           main] o.s.j.e.a.AnnotationMBeanExporter        : Registering beans for JMX exposure on startup
2024-09-10 17:10:49.319  INFO 50523 --- [           main] o.s.c.support.DefaultLifecycleProcessor  : Starting beans in phase 2147483647
2024-09-10 17:10:49.320  INFO 50523 --- [           main] d.s.w.p.DocumentationPluginsBootstrapper : Context refreshed
2024-09-10 17:10:49.352  INFO 50523 --- [           main] d.s.w.p.DocumentationPluginsBootstrapper : Found 1 custom documentation plugin(s)
2024-09-10 17:10:49.411  INFO 50523 --- [           main] s.d.s.w.s.ApiListingReferenceScanner     : Scanning for api listing references
2024-09-10 17:10:49.636  INFO 50523 --- [           main] o.s.b.w.embedded.tomcat.TomcatWebServer  : Tomcat started on port(s): 33897 (http) with context path ''
2024-09-10 17:10:49.641  INFO 50523 --- [           main] o.a.maven.surefire.booter.ForkedBooter   : Started ForkedBooter in 4.985 seconds (JVM running for 5.797)
2024-09-10 17:10:51.048  INFO 50523 --- [o-auto-1-exec-1] o.a.c.c.C.[Tomcat].[localhost].[/]       : Initializing Spring FrameworkServlet 'dispatcherServlet'
2024-09-10 17:10:51.048  INFO 50523 --- [o-auto-1-exec-1] o.s.web.servlet.DispatcherServlet        : FrameworkServlet 'dispatcherServlet': initialization started
2024-09-10 17:10:51.217  INFO 50523 --- [o-auto-1-exec-1] o.s.web.servlet.DispatcherServlet        : FrameworkServlet 'dispatcherServlet': initialization completed in 169 ms
Request method:	GET
Request URI:	http://localhost:33897/api/costfuns/5/baab
Proxy:			<none>
Request params:	<none>
Query params:	<none>
Form params:	<none>
Path params:	i=5
				s=baab
Headers:		Accept=*/*
Cookies:		<none>
Multiparts:		<none>
Body:			<none>

HTTP/1.1 200 
Content-Type: text/plain;charset=UTF-8
Content-Length: 2
Date: Tue, 10 Sep 2024 20:10:51 GMT

10
Request method:	GET
Request URI:	http://localhost:33897/api/costfuns/-445/baab
Proxy:			<none>
Request params:	<none>
Query params:	<none>
Form params:	<none>
Path params:	i=-445
				s=baab
Headers:		Accept=*/*
Cookies:		<none>
Multiparts:		<none>
Body:			<none>

HTTP/1.1 200 
Content-Type: text/plain;charset=UTF-8
Content-Length: 2
Date: Tue, 10 Sep 2024 20:10:51 GMT

10
Request method:	GET
Request URI:	http://localhost:33897/api/costfuns/667/baab
Proxy:			<none>
Request params:	<none>
Query params:	<none>
Form params:	<none>
Path params:	i=667
				s=baab
Headers:		Accept=*/*
Cookies:		<none>
Multiparts:		<none>
Body:			<none>

HTTP/1.1 200 
Content-Type: text/plain;charset=UTF-8
Content-Length: 2
Date: Tue, 10 Sep 2024 20:10:51 GMT

10
Request method:	GET
Request URI:	http://localhost:33897/api/costfuns/-4/baab
Proxy:			<none>
Request params:	<none>
Query params:	<none>
Form params:	<none>
Path params:	i=-4
				s=baab
Headers:		Accept=*/*
Cookies:		<none>
Multiparts:		<none>
Body:			<none>

HTTP/1.1 200 
Content-Type: text/plain;charset=UTF-8
Content-Length: 2
Date: Tue, 10 Sep 2024 20:10:51 GMT

10
2024-09-10 17:10:51.632  WARN 50523 --- [o-auto-1-exec-5] .w.s.m.s.DefaultHandlerExceptionResolver : Failed to bind request element: org.springframework.web.method.annotation.MethodArgumentTypeMismatchException: Failed to convert value of type 'java.lang.String' to required type 'java.lang.Integer'; nested exception is java.lang.NumberFormatException: For input string: "invalid"
Request method:	GET
Request URI:	http://localhost:33897/api/costfuns/invalid/baab
Proxy:			<none>
Request params:	<none>
Query params:	<none>
Form params:	<none>
Path params:	i=invalid
				s=baab
Headers:		Accept=*/*
Cookies:		<none>
Multiparts:		<none>
Body:			<none>

HTTP/1.1 400 
Content-Type: application/json;charset=UTF-8
Transfer-Encoding: chunked
Date: Tue, 10 Sep 2024 20:10:51 GMT
Connection: close

{
    "timestamp": "2024-09-10T20:10:51.646+0000",
    "status": 400,
    "error": "Bad Request",
    "message": "Failed to convert value of type 'java.lang.String' to required type 'java.lang.Integer'; nested exception is java.lang.NumberFormatException: For input string: \"invalid\"",
    "path": "/api/costfuns/invalid/baab"
}
Request method:	GET
Request URI:	http://localhost:33897/api/costfuns/2147483647/baab
Proxy:			<none>
Request params:	<none>
Query params:	<none>
Form params:	<none>
Path params:	i=2147483647
				s=baab
Headers:		Accept=*/*
Cookies:		<none>
Multiparts:		<none>
Body:			<none>

HTTP/1.1 200 
Content-Type: text/plain;charset=UTF-8
Content-Length: 2
Date: Tue, 10 Sep 2024 20:10:51 GMT

10
2024-09-10 17:10:51.814  INFO 50523 --- [           main] o.s.c.support.DefaultLifecycleProcessor  : Stopping beans in phase 2147483647
[[1;31mERROR[m] [1;31mTests [0;1mrun: [0;1m7[m, [1;31mFailures: [0;1;31m6[m, [1;31mErrors: [0;1;31m1[m, Skipped: 0, Time elapsed: 7.519 s[1;31m <<< FAILURE![m - in org.restscs.[1mv3_gpt4turbo_run01_CostfunsTest[m
[[1;31mERROR[m] testSubjectWithIEquals5(org.restscs.v3_gpt4turbo_run01_CostfunsTest)  Time elapsed: 1.474 s  <<< FAILURE!
java.lang.AssertionError: 
1 expectation failed.
Response body doesn't match expectation.
Expected: "1"
  Actual: 10

	at org.restscs.v3_gpt4turbo_run01_CostfunsTest.testSubjectWithIEquals5(v3_gpt4turbo_run01_CostfunsTest.java:62)

[[1;31mERROR[m] testSubjectWithILessThanMinus444(org.restscs.v3_gpt4turbo_run01_CostfunsTest)  Time elapsed: 0.041 s  <<< FAILURE!
java.lang.AssertionError: 
1 expectation failed.
Response body doesn't match expectation.
Expected: "2"
  Actual: 10

	at org.restscs.v3_gpt4turbo_run01_CostfunsTest.testSubjectWithILessThanMinus444(v3_gpt4turbo_run01_CostfunsTest.java:70)

[[1;31mERROR[m] testSubjectWithIGreaterThan666(org.restscs.v3_gpt4turbo_run01_CostfunsTest)  Time elapsed: 0.038 s  <<< FAILURE!
java.lang.AssertionError: 
1 expectation failed.
Response body doesn't match expectation.
Expected: "4"
  Actual: 10

	at org.restscs.v3_gpt4turbo_run01_CostfunsTest.testSubjectWithIGreaterThan666(v3_gpt4turbo_run01_CostfunsTest.java:78)

[[1;31mERROR[m] testSubjectWithIEqualsMinus4(org.restscs.v3_gpt4turbo_run01_CostfunsTest)  Time elapsed: 0.035 s  <<< FAILURE!
java.lang.AssertionError: 
1 expectation failed.
Response body doesn't match expectation.
Expected: "0"
  Actual: 10

	at org.restscs.v3_gpt4turbo_run01_CostfunsTest.testSubjectWithIEqualsMinus4(v3_gpt4turbo_run01_CostfunsTest.java:86)

[[1;31mERROR[m] testSubjectWithInvalidInput(org.restscs.v3_gpt4turbo_run01_CostfunsTest)  Time elapsed: 0.182 s  <<< FAILURE!
java.lang.AssertionError: 
1 expectation failed.
Expected status code <500> but was <400>.

	at org.restscs.v3_gpt4turbo_run01_CostfunsTest.testSubjectWithInvalidInput(v3_gpt4turbo_run01_CostfunsTest.java:93)

[[1;31mERROR[m] testSubjectWithBoundaryValue(org.restscs.v3_gpt4turbo_run01_CostfunsTest)  Time elapsed: 0.026 s  <<< FAILURE!
java.lang.AssertionError: 
1 expectation failed.
Response body doesn't match expectation.
Expected: ("4" or "5")
  Actual: 10

	at org.restscs.v3_gpt4turbo_run01_CostfunsTest.testSubjectWithBoundaryValue(v3_gpt4turbo_run01_CostfunsTest.java:101)

[[1;31mERROR[m] testSubjectWithSpecialCharactersInString(org.restscs.v3_gpt4turbo_run01_CostfunsTest)  Time elapsed: 0.003 s  <<< ERROR!
java.net.URISyntaxException: Malformed escape pair at index 44: http://localhost:33897/api/costfuns/5/ba@#$$%^&*()ab
	at org.restscs.v3_gpt4turbo_run01_CostfunsTest.testSubjectWithSpecialCharactersInString(v3_gpt4turbo_run01_CostfunsTest.java:107)

2024-09-10 17:10:51.857  INFO 50523 --- [       Thread-4] ConfigServletWebServerApplicationContext : Closing org.springframework.boot.web.servlet.context.AnnotationConfigServletWebServerApplicationContext@77896335: startup date [Tue Sep 10 17:10:45 BRT 2024]; root of context hierarchy
2024-09-10 17:10:51.861  INFO 50523 --- [       Thread-4] o.s.c.support.DefaultLifecycleProcessor  : Stopping beans in phase 2147483647
2024-09-10 17:10:51.861  INFO 50523 --- [       Thread-4] o.s.j.e.a.AnnotationMBeanExporter        : Unregistering JMX-exposed beans on shutdown
[[1;34mINFO[m] 
[[1;34mINFO[m] Results:
[[1;34mINFO[m] 
[[1;31mERROR[m] [1;31mFailures: [m
[[1;31mERROR[m] [1;31m  v3_gpt4turbo_run01_CostfunsTest.testSubjectWithBoundaryValue:101 1 expectation failed.
Response body doesn't match expectation.
Expected: ("4" or "5")
  Actual: 10
[m
[[1;31mERROR[m] [1;31m  v3_gpt4turbo_run01_CostfunsTest.testSubjectWithIEquals5:62 1 expectation failed.
Response body doesn't match expectation.
Expected: "1"
  Actual: 10
[m
[[1;31mERROR[m] [1;31m  v3_gpt4turbo_run01_CostfunsTest.testSubjectWithIEqualsMinus4:86 1 expectation failed.
Response body doesn't match expectation.
Expected: "0"
  Actual: 10
[m
[[1;31mERROR[m] [1;31m  v3_gpt4turbo_run01_CostfunsTest.testSubjectWithIGreaterThan666:78 1 expectation failed.
Response body doesn't match expectation.
Expected: "4"
  Actual: 10
[m
[[1;31mERROR[m] [1;31m  v3_gpt4turbo_run01_CostfunsTest.testSubjectWithILessThanMinus444:70 1 expectation failed.
Response body doesn't match expectation.
Expected: "2"
  Actual: 10
[m
[[1;31mERROR[m] [1;31m  v3_gpt4turbo_run01_CostfunsTest.testSubjectWithInvalidInput:93 1 expectation failed.
Expected status code <500> but was <400>.
[m
[[1;31mERROR[m] [1;31mErrors: [m
[[1;31mERROR[m] [1;31m  v3_gpt4turbo_run01_CostfunsTest.testSubjectWithSpecialCharactersInString:107 » URISyntax[m
[[1;34mINFO[m] 
[[1;31mERROR[m] [1;31mTests run: 7, Failures: 6, Errors: 1, Skipped: 0[m
[[1;34mINFO[m] 
[[1;34mINFO[m] [1m------------------------------------------------------------------------[m
[[1;34mINFO[m] [1;31mBUILD FAILURE[m
[[1;34mINFO[m] [1m------------------------------------------------------------------------[m
[[1;34mINFO[m] Total time:  11.057 s
[[1;34mINFO[m] Finished at: 2024-09-10T17:10:52-03:00
[[1;34mINFO[m] [1m------------------------------------------------------------------------[m
[[1;31mERROR[m] Failed to execute goal [32morg.apache.maven.plugins:maven-surefire-plugin:2.22.0:test[m [1m(default-test)[m on project [36mevomaster-benchmark-cs-rest-artificial-scs[m: [1;31mThere are test failures.[m
[[1;31mERROR[m] [1;31m[m
[[1;31mERROR[m] [1;31mPlease refer to /media/rincon/63999417195/eclipse-workspace/EMB-master/jdk_8_maven/cs/rest/artificial/scs/target/surefire-reports for the individual test results.[m
[[1;31mERROR[m] [1;31mPlease refer to dump files (if any exist) [date]-jvmRun[N].dump, [date].dumpstream and [date]-jvmRun[N].dumpstream.[m
[[1;31mERROR[m] -> [1m[Help 1][m
[[1;31mERROR[m] 
[[1;31mERROR[m] To see the full stack trace of the errors, re-run Maven with the [1m-e[m switch.
[[1;31mERROR[m] Re-run Maven using the [1m-X[m switch to enable full debug logging.
[[1;31mERROR[m] 
[[1;31mERROR[m] For more information about the errors and possible solutions, please read the following articles:
[[1;31mERROR[m] [1m[Help 1][m http://cwiki.apache.org/confluence/display/MAVEN/MojoFailureException

#####
