Correct the test code delimited by ***** according to the error messages delimited by ##### and generate another complete code in JUnit 5 format. The response must contain only Java code in JUnit 5 format.

Keep these five instructions for this generated test code:

Instruction 1: Keet this package line to generated test code file:
package market;

Instruction 2: Keep the following Java imports to generated test code file:
import  org.junit.jupiter.api.AfterAll;
import  org.junit.jupiter.api.BeforeAll;
import  org.junit.jupiter.api.BeforeEach;
import  org.junit.jupiter.api.Test;
import  org.junit.jupiter.api.Timeout;
import static org.junit.jupiter.api.Assertions.*;
import  java.util.Map;
import  java.util.List;
import static org.evomaster.client.java.controller.api.EMTestUtils.*;
import  org.evomaster.client.java.controller.SutHandler;
import  io.restassured.RestAssured;
import static io.restassured.RestAssured.given;
import  io.restassured.response.ValidatableResponse;
import static org.evomaster.client.java.sql.dsl.SqlDsl.sql;
import  org.evomaster.client.java.controller.api.dto.database.operations.InsertionResultsDto;
import  org.evomaster.client.java.controller.api.dto.database.operations.InsertionDto;
import static org.hamcrest.Matchers.*;
import  io.restassured.config.JsonConfig;
import  io.restassured.path.json.config.JsonPathConfig;
import static io.restassured.config.RedirectConfig.redirectConfig;
import static org.evomaster.client.java.controller.contentMatchers.NumberMatcher.*;
import static org.evomaster.client.java.controller.contentMatchers.StringMatcher.*;
import static org.evomaster.client.java.controller.contentMatchers.SubStringMatcher.*;
import static org.evomaster.client.java.controller.expect.ExpectationHandler.expectationHandler;
import  org.evomaster.client.java.controller.expect.ExpectationHandler;
import  io.restassured.path.json.JsonPath;
import  java.util.Arrays;

Instruction 3: Keep the same class name in this point (between the imports at instruction 2 and instruction 4)

Instruction 4: Keep these variables in the generated test code:
private static final SutHandler controller = new em.embedded.market.EmbeddedEvoMasterController();
private static String baseUrlOfSut;

Instruction 5: Keep the following setup and teardown methods in generated test code file:
@BeforeAll
public static void initClass() {
    controller.setupForGeneratedTest();
    baseUrlOfSut = controller.startSut();
    controller.registerOrExecuteInitSqlCommandsIfNeeded();
    assertNotNull(baseUrlOfSut);
    RestAssured.enableLoggingOfRequestAndResponseIfValidationFails();
    RestAssured.useRelaxedHTTPSValidation();
    RestAssured.urlEncodingEnabled = false;
    RestAssured.config = RestAssured.config()
        .jsonConfig(JsonConfig.jsonConfig().numberReturnType(JsonPathConfig.NumberReturnType.DOUBLE))
        .redirect(redirectConfig().followRedirects(false));
}


@AfterAll
public static void tearDown() {
    controller.stopSut();
}


@BeforeEach
public void initTest() {
    controller.resetDatabase(Arrays.asList("USER_ROLE","CUSTOMER_ORDER","CART_ITEM","PRODUCT","CART","CONTACTS"));
    controller.resetStateOfSUT();
}

*****

package market;

import org.junit.jupiter.api.AfterAll;
import org.junit.jupiter.api.BeforeAll;
import org.junit.jupiter.api.BeforeEach;
import org.junit.jupiter.api.Test;
import org.junit.jupiter.api.Timeout;
import static org.junit.jupiter.api.Assertions.*;
import java.util.Map;
import java.util.List;
import static org.evomaster.client.java.controller.api.EMTestUtils.*;
import org.evomaster.client.java.controller.SutHandler;
import io.restassured.RestAssured;
import static io.restassured.RestAssured.given;
import io.restassured.response.ValidatableResponse;
import static org.hamcrest.Matchers.*;
import io.restassured.config.JsonConfig;
import io.restassured.path.json.config.JsonPathConfig;
import static io.restassured.config.RedirectConfig.redirectConfig;
import static org.evomaster.client.java.controller.contentMatchers.NumberMatcher.*;
import static org.evomaster.client.java.controller.contentMatchers.StringMatcher.*;
import static org.evomaster.client.java.controller.contentMatchers.SubStringMatcher.*;
import static org.evomaster.client.java.controller.expect.ExpectationHandler.expectationHandler;
import org.evomaster.client.java.controller.expect.ExpectationHandler;
import io.restassured.path.json.JsonPath;
import java.util.Arrays;

public class v1_gpt4turbo_run01_RestErrorResponseTest {

    private static final SutHandler controller = new em.embedded.market.EmbeddedEvoMasterController();
    private static String baseUrlOfSut;

    @BeforeAll
    public static void initClass() {
        controller.setupForGeneratedTest();
        baseUrlOfSut = controller.startSut();
        controller.registerOrExecuteInitSqlCommandsIfNeeded();
        assertNotNull(baseUrlOfSut);
        RestAssured.enableLoggingOfRequestAndResponseIfValidationFails();
        RestAssured.useRelaxedHTTPSValidation();
        RestAssured.urlEncodingEnabled = false;
        RestAssured.config = RestAssured.config()
            .jsonConfig(JsonConfig.jsonConfig().numberReturnType(JsonPathConfig.NumberReturnType.DOUBLE))
            .redirect(redirectConfig().followRedirects(false));
    }

    @AfterAll
    public static void tearDown() {
        controller.stopSut();
    }

    @BeforeEach
    public void initTest() {
        controller.resetDatabase(Arrays.asList("USER_ROLE","CUSTOMER_ORDER","CART_ITEM","PRODUCT","CART","CONTACTS"));
        controller.resetStateOfSUT();
    }

    @Test
    public void testGetCustomerNotFound() {
        given()
            .baseUri(baseUrlOfSut)
            .basePath("/customer")
            .queryParam("name", "NonExistentUser")
        .when()
            .get()
        .then()
            .statusCode(404);
    }

    @Test
    public void testAddItemToCartUnauthorized() {
        given()
            .baseUri(baseUrlOfSut)
            .basePath("/customer/cart")
            .contentType("application/json")
            .body("{\"productId\": \"1\", \"quantity\": \"2\"}")
            .queryParam("name", "UnauthorizedUser")
        .when()
            .put()
        .then()
            .statusCode(401);
    }

    @Test
    public void testClearCartNoContent() {
        given()
            .baseUri(baseUrlOfSut)
            .basePath("/customer/cart")
            .queryParam("name", "EmptyCartUser")
        .when()
            .delete()
        .then()
            .statusCode(204);
    }

    @Test
    public void testSetDeliveryUnauthorized() {
        given()
            .baseUri(baseUrlOfSut)
            .basePath("/customer/cart/delivery")
            .queryParam("included", true)
            .queryParam("name", "UnauthorizedUser")
        .when()
            .put()
        .then()
            .statusCode(401);
    }

    @Test
    public void testPayByCardNotFound() {
        given()
            .baseUri(baseUrlOfSut)
            .basePath("/customer/cart/pay")
            .contentType("application/json")
            .body("{\"ccNumber\": \"4111111111111111\"}")
            .queryParam("name", "NonExistentUser")
        .when()
            .post()
        .then()
            .statusCode(404);
    }

    @Test
    public void testGetContactsForbidden() {
        given()
            .baseUri(baseUrlOfSut)
            .basePath("/customer/contacts")
            .queryParam("name", "UnauthorizedUser")
        .when()
            .get()
        .then()
            .statusCode(403);
    }

    @Test
    public void testUpdateContactsNotFound() {
        given()
            .baseUri(baseUrlOfSut)
            .basePath("/customer/contacts")
            .contentType("application/json")
            .body("{\"address\": \"New Address\", \"phone\": \"+7 999 999 9999\"}")
            .queryParam("name", "NonExistentUser")
        .when()
            .put()
        .then()
            .statusCode(404);
    }

    @Test
    public void testGetOrdersUnauthorized() {
        given()
            .baseUri(baseUrlOfSut)
            .basePath("/customer/orders")
            .queryParam("name", "UnauthorizedUser")
        .when()
            .get()
        .then()
            .statusCode(401);
    }

    @Test
    public void testGetProductNotFound() {
        given()
            .baseUri(baseUrlOfSut)
            .basePath("/products")
            .queryParam("productId", "9999")
        .when()
            .get()
        .then()
            .statusCode(404);
    }

    @Test
    public void testRegisterUserCreated() {
        given()
            .baseUri(baseUrlOfSut)
            .basePath("/register")
            .contentType("application/json")
            .body("{\"email\":\"ivan.petrov@yandex.ru\",\"password\":\"petrov\",\"name\":\"Ivan Petrov\",\"phone\":\"+7 123 456 78 90\",\"address\":\"Riesstrasse 18\"}")
        .when()
            .post()
        .then()
            .statusCode(201)
            .body("name", is("Ivan Petrov"));
    }
}

*****
#####
[[1;34mINFO[m] Scanning for projects...
[[1;34mINFO[m] 
[[1;34mINFO[m] [1m---------------------< [0;36mnet.lukyanets:market-rest[0;1m >----------------------[m
[[1;34mINFO[m] [1mBuilding market-rest 0.1.2[m
[[1;34mINFO[m] [1m--------------------------------[ jar ]---------------------------------[m
[[1;33mWARNING[m] The POM for com.sun.xml.bind:jaxb-osgi:jar:2.2.10 is invalid, transitive dependencies (if any) will not be available, enable debug logging for more details
[[1;34mINFO[m] 
[[1;34mINFO[m] [1m--- [0;32mmaven-clean-plugin:2.5:clean[m [1m(default-clean)[m @ [36mmarket-rest[0;1m ---[m
[[1;34mINFO[m] Deleting /media/rincon/63999417195/eclipse-workspace/EMB-master/jdk_11_maven/cs/rest-gui/market/market-rest/target
[[1;34mINFO[m] 
[[1;34mINFO[m] [1m--- [0;32mjacoco-maven-plugin:0.8.7:prepare-agent[m [1m(default)[m @ [36mmarket-rest[0;1m ---[m
[[1;34mINFO[m] argLine set to -javaagent:/home/rincon/.m2/repository/org/jacoco/org.jacoco.agent/0.8.7/org.jacoco.agent-0.8.7-runtime.jar=destfile=/media/rincon/63999417195/eclipse-workspace/EMB-master/jdk_11_maven/cs/rest-gui/market/market-rest/target/jacoco.exec
[[1;34mINFO[m] 
[[1;34mINFO[m] [1m--- [0;32mspring-boot-maven-plugin:2.4.3:build-info[m [1m(default)[m @ [36mmarket-rest[0;1m ---[m
[[1;34mINFO[m] 
[[1;34mINFO[m] [1m--- [0;32mmaven-resources-plugin:2.6:resources[m [1m(default-resources)[m @ [36mmarket-rest[0;1m ---[m
[[1;34mINFO[m] Using 'UTF-8' encoding to copy filtered resources.
[[1;34mINFO[m] Copying 3 resources
[[1;34mINFO[m] 
[[1;34mINFO[m] [1m--- [0;32mmaven-compiler-plugin:3.8.0:compile[m [1m(default-compile)[m @ [36mmarket-rest[0;1m ---[m
[[1;34mINFO[m] Changes detected - recompiling the module!
[[1;34mINFO[m] Compiling 11 source files to /media/rincon/63999417195/eclipse-workspace/EMB-master/jdk_11_maven/cs/rest-gui/market/market-rest/target/classes
[[1;34mINFO[m] 
[[1;34mINFO[m] [1m--- [0;32mjacoco-maven-plugin:0.8.7:prepare-agent[m [1m(default)[m @ [36mmarket-rest[0;1m ---[m
[[1;34mINFO[m] argLine set to -javaagent:/home/rincon/.m2/repository/org/jacoco/org.jacoco.agent/0.8.7/org.jacoco.agent-0.8.7-runtime.jar=destfile=/media/rincon/63999417195/eclipse-workspace/EMB-master/jdk_11_maven/cs/rest-gui/market/market-rest/target/jacoco.exec
[[1;34mINFO[m] 
[[1;34mINFO[m] [1m--- [0;32mspring-boot-maven-plugin:2.4.3:build-info[m [1m(default)[m @ [36mmarket-rest[0;1m ---[m
[[1;34mINFO[m] 
[[1;34mINFO[m] [1m--- [0;32mmaven-resources-plugin:2.6:resources[m [1m(default-resources)[m @ [36mmarket-rest[0;1m ---[m
[[1;34mINFO[m] Using 'UTF-8' encoding to copy filtered resources.
[[1;34mINFO[m] Copying 3 resources
[[1;34mINFO[m] 
[[1;34mINFO[m] [1m--- [0;32mmaven-compiler-plugin:3.8.0:compile[m [1m(default-compile)[m @ [36mmarket-rest[0;1m ---[m
[[1;34mINFO[m] Nothing to compile - all classes are up to date
[[1;34mINFO[m] 
[[1;34mINFO[m] [1m--- [0;32mmaven-resources-plugin:2.6:testResources[m [1m(default-testResources)[m @ [36mmarket-rest[0;1m ---[m
[[1;34mINFO[m] Using 'UTF-8' encoding to copy filtered resources.
[[1;34mINFO[m] skip non existing resourceDirectory /media/rincon/63999417195/eclipse-workspace/EMB-master/jdk_11_maven/cs/rest-gui/market/market-rest/src/test/resources
[[1;34mINFO[m] 
[[1;34mINFO[m] [1m--- [0;32mmaven-compiler-plugin:3.8.0:testCompile[m [1m(default-testCompile)[m @ [36mmarket-rest[0;1m ---[m
[[1;34mINFO[m] Changes detected - recompiling the module!
[[1;34mINFO[m] Compiling 1 source file to /media/rincon/63999417195/eclipse-workspace/EMB-master/jdk_11_maven/cs/rest-gui/market/market-rest/target/test-classes
[[1;34mINFO[m] 
[[1;34mINFO[m] [1m--- [0;32mjacoco-maven-plugin:0.8.7:prepare-agent[m [1m(default)[m @ [36mmarket-rest[0;1m ---[m
[[1;34mINFO[m] argLine set to -javaagent:/home/rincon/.m2/repository/org/jacoco/org.jacoco.agent/0.8.7/org.jacoco.agent-0.8.7-runtime.jar=destfile=/media/rincon/63999417195/eclipse-workspace/EMB-master/jdk_11_maven/cs/rest-gui/market/market-rest/target/jacoco.exec
[[1;34mINFO[m] 
[[1;34mINFO[m] [1m--- [0;32mspring-boot-maven-plugin:2.4.3:build-info[m [1m(default)[m @ [36mmarket-rest[0;1m ---[m
[[1;34mINFO[m] 
[[1;34mINFO[m] [1m--- [0;32mmaven-resources-plugin:2.6:resources[m [1m(default-resources)[m @ [36mmarket-rest[0;1m ---[m
[[1;34mINFO[m] Using 'UTF-8' encoding to copy filtered resources.
[[1;34mINFO[m] Copying 3 resources
[[1;34mINFO[m] 
[[1;34mINFO[m] [1m--- [0;32mmaven-compiler-plugin:3.8.0:compile[m [1m(default-compile)[m @ [36mmarket-rest[0;1m ---[m
[[1;34mINFO[m] Nothing to compile - all classes are up to date
[[1;34mINFO[m] 
[[1;34mINFO[m] [1m--- [0;32mmaven-resources-plugin:2.6:testResources[m [1m(default-testResources)[m @ [36mmarket-rest[0;1m ---[m
[[1;34mINFO[m] Using 'UTF-8' encoding to copy filtered resources.
[[1;34mINFO[m] skip non existing resourceDirectory /media/rincon/63999417195/eclipse-workspace/EMB-master/jdk_11_maven/cs/rest-gui/market/market-rest/src/test/resources
[[1;34mINFO[m] 
[[1;34mINFO[m] [1m--- [0;32mmaven-compiler-plugin:3.8.0:testCompile[m [1m(default-testCompile)[m @ [36mmarket-rest[0;1m ---[m
[[1;34mINFO[m] Nothing to compile - all classes are up to date
[[1;34mINFO[m] 
[[1;34mINFO[m] [1m--- [0;32mmaven-surefire-plugin:2.22.0:test[m [1m(default-test)[m @ [36mmarket-rest[0;1m ---[m
[[1;34mINFO[m] 
[[1;34mINFO[m] -------------------------------------------------------
[[1;34mINFO[m]  T E S T S
[[1;34mINFO[m] -------------------------------------------------------
[[1;34mINFO[m] Running market.[1mv1_gpt4turbo_run01_RestErrorResponseTest[m

  .   ____          _            __ _ _
 /\\ / ___'_ __ _ _(_)_ __  __ _ \ \ \ \
( ( )\___ | '_ | '_| | '_ \/ _` | \ \ \ \
 \\/  ___)| |_)| | | | | || (_| |  ) ) ) )
  '  |____| .__|_| |_|_| |_\__, | / / / /
 =========|_|==============|___/=/_/_/_/
 :: Spring Boot ::                (v2.4.3)

2024-09-12 15:30:13,036 INFO  [background-preinit] o.h.v.i.u.Version - HV000001: Hibernate Validator 6.1.7.Final
2024-09-12 15:30:13,150 INFO  [main] o.a.m.s.b.ForkedBooter - Starting ForkedBooter v2.22.0 using Java 11.0.20 on IFTO-PROBOOK with PID 8916 (started by rincon in /media/rincon/63999417195/eclipse-workspace/EMB-master/jdk_11_maven/cs/rest-gui/market/market-rest)
2024-09-12 15:30:13,157 INFO  [main] o.a.m.s.b.ForkedBooter - No active profile set, falling back to default profiles: default
2024-09-12 15:30:13,840 WARN  [main] o.s.b.c.c.ConfigDataEnvironment - Property 'spring.profiles' imported from location 'class path resource [application.yml]' is invalid and should be replaced with 'spring.config.activate.on-profile' [origin: class path resource [application.yml] - 34:13]
2024-09-12 15:30:13,840 WARN  [main] o.s.b.c.c.ConfigDataEnvironment - Property 'spring.profiles' imported from location 'class path resource [application.yml]' is invalid and should be replaced with 'spring.config.activate.on-profile' [origin: class path resource [application.yml] - 24:13]
2024-09-12 15:30:15,452 INFO  [main] o.s.d.r.c.RepositoryConfigurationDelegate - Bootstrapping Spring Data JPA repositories in DEFAULT mode.
2024-09-12 15:30:15,602 INFO  [main] o.s.d.r.c.RepositoryConfigurationDelegate - Finished Spring Data repository scanning in 135 ms. Found 8 JPA repository interfaces.
2024-09-12 15:30:16,135 INFO  [main] o.s.c.s.PostProcessorRegistrationDelegate$BeanPostProcessorChecker - Bean 'market.DataConfig' of type [market.DataConfig$$EnhancerBySpringCGLIB$$29d7674] is not eligible for getting processed by all BeanPostProcessors (for example: not eligible for auto-proxying)
2024-09-12 15:30:16,308 INFO  [main] o.s.c.s.PostProcessorRegistrationDelegate$BeanPostProcessorChecker - Bean 'org.springframework.security.access.expression.method.DefaultMethodSecurityExpressionHandler@42cf8d5' of type [org.springframework.security.access.expression.method.DefaultMethodSecurityExpressionHandler] is not eligible for getting processed by all BeanPostProcessors (for example: not eligible for auto-proxying)
2024-09-12 15:30:16,318 INFO  [main] o.s.c.s.PostProcessorRegistrationDelegate$BeanPostProcessorChecker - Bean 'methodSecurityMetadataSource' of type [org.springframework.security.access.method.DelegatingMethodSecurityMetadataSource] is not eligible for getting processed by all BeanPostProcessors (for example: not eligible for auto-proxying)
2024-09-12 15:30:16,855 INFO  [main] o.s.b.w.e.t.TomcatWebServer - Tomcat initialized with port(s): 0 (http)
2024-09-12 15:30:16,877 INFO  [main] o.a.c.h.Http11NioProtocol - Initializing ProtocolHandler ["http-nio-auto-1"]
2024-09-12 15:30:16,878 INFO  [main] o.a.c.c.StandardService - Starting service [Tomcat]
2024-09-12 15:30:16,878 INFO  [main] o.a.c.c.StandardEngine - Starting Servlet engine: [Apache Tomcat/9.0.43]
2024-09-12 15:30:17,012 INFO  [main] o.a.c.c.C.[.[.[/] - Initializing Spring embedded WebApplicationContext
2024-09-12 15:30:17,013 INFO  [main] o.s.b.w.s.c.ServletWebServerApplicationContext - Root WebApplicationContext: initialization completed in 3168 ms
2024-09-12 15:30:17,234 INFO  [main] c.z.h.HikariDataSource - HikariPool-1 - Starting...
2024-09-12 15:30:17,696 INFO  [main] c.z.h.HikariDataSource - HikariPool-1 - Start completed.
2024-09-12 15:30:17,968 INFO  [main] o.h.j.i.u.LogHelper - HHH000204: Processing PersistenceUnitInfo [name: default]
2024-09-12 15:30:18,072 INFO  [main] o.h.Version - HHH000412: Hibernate ORM core version 5.4.28.Final
2024-09-12 15:30:18,293 INFO  [main] o.h.a.c.Version - HCANN000001: Hibernate Commons Annotations {5.1.2.Final}
2024-09-12 15:30:18,686 INFO  [main] o.h.d.Dialect - HHH000400: Using dialect: org.hibernate.dialect.H2Dialect
2024-09-12 15:30:19,009 WARN  [main] o.h.b.i.InFlightMetadataCollectorImpl - HHH000069: Duplicate generator name gen
2024-09-12 15:30:19,011 WARN  [main] o.h.b.i.InFlightMetadataCollectorImpl - HHH000069: Duplicate generator name gen
2024-09-12 15:30:19,834 INFO  [main] o.h.e.t.j.p.i.JtaPlatformInitiator - HHH000490: Using JtaPlatform implementation: [org.hibernate.engine.transaction.jta.platform.internal.NoJtaPlatform]
2024-09-12 15:30:19,847 INFO  [main] o.s.o.j.LocalContainerEntityManagerFactoryBean - Initialized JPA EntityManagerFactory for persistence unit 'default'
2024-09-12 15:30:21,015 WARN  [main] o.s.b.a.o.j.JpaBaseConfiguration$JpaWebConfiguration - spring.jpa.open-in-view is enabled by default. Therefore, database queries may be performed during view rendering. Explicitly configure spring.jpa.open-in-view to disable this warning
2024-09-12 15:30:22,034 INFO  [main] o.s.s.w.DefaultSecurityFilterChain - Will secure any request with [org.springframework.security.web.context.request.async.WebAsyncManagerIntegrationFilter@648015d9, org.springframework.security.web.context.SecurityContextPersistenceFilter@48e86e1d, org.springframework.security.web.header.HeaderWriterFilter@7afaf8f4, org.springframework.security.web.authentication.logout.LogoutFilter@2c0d0b42, org.springframework.security.web.authentication.www.BasicAuthenticationFilter@6048d75, org.springframework.security.web.savedrequest.RequestCacheAwareFilter@3db5a68d, org.springframework.security.web.servletapi.SecurityContextHolderAwareRequestFilter@13b9ea2a, org.springframework.security.web.authentication.AnonymousAuthenticationFilter@aa418d, org.springframework.security.web.session.SessionManagementFilter@754043b, org.springframework.security.web.access.ExceptionTranslationFilter@7d18a47f, org.springframework.security.web.access.intercept.FilterSecurityInterceptor@6b6c7eb4]
2024-09-12 15:30:22,218 INFO  [main] o.s.s.c.ThreadPoolTaskExecutor - Initializing ExecutorService 'applicationTaskExecutor'
2024-09-12 15:30:22,666 INFO  [main] o.a.c.h.Http11NioProtocol - Starting ProtocolHandler ["http-nio-auto-1"]
2024-09-12 15:30:22,695 INFO  [main] o.s.b.w.e.t.TomcatWebServer - Tomcat started on port(s): 42671 (http) with context path ''
2024-09-12 15:30:23,326 INFO  [main] o.a.m.s.b.ForkedBooter - Started ForkedBooter in 11.126 seconds (JVM running for 13.334)
2024-09-12 15:30:25,209 INFO  [http-nio-auto-1-exec-1] o.a.c.c.C.[.[.[/] - Initializing Spring DispatcherServlet 'dispatcherServlet'
2024-09-12 15:30:25,209 INFO  [http-nio-auto-1-exec-1] o.s.w.s.DispatcherServlet - Initializing Servlet 'dispatcherServlet'
2024-09-12 15:30:25,211 INFO  [http-nio-auto-1-exec-1] o.s.w.s.DispatcherServlet - Completed initialization in 2 ms
2024-09-12 15:30:25,618 WARN  [http-nio-auto-1-exec-1] m.r.e.RestExceptionHandler - RestErrorResponse{message='Argument validation error', entityName='UserAccount', description='uri=/register', fieldErrors=[{field='email', message='Account with this email already exists'}]}
Request method:	POST
Request URI:	http://localhost:42671/register
Proxy:			<none>
Request params:	<none>
Query params:	<none>
Form params:	<none>
Path params:	<none>
Headers:		Accept=*/*
				Content-Type=application/json; charset=UTF-8
Cookies:		<none>
Multiparts:		<none>
Body:
{
    "email": "ivan.petrov@yandex.ru",
    "password": "petrov",
    "name": "Ivan Petrov",
    "phone": "+7 123 456 78 90",
    "address": "Riesstrasse 18"
}

HTTP/1.1 406 
X-Content-Type-Options: nosniff
X-XSS-Protection: 1; mode=block
Cache-Control: no-cache, no-store, max-age=0, must-revalidate
Pragma: no-cache
Expires: 0
Content-Type: application/json
Transfer-Encoding: chunked
Date: Thu, 12 Sep 2024 18:30:25 GMT
Keep-Alive: timeout=60
Connection: keep-alive

{
    "message": "Argument validation error",
    "description": "uri=/register",
    "entityName": "UserAccount",
    "fieldErrors": [
        {
            "field": "email",
            "message": "Account with this email already exists"
        }
    ]
}
2024-09-12 15:30:25,934 WARN  [http-nio-auto-1-exec-2] m.r.e.RestExceptionHandler - RestErrorResponse{message='Acesso negado', entityName='null', description='uri=/customer/contacts', fieldErrors=[]}
Request method:	PUT
Request URI:	http://localhost:42671/customer/contacts?name=NonExistentUser
Proxy:			<none>
Request params:	<none>
Query params:	name=NonExistentUser
Form params:	<none>
Path params:	<none>
Headers:		Accept=*/*
				Content-Type=application/json; charset=UTF-8
Cookies:		<none>
Multiparts:		<none>
Body:
{
    "address": "New Address",
    "phone": "+7 999 999 9999"
}

HTTP/1.1 401 
X-Content-Type-Options: nosniff
X-XSS-Protection: 1; mode=block
Cache-Control: no-cache, no-store, max-age=0, must-revalidate
Pragma: no-cache
Expires: 0
Content-Type: application/json
Transfer-Encoding: chunked
Date: Thu, 12 Sep 2024 18:30:25 GMT
Keep-Alive: timeout=60
Connection: keep-alive

{
    "message": "Acesso negado",
    "description": "uri=/customer/contacts",
    "entityName": null,
    "fieldErrors": [
        
    ]
}
Request method:	GET
Request URI:	http://localhost:42671/customer?name=NonExistentUser
Proxy:			<none>
Request params:	<none>
Query params:	name=NonExistentUser
Form params:	<none>
Path params:	<none>
Headers:		Accept=*/*
Cookies:		<none>
Multiparts:		<none>
Body:			<none>

HTTP/1.1 401 
Set-Cookie: JSESSIONID=F37735F641E00485B3B29A936A3A2080; Path=/; HttpOnly
WWW-Authenticate: Basic realm="Realm"
X-Content-Type-Options: nosniff
X-XSS-Protection: 1; mode=block
Cache-Control: no-cache, no-store, max-age=0, must-revalidate
Pragma: no-cache
Expires: 0
Content-Type: application/json
Transfer-Encoding: chunked
Date: Thu, 12 Sep 2024 18:30:25 GMT
Keep-Alive: timeout=60
Connection: keep-alive

{
    "timestamp": "2024-09-12T18:30:26.005+00:00",
    "status": 401,
    "error": "Unauthorized",
    "message": "",
    "path": "/customer"
}
2024-09-12 15:30:26,103 WARN  [http-nio-auto-1-exec-4] m.r.e.RestExceptionHandler - RestErrorResponse{message='Acesso negado', entityName='null', description='uri=/customer/cart/delivery', fieldErrors=[]}
2024-09-12 15:30:26,169 WARN  [http-nio-auto-1-exec-5] m.r.e.RestExceptionHandler - RestErrorResponse{message='Acesso negado', entityName='null', description='uri=/customer/cart', fieldErrors=[]}
2024-09-12 15:30:26,202 WARN  [http-nio-auto-1-exec-6] m.r.e.RestExceptionHandler - RestErrorResponse{message='Acesso negado', entityName='null', description='uri=/customer/orders', fieldErrors=[]}
Request method:	GET
Request URI:	http://localhost:42671/products?productId=9999
Proxy:			<none>
Request params:	<none>
Query params:	productId=9999
Form params:	<none>
Path params:	<none>
Headers:		Accept=*/*
Cookies:		<none>
Multiparts:		<none>
Body:			<none>

HTTP/1.1 200 
X-Content-Type-Options: nosniff
X-XSS-Protection: 1; mode=block
Cache-Control: no-cache, no-store, max-age=0, must-revalidate
Pragma: no-cache
Expires: 0
Content-Type: application/json
Transfer-Encoding: chunked
Date: Thu, 12 Sep 2024 18:30:25 GMT
Keep-Alive: timeout=60
Connection: keep-alive

[
    {
        "productId": 1,
        "distillery": "Ardbeg",
        "name": "Ten",
        "price": 4420.0,
        "age": 10,
        "volume": 700,
        "alcohol": 46.0,
        "description": "Ten Years Old is the basis of the Ardbeg range. After 10 years of maturation in ex-bourbon casks, the whiskey bottled at 46% ABV without cold filtering. The characteristic peat, although clearly present but in perfect balance with the natural sweetness and not predominant in the taste.",
        "available": false,
        "links": [
            {
                "rel": "self",
                "href": "http://localhost:42671/products/1"
            }
        ]
    },
    {
        "productId": 2,
        "distillery": "Ardbeg",
        "name": "Uigeadail",
        "price": 7020.0,
        "age": 0,
        "volume": 700,
        "alcohol": 54.2,
        "description": "Ardbeg Uigedael is named after Loch Uigedael, the lake in the grounds of the distillery Ardbeg which are the water is an important factor in the distilling process. The Uigedael a vatted malt, bottled at 54.2% ABV without cold filtering. Ardbeg Uigedael has no age indication for the expression consists of various malts of different ages. Malts are used partly matured in ex-bourbon and partly on ex-sherry casks.",
        "available": true,
        "links": [
            {
                "rel": "self",
                "href": "http://localhost:42671/products/2"
            }
        ]
    },
    {
        "productId": 3,
        "distillery": "Balvenie",
        "name": "12 y.o. Doublewood",
        "price": 5403.0,
        "age": 12,
        "volume": 700,
        "alcohol": 40.0,
        "description": "Has clear influences from both bourbon and sherry wood. This malt has only 12 years aged in bourbon casks and then 3 months in young Oloroso casks. The peppery character from the bourbon barrels, penetrates, as it were by the rich and full aroma of Oloroso casks it. The Balvenie Double Wood is therefore a very complex malt.",
        "available": true,
        "links": [
            {
                "rel": "self",
                "href": "http://localhost:42671/products/3"
            }
        ]
    },
    {
        "productId": 4,
        "distillery": "Caol Ila",
        "name": "12 y.o.",
        "price": 4913.0,
        "age": 12,
        "volume": 700,
        "alcohol": 43.0,
        "description": "Smoked ham comes across delicately with citrus and cigar leaves. Fresh and smoky, probably the best part of this whisky. With an almost full body, oil and tar meet subtle smoke. Hints of sweet tastes like honey. Some spices like pepper combined with little sweetness.",
        "available": true,
        "links": [
            {
                "rel": "self",
                "href": "http://localhost:42671/products/4"
            }
        ]
    },
    {
        "productId": 5,
        "distillery": "Dalwhinnie",
        "name": "15 y.o.",
        "price": 6517.0,
        "age": 15,
        "volume": 750,
        "alcohol": 43.0,
        "description": "A good introduction to the delights of single malt whisky – elegant, smooth and medium-bodied, with a light, fruity palate and a whiff of heather on the finish. Part of Diageo's Classic Malt range. ",
        "available": true,
        "links": [
            {
                "rel": "self",
                "href": "http://localhost:42671/products/5"
            }
        ]
    },
    {
        "productId": 6,
        "distillery": "Lagavulin",
        "name": "16 y.o.",
        "price": 6620.0,
        "age": 16,
        "volume": 750,
        "alcohol": 43.0,
        "description": "The Islay representative in the 'Classic Malts' series is a deep, dry and exceptionally peaty bruiser. Probably the most pungent of all Islay malts, Lagavulin is not for the faint-hearted but inspires fanatical devotion in its many followers.",
        "available": true,
        "links": [
            {
                "rel": "self",
                "href": "http://localhost:42671/products/6"
            }
        ]
    },
    {
        "productId": 7,
        "distillery": "Laphroaig",
        "name": "Quarter Cask",
        "price": 5100.0,
        "age": 0,
        "volume": 700,
        "alcohol": 48.0,
        "description": "A vibrant young Laphroaig whose maturation has been accelerated by ageing in quarter casks. This shows soft sweetness and a velvety feel when first tasted, then the intense peatiness so unique to Laphroaig comes bursting through. A terrific whisky and great value.",
        "available": true,
        "links": [
            {
                "rel": "self",
                "href": "http://localhost:42671/products/7"
            }
        ]
    },
    {
        "productId": 8,
        "distillery": "Springbank",
        "name": "12 y.o. Cask Strength Batch 6",
        "price": 8127.0,
        "age": 12,
        "volume": 700,
        "alcohol": 53.1,
        "description": "Like a storm gathering of the Kintyre coast, dark and ominous, yet tastes so good. The richness comes from the high percentage of sherry casks used in maturation. This is a truly classic Springbank, best enjoyed after dinner, or with your favourite cigar.",
        "available": true,
        "links": [
            {
                "rel": "self",
                "href": "http://localhost:42671/products/8"
            }
        ]
    },
    {
        "productId": 9,
        "distillery": "Springbank",
        "name": "18 y.o.",
        "price": 14490.0,
        "age": 18,
        "volume": 700,
        "alcohol": 46.0,
        "description": "This heavily sherried 18-year-old Springbank has been bottled by Mark Reynier as part of his Renegade series. Distilled in 1995, this sherry hogshead was aged for 10 years in Campbeltown and then moved to Bruichladdich for a further eight years.",
        "available": true,
        "links": [
            {
                "rel": "self",
                "href": "http://localhost:42671/products/9"
            }
        ]
    },
    {
        "productId": 10,
        "distillery": "Talisker",
        "name": "10 y.o.",
        "price": 4683.0,
        "age": 10,
        "volume": 750,
        "alcohol": 45.8,
        "description": "Powerful peat smoke with the salinity of sea water and the moisture of fresh oysters. Full sweetness of dried fruit with smoke and strong aromas of malted barley, warm and intense. Peppery in the mouth. Big, long, warming and peppery on the finish with an attractive sweetness.",
        "available": true,
        "links": [
            {
                "rel": "self",
                "href": "http://localhost:42671/products/10"
            }
        ]
    },
    {
        "productId": 11,
        "distillery": "Glenkinchie",
        "name": "12 y.o.",
        "price": 4547.0,
        "age": 12,
        "volume": 700,
        "alcohol": 43.0,
        "description": "A light, delicate whiskey; sweet and creamy with a subtle floral aroma. This subtle, refined Lowland is ideal as an aperitif; try it straight from the fridge or freezer.",
        "available": false,
        "links": [
            {
                "rel": "self",
                "href": "http://localhost:42671/products/11"
            }
        ]
    }
]
2024-09-12 15:30:26,471 WARN  [http-nio-auto-1-exec-8] m.r.e.RestExceptionHandler - RestErrorResponse{message='Acesso negado', entityName='null', description='uri=/customer/cart/pay', fieldErrors=[]}
Request method:	POST
Request URI:	http://localhost:42671/customer/cart/pay?name=NonExistentUser
Proxy:			<none>
Request params:	<none>
Query params:	name=NonExistentUser
Form params:	<none>
Path params:	<none>
Headers:		Accept=*/*
				Content-Type=application/json; charset=UTF-8
Cookies:		<none>
Multiparts:		<none>
Body:
{
    "ccNumber": "4111111111111111"
}

HTTP/1.1 401 
X-Content-Type-Options: nosniff
X-XSS-Protection: 1; mode=block
Cache-Control: no-cache, no-store, max-age=0, must-revalidate
Pragma: no-cache
Expires: 0
Content-Type: application/json
Transfer-Encoding: chunked
Date: Thu, 12 Sep 2024 18:30:25 GMT
Keep-Alive: timeout=60
Connection: keep-alive

{
    "message": "Acesso negado",
    "description": "uri=/customer/cart/pay",
    "entityName": null,
    "fieldErrors": [
        
    ]
}
2024-09-12 15:30:26,501 WARN  [http-nio-auto-1-exec-9] m.r.e.RestExceptionHandler - RestErrorResponse{message='Acesso negado', entityName='null', description='uri=/customer/contacts', fieldErrors=[]}
Request method:	GET
Request URI:	http://localhost:42671/customer/contacts?name=UnauthorizedUser
Proxy:			<none>
Request params:	<none>
Query params:	name=UnauthorizedUser
Form params:	<none>
Path params:	<none>
Headers:		Accept=*/*
Cookies:		<none>
Multiparts:		<none>
Body:			<none>

HTTP/1.1 401 
X-Content-Type-Options: nosniff
X-XSS-Protection: 1; mode=block
Cache-Control: no-cache, no-store, max-age=0, must-revalidate
Pragma: no-cache
Expires: 0
Content-Type: application/json
Transfer-Encoding: chunked
Date: Thu, 12 Sep 2024 18:30:25 GMT
Keep-Alive: timeout=60
Connection: keep-alive

{
    "message": "Acesso negado",
    "description": "uri=/customer/contacts",
    "entityName": null,
    "fieldErrors": [
        
    ]
}
2024-09-12 15:30:26,536 WARN  [http-nio-auto-1-exec-10] m.r.e.RestExceptionHandler - RestErrorResponse{message='Acesso negado', entityName='null', description='uri=/customer/cart', fieldErrors=[]}
Request method:	DELETE
Request URI:	http://localhost:42671/customer/cart?name=EmptyCartUser
Proxy:			<none>
Request params:	<none>
Query params:	name=EmptyCartUser
Form params:	<none>
Path params:	<none>
Headers:		Accept=*/*
Cookies:		<none>
Multiparts:		<none>
Body:			<none>

HTTP/1.1 401 
X-Content-Type-Options: nosniff
X-XSS-Protection: 1; mode=block
Cache-Control: no-cache, no-store, max-age=0, must-revalidate
Pragma: no-cache
Expires: 0
Content-Type: application/json
Transfer-Encoding: chunked
Date: Thu, 12 Sep 2024 18:30:25 GMT
Keep-Alive: timeout=60
Connection: keep-alive

{
    "message": "Acesso negado",
    "description": "uri=/customer/cart",
    "entityName": null,
    "fieldErrors": [
        
    ]
}
2024-09-12 15:30:26,555 INFO  [main] o.a.c.h.Http11NioProtocol - Pausing ProtocolHandler ["http-nio-auto-1"]
2024-09-12 15:30:26,556 INFO  [main] o.a.c.c.StandardService - Stopping service [Tomcat]
2024-09-12 15:30:26,558 INFO  [main] o.a.c.c.C.[.[.[/] - Destroying Spring FrameworkServlet 'dispatcherServlet'
2024-09-12 15:30:26,561 INFO  [main] o.a.c.h.Http11NioProtocol - Stopping ProtocolHandler ["http-nio-auto-1"]
2024-09-12 15:30:26,567 INFO  [main] o.a.c.h.Http11NioProtocol - Destroying ProtocolHandler ["http-nio-auto-1"]
[[1;31mERROR[m] [1;31mTests [0;1mrun: [0;1m10[m, [1;31mFailures: [0;1;31m7[m, Errors: 0, Skipped: 0, Time elapsed: 15.641 s[1;31m <<< FAILURE![m - in market.[1mv1_gpt4turbo_run01_RestErrorResponseTest[m
[[1;31mERROR[m] testRegisterUserCreated  Time elapsed: 1.699 s  <<< FAILURE!
java.lang.AssertionError: 
1 expectation failed.
Expected status code <201> but was <406>.

	at market.v1_gpt4turbo_run01_RestErrorResponseTest.testRegisterUserCreated(v1_gpt4turbo_run01_RestErrorResponseTest.java:184)

[[1;31mERROR[m] testUpdateContactsNotFound  Time elapsed: 0.103 s  <<< FAILURE!
java.lang.AssertionError: 
1 expectation failed.
Expected status code <404> but was <401>.

	at market.v1_gpt4turbo_run01_RestErrorResponseTest.testUpdateContactsNotFound(v1_gpt4turbo_run01_RestErrorResponseTest.java:147)

[[1;31mERROR[m] testGetCustomerNotFound  Time elapsed: 0.122 s  <<< FAILURE!
java.lang.AssertionError: 
1 expectation failed.
Expected status code <404> but was <401>.

	at market.v1_gpt4turbo_run01_RestErrorResponseTest.testGetCustomerNotFound(v1_gpt4turbo_run01_RestErrorResponseTest.java:68)

[[1;31mERROR[m] testGetProductNotFound  Time elapsed: 0.229 s  <<< FAILURE!
java.lang.AssertionError: 
1 expectation failed.
Expected status code <404> but was <200>.

	at market.v1_gpt4turbo_run01_RestErrorResponseTest.testGetProductNotFound(v1_gpt4turbo_run01_RestErrorResponseTest.java:171)

[[1;31mERROR[m] testPayByCardNotFound  Time elapsed: 0.043 s  <<< FAILURE!
java.lang.AssertionError: 
1 expectation failed.
Expected status code <404> but was <401>.

	at market.v1_gpt4turbo_run01_RestErrorResponseTest.testPayByCardNotFound(v1_gpt4turbo_run01_RestErrorResponseTest.java:121)

[[1;31mERROR[m] testGetContactsForbidden  Time elapsed: 0.029 s  <<< FAILURE!
java.lang.AssertionError: 
1 expectation failed.
Expected status code <403> but was <401>.

	at market.v1_gpt4turbo_run01_RestErrorResponseTest.testGetContactsForbidden(v1_gpt4turbo_run01_RestErrorResponseTest.java:133)

[[1;31mERROR[m] testClearCartNoContent  Time elapsed: 0.035 s  <<< FAILURE!
java.lang.AssertionError: 
1 expectation failed.
Expected status code <204> but was <401>.

	at market.v1_gpt4turbo_run01_RestErrorResponseTest.testClearCartNoContent(v1_gpt4turbo_run01_RestErrorResponseTest.java:94)

2024-09-12 15:30:26,616 INFO  [SpringContextShutdownHook] o.s.s.c.ThreadPoolTaskExecutor - Shutting down ExecutorService 'applicationTaskExecutor'
2024-09-12 15:30:26,631 INFO  [SpringContextShutdownHook] o.s.o.j.LocalContainerEntityManagerFactoryBean - Closing JPA EntityManagerFactory for persistence unit 'default'
2024-09-12 15:30:26,635 INFO  [SpringContextShutdownHook] c.z.h.HikariDataSource - HikariPool-1 - Shutdown initiated...
2024-09-12 15:30:26,643 INFO  [SpringContextShutdownHook] c.z.h.HikariDataSource - HikariPool-1 - Shutdown completed.
[[1;34mINFO[m] 
[[1;34mINFO[m] Results:
[[1;34mINFO[m] 
[[1;31mERROR[m] [1;31mFailures: [m
[[1;31mERROR[m] [1;31m  v1_gpt4turbo_run01_RestErrorResponseTest.testClearCartNoContent:94 1 expectation failed.
Expected status code <204> but was <401>.
[m
[[1;31mERROR[m] [1;31m  v1_gpt4turbo_run01_RestErrorResponseTest.testGetContactsForbidden:133 1 expectation failed.
Expected status code <403> but was <401>.
[m
[[1;31mERROR[m] [1;31m  v1_gpt4turbo_run01_RestErrorResponseTest.testGetCustomerNotFound:68 1 expectation failed.
Expected status code <404> but was <401>.
[m
[[1;31mERROR[m] [1;31m  v1_gpt4turbo_run01_RestErrorResponseTest.testGetProductNotFound:171 1 expectation failed.
Expected status code <404> but was <200>.
[m
[[1;31mERROR[m] [1;31m  v1_gpt4turbo_run01_RestErrorResponseTest.testPayByCardNotFound:121 1 expectation failed.
Expected status code <404> but was <401>.
[m
[[1;31mERROR[m] [1;31m  v1_gpt4turbo_run01_RestErrorResponseTest.testRegisterUserCreated:184 1 expectation failed.
Expected status code <201> but was <406>.
[m
[[1;31mERROR[m] [1;31m  v1_gpt4turbo_run01_RestErrorResponseTest.testUpdateContactsNotFound:147 1 expectation failed.
Expected status code <404> but was <401>.
[m
[[1;34mINFO[m] 
[[1;31mERROR[m] [1;31mTests run: 10, Failures: 7, Errors: 0, Skipped: 0[m
[[1;34mINFO[m] 
[[1;34mINFO[m] [1m------------------------------------------------------------------------[m
[[1;34mINFO[m] [1;31mBUILD FAILURE[m
[[1;34mINFO[m] [1m------------------------------------------------------------------------[m
[[1;34mINFO[m] Total time:  21.028 s
[[1;34mINFO[m] Finished at: 2024-09-12T15:30:27-03:00
[[1;34mINFO[m] [1m------------------------------------------------------------------------[m
[[1;31mERROR[m] Failed to execute goal [32morg.apache.maven.plugins:maven-surefire-plugin:2.22.0:test[m [1m(default-test)[m on project [36mmarket-rest[m: [1;31mThere are test failures.[m
[[1;31mERROR[m] [1;31m[m
[[1;31mERROR[m] [1;31mPlease refer to /media/rincon/63999417195/eclipse-workspace/EMB-master/jdk_11_maven/cs/rest-gui/market/market-rest/target/surefire-reports for the individual test results.[m
[[1;31mERROR[m] [1;31mPlease refer to dump files (if any exist) [date]-jvmRun[N].dump, [date].dumpstream and [date]-jvmRun[N].dumpstream.[m
[[1;31mERROR[m] -> [1m[Help 1][m
[[1;31mERROR[m] 
[[1;31mERROR[m] To see the full stack trace of the errors, re-run Maven with the [1m-e[m switch.
[[1;31mERROR[m] Re-run Maven using the [1m-X[m switch to enable full debug logging.
[[1;31mERROR[m] 
[[1;31mERROR[m] For more information about the errors and possible solutions, please read the following articles:
[[1;31mERROR[m] [1m[Help 1][m http://cwiki.apache.org/confluence/display/MAVEN/MojoFailureException

#####
