[[1;34mINFO[m] Scanning for projects...
[[1;34mINFO[m] 
[[1;34mINFO[m] [1m---------------------< [0;36mnet.lukyanets:market-rest[0;1m >----------------------[m
[[1;34mINFO[m] [1mBuilding market-rest 0.1.2[m
[[1;34mINFO[m] [1m--------------------------------[ jar ]---------------------------------[m
[[1;33mWARNING[m] The POM for com.sun.xml.bind:jaxb-osgi:jar:2.2.10 is invalid, transitive dependencies (if any) will not be available, enable debug logging for more details
[[1;34mINFO[m] 
[[1;34mINFO[m] [1m--- [0;32mmaven-clean-plugin:2.5:clean[m [1m(default-clean)[m @ [36mmarket-rest[0;1m ---[m
[[1;34mINFO[m] Deleting /media/rincon/63999417195/eclipse-workspace/EMB-master/jdk_11_maven/cs/rest-gui/market/market-rest/target
[[1;34mINFO[m] 
[[1;34mINFO[m] [1m--- [0;32mjacoco-maven-plugin:0.8.7:prepare-agent[m [1m(default)[m @ [36mmarket-rest[0;1m ---[m
[[1;34mINFO[m] argLine set to -javaagent:/home/rincon/.m2/repository/org/jacoco/org.jacoco.agent/0.8.7/org.jacoco.agent-0.8.7-runtime.jar=destfile=/media/rincon/63999417195/eclipse-workspace/EMB-master/jdk_11_maven/cs/rest-gui/market/market-rest/target/jacoco.exec
[[1;34mINFO[m] 
[[1;34mINFO[m] [1m--- [0;32mspring-boot-maven-plugin:2.4.3:build-info[m [1m(default)[m @ [36mmarket-rest[0;1m ---[m
[[1;34mINFO[m] 
[[1;34mINFO[m] [1m--- [0;32mmaven-resources-plugin:2.6:resources[m [1m(default-resources)[m @ [36mmarket-rest[0;1m ---[m
[[1;34mINFO[m] Using 'UTF-8' encoding to copy filtered resources.
[[1;34mINFO[m] Copying 3 resources
[[1;34mINFO[m] 
[[1;34mINFO[m] [1m--- [0;32mmaven-compiler-plugin:3.8.0:compile[m [1m(default-compile)[m @ [36mmarket-rest[0;1m ---[m
[[1;34mINFO[m] Changes detected - recompiling the module!
[[1;34mINFO[m] Compiling 11 source files to /media/rincon/63999417195/eclipse-workspace/EMB-master/jdk_11_maven/cs/rest-gui/market/market-rest/target/classes
[[1;34mINFO[m] 
[[1;34mINFO[m] [1m--- [0;32mjacoco-maven-plugin:0.8.7:prepare-agent[m [1m(default)[m @ [36mmarket-rest[0;1m ---[m
[[1;34mINFO[m] argLine set to -javaagent:/home/rincon/.m2/repository/org/jacoco/org.jacoco.agent/0.8.7/org.jacoco.agent-0.8.7-runtime.jar=destfile=/media/rincon/63999417195/eclipse-workspace/EMB-master/jdk_11_maven/cs/rest-gui/market/market-rest/target/jacoco.exec
[[1;34mINFO[m] 
[[1;34mINFO[m] [1m--- [0;32mspring-boot-maven-plugin:2.4.3:build-info[m [1m(default)[m @ [36mmarket-rest[0;1m ---[m
[[1;34mINFO[m] 
[[1;34mINFO[m] [1m--- [0;32mmaven-resources-plugin:2.6:resources[m [1m(default-resources)[m @ [36mmarket-rest[0;1m ---[m
[[1;34mINFO[m] Using 'UTF-8' encoding to copy filtered resources.
[[1;34mINFO[m] Copying 3 resources
[[1;34mINFO[m] 
[[1;34mINFO[m] [1m--- [0;32mmaven-compiler-plugin:3.8.0:compile[m [1m(default-compile)[m @ [36mmarket-rest[0;1m ---[m
[[1;34mINFO[m] Nothing to compile - all classes are up to date
[[1;34mINFO[m] 
[[1;34mINFO[m] [1m--- [0;32mmaven-resources-plugin:2.6:testResources[m [1m(default-testResources)[m @ [36mmarket-rest[0;1m ---[m
[[1;34mINFO[m] Using 'UTF-8' encoding to copy filtered resources.
[[1;34mINFO[m] skip non existing resourceDirectory /media/rincon/63999417195/eclipse-workspace/EMB-master/jdk_11_maven/cs/rest-gui/market/market-rest/src/test/resources
[[1;34mINFO[m] 
[[1;34mINFO[m] [1m--- [0;32mmaven-compiler-plugin:3.8.0:testCompile[m [1m(default-testCompile)[m @ [36mmarket-rest[0;1m ---[m
[[1;34mINFO[m] Changes detected - recompiling the module!
[[1;34mINFO[m] Compiling 1 source file to /media/rincon/63999417195/eclipse-workspace/EMB-master/jdk_11_maven/cs/rest-gui/market/market-rest/target/test-classes
[[1;34mINFO[m] 
[[1;34mINFO[m] [1m--- [0;32mjacoco-maven-plugin:0.8.7:prepare-agent[m [1m(default)[m @ [36mmarket-rest[0;1m ---[m
[[1;34mINFO[m] argLine set to -javaagent:/home/rincon/.m2/repository/org/jacoco/org.jacoco.agent/0.8.7/org.jacoco.agent-0.8.7-runtime.jar=destfile=/media/rincon/63999417195/eclipse-workspace/EMB-master/jdk_11_maven/cs/rest-gui/market/market-rest/target/jacoco.exec
[[1;34mINFO[m] 
[[1;34mINFO[m] [1m--- [0;32mspring-boot-maven-plugin:2.4.3:build-info[m [1m(default)[m @ [36mmarket-rest[0;1m ---[m
[[1;34mINFO[m] 
[[1;34mINFO[m] [1m--- [0;32mmaven-resources-plugin:2.6:resources[m [1m(default-resources)[m @ [36mmarket-rest[0;1m ---[m
[[1;34mINFO[m] Using 'UTF-8' encoding to copy filtered resources.
[[1;34mINFO[m] Copying 3 resources
[[1;34mINFO[m] 
[[1;34mINFO[m] [1m--- [0;32mmaven-compiler-plugin:3.8.0:compile[m [1m(default-compile)[m @ [36mmarket-rest[0;1m ---[m
[[1;34mINFO[m] Nothing to compile - all classes are up to date
[[1;34mINFO[m] 
[[1;34mINFO[m] [1m--- [0;32mmaven-resources-plugin:2.6:testResources[m [1m(default-testResources)[m @ [36mmarket-rest[0;1m ---[m
[[1;34mINFO[m] Using 'UTF-8' encoding to copy filtered resources.
[[1;34mINFO[m] skip non existing resourceDirectory /media/rincon/63999417195/eclipse-workspace/EMB-master/jdk_11_maven/cs/rest-gui/market/market-rest/src/test/resources
[[1;34mINFO[m] 
[[1;34mINFO[m] [1m--- [0;32mmaven-compiler-plugin:3.8.0:testCompile[m [1m(default-testCompile)[m @ [36mmarket-rest[0;1m ---[m
[[1;34mINFO[m] Nothing to compile - all classes are up to date
[[1;34mINFO[m] 
[[1;34mINFO[m] [1m--- [0;32mmaven-surefire-plugin:2.22.0:test[m [1m(default-test)[m @ [36mmarket-rest[0;1m ---[m
[[1;34mINFO[m] 
[[1;34mINFO[m] -------------------------------------------------------
[[1;34mINFO[m]  T E S T S
[[1;34mINFO[m] -------------------------------------------------------
[[1;34mINFO[m] Running market.[1mv1_gpt4turbo_run02_ContactsRestControllerTest[m

  .   ____          _            __ _ _
 /\\ / ___'_ __ _ _(_)_ __  __ _ \ \ \ \
( ( )\___ | '_ | '_| | '_ \/ _` | \ \ \ \
 \\/  ___)| |_)| | | | | || (_| |  ) ) ) )
  '  |____| .__|_| |_|_| |_\__, | / / / /
 =========|_|==============|___/=/_/_/_/
 :: Spring Boot ::                (v2.4.3)

2024-09-12 15:40:08,800 INFO  [background-preinit] o.h.v.i.u.Version - HV000001: Hibernate Validator 6.1.7.Final
2024-09-12 15:40:08,947 INFO  [main] o.a.m.s.b.ForkedBooter - Starting ForkedBooter v2.22.0 using Java 11.0.20 on IFTO-PROBOOK with PID 10339 (started by rincon in /media/rincon/63999417195/eclipse-workspace/EMB-master/jdk_11_maven/cs/rest-gui/market/market-rest)
2024-09-12 15:40:08,955 INFO  [main] o.a.m.s.b.ForkedBooter - No active profile set, falling back to default profiles: default
2024-09-12 15:40:09,540 WARN  [main] o.s.b.c.c.ConfigDataEnvironment - Property 'spring.profiles' imported from location 'class path resource [application.yml]' is invalid and should be replaced with 'spring.config.activate.on-profile' [origin: class path resource [application.yml] - 34:13]
2024-09-12 15:40:09,540 WARN  [main] o.s.b.c.c.ConfigDataEnvironment - Property 'spring.profiles' imported from location 'class path resource [application.yml]' is invalid and should be replaced with 'spring.config.activate.on-profile' [origin: class path resource [application.yml] - 24:13]
2024-09-12 15:40:11,038 INFO  [main] o.s.d.r.c.RepositoryConfigurationDelegate - Bootstrapping Spring Data JPA repositories in DEFAULT mode.
2024-09-12 15:40:11,179 INFO  [main] o.s.d.r.c.RepositoryConfigurationDelegate - Finished Spring Data repository scanning in 126 ms. Found 8 JPA repository interfaces.
2024-09-12 15:40:11,783 INFO  [main] o.s.c.s.PostProcessorRegistrationDelegate$BeanPostProcessorChecker - Bean 'market.DataConfig' of type [market.DataConfig$$EnhancerBySpringCGLIB$$531042fa] is not eligible for getting processed by all BeanPostProcessors (for example: not eligible for auto-proxying)
2024-09-12 15:40:12,022 INFO  [main] o.s.c.s.PostProcessorRegistrationDelegate$BeanPostProcessorChecker - Bean 'org.springframework.security.access.expression.method.DefaultMethodSecurityExpressionHandler@4372cb9c' of type [org.springframework.security.access.expression.method.DefaultMethodSecurityExpressionHandler] is not eligible for getting processed by all BeanPostProcessors (for example: not eligible for auto-proxying)
2024-09-12 15:40:12,034 INFO  [main] o.s.c.s.PostProcessorRegistrationDelegate$BeanPostProcessorChecker - Bean 'methodSecurityMetadataSource' of type [org.springframework.security.access.method.DelegatingMethodSecurityMetadataSource] is not eligible for getting processed by all BeanPostProcessors (for example: not eligible for auto-proxying)
2024-09-12 15:40:12,597 INFO  [main] o.s.b.w.e.t.TomcatWebServer - Tomcat initialized with port(s): 0 (http)
2024-09-12 15:40:12,615 INFO  [main] o.a.c.h.Http11NioProtocol - Initializing ProtocolHandler ["http-nio-auto-1"]
2024-09-12 15:40:12,615 INFO  [main] o.a.c.c.StandardService - Starting service [Tomcat]
2024-09-12 15:40:12,616 INFO  [main] o.a.c.c.StandardEngine - Starting Servlet engine: [Apache Tomcat/9.0.43]
2024-09-12 15:40:12,762 INFO  [main] o.a.c.c.C.[.[.[/] - Initializing Spring embedded WebApplicationContext
2024-09-12 15:40:12,763 INFO  [main] o.s.b.w.s.c.ServletWebServerApplicationContext - Root WebApplicationContext: initialization completed in 3218 ms
2024-09-12 15:40:13,000 INFO  [main] c.z.h.HikariDataSource - HikariPool-1 - Starting...
2024-09-12 15:40:13,413 INFO  [main] c.z.h.HikariDataSource - HikariPool-1 - Start completed.
2024-09-12 15:40:13,639 INFO  [main] o.h.j.i.u.LogHelper - HHH000204: Processing PersistenceUnitInfo [name: default]
2024-09-12 15:40:13,748 INFO  [main] o.h.Version - HHH000412: Hibernate ORM core version 5.4.28.Final
2024-09-12 15:40:13,941 INFO  [main] o.h.a.c.Version - HCANN000001: Hibernate Commons Annotations {5.1.2.Final}
2024-09-12 15:40:14,262 INFO  [main] o.h.d.Dialect - HHH000400: Using dialect: org.hibernate.dialect.H2Dialect
2024-09-12 15:40:14,580 WARN  [main] o.h.b.i.InFlightMetadataCollectorImpl - HHH000069: Duplicate generator name gen
2024-09-12 15:40:14,583 WARN  [main] o.h.b.i.InFlightMetadataCollectorImpl - HHH000069: Duplicate generator name gen
2024-09-12 15:40:15,408 INFO  [main] o.h.e.t.j.p.i.JtaPlatformInitiator - HHH000490: Using JtaPlatform implementation: [org.hibernate.engine.transaction.jta.platform.internal.NoJtaPlatform]
2024-09-12 15:40:15,420 INFO  [main] o.s.o.j.LocalContainerEntityManagerFactoryBean - Initialized JPA EntityManagerFactory for persistence unit 'default'
2024-09-12 15:40:16,572 WARN  [main] o.s.b.a.o.j.JpaBaseConfiguration$JpaWebConfiguration - spring.jpa.open-in-view is enabled by default. Therefore, database queries may be performed during view rendering. Explicitly configure spring.jpa.open-in-view to disable this warning
2024-09-12 15:40:17,631 INFO  [main] o.s.s.w.DefaultSecurityFilterChain - Will secure any request with [org.springframework.security.web.context.request.async.WebAsyncManagerIntegrationFilter@28d32d3d, org.springframework.security.web.context.SecurityContextPersistenceFilter@53fbe327, org.springframework.security.web.header.HeaderWriterFilter@1dfe1832, org.springframework.security.web.authentication.logout.LogoutFilter@4c03e6d7, org.springframework.security.web.authentication.www.BasicAuthenticationFilter@6d2e59bb, org.springframework.security.web.savedrequest.RequestCacheAwareFilter@47ff2270, org.springframework.security.web.servletapi.SecurityContextHolderAwareRequestFilter@1f3c6d34, org.springframework.security.web.authentication.AnonymousAuthenticationFilter@3defaf6b, org.springframework.security.web.session.SessionManagementFilter@3f863f0c, org.springframework.security.web.access.ExceptionTranslationFilter@5f877a4, org.springframework.security.web.access.intercept.FilterSecurityInterceptor@638b6eff]
2024-09-12 15:40:17,805 INFO  [main] o.s.s.c.ThreadPoolTaskExecutor - Initializing ExecutorService 'applicationTaskExecutor'
2024-09-12 15:40:18,249 INFO  [main] o.a.c.h.Http11NioProtocol - Starting ProtocolHandler ["http-nio-auto-1"]
2024-09-12 15:40:18,279 INFO  [main] o.s.b.w.e.t.TomcatWebServer - Tomcat started on port(s): 46043 (http) with context path ''
2024-09-12 15:40:18,829 INFO  [main] o.a.m.s.b.ForkedBooter - Started ForkedBooter in 10.859 seconds (JVM running for 13.188)
2024-09-12 15:40:20,897 INFO  [http-nio-auto-1-exec-1] o.a.c.c.C.[.[.[/] - Initializing Spring DispatcherServlet 'dispatcherServlet'
2024-09-12 15:40:20,897 INFO  [http-nio-auto-1-exec-1] o.s.w.s.DispatcherServlet - Initializing Servlet 'dispatcherServlet'
2024-09-12 15:40:20,900 INFO  [http-nio-auto-1-exec-1] o.s.w.s.DispatcherServlet - Completed initialization in 2 ms
2024-09-12 15:40:20,986 WARN  [http-nio-auto-1-exec-1] m.r.e.RestExceptionHandler - RestErrorResponse{message='Acesso negado', entityName='null', description='uri=/customer/contacts', fieldErrors=[]}
Request method:	GET
Request URI:	http://localhost:46043/customer/contacts
Proxy:			<none>
Request params:	<none>
Query params:	<none>
Form params:	<none>
Path params:	<none>
Headers:		Accept=*/*
Cookies:		<none>
Multiparts:		<none>
Body:			<none>

HTTP/1.1 401 
X-Content-Type-Options: nosniff
X-XSS-Protection: 1; mode=block
Cache-Control: no-cache, no-store, max-age=0, must-revalidate
Pragma: no-cache
Expires: 0
Content-Type: application/json
Transfer-Encoding: chunked
Date: Thu, 12 Sep 2024 18:40:21 GMT
Keep-Alive: timeout=60
Connection: keep-alive

{
    "message": "Acesso negado",
    "description": "uri=/customer/contacts",
    "entityName": null,
    "fieldErrors": [
        
    ]
}
2024-09-12 15:40:21,252 INFO  [main] o.a.c.h.Http11NioProtocol - Pausing ProtocolHandler ["http-nio-auto-1"]
2024-09-12 15:40:21,253 INFO  [main] o.a.c.c.StandardService - Stopping service [Tomcat]
2024-09-12 15:40:21,255 INFO  [main] o.a.c.c.C.[.[.[/] - Destroying Spring FrameworkServlet 'dispatcherServlet'
2024-09-12 15:40:21,259 INFO  [main] o.a.c.h.Http11NioProtocol - Stopping ProtocolHandler ["http-nio-auto-1"]
2024-09-12 15:40:21,264 INFO  [main] o.a.c.h.Http11NioProtocol - Destroying ProtocolHandler ["http-nio-auto-1"]
[[1;31mERROR[m] [1;31mTests [0;1mrun: [0;1m2[m, [1;31mFailures: [0;1;31m1[m, [1;31mErrors: [0;1;31m1[m, Skipped: 0, Time elapsed: 14.515 s[1;31m <<< FAILURE![m - in market.[1mv1_gpt4turbo_run02_ContactsRestControllerTest[m
[[1;31mERROR[m] testUpdateContacts  Time elapsed: 0.377 s  <<< ERROR!
com.fasterxml.jackson.databind.exc.InvalidDefinitionException: No serializer found for class market.v1_gpt4turbo_run02_ContactsRestControllerTest$ContactsDTO and no properties discovered to create BeanSerializer (to avoid exception, disable SerializationFeature.FAIL_ON_EMPTY_BEANS)
	at market.v1_gpt4turbo_run02_ContactsRestControllerTest.testUpdateContacts(v1_gpt4turbo_run02_ContactsRestControllerTest.java:80)

[[1;31mERROR[m] testGetContacts  Time elapsed: 1.16 s  <<< FAILURE!
java.lang.AssertionError: 
1 expectation failed.
Expected status code <200> but was <401>.

	at market.v1_gpt4turbo_run02_ContactsRestControllerTest.testGetContacts(v1_gpt4turbo_run02_ContactsRestControllerTest.java:62)

2024-09-12 15:40:21,528 INFO  [SpringContextShutdownHook] o.s.s.c.ThreadPoolTaskExecutor - Shutting down ExecutorService 'applicationTaskExecutor'
2024-09-12 15:40:21,535 INFO  [SpringContextShutdownHook] o.s.o.j.LocalContainerEntityManagerFactoryBean - Closing JPA EntityManagerFactory for persistence unit 'default'
2024-09-12 15:40:21,536 INFO  [SpringContextShutdownHook] c.z.h.HikariDataSource - HikariPool-1 - Shutdown initiated...
2024-09-12 15:40:21,539 INFO  [SpringContextShutdownHook] c.z.h.HikariDataSource - HikariPool-1 - Shutdown completed.
[[1;34mINFO[m] 
[[1;34mINFO[m] Results:
[[1;34mINFO[m] 
[[1;31mERROR[m] [1;31mFailures: [m
[[1;31mERROR[m] [1;31m  v1_gpt4turbo_run02_ContactsRestControllerTest.testGetContacts:62 1 expectation failed.
Expected status code <200> but was <401>.
[m
[[1;31mERROR[m] [1;31mErrors: [m
[[1;31mERROR[m] [1;31m  v1_gpt4turbo_run02_ContactsRestControllerTest.testUpdateContacts:80 » InvalidDefinition[m
[[1;34mINFO[m] 
[[1;31mERROR[m] [1;31mTests run: 2, Failures: 1, Errors: 1, Skipped: 0[m
[[1;34mINFO[m] 
[[1;34mINFO[m] [1m------------------------------------------------------------------------[m
[[1;34mINFO[m] [1;31mBUILD FAILURE[m
[[1;34mINFO[m] [1m------------------------------------------------------------------------[m
[[1;34mINFO[m] Total time:  19.912 s
[[1;34mINFO[m] Finished at: 2024-09-12T15:40:21-03:00
[[1;34mINFO[m] [1m------------------------------------------------------------------------[m
[[1;31mERROR[m] Failed to execute goal [32morg.apache.maven.plugins:maven-surefire-plugin:2.22.0:test[m [1m(default-test)[m on project [36mmarket-rest[m: [1;31mThere are test failures.[m
[[1;31mERROR[m] [1;31m[m
[[1;31mERROR[m] [1;31mPlease refer to /media/rincon/63999417195/eclipse-workspace/EMB-master/jdk_11_maven/cs/rest-gui/market/market-rest/target/surefire-reports for the individual test results.[m
[[1;31mERROR[m] [1;31mPlease refer to dump files (if any exist) [date]-jvmRun[N].dump, [date].dumpstream and [date]-jvmRun[N].dumpstream.[m
[[1;31mERROR[m] -> [1m[Help 1][m
[[1;31mERROR[m] 
[[1;31mERROR[m] To see the full stack trace of the errors, re-run Maven with the [1m-e[m switch.
[[1;31mERROR[m] Re-run Maven using the [1m-X[m switch to enable full debug logging.
[[1;31mERROR[m] 
[[1;31mERROR[m] For more information about the errors and possible solutions, please read the following articles:
[[1;31mERROR[m] [1m[Help 1][m http://cwiki.apache.org/confluence/display/MAVEN/MojoFailureException
