[[1;34mINFO[m] Scanning for projects...
[[1;34mINFO[m] 
[[1;34mINFO[m] [1m---------------------< [0;36mnet.lukyanets:market-rest[0;1m >----------------------[m
[[1;34mINFO[m] [1mBuilding market-rest 0.1.2[m
[[1;34mINFO[m] [1m--------------------------------[ jar ]---------------------------------[m
[[1;33mWARNING[m] The POM for com.sun.xml.bind:jaxb-osgi:jar:2.2.10 is invalid, transitive dependencies (if any) will not be available, enable debug logging for more details
[[1;34mINFO[m] 
[[1;34mINFO[m] [1m--- [0;32mmaven-clean-plugin:2.5:clean[m [1m(default-clean)[m @ [36mmarket-rest[0;1m ---[m
[[1;34mINFO[m] Deleting /media/rincon/63999417195/eclipse-workspace/EMB-master/jdk_11_maven/cs/rest-gui/market/market-rest/target
[[1;34mINFO[m] 
[[1;34mINFO[m] [1m--- [0;32mjacoco-maven-plugin:0.8.7:prepare-agent[m [1m(default)[m @ [36mmarket-rest[0;1m ---[m
[[1;34mINFO[m] argLine set to -javaagent:/home/rincon/.m2/repository/org/jacoco/org.jacoco.agent/0.8.7/org.jacoco.agent-0.8.7-runtime.jar=destfile=/media/rincon/63999417195/eclipse-workspace/EMB-master/jdk_11_maven/cs/rest-gui/market/market-rest/target/jacoco.exec
[[1;34mINFO[m] 
[[1;34mINFO[m] [1m--- [0;32mspring-boot-maven-plugin:2.4.3:build-info[m [1m(default)[m @ [36mmarket-rest[0;1m ---[m
[[1;34mINFO[m] 
[[1;34mINFO[m] [1m--- [0;32mmaven-resources-plugin:2.6:resources[m [1m(default-resources)[m @ [36mmarket-rest[0;1m ---[m
[[1;34mINFO[m] Using 'UTF-8' encoding to copy filtered resources.
[[1;34mINFO[m] Copying 3 resources
[[1;34mINFO[m] 
[[1;34mINFO[m] [1m--- [0;32mmaven-compiler-plugin:3.8.0:compile[m [1m(default-compile)[m @ [36mmarket-rest[0;1m ---[m
[[1;34mINFO[m] Changes detected - recompiling the module!
[[1;34mINFO[m] Compiling 11 source files to /media/rincon/63999417195/eclipse-workspace/EMB-master/jdk_11_maven/cs/rest-gui/market/market-rest/target/classes
[[1;34mINFO[m] 
[[1;34mINFO[m] [1m--- [0;32mjacoco-maven-plugin:0.8.7:prepare-agent[m [1m(default)[m @ [36mmarket-rest[0;1m ---[m
[[1;34mINFO[m] argLine set to -javaagent:/home/rincon/.m2/repository/org/jacoco/org.jacoco.agent/0.8.7/org.jacoco.agent-0.8.7-runtime.jar=destfile=/media/rincon/63999417195/eclipse-workspace/EMB-master/jdk_11_maven/cs/rest-gui/market/market-rest/target/jacoco.exec
[[1;34mINFO[m] 
[[1;34mINFO[m] [1m--- [0;32mspring-boot-maven-plugin:2.4.3:build-info[m [1m(default)[m @ [36mmarket-rest[0;1m ---[m
[[1;34mINFO[m] 
[[1;34mINFO[m] [1m--- [0;32mmaven-resources-plugin:2.6:resources[m [1m(default-resources)[m @ [36mmarket-rest[0;1m ---[m
[[1;34mINFO[m] Using 'UTF-8' encoding to copy filtered resources.
[[1;34mINFO[m] Copying 3 resources
[[1;34mINFO[m] 
[[1;34mINFO[m] [1m--- [0;32mmaven-compiler-plugin:3.8.0:compile[m [1m(default-compile)[m @ [36mmarket-rest[0;1m ---[m
[[1;34mINFO[m] Nothing to compile - all classes are up to date
[[1;34mINFO[m] 
[[1;34mINFO[m] [1m--- [0;32mmaven-resources-plugin:2.6:testResources[m [1m(default-testResources)[m @ [36mmarket-rest[0;1m ---[m
[[1;34mINFO[m] Using 'UTF-8' encoding to copy filtered resources.
[[1;34mINFO[m] skip non existing resourceDirectory /media/rincon/63999417195/eclipse-workspace/EMB-master/jdk_11_maven/cs/rest-gui/market/market-rest/src/test/resources
[[1;34mINFO[m] 
[[1;34mINFO[m] [1m--- [0;32mmaven-compiler-plugin:3.8.0:testCompile[m [1m(default-testCompile)[m @ [36mmarket-rest[0;1m ---[m
[[1;34mINFO[m] Changes detected - recompiling the module!
[[1;34mINFO[m] Compiling 1 source file to /media/rincon/63999417195/eclipse-workspace/EMB-master/jdk_11_maven/cs/rest-gui/market/market-rest/target/test-classes
[[1;34mINFO[m] 
[[1;34mINFO[m] [1m--- [0;32mjacoco-maven-plugin:0.8.7:prepare-agent[m [1m(default)[m @ [36mmarket-rest[0;1m ---[m
[[1;34mINFO[m] argLine set to -javaagent:/home/rincon/.m2/repository/org/jacoco/org.jacoco.agent/0.8.7/org.jacoco.agent-0.8.7-runtime.jar=destfile=/media/rincon/63999417195/eclipse-workspace/EMB-master/jdk_11_maven/cs/rest-gui/market/market-rest/target/jacoco.exec
[[1;34mINFO[m] 
[[1;34mINFO[m] [1m--- [0;32mspring-boot-maven-plugin:2.4.3:build-info[m [1m(default)[m @ [36mmarket-rest[0;1m ---[m
[[1;34mINFO[m] 
[[1;34mINFO[m] [1m--- [0;32mmaven-resources-plugin:2.6:resources[m [1m(default-resources)[m @ [36mmarket-rest[0;1m ---[m
[[1;34mINFO[m] Using 'UTF-8' encoding to copy filtered resources.
[[1;34mINFO[m] Copying 3 resources
[[1;34mINFO[m] 
[[1;34mINFO[m] [1m--- [0;32mmaven-compiler-plugin:3.8.0:compile[m [1m(default-compile)[m @ [36mmarket-rest[0;1m ---[m
[[1;34mINFO[m] Nothing to compile - all classes are up to date
[[1;34mINFO[m] 
[[1;34mINFO[m] [1m--- [0;32mmaven-resources-plugin:2.6:testResources[m [1m(default-testResources)[m @ [36mmarket-rest[0;1m ---[m
[[1;34mINFO[m] Using 'UTF-8' encoding to copy filtered resources.
[[1;34mINFO[m] skip non existing resourceDirectory /media/rincon/63999417195/eclipse-workspace/EMB-master/jdk_11_maven/cs/rest-gui/market/market-rest/src/test/resources
[[1;34mINFO[m] 
[[1;34mINFO[m] [1m--- [0;32mmaven-compiler-plugin:3.8.0:testCompile[m [1m(default-testCompile)[m @ [36mmarket-rest[0;1m ---[m
[[1;34mINFO[m] Nothing to compile - all classes are up to date
[[1;34mINFO[m] 
[[1;34mINFO[m] [1m--- [0;32mmaven-surefire-plugin:2.22.0:test[m [1m(default-test)[m @ [36mmarket-rest[0;1m ---[m
[[1;34mINFO[m] 
[[1;34mINFO[m] -------------------------------------------------------
[[1;34mINFO[m]  T E S T S
[[1;34mINFO[m] -------------------------------------------------------
[[1;34mINFO[m] Running market.[1mv1_gpt35_run02_ProductsRestControllerTest[m

  .   ____          _            __ _ _
 /\\ / ___'_ __ _ _(_)_ __  __ _ \ \ \ \
( ( )\___ | '_ | '_| | '_ \/ _` | \ \ \ \
 \\/  ___)| |_)| | | | | || (_| |  ) ) ) )
  '  |____| .__|_| |_|_| |_\__, | / / / /
 =========|_|==============|___/=/_/_/_/
 :: Spring Boot ::                (v2.4.3)

2024-09-13 10:33:49,949 INFO  [background-preinit] o.h.v.i.u.Version - HV000001: Hibernate Validator 6.1.7.Final
2024-09-13 10:33:50,069 INFO  [main] o.a.m.s.b.ForkedBooter - Starting ForkedBooter v2.22.0 using Java 11.0.20 on IFTO-PROBOOK with PID 36688 (started by rincon in /media/rincon/63999417195/eclipse-workspace/EMB-master/jdk_11_maven/cs/rest-gui/market/market-rest)
2024-09-13 10:33:50,077 INFO  [main] o.a.m.s.b.ForkedBooter - No active profile set, falling back to default profiles: default
2024-09-13 10:33:50,930 WARN  [main] o.s.b.c.c.ConfigDataEnvironment - Property 'spring.profiles' imported from location 'class path resource [application.yml]' is invalid and should be replaced with 'spring.config.activate.on-profile' [origin: class path resource [application.yml] - 34:13]
2024-09-13 10:33:50,930 WARN  [main] o.s.b.c.c.ConfigDataEnvironment - Property 'spring.profiles' imported from location 'class path resource [application.yml]' is invalid and should be replaced with 'spring.config.activate.on-profile' [origin: class path resource [application.yml] - 24:13]
2024-09-13 10:33:52,806 INFO  [main] o.s.d.r.c.RepositoryConfigurationDelegate - Bootstrapping Spring Data JPA repositories in DEFAULT mode.
2024-09-13 10:33:52,956 INFO  [main] o.s.d.r.c.RepositoryConfigurationDelegate - Finished Spring Data repository scanning in 133 ms. Found 8 JPA repository interfaces.
2024-09-13 10:33:53,520 INFO  [main] o.s.c.s.PostProcessorRegistrationDelegate$BeanPostProcessorChecker - Bean 'market.DataConfig' of type [market.DataConfig$$EnhancerBySpringCGLIB$$f145ea36] is not eligible for getting processed by all BeanPostProcessors (for example: not eligible for auto-proxying)
2024-09-13 10:33:53,750 INFO  [main] o.s.c.s.PostProcessorRegistrationDelegate$BeanPostProcessorChecker - Bean 'org.springframework.security.access.expression.method.DefaultMethodSecurityExpressionHandler@4f5c72ad' of type [org.springframework.security.access.expression.method.DefaultMethodSecurityExpressionHandler] is not eligible for getting processed by all BeanPostProcessors (for example: not eligible for auto-proxying)
2024-09-13 10:33:53,760 INFO  [main] o.s.c.s.PostProcessorRegistrationDelegate$BeanPostProcessorChecker - Bean 'methodSecurityMetadataSource' of type [org.springframework.security.access.method.DelegatingMethodSecurityMetadataSource] is not eligible for getting processed by all BeanPostProcessors (for example: not eligible for auto-proxying)
2024-09-13 10:33:54,360 INFO  [main] o.s.b.w.e.t.TomcatWebServer - Tomcat initialized with port(s): 0 (http)
2024-09-13 10:33:54,384 INFO  [main] o.a.c.h.Http11NioProtocol - Initializing ProtocolHandler ["http-nio-auto-1"]
2024-09-13 10:33:54,385 INFO  [main] o.a.c.c.StandardService - Starting service [Tomcat]
2024-09-13 10:33:54,386 INFO  [main] o.a.c.c.StandardEngine - Starting Servlet engine: [Apache Tomcat/9.0.43]
2024-09-13 10:33:54,554 INFO  [main] o.a.c.c.C.[.[.[/] - Initializing Spring embedded WebApplicationContext
2024-09-13 10:33:54,554 INFO  [main] o.s.b.w.s.c.ServletWebServerApplicationContext - Root WebApplicationContext: initialization completed in 3619 ms
2024-09-13 10:33:54,792 INFO  [main] c.z.h.HikariDataSource - HikariPool-1 - Starting...
2024-09-13 10:33:55,279 INFO  [main] c.z.h.HikariDataSource - HikariPool-1 - Start completed.
2024-09-13 10:33:55,602 INFO  [main] o.h.j.i.u.LogHelper - HHH000204: Processing PersistenceUnitInfo [name: default]
2024-09-13 10:33:55,712 INFO  [main] o.h.Version - HHH000412: Hibernate ORM core version 5.4.28.Final
2024-09-13 10:33:55,969 INFO  [main] o.h.a.c.Version - HCANN000001: Hibernate Commons Annotations {5.1.2.Final}
2024-09-13 10:33:56,295 INFO  [main] o.h.d.Dialect - HHH000400: Using dialect: org.hibernate.dialect.H2Dialect
2024-09-13 10:33:56,653 WARN  [main] o.h.b.i.InFlightMetadataCollectorImpl - HHH000069: Duplicate generator name gen
2024-09-13 10:33:56,657 WARN  [main] o.h.b.i.InFlightMetadataCollectorImpl - HHH000069: Duplicate generator name gen
2024-09-13 10:33:57,641 INFO  [main] o.h.e.t.j.p.i.JtaPlatformInitiator - HHH000490: Using JtaPlatform implementation: [org.hibernate.engine.transaction.jta.platform.internal.NoJtaPlatform]
2024-09-13 10:33:57,655 INFO  [main] o.s.o.j.LocalContainerEntityManagerFactoryBean - Initialized JPA EntityManagerFactory for persistence unit 'default'
2024-09-13 10:33:59,024 WARN  [main] o.s.b.a.o.j.JpaBaseConfiguration$JpaWebConfiguration - spring.jpa.open-in-view is enabled by default. Therefore, database queries may be performed during view rendering. Explicitly configure spring.jpa.open-in-view to disable this warning
2024-09-13 10:34:00,214 INFO  [main] o.s.s.w.DefaultSecurityFilterChain - Will secure any request with [org.springframework.security.web.context.request.async.WebAsyncManagerIntegrationFilter@21763fe5, org.springframework.security.web.context.SecurityContextPersistenceFilter@6bd0cc89, org.springframework.security.web.header.HeaderWriterFilter@301b9fa, org.springframework.security.web.authentication.logout.LogoutFilter@5b1ebe39, org.springframework.security.web.authentication.www.BasicAuthenticationFilter@49ce3079, org.springframework.security.web.savedrequest.RequestCacheAwareFilter@55da9168, org.springframework.security.web.servletapi.SecurityContextHolderAwareRequestFilter@d566357, org.springframework.security.web.authentication.AnonymousAuthenticationFilter@15c9894, org.springframework.security.web.session.SessionManagementFilter@25320226, org.springframework.security.web.access.ExceptionTranslationFilter@3ff73229, org.springframework.security.web.access.intercept.FilterSecurityInterceptor@21ce3b50]
2024-09-13 10:34:00,391 INFO  [main] o.s.s.c.ThreadPoolTaskExecutor - Initializing ExecutorService 'applicationTaskExecutor'
2024-09-13 10:34:00,925 INFO  [main] o.a.c.h.Http11NioProtocol - Starting ProtocolHandler ["http-nio-auto-1"]
2024-09-13 10:34:00,959 INFO  [main] o.s.b.w.e.t.TomcatWebServer - Tomcat started on port(s): 37039 (http) with context path ''
2024-09-13 10:34:01,705 INFO  [main] o.a.m.s.b.ForkedBooter - Started ForkedBooter in 12.769 seconds (JVM running for 15.558)
2024-09-13 10:34:04,061 INFO  [http-nio-auto-1-exec-1] o.a.c.c.C.[.[.[/] - Initializing Spring DispatcherServlet 'dispatcherServlet'
2024-09-13 10:34:04,061 INFO  [http-nio-auto-1-exec-1] o.s.w.s.DispatcherServlet - Initializing Servlet 'dispatcherServlet'
2024-09-13 10:34:04,064 INFO  [http-nio-auto-1-exec-1] o.s.w.s.DispatcherServlet - Completed initialization in 3 ms
Request method:	GET
Request URI:	http://localhost:37039/products/1
Proxy:			<none>
Request params:	<none>
Query params:	<none>
Form params:	<none>
Path params:	<none>
Headers:		Accept=*/*
Cookies:		<none>
Multiparts:		<none>
Body:			<none>

HTTP/1.1 200 
X-Content-Type-Options: nosniff
X-XSS-Protection: 1; mode=block
Cache-Control: no-cache, no-store, max-age=0, must-revalidate
Pragma: no-cache
Expires: 0
Content-Type: application/hal+json
Transfer-Encoding: chunked
Date: Fri, 13 Sep 2024 13:34:04 GMT
Keep-Alive: timeout=60
Connection: keep-alive

{
    "productId": 1,
    "distillery": "Ardbeg",
    "name": "Ten",
    "price": 4420.0,
    "age": 10,
    "volume": 700,
    "alcohol": 46.0,
    "description": "Ten Years Old is the basis of the Ardbeg range. After 10 years of maturation in ex-bourbon casks, the whiskey bottled at 46% ABV without cold filtering. The characteristic peat, although clearly present but in perfect balance with the natural sweetness and not predominant in the taste.",
    "available": false,
    "_links": {
        "All products": {
            "href": "http://localhost:37039/products"
        }
    }
}
Request method:	GET
Request URI:	http://localhost:37039/products
Proxy:			<none>
Request params:	<none>
Query params:	<none>
Form params:	<none>
Path params:	<none>
Headers:		Accept=*/*
Cookies:		<none>
Multiparts:		<none>
Body:			<none>

HTTP/1.1 200 
X-Content-Type-Options: nosniff
X-XSS-Protection: 1; mode=block
Cache-Control: no-cache, no-store, max-age=0, must-revalidate
Pragma: no-cache
Expires: 0
Content-Type: application/json
Transfer-Encoding: chunked
Date: Fri, 13 Sep 2024 13:34:05 GMT
Keep-Alive: timeout=60
Connection: keep-alive

[
    {
        "productId": 1,
        "distillery": "Ardbeg",
        "name": "Ten",
        "price": 4420.0,
        "age": 10,
        "volume": 700,
        "alcohol": 46.0,
        "description": "Ten Years Old is the basis of the Ardbeg range. After 10 years of maturation in ex-bourbon casks, the whiskey bottled at 46% ABV without cold filtering. The characteristic peat, although clearly present but in perfect balance with the natural sweetness and not predominant in the taste.",
        "available": false,
        "links": [
            {
                "rel": "self",
                "href": "http://localhost:37039/products/1"
            }
        ]
    },
    {
        "productId": 2,
        "distillery": "Ardbeg",
        "name": "Uigeadail",
        "price": 7020.0,
        "age": 0,
        "volume": 700,
        "alcohol": 54.2,
        "description": "Ardbeg Uigedael is named after Loch Uigedael, the lake in the grounds of the distillery Ardbeg which are the water is an important factor in the distilling process. The Uigedael a vatted malt, bottled at 54.2% ABV without cold filtering. Ardbeg Uigedael has no age indication for the expression consists of various malts of different ages. Malts are used partly matured in ex-bourbon and partly on ex-sherry casks.",
        "available": true,
        "links": [
            {
                "rel": "self",
                "href": "http://localhost:37039/products/2"
            }
        ]
    },
    {
        "productId": 3,
        "distillery": "Balvenie",
        "name": "12 y.o. Doublewood",
        "price": 5403.0,
        "age": 12,
        "volume": 700,
        "alcohol": 40.0,
        "description": "Has clear influences from both bourbon and sherry wood. This malt has only 12 years aged in bourbon casks and then 3 months in young Oloroso casks. The peppery character from the bourbon barrels, penetrates, as it were by the rich and full aroma of Oloroso casks it. The Balvenie Double Wood is therefore a very complex malt.",
        "available": true,
        "links": [
            {
                "rel": "self",
                "href": "http://localhost:37039/products/3"
            }
        ]
    },
    {
        "productId": 4,
        "distillery": "Caol Ila",
        "name": "12 y.o.",
        "price": 4913.0,
        "age": 12,
        "volume": 700,
        "alcohol": 43.0,
        "description": "Smoked ham comes across delicately with citrus and cigar leaves. Fresh and smoky, probably the best part of this whisky. With an almost full body, oil and tar meet subtle smoke. Hints of sweet tastes like honey. Some spices like pepper combined with little sweetness.",
        "available": true,
        "links": [
            {
                "rel": "self",
                "href": "http://localhost:37039/products/4"
            }
        ]
    },
    {
        "productId": 5,
        "distillery": "Dalwhinnie",
        "name": "15 y.o.",
        "price": 6517.0,
        "age": 15,
        "volume": 750,
        "alcohol": 43.0,
        "description": "A good introduction to the delights of single malt whisky – elegant, smooth and medium-bodied, with a light, fruity palate and a whiff of heather on the finish. Part of Diageo's Classic Malt range. ",
        "available": true,
        "links": [
            {
                "rel": "self",
                "href": "http://localhost:37039/products/5"
            }
        ]
    },
    {
        "productId": 6,
        "distillery": "Lagavulin",
        "name": "16 y.o.",
        "price": 6620.0,
        "age": 16,
        "volume": 750,
        "alcohol": 43.0,
        "description": "The Islay representative in the 'Classic Malts' series is a deep, dry and exceptionally peaty bruiser. Probably the most pungent of all Islay malts, Lagavulin is not for the faint-hearted but inspires fanatical devotion in its many followers.",
        "available": true,
        "links": [
            {
                "rel": "self",
                "href": "http://localhost:37039/products/6"
            }
        ]
    },
    {
        "productId": 7,
        "distillery": "Laphroaig",
        "name": "Quarter Cask",
        "price": 5100.0,
        "age": 0,
        "volume": 700,
        "alcohol": 48.0,
        "description": "A vibrant young Laphroaig whose maturation has been accelerated by ageing in quarter casks. This shows soft sweetness and a velvety feel when first tasted, then the intense peatiness so unique to Laphroaig comes bursting through. A terrific whisky and great value.",
        "available": true,
        "links": [
            {
                "rel": "self",
                "href": "http://localhost:37039/products/7"
            }
        ]
    },
    {
        "productId": 8,
        "distillery": "Springbank",
        "name": "12 y.o. Cask Strength Batch 6",
        "price": 8127.0,
        "age": 12,
        "volume": 700,
        "alcohol": 53.1,
        "description": "Like a storm gathering of the Kintyre coast, dark and ominous, yet tastes so good. The richness comes from the high percentage of sherry casks used in maturation. This is a truly classic Springbank, best enjoyed after dinner, or with your favourite cigar.",
        "available": true,
        "links": [
            {
                "rel": "self",
                "href": "http://localhost:37039/products/8"
            }
        ]
    },
    {
        "productId": 9,
        "distillery": "Springbank",
        "name": "18 y.o.",
        "price": 14490.0,
        "age": 18,
        "volume": 700,
        "alcohol": 46.0,
        "description": "This heavily sherried 18-year-old Springbank has been bottled by Mark Reynier as part of his Renegade series. Distilled in 1995, this sherry hogshead was aged for 10 years in Campbeltown and then moved to Bruichladdich for a further eight years.",
        "available": true,
        "links": [
            {
                "rel": "self",
                "href": "http://localhost:37039/products/9"
            }
        ]
    },
    {
        "productId": 10,
        "distillery": "Talisker",
        "name": "10 y.o.",
        "price": 4683.0,
        "age": 10,
        "volume": 750,
        "alcohol": 45.8,
        "description": "Powerful peat smoke with the salinity of sea water and the moisture of fresh oysters. Full sweetness of dried fruit with smoke and strong aromas of malted barley, warm and intense. Peppery in the mouth. Big, long, warming and peppery on the finish with an attractive sweetness.",
        "available": true,
        "links": [
            {
                "rel": "self",
                "href": "http://localhost:37039/products/10"
            }
        ]
    },
    {
        "productId": 11,
        "distillery": "Glenkinchie",
        "name": "12 y.o.",
        "price": 4547.0,
        "age": 12,
        "volume": 700,
        "alcohol": 43.0,
        "description": "A light, delicate whiskey; sweet and creamy with a subtle floral aroma. This subtle, refined Lowland is ideal as an aperitif; try it straight from the fridge or freezer.",
        "available": false,
        "links": [
            {
                "rel": "self",
                "href": "http://localhost:37039/products/11"
            }
        ]
    }
]
2024-09-13 10:34:05,934 INFO  [main] o.a.c.h.Http11NioProtocol - Pausing ProtocolHandler ["http-nio-auto-1"]
2024-09-13 10:34:05,934 INFO  [main] o.a.c.c.StandardService - Stopping service [Tomcat]
2024-09-13 10:34:05,936 INFO  [main] o.a.c.c.C.[.[.[/] - Destroying Spring FrameworkServlet 'dispatcherServlet'
2024-09-13 10:34:05,944 INFO  [main] o.a.c.h.Http11NioProtocol - Stopping ProtocolHandler ["http-nio-auto-1"]
2024-09-13 10:34:05,950 INFO  [main] o.a.c.h.Http11NioProtocol - Destroying ProtocolHandler ["http-nio-auto-1"]
[[1;31mERROR[m] [1;31mTests [0;1mrun: [0;1m2[m, [1;31mFailures: [0;1;31m2[m, Errors: 0, Skipped: 0, Time elapsed: 18.522 s[1;31m <<< FAILURE![m - in market.[1mv1_gpt35_run02_ProductsRestControllerTest[m
[[1;31mERROR[m] testGetProductByIdEndpoint  Time elapsed: 2.846 s  <<< FAILURE!
java.lang.AssertionError: 
1 expectation failed.
JSON path name doesn't match.
Expected: product1
  Actual: Ten

	at market.v1_gpt35_run02_ProductsRestControllerTest.testGetProductByIdEndpoint(v1_gpt35_run02_ProductsRestControllerTest.java:79)

[[1;31mERROR[m] testGetProductsEndpoint  Time elapsed: 0.304 s  <<< FAILURE!
java.lang.AssertionError: 
1 expectation failed.
JSON path name doesn't match.
Expected: (a collection containing "product1" and a collection containing "product2" and a collection containing "product3")
  Actual: [Ten, Uigeadail, 12 y.o. Doublewood, 12 y.o., 15 y.o., 16 y.o., Quarter Cask, 12 y.o. Cask Strength Batch 6, 18 y.o., 10 y.o., 12 y.o.]

	at market.v1_gpt35_run02_ProductsRestControllerTest.testGetProductsEndpoint(v1_gpt35_run02_ProductsRestControllerTest.java:69)

2024-09-13 10:34:06,334 INFO  [SpringContextShutdownHook] o.s.s.c.ThreadPoolTaskExecutor - Shutting down ExecutorService 'applicationTaskExecutor'
2024-09-13 10:34:06,351 INFO  [SpringContextShutdownHook] o.s.o.j.LocalContainerEntityManagerFactoryBean - Closing JPA EntityManagerFactory for persistence unit 'default'
2024-09-13 10:34:06,353 INFO  [SpringContextShutdownHook] c.z.h.HikariDataSource - HikariPool-1 - Shutdown initiated...
2024-09-13 10:34:06,358 INFO  [SpringContextShutdownHook] c.z.h.HikariDataSource - HikariPool-1 - Shutdown completed.
[[1;34mINFO[m] 
[[1;34mINFO[m] Results:
[[1;34mINFO[m] 
[[1;31mERROR[m] [1;31mFailures: [m
[[1;31mERROR[m] [1;31m  v1_gpt35_run02_ProductsRestControllerTest.testGetProductByIdEndpoint:79 1 expectation failed.
JSON path name doesn't match.
Expected: product1
  Actual: Ten
[m
[[1;31mERROR[m] [1;31m  v1_gpt35_run02_ProductsRestControllerTest.testGetProductsEndpoint:69 1 expectation failed.
JSON path name doesn't match.
Expected: (a collection containing "product1" and a collection containing "product2" and a collection containing "product3")
  Actual: [Ten, Uigeadail, 12 y.o. Doublewood, 12 y.o., 15 y.o., 16 y.o., Quarter Cask, 12 y.o. Cask Strength Batch 6, 18 y.o., 10 y.o., 12 y.o.]
[m
[[1;34mINFO[m] 
[[1;31mERROR[m] [1;31mTests run: 2, Failures: 2, Errors: 0, Skipped: 0[m
[[1;34mINFO[m] 
[[1;34mINFO[m] [1m------------------------------------------------------------------------[m
[[1;34mINFO[m] [1;31mBUILD FAILURE[m
[[1;34mINFO[m] [1m------------------------------------------------------------------------[m
[[1;34mINFO[m] Total time:  25.254 s
[[1;34mINFO[m] Finished at: 2024-09-13T10:34:06-03:00
[[1;34mINFO[m] [1m------------------------------------------------------------------------[m
[[1;31mERROR[m] Failed to execute goal [32morg.apache.maven.plugins:maven-surefire-plugin:2.22.0:test[m [1m(default-test)[m on project [36mmarket-rest[m: [1;31mThere are test failures.[m
[[1;31mERROR[m] [1;31m[m
[[1;31mERROR[m] [1;31mPlease refer to /media/rincon/63999417195/eclipse-workspace/EMB-master/jdk_11_maven/cs/rest-gui/market/market-rest/target/surefire-reports for the individual test results.[m
[[1;31mERROR[m] [1;31mPlease refer to dump files (if any exist) [date]-jvmRun[N].dump, [date].dumpstream and [date]-jvmRun[N].dumpstream.[m
[[1;31mERROR[m] -> [1m[Help 1][m
[[1;31mERROR[m] 
[[1;31mERROR[m] To see the full stack trace of the errors, re-run Maven with the [1m-e[m switch.
[[1;31mERROR[m] Re-run Maven using the [1m-X[m switch to enable full debug logging.
[[1;31mERROR[m] 
[[1;31mERROR[m] For more information about the errors and possible solutions, please read the following articles:
[[1;31mERROR[m] [1m[Help 1][m http://cwiki.apache.org/confluence/display/MAVEN/MojoFailureException
