[[1;34mINFO[m] Scanning for projects...
[[1;34mINFO[m] 
[[1;34mINFO[m] [1m------< [0;36morg.evomaster:evomaster-benchmark-cs-rest-artificial-scs[0;1m >------[m
[[1;34mINFO[m] [1mBuilding evomaster-benchmark-cs-rest-artificial-scs 3.0.0[m
[[1;34mINFO[m] [1m--------------------------------[ jar ]---------------------------------[m
[[1;34mINFO[m] 
[[1;34mINFO[m] [1m--- [0;32mmaven-clean-plugin:2.5:clean[m [1m(default-clean)[m @ [36mevomaster-benchmark-cs-rest-artificial-scs[0;1m ---[m
[[1;34mINFO[m] Deleting /media/rincon/63999417195/eclipse-workspace/EMB-master/jdk_8_maven/cs/rest/artificial/scs/target
[[1;34mINFO[m] 
[[1;34mINFO[m] [1m--- [0;32mjacoco-maven-plugin:0.8.7:prepare-agent[m [1m(default)[m @ [36mevomaster-benchmark-cs-rest-artificial-scs[0;1m ---[m
[[1;34mINFO[m] argLine set to -javaagent:/home/rincon/.m2/repository/org/jacoco/org.jacoco.agent/0.8.7/org.jacoco.agent-0.8.7-runtime.jar=destfile=/media/rincon/63999417195/eclipse-workspace/EMB-master/jdk_8_maven/cs/rest/artificial/scs/target/jacoco.exec
[[1;34mINFO[m] 
[[1;34mINFO[m] [1m--- [0;32mmaven-resources-plugin:2.6:resources[m [1m(default-resources)[m @ [36mevomaster-benchmark-cs-rest-artificial-scs[0;1m ---[m
[[1;34mINFO[m] Using 'UTF-8' encoding to copy filtered resources.
[[1;34mINFO[m] skip non existing resourceDirectory /media/rincon/63999417195/eclipse-workspace/EMB-master/jdk_8_maven/cs/rest/artificial/scs/src/main/resources
[[1;34mINFO[m] 
[[1;34mINFO[m] [1m--- [0;32mmaven-compiler-plugin:3.8.0:compile[m [1m(default-compile)[m @ [36mevomaster-benchmark-cs-rest-artificial-scs[0;1m ---[m
[[1;34mINFO[m] Changes detected - recompiling the module!
[[1;34mINFO[m] Compiling 14 source files to /media/rincon/63999417195/eclipse-workspace/EMB-master/jdk_8_maven/cs/rest/artificial/scs/target/classes
[[1;34mINFO[m] 
[[1;34mINFO[m] [1m--- [0;32mjacoco-maven-plugin:0.8.7:prepare-agent[m [1m(default)[m @ [36mevomaster-benchmark-cs-rest-artificial-scs[0;1m ---[m
[[1;34mINFO[m] argLine set to -javaagent:/home/rincon/.m2/repository/org/jacoco/org.jacoco.agent/0.8.7/org.jacoco.agent-0.8.7-runtime.jar=destfile=/media/rincon/63999417195/eclipse-workspace/EMB-master/jdk_8_maven/cs/rest/artificial/scs/target/jacoco.exec
[[1;34mINFO[m] 
[[1;34mINFO[m] [1m--- [0;32mmaven-resources-plugin:2.6:resources[m [1m(default-resources)[m @ [36mevomaster-benchmark-cs-rest-artificial-scs[0;1m ---[m
[[1;34mINFO[m] Using 'UTF-8' encoding to copy filtered resources.
[[1;34mINFO[m] skip non existing resourceDirectory /media/rincon/63999417195/eclipse-workspace/EMB-master/jdk_8_maven/cs/rest/artificial/scs/src/main/resources
[[1;34mINFO[m] 
[[1;34mINFO[m] [1m--- [0;32mmaven-compiler-plugin:3.8.0:compile[m [1m(default-compile)[m @ [36mevomaster-benchmark-cs-rest-artificial-scs[0;1m ---[m
[[1;34mINFO[m] Changes detected - recompiling the module!
[[1;34mINFO[m] Compiling 14 source files to /media/rincon/63999417195/eclipse-workspace/EMB-master/jdk_8_maven/cs/rest/artificial/scs/target/classes
[[1;34mINFO[m] 
[[1;34mINFO[m] [1m--- [0;32mmaven-resources-plugin:2.6:testResources[m [1m(default-testResources)[m @ [36mevomaster-benchmark-cs-rest-artificial-scs[0;1m ---[m
[[1;34mINFO[m] Using 'UTF-8' encoding to copy filtered resources.
[[1;34mINFO[m] skip non existing resourceDirectory /media/rincon/63999417195/eclipse-workspace/EMB-master/jdk_8_maven/cs/rest/artificial/scs/src/test/resources
[[1;34mINFO[m] 
[[1;34mINFO[m] [1m--- [0;32mmaven-compiler-plugin:3.8.0:testCompile[m [1m(default-testCompile)[m @ [36mevomaster-benchmark-cs-rest-artificial-scs[0;1m ---[m
[[1;34mINFO[m] Changes detected - recompiling the module!
[[1;34mINFO[m] Compiling 1 source file to /media/rincon/63999417195/eclipse-workspace/EMB-master/jdk_8_maven/cs/rest/artificial/scs/target/test-classes
[[1;34mINFO[m] 
[[1;34mINFO[m] [1m--- [0;32mjacoco-maven-plugin:0.8.7:prepare-agent[m [1m(default)[m @ [36mevomaster-benchmark-cs-rest-artificial-scs[0;1m ---[m
[[1;34mINFO[m] argLine set to -javaagent:/home/rincon/.m2/repository/org/jacoco/org.jacoco.agent/0.8.7/org.jacoco.agent-0.8.7-runtime.jar=destfile=/media/rincon/63999417195/eclipse-workspace/EMB-master/jdk_8_maven/cs/rest/artificial/scs/target/jacoco.exec
[[1;34mINFO[m] 
[[1;34mINFO[m] [1m--- [0;32mmaven-resources-plugin:2.6:resources[m [1m(default-resources)[m @ [36mevomaster-benchmark-cs-rest-artificial-scs[0;1m ---[m
[[1;34mINFO[m] Using 'UTF-8' encoding to copy filtered resources.
[[1;34mINFO[m] skip non existing resourceDirectory /media/rincon/63999417195/eclipse-workspace/EMB-master/jdk_8_maven/cs/rest/artificial/scs/src/main/resources
[[1;34mINFO[m] 
[[1;34mINFO[m] [1m--- [0;32mmaven-compiler-plugin:3.8.0:compile[m [1m(default-compile)[m @ [36mevomaster-benchmark-cs-rest-artificial-scs[0;1m ---[m
[[1;34mINFO[m] Changes detected - recompiling the module!
[[1;34mINFO[m] Compiling 14 source files to /media/rincon/63999417195/eclipse-workspace/EMB-master/jdk_8_maven/cs/rest/artificial/scs/target/classes
[[1;34mINFO[m] 
[[1;34mINFO[m] [1m--- [0;32mmaven-resources-plugin:2.6:testResources[m [1m(default-testResources)[m @ [36mevomaster-benchmark-cs-rest-artificial-scs[0;1m ---[m
[[1;34mINFO[m] Using 'UTF-8' encoding to copy filtered resources.
[[1;34mINFO[m] skip non existing resourceDirectory /media/rincon/63999417195/eclipse-workspace/EMB-master/jdk_8_maven/cs/rest/artificial/scs/src/test/resources
[[1;34mINFO[m] 
[[1;34mINFO[m] [1m--- [0;32mmaven-compiler-plugin:3.8.0:testCompile[m [1m(default-testCompile)[m @ [36mevomaster-benchmark-cs-rest-artificial-scs[0;1m ---[m
[[1;34mINFO[m] Nothing to compile - all classes are up to date
[[1;34mINFO[m] 
[[1;34mINFO[m] [1m--- [0;32mmaven-surefire-plugin:2.22.0:test[m [1m(default-test)[m @ [36mevomaster-benchmark-cs-rest-artificial-scs[0;1m ---[m
[[1;34mINFO[m] 
[[1;34mINFO[m] -------------------------------------------------------
[[1;34mINFO[m]  T E S T S
[[1;34mINFO[m] -------------------------------------------------------
[[1;34mINFO[m] Running org.restscs.[1mv1_gpt35_run03_PatTest[m

  .   ____          _            __ _ _
 /\\ / ___'_ __ _ _(_)_ __  __ _ \ \ \ \
( ( )\___ | '_ | '_| | '_ \/ _` | \ \ \ \
 \\/  ___)| |_)| | | | | || (_| |  ) ) ) )
  '  |____| .__|_| |_|_| |_\__, | / / / /
 =========|_|==============|___/=/_/_/_/
 :: Spring Boot ::        (v2.0.3.RELEASE)

2024-09-06 21:07:33.083  INFO 11936 --- [           main] o.a.maven.surefire.booter.ForkedBooter   : Starting ForkedBooter v2.22.0 on IFTO-PROBOOK with PID 11936 (started by rincon in /media/rincon/63999417195/eclipse-workspace/EMB-master/jdk_8_maven/cs/rest/artificial/scs)
2024-09-06 21:07:33.091  INFO 11936 --- [           main] o.a.maven.surefire.booter.ForkedBooter   : No active profile set, falling back to default profiles: default
2024-09-06 21:07:33.715  INFO 11936 --- [           main] ConfigServletWebServerApplicationContext : Refreshing org.springframework.boot.web.servlet.context.AnnotationConfigServletWebServerApplicationContext@7faa0680: startup date [Fri Sep 06 21:07:33 BRT 2024]; root of context hierarchy
2024-09-06 21:07:35.561  INFO 11936 --- [           main] f.a.AutowiredAnnotationBeanPostProcessor : JSR-330 'javax.inject.Inject' annotation found and supported for autowiring
2024-09-06 21:07:36.110  INFO 11936 --- [           main] o.s.b.w.embedded.tomcat.TomcatWebServer  : Tomcat initialized with port(s): 0 (http)
2024-09-06 21:07:36.171  INFO 11936 --- [           main] o.apache.catalina.core.StandardService   : Starting service [Tomcat]
2024-09-06 21:07:36.172  INFO 11936 --- [           main] org.apache.catalina.core.StandardEngine  : Starting Servlet Engine: Apache Tomcat/8.5.31
2024-09-06 21:07:36.189  INFO 11936 --- [ost-startStop-1] o.a.catalina.core.AprLifecycleListener   : The APR based Apache Tomcat Native library which allows optimal performance in production environments was not found on the java.library.path: [/usr/java/packages/lib/amd64:/usr/lib64:/lib64:/lib:/usr/lib]
2024-09-06 21:07:36.347  INFO 11936 --- [ost-startStop-1] o.a.c.c.C.[Tomcat].[localhost].[/]       : Initializing Spring embedded WebApplicationContext
2024-09-06 21:07:36.347  INFO 11936 --- [ost-startStop-1] o.s.web.context.ContextLoader            : Root WebApplicationContext: initialization completed in 2637 ms
2024-09-06 21:07:36.498  INFO 11936 --- [ost-startStop-1] o.s.b.w.servlet.ServletRegistrationBean  : Servlet dispatcherServlet mapped to [/]
2024-09-06 21:07:36.504  INFO 11936 --- [ost-startStop-1] o.s.b.w.servlet.FilterRegistrationBean   : Mapping filter: 'characterEncodingFilter' to: [/*]
2024-09-06 21:07:36.505  INFO 11936 --- [ost-startStop-1] o.s.b.w.servlet.FilterRegistrationBean   : Mapping filter: 'hiddenHttpMethodFilter' to: [/*]
2024-09-06 21:07:36.506  INFO 11936 --- [ost-startStop-1] o.s.b.w.servlet.FilterRegistrationBean   : Mapping filter: 'httpPutFormContentFilter' to: [/*]
2024-09-06 21:07:36.506  INFO 11936 --- [ost-startStop-1] o.s.b.w.servlet.FilterRegistrationBean   : Mapping filter: 'requestContextFilter' to: [/*]
2024-09-06 21:07:37.077  INFO 11936 --- [           main] s.w.s.m.m.a.RequestMappingHandlerMapping : Mapped "{[/api/pat/{txt}],methods=[GET]}" onto public org.springframework.http.ResponseEntity<java.lang.String> org.restscs.ScsRest.regex(java.lang.String)
2024-09-06 21:07:37.079  INFO 11936 --- [           main] s.w.s.m.m.a.RequestMappingHandlerMapping : Mapped "{[/api/title/{sex}/{title}],methods=[GET]}" onto public org.springframework.http.ResponseEntity<java.lang.String> org.restscs.ScsRest.title(java.lang.String,java.lang.String)
2024-09-06 21:07:37.080  INFO 11936 --- [           main] s.w.s.m.m.a.RequestMappingHandlerMapping : Mapped "{[/api/cookie/{name}/{val}/{site}],methods=[GET]}" onto public org.springframework.http.ResponseEntity<java.lang.String> org.restscs.ScsRest.cookie(java.lang.String,java.lang.String,java.lang.String)
2024-09-06 21:07:37.081  INFO 11936 --- [           main] s.w.s.m.m.a.RequestMappingHandlerMapping : Mapped "{[/api/calc/{op}/{arg1}/{arg2}],methods=[GET]}" onto public org.springframework.http.ResponseEntity<java.lang.String> org.restscs.ScsRest.calc(java.lang.String,double,double)
2024-09-06 21:07:37.082  INFO 11936 --- [           main] s.w.s.m.m.a.RequestMappingHandlerMapping : Mapped "{[/api/costfuns/{i}/{s}],methods=[GET]}" onto public org.springframework.http.ResponseEntity<java.lang.String> org.restscs.ScsRest.costfuns(java.lang.Integer,java.lang.String)
2024-09-06 21:07:37.083  INFO 11936 --- [           main] s.w.s.m.m.a.RequestMappingHandlerMapping : Mapped "{[/api/dateparse/{dayname}/{monthname}],methods=[GET]}" onto public org.springframework.http.ResponseEntity<java.lang.String> org.restscs.ScsRest.dateParse(java.lang.String,java.lang.String)
2024-09-06 21:07:37.083  INFO 11936 --- [           main] s.w.s.m.m.a.RequestMappingHandlerMapping : Mapped "{[/api/filesuffix/{directory}/{file}],methods=[GET]}" onto public org.springframework.http.ResponseEntity<java.lang.String> org.restscs.ScsRest.fileSuffix(java.lang.String,java.lang.String)
2024-09-06 21:07:37.084  INFO 11936 --- [           main] s.w.s.m.m.a.RequestMappingHandlerMapping : Mapped "{[/api/notypevar/{i}/{s}],methods=[GET]}" onto public org.springframework.http.ResponseEntity<java.lang.String> org.restscs.ScsRest.notyPevar(java.lang.Integer,java.lang.String)
2024-09-06 21:07:37.085  INFO 11936 --- [           main] s.w.s.m.m.a.RequestMappingHandlerMapping : Mapped "{[/api/ordered4/{w}/{x}/{z}/{y}],methods=[GET]}" onto public org.springframework.http.ResponseEntity<java.lang.String> org.restscs.ScsRest.ordered4(java.lang.String,java.lang.String,java.lang.String,java.lang.String)
2024-09-06 21:07:37.086  INFO 11936 --- [           main] s.w.s.m.m.a.RequestMappingHandlerMapping : Mapped "{[/api/pat/{txt}/{pat}],methods=[GET]}" onto public org.springframework.http.ResponseEntity<java.lang.String> org.restscs.ScsRest.pat(java.lang.String,java.lang.String)
2024-09-06 21:07:37.087  INFO 11936 --- [           main] s.w.s.m.m.a.RequestMappingHandlerMapping : Mapped "{[/api/text2txt/{word1}/{word2}/{word3}],methods=[GET]}" onto public org.springframework.http.ResponseEntity<java.lang.String> org.restscs.ScsRest.text2txt(java.lang.String,java.lang.String,java.lang.String)
2024-09-06 21:07:37.094  INFO 11936 --- [           main] s.w.s.m.m.a.RequestMappingHandlerMapping : Mapped "{[/swagger-resources/configuration/security]}" onto public org.springframework.http.ResponseEntity<springfox.documentation.swagger.web.SecurityConfiguration> springfox.documentation.swagger.web.ApiResourceController.securityConfiguration()
2024-09-06 21:07:37.097  INFO 11936 --- [           main] s.w.s.m.m.a.RequestMappingHandlerMapping : Mapped "{[/swagger-resources/configuration/ui]}" onto public org.springframework.http.ResponseEntity<springfox.documentation.swagger.web.UiConfiguration> springfox.documentation.swagger.web.ApiResourceController.uiConfiguration()
2024-09-06 21:07:37.098  INFO 11936 --- [           main] s.w.s.m.m.a.RequestMappingHandlerMapping : Mapped "{[/swagger-resources]}" onto public org.springframework.http.ResponseEntity<java.util.List<springfox.documentation.swagger.web.SwaggerResource>> springfox.documentation.swagger.web.ApiResourceController.swaggerResources()
2024-09-06 21:07:37.105  INFO 11936 --- [           main] s.w.s.m.m.a.RequestMappingHandlerMapping : Mapped "{[/error],produces=[text/html]}" onto public org.springframework.web.servlet.ModelAndView org.springframework.boot.autoconfigure.web.servlet.error.BasicErrorController.errorHtml(javax.servlet.http.HttpServletRequest,javax.servlet.http.HttpServletResponse)
2024-09-06 21:07:37.106  INFO 11936 --- [           main] s.w.s.m.m.a.RequestMappingHandlerMapping : Mapped "{[/error]}" onto public org.springframework.http.ResponseEntity<java.util.Map<java.lang.String, java.lang.Object>> org.springframework.boot.autoconfigure.web.servlet.error.BasicErrorController.error(javax.servlet.http.HttpServletRequest)
2024-09-06 21:07:37.294  INFO 11936 --- [           main] pertySourcedRequestMappingHandlerMapping : Mapped URL path [/v2/api-docs] onto method [public org.springframework.http.ResponseEntity<springfox.documentation.spring.web.json.Json> springfox.documentation.swagger2.web.Swagger2Controller.getDocumentation(java.lang.String,javax.servlet.http.HttpServletRequest)]
2024-09-06 21:07:37.397  INFO 11936 --- [           main] o.s.w.s.handler.SimpleUrlHandlerMapping  : Mapped URL path [/**/favicon.ico] onto handler of type [class org.springframework.web.servlet.resource.ResourceHttpRequestHandler]
2024-09-06 21:07:37.583  INFO 11936 --- [           main] s.w.s.m.m.a.RequestMappingHandlerAdapter : Looking for @ControllerAdvice: org.springframework.boot.web.servlet.context.AnnotationConfigServletWebServerApplicationContext@7faa0680: startup date [Fri Sep 06 21:07:33 BRT 2024]; root of context hierarchy
2024-09-06 21:07:37.656  INFO 11936 --- [           main] o.s.w.s.handler.SimpleUrlHandlerMapping  : Mapped URL path [/webjars/**] onto handler of type [class org.springframework.web.servlet.resource.ResourceHttpRequestHandler]
2024-09-06 21:07:37.657  INFO 11936 --- [           main] o.s.w.s.handler.SimpleUrlHandlerMapping  : Mapped URL path [/**] onto handler of type [class org.springframework.web.servlet.resource.ResourceHttpRequestHandler]
2024-09-06 21:07:37.930  INFO 11936 --- [           main] o.s.j.e.a.AnnotationMBeanExporter        : Registering beans for JMX exposure on startup
2024-09-06 21:07:37.944  INFO 11936 --- [           main] o.s.c.support.DefaultLifecycleProcessor  : Starting beans in phase 2147483647
2024-09-06 21:07:37.945  INFO 11936 --- [           main] d.s.w.p.DocumentationPluginsBootstrapper : Context refreshed
2024-09-06 21:07:37.984  INFO 11936 --- [           main] d.s.w.p.DocumentationPluginsBootstrapper : Found 1 custom documentation plugin(s)
2024-09-06 21:07:38.044  INFO 11936 --- [           main] s.d.s.w.s.ApiListingReferenceScanner     : Scanning for api listing references
2024-09-06 21:07:38.256  INFO 11936 --- [           main] o.s.b.w.embedded.tomcat.TomcatWebServer  : Tomcat started on port(s): 43119 (http) with context path ''
2024-09-06 21:07:38.262  INFO 11936 --- [           main] o.a.maven.surefire.booter.ForkedBooter   : Started ForkedBooter in 5.969 seconds (JVM running for 7.064)
2024-09-06 21:07:39.456  INFO 11936 --- [           main] o.s.c.support.DefaultLifecycleProcessor  : Stopping beans in phase 2147483647
[[1;31mERROR[m] [1;31mTests [0;1mrun: [0;1m11[m, Failures: 0, [1;31mErrors: [0;1;31m11[m, Skipped: 0, Time elapsed: 7.626 s[1;31m <<< FAILURE![m - in org.restscs.[1mv1_gpt35_run03_PatTest[m
[[1;31mERROR[m] testPatWithParamsEndpoint(org.restscs.v1_gpt35_run03_PatTest)  Time elapsed: 0.611 s  <<< ERROR!
java.net.URISyntaxException: Illegal character in path at index 31: http://localhost:43119/api/pat/{txt}/{pat}
	at org.restscs.v1_gpt35_run03_PatTest.testPatWithParamsEndpoint(v1_gpt35_run03_PatTest.java:70)

[[1;31mERROR[m] testPatEndpoint(org.restscs.v1_gpt35_run03_PatTest)  Time elapsed: 0.002 s  <<< ERROR!
java.net.URISyntaxException: Illegal character in path at index 31: http://localhost:43119/api/pat/{txt}
	at org.restscs.v1_gpt35_run03_PatTest.testPatEndpoint(v1_gpt35_run03_PatTest.java:61)

[[1;31mERROR[m] testText2txtEndpoint(org.restscs.v1_gpt35_run03_PatTest)  Time elapsed: 0.005 s  <<< ERROR!
java.net.URISyntaxException: Illegal character in path at index 36: http://localhost:43119/api/text2txt/{word1}/{word2}/{word3}
	at org.restscs.v1_gpt35_run03_PatTest.testText2txtEndpoint(v1_gpt35_run03_PatTest.java:79)

[[1;31mERROR[m] testTitleEndpoint(org.restscs.v1_gpt35_run03_PatTest)  Time elapsed: 0.005 s  <<< ERROR!
java.net.URISyntaxException: Illegal character in path at index 33: http://localhost:43119/api/title/{sex}/{title}
	at org.restscs.v1_gpt35_run03_PatTest.testTitleEndpoint(v1_gpt35_run03_PatTest.java:88)

[[1;31mERROR[m] testCostfunsEndpoint(org.restscs.v1_gpt35_run03_PatTest)  Time elapsed: 0.004 s  <<< ERROR!
java.net.URISyntaxException: Illegal character in path at index 36: http://localhost:43119/api/costfuns/{i}/{s}
	at org.restscs.v1_gpt35_run03_PatTest.testCostfunsEndpoint(v1_gpt35_run03_PatTest.java:97)

[[1;31mERROR[m] testDateparseEndpoint(org.restscs.v1_gpt35_run03_PatTest)  Time elapsed: 0.005 s  <<< ERROR!
java.net.URISyntaxException: Illegal character in path at index 37: http://localhost:43119/api/dateparse/{dayname}/{monthname}
	at org.restscs.v1_gpt35_run03_PatTest.testDateparseEndpoint(v1_gpt35_run03_PatTest.java:106)

[[1;31mERROR[m] testFilesuffixEndpoint(org.restscs.v1_gpt35_run03_PatTest)  Time elapsed: 0.005 s  <<< ERROR!
java.net.URISyntaxException: Illegal character in path at index 38: http://localhost:43119/api/filesuffix/{directory}/{file}
	at org.restscs.v1_gpt35_run03_PatTest.testFilesuffixEndpoint(v1_gpt35_run03_PatTest.java:115)

[[1;31mERROR[m] testNotypevarEndpoint(org.restscs.v1_gpt35_run03_PatTest)  Time elapsed: 0.007 s  <<< ERROR!
java.net.URISyntaxException: Illegal character in path at index 37: http://localhost:43119/api/notypevar/{i}/{s}
	at org.restscs.v1_gpt35_run03_PatTest.testNotypevarEndpoint(v1_gpt35_run03_PatTest.java:124)

[[1;31mERROR[m] testOrdered4Endpoint(org.restscs.v1_gpt35_run03_PatTest)  Time elapsed: 0.005 s  <<< ERROR!
java.net.URISyntaxException: Illegal character in path at index 36: http://localhost:43119/api/ordered4/{w}/{x}/{z}/{y}
	at org.restscs.v1_gpt35_run03_PatTest.testOrdered4Endpoint(v1_gpt35_run03_PatTest.java:133)

[[1;31mERROR[m] testCalcEndpoint(org.restscs.v1_gpt35_run03_PatTest)  Time elapsed: 0.004 s  <<< ERROR!
java.net.URISyntaxException: Illegal character in path at index 32: http://localhost:43119/api/calc/{op}/{arg1}/{arg2}
	at org.restscs.v1_gpt35_run03_PatTest.testCalcEndpoint(v1_gpt35_run03_PatTest.java:142)

[[1;31mERROR[m] testCookieEndpoint(org.restscs.v1_gpt35_run03_PatTest)  Time elapsed: 0.004 s  <<< ERROR!
java.net.URISyntaxException: Illegal character in path at index 34: http://localhost:43119/api/cookie/{name}/{val}/{site}
	at org.restscs.v1_gpt35_run03_PatTest.testCookieEndpoint(v1_gpt35_run03_PatTest.java:151)

2024-09-06 21:07:39.513  INFO 11936 --- [       Thread-4] ConfigServletWebServerApplicationContext : Closing org.springframework.boot.web.servlet.context.AnnotationConfigServletWebServerApplicationContext@7faa0680: startup date [Fri Sep 06 21:07:33 BRT 2024]; root of context hierarchy
2024-09-06 21:07:39.516  INFO 11936 --- [       Thread-4] o.s.c.support.DefaultLifecycleProcessor  : Stopping beans in phase 2147483647
2024-09-06 21:07:39.517  INFO 11936 --- [       Thread-4] o.s.j.e.a.AnnotationMBeanExporter        : Unregistering JMX-exposed beans on shutdown
[[1;34mINFO[m] 
[[1;34mINFO[m] Results:
[[1;34mINFO[m] 
[[1;31mERROR[m] [1;31mErrors: [m
[[1;31mERROR[m] [1;31m  v1_gpt35_run03_PatTest.testCalcEndpoint:142 » URISyntax Illegal character in p...[m
[[1;31mERROR[m] [1;31m  v1_gpt35_run03_PatTest.testCookieEndpoint:151 » URISyntax Illegal character in...[m
[[1;31mERROR[m] [1;31m  v1_gpt35_run03_PatTest.testCostfunsEndpoint:97 » URISyntax Illegal character i...[m
[[1;31mERROR[m] [1;31m  v1_gpt35_run03_PatTest.testDateparseEndpoint:106 » URISyntax Illegal character...[m
[[1;31mERROR[m] [1;31m  v1_gpt35_run03_PatTest.testFilesuffixEndpoint:115 » URISyntax Illegal characte...[m
[[1;31mERROR[m] [1;31m  v1_gpt35_run03_PatTest.testNotypevarEndpoint:124 » URISyntax Illegal character...[m
[[1;31mERROR[m] [1;31m  v1_gpt35_run03_PatTest.testOrdered4Endpoint:133 » URISyntax Illegal character ...[m
[[1;31mERROR[m] [1;31m  v1_gpt35_run03_PatTest.testPatEndpoint:61 » URISyntax Illegal character in pat...[m
[[1;31mERROR[m] [1;31m  v1_gpt35_run03_PatTest.testPatWithParamsEndpoint:70 » URISyntax Illegal charac...[m
[[1;31mERROR[m] [1;31m  v1_gpt35_run03_PatTest.testText2txtEndpoint:79 » URISyntax Illegal character i...[m
[[1;31mERROR[m] [1;31m  v1_gpt35_run03_PatTest.testTitleEndpoint:88 » URISyntax Illegal character in p...[m
[[1;34mINFO[m] 
[[1;31mERROR[m] [1;31mTests run: 11, Failures: 0, Errors: 11, Skipped: 0[m
[[1;34mINFO[m] 
[[1;34mINFO[m] [1m------------------------------------------------------------------------[m
[[1;34mINFO[m] [1;31mBUILD FAILURE[m
[[1;34mINFO[m] [1m------------------------------------------------------------------------[m
[[1;34mINFO[m] Total time:  11.852 s
[[1;34mINFO[m] Finished at: 2024-09-06T21:07:40-03:00
[[1;34mINFO[m] [1m------------------------------------------------------------------------[m
[[1;31mERROR[m] Failed to execute goal [32morg.apache.maven.plugins:maven-surefire-plugin:2.22.0:test[m [1m(default-test)[m on project [36mevomaster-benchmark-cs-rest-artificial-scs[m: [1;31mThere are test failures.[m
[[1;31mERROR[m] [1;31m[m
[[1;31mERROR[m] [1;31mPlease refer to /media/rincon/63999417195/eclipse-workspace/EMB-master/jdk_8_maven/cs/rest/artificial/scs/target/surefire-reports for the individual test results.[m
[[1;31mERROR[m] [1;31mPlease refer to dump files (if any exist) [date]-jvmRun[N].dump, [date].dumpstream and [date]-jvmRun[N].dumpstream.[m
[[1;31mERROR[m] -> [1m[Help 1][m
[[1;31mERROR[m] 
[[1;31mERROR[m] To see the full stack trace of the errors, re-run Maven with the [1m-e[m switch.
[[1;31mERROR[m] Re-run Maven using the [1m-X[m switch to enable full debug logging.
[[1;31mERROR[m] 
[[1;31mERROR[m] For more information about the errors and possible solutions, please read the following articles:
[[1;31mERROR[m] [1m[Help 1][m http://cwiki.apache.org/confluence/display/MAVEN/MojoFailureException
