Correct the test code delimited by ***** according to the error messages delimited by ##### and generate another complete code in JUnit 4 format. The response must contain only Java code in JUnit 4 format.

Keep these five instructions for this generated test code:

Instruction 1: Keet this package line to generated test code file:
package org.restscs;

Instruction 2: Keep the following Java imports to generated test code file:
import  org.junit.AfterClass;
import  org.junit.BeforeClass;
import  org.junit.Before;
import  org.junit.Test;
import static org.junit.Assert.*;
import  java.util.Map;
import  java.util.List;
import static org.evomaster.client.java.controller.api.EMTestUtils.*;
import  org.evomaster.client.java.controller.SutHandler;
import  io.restassured.RestAssured;
import static io.restassured.RestAssured.given;
import  io.restassured.response.ValidatableResponse;
import static org.hamcrest.Matchers.*;
import  io.restassured.config.JsonConfig;
import  io.restassured.path.json.config.JsonPathConfig;
import static io.restassured.config.RedirectConfig.redirectConfig;
import static org.evomaster.client.java.controller.contentMatchers.NumberMatcher.*;
import static org.evomaster.client.java.controller.contentMatchers.StringMatcher.*;
import static org.evomaster.client.java.controller.contentMatchers.SubStringMatcher.*;
import static org.evomaster.client.java.controller.expect.ExpectationHandler.expectationHandler;
import  org.evomaster.client.java.controller.expect.ExpectationHandler;
import  io.restassured.path.json.JsonPath;
import  java.util.Arrays;

Instruction 3: Keep the same class name in this point (between the imports at instruction 2 and instruction 4)

Instruction 4: Keep these variables in the generated test code:
private static final SutHandler controller = new em.embedded.org.restscs.EmbeddedEvoMasterController();
private static String baseUrlOfSut;

Instruction 5: Keep the following setup and teardown methods in generated test code file:
@BeforeClass
public static void initClass() {
    controller.setupForGeneratedTest();
    baseUrlOfSut = controller.startSut();
    controller.registerOrExecuteInitSqlCommandsIfNeeded();
    assertNotNull(baseUrlOfSut);
    RestAssured.enableLoggingOfRequestAndResponseIfValidationFails();
    RestAssured.useRelaxedHTTPSValidation();
    RestAssured.urlEncodingEnabled = false;
    RestAssured.config = RestAssured.config()
        .jsonConfig(JsonConfig.jsonConfig().numberReturnType(JsonPathConfig.NumberReturnType.DOUBLE))
        .redirect(redirectConfig().followRedirects(false));
}


@AfterClass
public static void tearDown() {
    controller.stopSut();
}


@Before
public void initTest() {
    controller.resetStateOfSUT();
}


*****

package org.restscs;

import org.junit.AfterClass;
import org.junit.BeforeClass;
import org.junit.Before;
import org.junit.Test;
import static org.junit.Assert.*;
import java.util.Map;
import java.util.List;
import static org.evomaster.client.java.controller.api.EMTestUtils.*;
import org.evomaster.client.java.controller.SutHandler;
import io.restassured.RestAssured;
import static io.restassured.RestAssured.given;
import io.restassured.response.ValidatableResponse;
import static org.hamcrest.Matchers.*;
import io.restassured.config.JsonConfig;
import io.restassured.path.json.config.JsonPathConfig;
import static io.restassured.config.RedirectConfig.redirectConfig;
import static org.evomaster.client.java.controller.contentMatchers.NumberMatcher.*;
import static org.evomaster.client.java.controller.contentMatchers.StringMatcher.*;
import static org.evomaster.client.java.controller.contentMatchers.SubStringMatcher.*;
import static org.evomaster.client.java.controller.expect.ExpectationHandler.expectationHandler;
import org.evomaster.client.java.controller.expect.ExpectationHandler;
import io.restassured.path.json.JsonPath;
import java.util.Arrays;

public class v1_gpt4o_run03_Text2TxtTest {
    private static final SutHandler controller = new em.embedded.org.restscs.EmbeddedEvoMasterController();
    private static String baseUrlOfSut;

    @BeforeClass
    public static void initClass() {
        controller.setupForGeneratedTest();
        baseUrlOfSut = controller.startSut();
        controller.registerOrExecuteInitSqlCommandsIfNeeded();
        assertNotNull(baseUrlOfSut);
        RestAssured.enableLoggingOfRequestAndResponseIfValidationFails();
        RestAssured.useRelaxedHTTPSValidation();
        RestAssured.urlEncodingEnabled = false;
        RestAssured.config = RestAssured.config()
            .jsonConfig(JsonConfig.jsonConfig().numberReturnType(JsonPathConfig.NumberReturnType.DOUBLE))
            .redirect(redirectConfig().followRedirects(false));
    }

    @AfterClass
    public static void tearDown() {
        controller.stopSut();
    }

    @Before
    public void initTest() {
        controller.resetStateOfSUT();
    }

    @Test
    public void testCalcUsingGET() {
        given().baseUri(baseUrlOfSut)
            .pathParam("op", "add")
            .pathParam("arg1", 1)
            .pathParam("arg2", 2)
        .when().get("/api/calc/{op}/{arg1}/{arg2}")
        .then().statusCode(200)
            .body(equalTo("3"));
    }

    @Test
    public void testCookieUsingGET() {
        given().baseUri(baseUrlOfSut)
            .pathParam("name", "session")
            .pathParam("val", "12345")
            .pathParam("site", "example.com")
        .when().get("/api/cookie/{name}/{val}/{site}")
        .then().statusCode(200)
            .body(equalTo("session=12345; Domain=example.com; Path=/"));
    }

    @Test
    public void testCostfunsUsingGET() {
        given().baseUri(baseUrlOfSut)
            .pathParam("i", 1)
            .pathParam("s", "test")
        .when().get("/api/costfuns/{i}/{s}")
        .then().statusCode(200)
            .body(equalTo("Cost function result"));
    }

    @Test
    public void testDateParseUsingGET() {
        given().baseUri(baseUrlOfSut)
            .pathParam("dayname", "Monday")
            .pathParam("monthname", "January")
        .when().get("/api/dateparse/{dayname}/{monthname}")
        .then().statusCode(200)
            .body(equalTo("Parsed Date"));
    }

    @Test
    public void testFileSuffixUsingGET() {
        given().baseUri(baseUrlOfSut)
            .pathParam("directory", "home")
            .pathParam("file", "document.txt")
        .when().get("/api/filesuffix/{directory}/{file}")
        .then().statusCode(200)
            .body(equalTo("txt"));
    }

    @Test
    public void testNotyPevarUsingGET() {
        given().baseUri(baseUrlOfSut)
            .pathParam("i", 5)
            .pathParam("s", "example")
        .when().get("/api/notypevar/{i}/{s}")
        .then().statusCode(200)
            .body(equalTo("Processed notypevar"));
    }

    @Test
    public void testOrdered4UsingGET() {
        given().baseUri(baseUrlOfSut)
            .pathParam("w", "one")
            .pathParam("x", "two")
            .pathParam("y", "three")
            .pathParam("z", "four")
        .when().get("/api/ordered4/{w}/{x}/{z}/{y}")
        .then().statusCode(200)
            .body(equalTo("Ordered result"));
    }

    @Test
    public void testRegexUsingGET() {
        given().baseUri(baseUrlOfSut)
            .pathParam("txt", "example text")
        .when().get("/api/pat/{txt}")
        .then().statusCode(200)
            .body(equalTo("Regex match result"));
    }

    @Test
    public void testPatUsingGET() {
        given().baseUri(baseUrlOfSut)
            .pathParam("txt", "example text")
            .pathParam("pat", "^example")
        .when().get("/api/pat/{txt}/{pat}")
        .then().statusCode(200)
            .body(equalTo("Pattern match result"));
    }

    @Test
    public void testText2txtUsingGET() {
        given().baseUri(baseUrlOfSut)
            .pathParam("word1", "by")
            .pathParam("word2", "the")
            .pathParam("word3", "way")
        .when().get("/api/text2txt/{word1}/{word2}/{word3}")
        .then().statusCode(200)
            .body(equalTo("btw"));
    }

    @Test
    public void testTitleUsingGET() {
        given().baseUri(baseUrlOfSut)
            .pathParam("sex", "male")
            .pathParam("title", "Mr")
        .when().get("/api/title/{sex}/{title}")
        .then().statusCode(200)
            .body(equalTo("Title processed"));
    }
}

*****
#####
[[1;34mINFO[m] Scanning for projects...
[[1;34mINFO[m] 
[[1;34mINFO[m] [1m------< [0;36morg.evomaster:evomaster-benchmark-cs-rest-artificial-scs[0;1m >------[m
[[1;34mINFO[m] [1mBuilding evomaster-benchmark-cs-rest-artificial-scs 3.0.0[m
[[1;34mINFO[m] [1m--------------------------------[ jar ]---------------------------------[m
[[1;34mINFO[m] 
[[1;34mINFO[m] [1m--- [0;32mmaven-clean-plugin:2.5:clean[m [1m(default-clean)[m @ [36mevomaster-benchmark-cs-rest-artificial-scs[0;1m ---[m
[[1;34mINFO[m] Deleting /media/rincon/63999417195/eclipse-workspace/EMB-master/jdk_8_maven/cs/rest/artificial/scs/target
[[1;34mINFO[m] 
[[1;34mINFO[m] [1m--- [0;32mjacoco-maven-plugin:0.8.7:prepare-agent[m [1m(default)[m @ [36mevomaster-benchmark-cs-rest-artificial-scs[0;1m ---[m
[[1;34mINFO[m] argLine set to -javaagent:/home/rincon/.m2/repository/org/jacoco/org.jacoco.agent/0.8.7/org.jacoco.agent-0.8.7-runtime.jar=destfile=/media/rincon/63999417195/eclipse-workspace/EMB-master/jdk_8_maven/cs/rest/artificial/scs/target/jacoco.exec
[[1;34mINFO[m] 
[[1;34mINFO[m] [1m--- [0;32mmaven-resources-plugin:2.6:resources[m [1m(default-resources)[m @ [36mevomaster-benchmark-cs-rest-artificial-scs[0;1m ---[m
[[1;34mINFO[m] Using 'UTF-8' encoding to copy filtered resources.
[[1;34mINFO[m] skip non existing resourceDirectory /media/rincon/63999417195/eclipse-workspace/EMB-master/jdk_8_maven/cs/rest/artificial/scs/src/main/resources
[[1;34mINFO[m] 
[[1;34mINFO[m] [1m--- [0;32mmaven-compiler-plugin:3.8.0:compile[m [1m(default-compile)[m @ [36mevomaster-benchmark-cs-rest-artificial-scs[0;1m ---[m
[[1;34mINFO[m] Changes detected - recompiling the module!
[[1;34mINFO[m] Compiling 14 source files to /media/rincon/63999417195/eclipse-workspace/EMB-master/jdk_8_maven/cs/rest/artificial/scs/target/classes
[[1;34mINFO[m] 
[[1;34mINFO[m] [1m--- [0;32mjacoco-maven-plugin:0.8.7:prepare-agent[m [1m(default)[m @ [36mevomaster-benchmark-cs-rest-artificial-scs[0;1m ---[m
[[1;34mINFO[m] argLine set to -javaagent:/home/rincon/.m2/repository/org/jacoco/org.jacoco.agent/0.8.7/org.jacoco.agent-0.8.7-runtime.jar=destfile=/media/rincon/63999417195/eclipse-workspace/EMB-master/jdk_8_maven/cs/rest/artificial/scs/target/jacoco.exec
[[1;34mINFO[m] 
[[1;34mINFO[m] [1m--- [0;32mmaven-resources-plugin:2.6:resources[m [1m(default-resources)[m @ [36mevomaster-benchmark-cs-rest-artificial-scs[0;1m ---[m
[[1;34mINFO[m] Using 'UTF-8' encoding to copy filtered resources.
[[1;34mINFO[m] skip non existing resourceDirectory /media/rincon/63999417195/eclipse-workspace/EMB-master/jdk_8_maven/cs/rest/artificial/scs/src/main/resources
[[1;34mINFO[m] 
[[1;34mINFO[m] [1m--- [0;32mmaven-compiler-plugin:3.8.0:compile[m [1m(default-compile)[m @ [36mevomaster-benchmark-cs-rest-artificial-scs[0;1m ---[m
[[1;34mINFO[m] Changes detected - recompiling the module!
[[1;34mINFO[m] Compiling 14 source files to /media/rincon/63999417195/eclipse-workspace/EMB-master/jdk_8_maven/cs/rest/artificial/scs/target/classes
[[1;34mINFO[m] 
[[1;34mINFO[m] [1m--- [0;32mmaven-resources-plugin:2.6:testResources[m [1m(default-testResources)[m @ [36mevomaster-benchmark-cs-rest-artificial-scs[0;1m ---[m
[[1;34mINFO[m] Using 'UTF-8' encoding to copy filtered resources.
[[1;34mINFO[m] skip non existing resourceDirectory /media/rincon/63999417195/eclipse-workspace/EMB-master/jdk_8_maven/cs/rest/artificial/scs/src/test/resources
[[1;34mINFO[m] 
[[1;34mINFO[m] [1m--- [0;32mmaven-compiler-plugin:3.8.0:testCompile[m [1m(default-testCompile)[m @ [36mevomaster-benchmark-cs-rest-artificial-scs[0;1m ---[m
[[1;34mINFO[m] Changes detected - recompiling the module!
[[1;34mINFO[m] Compiling 1 source file to /media/rincon/63999417195/eclipse-workspace/EMB-master/jdk_8_maven/cs/rest/artificial/scs/target/test-classes
[[1;34mINFO[m] 
[[1;34mINFO[m] [1m--- [0;32mjacoco-maven-plugin:0.8.7:prepare-agent[m [1m(default)[m @ [36mevomaster-benchmark-cs-rest-artificial-scs[0;1m ---[m
[[1;34mINFO[m] argLine set to -javaagent:/home/rincon/.m2/repository/org/jacoco/org.jacoco.agent/0.8.7/org.jacoco.agent-0.8.7-runtime.jar=destfile=/media/rincon/63999417195/eclipse-workspace/EMB-master/jdk_8_maven/cs/rest/artificial/scs/target/jacoco.exec
[[1;34mINFO[m] 
[[1;34mINFO[m] [1m--- [0;32mmaven-resources-plugin:2.6:resources[m [1m(default-resources)[m @ [36mevomaster-benchmark-cs-rest-artificial-scs[0;1m ---[m
[[1;34mINFO[m] Using 'UTF-8' encoding to copy filtered resources.
[[1;34mINFO[m] skip non existing resourceDirectory /media/rincon/63999417195/eclipse-workspace/EMB-master/jdk_8_maven/cs/rest/artificial/scs/src/main/resources
[[1;34mINFO[m] 
[[1;34mINFO[m] [1m--- [0;32mmaven-compiler-plugin:3.8.0:compile[m [1m(default-compile)[m @ [36mevomaster-benchmark-cs-rest-artificial-scs[0;1m ---[m
[[1;34mINFO[m] Changes detected - recompiling the module!
[[1;34mINFO[m] Compiling 14 source files to /media/rincon/63999417195/eclipse-workspace/EMB-master/jdk_8_maven/cs/rest/artificial/scs/target/classes
[[1;34mINFO[m] 
[[1;34mINFO[m] [1m--- [0;32mmaven-resources-plugin:2.6:testResources[m [1m(default-testResources)[m @ [36mevomaster-benchmark-cs-rest-artificial-scs[0;1m ---[m
[[1;34mINFO[m] Using 'UTF-8' encoding to copy filtered resources.
[[1;34mINFO[m] skip non existing resourceDirectory /media/rincon/63999417195/eclipse-workspace/EMB-master/jdk_8_maven/cs/rest/artificial/scs/src/test/resources
[[1;34mINFO[m] 
[[1;34mINFO[m] [1m--- [0;32mmaven-compiler-plugin:3.8.0:testCompile[m [1m(default-testCompile)[m @ [36mevomaster-benchmark-cs-rest-artificial-scs[0;1m ---[m
[[1;34mINFO[m] Nothing to compile - all classes are up to date
[[1;34mINFO[m] 
[[1;34mINFO[m] [1m--- [0;32mmaven-surefire-plugin:2.22.0:test[m [1m(default-test)[m @ [36mevomaster-benchmark-cs-rest-artificial-scs[0;1m ---[m
[[1;34mINFO[m] 
[[1;34mINFO[m] -------------------------------------------------------
[[1;34mINFO[m]  T E S T S
[[1;34mINFO[m] -------------------------------------------------------
[[1;34mINFO[m] Running org.restscs.[1mv1_gpt4o_run03_Text2TxtTest[m

  .   ____          _            __ _ _
 /\\ / ___'_ __ _ _(_)_ __  __ _ \ \ \ \
( ( )\___ | '_ | '_| | '_ \/ _` | \ \ \ \
 \\/  ___)| |_)| | | | | || (_| |  ) ) ) )
  '  |____| .__|_| |_|_| |_\__, | / / / /
 =========|_|==============|___/=/_/_/_/
 :: Spring Boot ::        (v2.0.3.RELEASE)

2024-09-06 22:28:32.725  INFO 27683 --- [           main] o.a.maven.surefire.booter.ForkedBooter   : Starting ForkedBooter v2.22.0 on IFTO-PROBOOK with PID 27683 (started by rincon in /media/rincon/63999417195/eclipse-workspace/EMB-master/jdk_8_maven/cs/rest/artificial/scs)
2024-09-06 22:28:32.731  INFO 27683 --- [           main] o.a.maven.surefire.booter.ForkedBooter   : No active profile set, falling back to default profiles: default
2024-09-06 22:28:33.278  INFO 27683 --- [           main] ConfigServletWebServerApplicationContext : Refreshing org.springframework.boot.web.servlet.context.AnnotationConfigServletWebServerApplicationContext@72af90e8: startup date [Fri Sep 06 22:28:33 BRT 2024]; root of context hierarchy
2024-09-06 22:28:34.414  INFO 27683 --- [           main] f.a.AutowiredAnnotationBeanPostProcessor : JSR-330 'javax.inject.Inject' annotation found and supported for autowiring
2024-09-06 22:28:34.840  INFO 27683 --- [           main] o.s.b.w.embedded.tomcat.TomcatWebServer  : Tomcat initialized with port(s): 0 (http)
2024-09-06 22:28:34.889  INFO 27683 --- [           main] o.apache.catalina.core.StandardService   : Starting service [Tomcat]
2024-09-06 22:28:34.889  INFO 27683 --- [           main] org.apache.catalina.core.StandardEngine  : Starting Servlet Engine: Apache Tomcat/8.5.31
2024-09-06 22:28:34.902  INFO 27683 --- [ost-startStop-1] o.a.catalina.core.AprLifecycleListener   : The APR based Apache Tomcat Native library which allows optimal performance in production environments was not found on the java.library.path: [/usr/java/packages/lib/amd64:/usr/lib64:/lib64:/lib:/usr/lib]
2024-09-06 22:28:35.006  INFO 27683 --- [ost-startStop-1] o.a.c.c.C.[Tomcat].[localhost].[/]       : Initializing Spring embedded WebApplicationContext
2024-09-06 22:28:35.006  INFO 27683 --- [ost-startStop-1] o.s.web.context.ContextLoader            : Root WebApplicationContext: initialization completed in 1732 ms
2024-09-06 22:28:35.122  INFO 27683 --- [ost-startStop-1] o.s.b.w.servlet.ServletRegistrationBean  : Servlet dispatcherServlet mapped to [/]
2024-09-06 22:28:35.126  INFO 27683 --- [ost-startStop-1] o.s.b.w.servlet.FilterRegistrationBean   : Mapping filter: 'characterEncodingFilter' to: [/*]
2024-09-06 22:28:35.127  INFO 27683 --- [ost-startStop-1] o.s.b.w.servlet.FilterRegistrationBean   : Mapping filter: 'hiddenHttpMethodFilter' to: [/*]
2024-09-06 22:28:35.127  INFO 27683 --- [ost-startStop-1] o.s.b.w.servlet.FilterRegistrationBean   : Mapping filter: 'httpPutFormContentFilter' to: [/*]
2024-09-06 22:28:35.127  INFO 27683 --- [ost-startStop-1] o.s.b.w.servlet.FilterRegistrationBean   : Mapping filter: 'requestContextFilter' to: [/*]
2024-09-06 22:28:35.601  INFO 27683 --- [           main] s.w.s.m.m.a.RequestMappingHandlerMapping : Mapped "{[/api/pat/{txt}],methods=[GET]}" onto public org.springframework.http.ResponseEntity<java.lang.String> org.restscs.ScsRest.regex(java.lang.String)
2024-09-06 22:28:35.603  INFO 27683 --- [           main] s.w.s.m.m.a.RequestMappingHandlerMapping : Mapped "{[/api/pat/{txt}/{pat}],methods=[GET]}" onto public org.springframework.http.ResponseEntity<java.lang.String> org.restscs.ScsRest.pat(java.lang.String,java.lang.String)
2024-09-06 22:28:35.603  INFO 27683 --- [           main] s.w.s.m.m.a.RequestMappingHandlerMapping : Mapped "{[/api/title/{sex}/{title}],methods=[GET]}" onto public org.springframework.http.ResponseEntity<java.lang.String> org.restscs.ScsRest.title(java.lang.String,java.lang.String)
2024-09-06 22:28:35.604  INFO 27683 --- [           main] s.w.s.m.m.a.RequestMappingHandlerMapping : Mapped "{[/api/calc/{op}/{arg1}/{arg2}],methods=[GET]}" onto public org.springframework.http.ResponseEntity<java.lang.String> org.restscs.ScsRest.calc(java.lang.String,double,double)
2024-09-06 22:28:35.604  INFO 27683 --- [           main] s.w.s.m.m.a.RequestMappingHandlerMapping : Mapped "{[/api/cookie/{name}/{val}/{site}],methods=[GET]}" onto public org.springframework.http.ResponseEntity<java.lang.String> org.restscs.ScsRest.cookie(java.lang.String,java.lang.String,java.lang.String)
2024-09-06 22:28:35.605  INFO 27683 --- [           main] s.w.s.m.m.a.RequestMappingHandlerMapping : Mapped "{[/api/costfuns/{i}/{s}],methods=[GET]}" onto public org.springframework.http.ResponseEntity<java.lang.String> org.restscs.ScsRest.costfuns(java.lang.Integer,java.lang.String)
2024-09-06 22:28:35.605  INFO 27683 --- [           main] s.w.s.m.m.a.RequestMappingHandlerMapping : Mapped "{[/api/dateparse/{dayname}/{monthname}],methods=[GET]}" onto public org.springframework.http.ResponseEntity<java.lang.String> org.restscs.ScsRest.dateParse(java.lang.String,java.lang.String)
2024-09-06 22:28:35.606  INFO 27683 --- [           main] s.w.s.m.m.a.RequestMappingHandlerMapping : Mapped "{[/api/filesuffix/{directory}/{file}],methods=[GET]}" onto public org.springframework.http.ResponseEntity<java.lang.String> org.restscs.ScsRest.fileSuffix(java.lang.String,java.lang.String)
2024-09-06 22:28:35.606  INFO 27683 --- [           main] s.w.s.m.m.a.RequestMappingHandlerMapping : Mapped "{[/api/notypevar/{i}/{s}],methods=[GET]}" onto public org.springframework.http.ResponseEntity<java.lang.String> org.restscs.ScsRest.notyPevar(java.lang.Integer,java.lang.String)
2024-09-06 22:28:35.607  INFO 27683 --- [           main] s.w.s.m.m.a.RequestMappingHandlerMapping : Mapped "{[/api/ordered4/{w}/{x}/{z}/{y}],methods=[GET]}" onto public org.springframework.http.ResponseEntity<java.lang.String> org.restscs.ScsRest.ordered4(java.lang.String,java.lang.String,java.lang.String,java.lang.String)
2024-09-06 22:28:35.608  INFO 27683 --- [           main] s.w.s.m.m.a.RequestMappingHandlerMapping : Mapped "{[/api/text2txt/{word1}/{word2}/{word3}],methods=[GET]}" onto public org.springframework.http.ResponseEntity<java.lang.String> org.restscs.ScsRest.text2txt(java.lang.String,java.lang.String,java.lang.String)
2024-09-06 22:28:35.613  INFO 27683 --- [           main] s.w.s.m.m.a.RequestMappingHandlerMapping : Mapped "{[/swagger-resources/configuration/security]}" onto public org.springframework.http.ResponseEntity<springfox.documentation.swagger.web.SecurityConfiguration> springfox.documentation.swagger.web.ApiResourceController.securityConfiguration()
2024-09-06 22:28:35.614  INFO 27683 --- [           main] s.w.s.m.m.a.RequestMappingHandlerMapping : Mapped "{[/swagger-resources/configuration/ui]}" onto public org.springframework.http.ResponseEntity<springfox.documentation.swagger.web.UiConfiguration> springfox.documentation.swagger.web.ApiResourceController.uiConfiguration()
2024-09-06 22:28:35.615  INFO 27683 --- [           main] s.w.s.m.m.a.RequestMappingHandlerMapping : Mapped "{[/swagger-resources]}" onto public org.springframework.http.ResponseEntity<java.util.List<springfox.documentation.swagger.web.SwaggerResource>> springfox.documentation.swagger.web.ApiResourceController.swaggerResources()
2024-09-06 22:28:35.619  INFO 27683 --- [           main] s.w.s.m.m.a.RequestMappingHandlerMapping : Mapped "{[/error],produces=[text/html]}" onto public org.springframework.web.servlet.ModelAndView org.springframework.boot.autoconfigure.web.servlet.error.BasicErrorController.errorHtml(javax.servlet.http.HttpServletRequest,javax.servlet.http.HttpServletResponse)
2024-09-06 22:28:35.620  INFO 27683 --- [           main] s.w.s.m.m.a.RequestMappingHandlerMapping : Mapped "{[/error]}" onto public org.springframework.http.ResponseEntity<java.util.Map<java.lang.String, java.lang.Object>> org.springframework.boot.autoconfigure.web.servlet.error.BasicErrorController.error(javax.servlet.http.HttpServletRequest)
2024-09-06 22:28:35.775  INFO 27683 --- [           main] pertySourcedRequestMappingHandlerMapping : Mapped URL path [/v2/api-docs] onto method [public org.springframework.http.ResponseEntity<springfox.documentation.spring.web.json.Json> springfox.documentation.swagger2.web.Swagger2Controller.getDocumentation(java.lang.String,javax.servlet.http.HttpServletRequest)]
2024-09-06 22:28:35.872  INFO 27683 --- [           main] o.s.w.s.handler.SimpleUrlHandlerMapping  : Mapped URL path [/**/favicon.ico] onto handler of type [class org.springframework.web.servlet.resource.ResourceHttpRequestHandler]
2024-09-06 22:28:36.031  INFO 27683 --- [           main] s.w.s.m.m.a.RequestMappingHandlerAdapter : Looking for @ControllerAdvice: org.springframework.boot.web.servlet.context.AnnotationConfigServletWebServerApplicationContext@72af90e8: startup date [Fri Sep 06 22:28:33 BRT 2024]; root of context hierarchy
2024-09-06 22:28:36.105  INFO 27683 --- [           main] o.s.w.s.handler.SimpleUrlHandlerMapping  : Mapped URL path [/webjars/**] onto handler of type [class org.springframework.web.servlet.resource.ResourceHttpRequestHandler]
2024-09-06 22:28:36.105  INFO 27683 --- [           main] o.s.w.s.handler.SimpleUrlHandlerMapping  : Mapped URL path [/**] onto handler of type [class org.springframework.web.servlet.resource.ResourceHttpRequestHandler]
2024-09-06 22:28:36.333  INFO 27683 --- [           main] o.s.j.e.a.AnnotationMBeanExporter        : Registering beans for JMX exposure on startup
2024-09-06 22:28:36.346  INFO 27683 --- [           main] o.s.c.support.DefaultLifecycleProcessor  : Starting beans in phase 2147483647
2024-09-06 22:28:36.346  INFO 27683 --- [           main] d.s.w.p.DocumentationPluginsBootstrapper : Context refreshed
2024-09-06 22:28:36.376  INFO 27683 --- [           main] d.s.w.p.DocumentationPluginsBootstrapper : Found 1 custom documentation plugin(s)
2024-09-06 22:28:36.426  INFO 27683 --- [           main] s.d.s.w.s.ApiListingReferenceScanner     : Scanning for api listing references
2024-09-06 22:28:36.628  INFO 27683 --- [           main] o.s.b.w.embedded.tomcat.TomcatWebServer  : Tomcat started on port(s): 37685 (http) with context path ''
2024-09-06 22:28:36.634  INFO 27683 --- [           main] o.a.maven.surefire.booter.ForkedBooter   : Started ForkedBooter in 4.56 seconds (JVM running for 5.424)
2024-09-06 22:28:37.988  INFO 27683 --- [o-auto-1-exec-1] o.a.c.c.C.[Tomcat].[localhost].[/]       : Initializing Spring FrameworkServlet 'dispatcherServlet'
2024-09-06 22:28:37.988  INFO 27683 --- [o-auto-1-exec-1] o.s.web.servlet.DispatcherServlet        : FrameworkServlet 'dispatcherServlet': initialization started
2024-09-06 22:28:38.134  INFO 27683 --- [o-auto-1-exec-1] o.s.web.servlet.DispatcherServlet        : FrameworkServlet 'dispatcherServlet': initialization completed in 146 ms
Request method:	GET
Request URI:	http://localhost:37685/api/calc/add/1/2
Proxy:			<none>
Request params:	<none>
Query params:	<none>
Form params:	<none>
Path params:	op=add
				arg1=1
				arg2=2
Headers:		Accept=*/*
Cookies:		<none>
Multiparts:		<none>
Body:			<none>

HTTP/1.1 200 
Content-Type: text/plain;charset=UTF-8
Content-Length: 3
Date: Sat, 07 Sep 2024 01:28:38 GMT

0.0
Request method:	GET
Request URI:	http://localhost:37685/api/cookie/session/12345/example.com
Proxy:			<none>
Request params:	<none>
Query params:	<none>
Form params:	<none>
Path params:	name=session
				val=12345
				site=example.com
Headers:		Accept=*/*
Cookies:		<none>
Multiparts:		<none>
Body:			<none>

HTTP/1.1 200 
Content-Disposition: inline;filename=f.txt
Content-Type: text/plain;charset=UTF-8
Content-Length: 1
Date: Sat, 07 Sep 2024 01:28:38 GMT

2
Request method:	GET
Request URI:	http://localhost:37685/api/costfuns/1/test
Proxy:			<none>
Request params:	<none>
Query params:	<none>
Form params:	<none>
Path params:	i=1
				s=test
Headers:		Accept=*/*
Cookies:		<none>
Multiparts:		<none>
Body:			<none>

HTTP/1.1 200 
Content-Type: text/plain;charset=UTF-8
Content-Length: 2
Date: Sat, 07 Sep 2024 01:28:38 GMT

10
Request method:	GET
Request URI:	http://localhost:37685/api/dateparse/Monday/January
Proxy:			<none>
Request params:	<none>
Query params:	<none>
Form params:	<none>
Path params:	dayname=Monday
				monthname=January
Headers:		Accept=*/*
Cookies:		<none>
Multiparts:		<none>
Body:			<none>

HTTP/1.1 200 
Content-Type: text/plain;charset=UTF-8
Content-Length: 1
Date: Sat, 07 Sep 2024 01:28:38 GMT

0
Request method:	GET
Request URI:	http://localhost:37685/api/filesuffix/home/document.txt
Proxy:			<none>
Request params:	<none>
Query params:	<none>
Form params:	<none>
Path params:	directory=home
				file=document.txt
Headers:		Accept=*/*
Cookies:		<none>
Multiparts:		<none>
Body:			<none>

HTTP/1.1 200 
Content-Type: text/plain;charset=UTF-8
Content-Length: 1
Date: Sat, 07 Sep 2024 01:28:38 GMT

0
Request method:	GET
Request URI:	http://localhost:37685/api/notypevar/5/example
Proxy:			<none>
Request params:	<none>
Query params:	<none>
Form params:	<none>
Path params:	i=5
				s=example
Headers:		Accept=*/*
Cookies:		<none>
Multiparts:		<none>
Body:			<none>

HTTP/1.1 200 
Content-Type: text/plain;charset=UTF-8
Content-Length: 1
Date: Sat, 07 Sep 2024 01:28:38 GMT

0
Request method:	GET
Request URI:	http://localhost:37685/api/ordered4/one/two/four/three
Proxy:			<none>
Request params:	<none>
Query params:	<none>
Form params:	<none>
Path params:	w=one
				x=two
				y=three
				z=four
Headers:		Accept=*/*
Cookies:		<none>
Multiparts:		<none>
Body:			<none>

HTTP/1.1 200 
Content-Type: text/plain;charset=UTF-8
Content-Length: 9
Date: Sat, 07 Sep 2024 01:28:38 GMT

unordered
Request method:	GET
Request URI:	http://localhost:37685/api/title/male/Mr
Proxy:			<none>
Request params:	<none>
Query params:	<none>
Form params:	<none>
Path params:	sex=male
				title=Mr
Headers:		Accept=*/*
Cookies:		<none>
Multiparts:		<none>
Body:			<none>

HTTP/1.1 200 
Content-Type: text/plain;charset=UTF-8
Content-Length: 1
Date: Sat, 07 Sep 2024 01:28:38 GMT

1
2024-09-06 22:28:38.624  INFO 27683 --- [           main] o.s.c.support.DefaultLifecycleProcessor  : Stopping beans in phase 2147483647
[[1;31mERROR[m] [1;31mTests [0;1mrun: [0;1m11[m, [1;31mFailures: [0;1;31m8[m, [1;31mErrors: [0;1;31m2[m, Skipped: 0, Time elapsed: 6.981 s[1;31m <<< FAILURE![m - in org.restscs.[1mv1_gpt4o_run03_Text2TxtTest[m
[[1;31mERROR[m] testCalcUsingGET(org.restscs.v1_gpt4o_run03_Text2TxtTest)  Time elapsed: 1.407 s  <<< FAILURE!
java.lang.AssertionError: 
1 expectation failed.
Response body doesn't match expectation.
Expected: "3"
  Actual: 0.0

	at org.restscs.v1_gpt4o_run03_Text2TxtTest.testCalcUsingGET(v1_gpt4o_run03_Text2TxtTest.java:64)

[[1;31mERROR[m] testCookieUsingGET(org.restscs.v1_gpt4o_run03_Text2TxtTest)  Time elapsed: 0.054 s  <<< FAILURE!
java.lang.AssertionError: 
1 expectation failed.
Response body doesn't match expectation.
Expected: "session=12345; Domain=example.com; Path=/"
  Actual: 2

	at org.restscs.v1_gpt4o_run03_Text2TxtTest.testCookieUsingGET(v1_gpt4o_run03_Text2TxtTest.java:75)

[[1;31mERROR[m] testCostfunsUsingGET(org.restscs.v1_gpt4o_run03_Text2TxtTest)  Time elapsed: 0.025 s  <<< FAILURE!
java.lang.AssertionError: 
1 expectation failed.
Response body doesn't match expectation.
Expected: "Cost function result"
  Actual: 10

	at org.restscs.v1_gpt4o_run03_Text2TxtTest.testCostfunsUsingGET(v1_gpt4o_run03_Text2TxtTest.java:85)

[[1;31mERROR[m] testDateParseUsingGET(org.restscs.v1_gpt4o_run03_Text2TxtTest)  Time elapsed: 0.022 s  <<< FAILURE!
java.lang.AssertionError: 
1 expectation failed.
Response body doesn't match expectation.
Expected: "Parsed Date"
  Actual: 0

	at org.restscs.v1_gpt4o_run03_Text2TxtTest.testDateParseUsingGET(v1_gpt4o_run03_Text2TxtTest.java:95)

[[1;31mERROR[m] testFileSuffixUsingGET(org.restscs.v1_gpt4o_run03_Text2TxtTest)  Time elapsed: 0.018 s  <<< FAILURE!
java.lang.AssertionError: 
1 expectation failed.
Response body doesn't match expectation.
Expected: "txt"
  Actual: 0

	at org.restscs.v1_gpt4o_run03_Text2TxtTest.testFileSuffixUsingGET(v1_gpt4o_run03_Text2TxtTest.java:105)

[[1;31mERROR[m] testNotyPevarUsingGET(org.restscs.v1_gpt4o_run03_Text2TxtTest)  Time elapsed: 0.019 s  <<< FAILURE!
java.lang.AssertionError: 
1 expectation failed.
Response body doesn't match expectation.
Expected: "Processed notypevar"
  Actual: 0

	at org.restscs.v1_gpt4o_run03_Text2TxtTest.testNotyPevarUsingGET(v1_gpt4o_run03_Text2TxtTest.java:115)

[[1;31mERROR[m] testOrdered4UsingGET(org.restscs.v1_gpt4o_run03_Text2TxtTest)  Time elapsed: 0.022 s  <<< FAILURE!
java.lang.AssertionError: 
1 expectation failed.
Response body doesn't match expectation.
Expected: "Ordered result"
  Actual: unordered

	at org.restscs.v1_gpt4o_run03_Text2TxtTest.testOrdered4UsingGET(v1_gpt4o_run03_Text2TxtTest.java:127)

[[1;31mERROR[m] testRegexUsingGET(org.restscs.v1_gpt4o_run03_Text2TxtTest)  Time elapsed: 0.004 s  <<< ERROR!
java.net.URISyntaxException: Illegal character in path at index 38: http://localhost:37685/api/pat/example text
	at org.restscs.v1_gpt4o_run03_Text2TxtTest.testRegexUsingGET(v1_gpt4o_run03_Text2TxtTest.java:134)

[[1;31mERROR[m] testPatUsingGET(org.restscs.v1_gpt4o_run03_Text2TxtTest)  Time elapsed: 0.003 s  <<< ERROR!
java.net.URISyntaxException: Illegal character in path at index 38: http://localhost:37685/api/pat/example text/^example
	at org.restscs.v1_gpt4o_run03_Text2TxtTest.testPatUsingGET(v1_gpt4o_run03_Text2TxtTest.java:144)

[[1;31mERROR[m] testTitleUsingGET(org.restscs.v1_gpt4o_run03_Text2TxtTest)  Time elapsed: 0.02 s  <<< FAILURE!
java.lang.AssertionError: 
1 expectation failed.
Response body doesn't match expectation.
Expected: "Title processed"
  Actual: 1

	at org.restscs.v1_gpt4o_run03_Text2TxtTest.testTitleUsingGET(v1_gpt4o_run03_Text2TxtTest.java:167)

2024-09-06 22:28:38.657  INFO 27683 --- [       Thread-4] ConfigServletWebServerApplicationContext : Closing org.springframework.boot.web.servlet.context.AnnotationConfigServletWebServerApplicationContext@72af90e8: startup date [Fri Sep 06 22:28:33 BRT 2024]; root of context hierarchy
2024-09-06 22:28:38.661  INFO 27683 --- [       Thread-4] o.s.c.support.DefaultLifecycleProcessor  : Stopping beans in phase 2147483647
2024-09-06 22:28:38.661  INFO 27683 --- [       Thread-4] o.s.j.e.a.AnnotationMBeanExporter        : Unregistering JMX-exposed beans on shutdown
[[1;34mINFO[m] 
[[1;34mINFO[m] Results:
[[1;34mINFO[m] 
[[1;31mERROR[m] [1;31mFailures: [m
[[1;31mERROR[m] [1;31m  v1_gpt4o_run03_Text2TxtTest.testCalcUsingGET:64 1 expectation failed.
Response body doesn't match expectation.
Expected: "3"
  Actual: 0.0
[m
[[1;31mERROR[m] [1;31m  v1_gpt4o_run03_Text2TxtTest.testCookieUsingGET:75 1 expectation failed.
Response body doesn't match expectation.
Expected: "session=12345; Domain=example.com; Path=/"
  Actual: 2
[m
[[1;31mERROR[m] [1;31m  v1_gpt4o_run03_Text2TxtTest.testCostfunsUsingGET:85 1 expectation failed.
Response body doesn't match expectation.
Expected: "Cost function result"
  Actual: 10
[m
[[1;31mERROR[m] [1;31m  v1_gpt4o_run03_Text2TxtTest.testDateParseUsingGET:95 1 expectation failed.
Response body doesn't match expectation.
Expected: "Parsed Date"
  Actual: 0
[m
[[1;31mERROR[m] [1;31m  v1_gpt4o_run03_Text2TxtTest.testFileSuffixUsingGET:105 1 expectation failed.
Response body doesn't match expectation.
Expected: "txt"
  Actual: 0
[m
[[1;31mERROR[m] [1;31m  v1_gpt4o_run03_Text2TxtTest.testNotyPevarUsingGET:115 1 expectation failed.
Response body doesn't match expectation.
Expected: "Processed notypevar"
  Actual: 0
[m
[[1;31mERROR[m] [1;31m  v1_gpt4o_run03_Text2TxtTest.testOrdered4UsingGET:127 1 expectation failed.
Response body doesn't match expectation.
Expected: "Ordered result"
  Actual: unordered
[m
[[1;31mERROR[m] [1;31m  v1_gpt4o_run03_Text2TxtTest.testTitleUsingGET:167 1 expectation failed.
Response body doesn't match expectation.
Expected: "Title processed"
  Actual: 1
[m
[[1;31mERROR[m] [1;31mErrors: [m
[[1;31mERROR[m] [1;31m  v1_gpt4o_run03_Text2TxtTest.testPatUsingGET:144 » URISyntax Illegal character ...[m
[[1;31mERROR[m] [1;31m  v1_gpt4o_run03_Text2TxtTest.testRegexUsingGET:134 » URISyntax Illegal characte...[m
[[1;34mINFO[m] 
[[1;31mERROR[m] [1;31mTests run: 11, Failures: 8, Errors: 2, Skipped: 0[m
[[1;34mINFO[m] 
[[1;34mINFO[m] [1m------------------------------------------------------------------------[m
[[1;34mINFO[m] [1;31mBUILD FAILURE[m
[[1;34mINFO[m] [1m------------------------------------------------------------------------[m
[[1;34mINFO[m] Total time:  10.503 s
[[1;34mINFO[m] Finished at: 2024-09-06T22:28:39-03:00
[[1;34mINFO[m] [1m------------------------------------------------------------------------[m
[[1;31mERROR[m] Failed to execute goal [32morg.apache.maven.plugins:maven-surefire-plugin:2.22.0:test[m [1m(default-test)[m on project [36mevomaster-benchmark-cs-rest-artificial-scs[m: [1;31mThere are test failures.[m
[[1;31mERROR[m] [1;31m[m
[[1;31mERROR[m] [1;31mPlease refer to /media/rincon/63999417195/eclipse-workspace/EMB-master/jdk_8_maven/cs/rest/artificial/scs/target/surefire-reports for the individual test results.[m
[[1;31mERROR[m] [1;31mPlease refer to dump files (if any exist) [date]-jvmRun[N].dump, [date].dumpstream and [date]-jvmRun[N].dumpstream.[m
[[1;31mERROR[m] -> [1m[Help 1][m
[[1;31mERROR[m] 
[[1;31mERROR[m] To see the full stack trace of the errors, re-run Maven with the [1m-e[m switch.
[[1;31mERROR[m] Re-run Maven using the [1m-X[m switch to enable full debug logging.
[[1;31mERROR[m] 
[[1;31mERROR[m] For more information about the errors and possible solutions, please read the following articles:
[[1;31mERROR[m] [1m[Help 1][m http://cwiki.apache.org/confluence/display/MAVEN/MojoFailureException

#####
