[[1;34mINFO[m] Scanning for projects...
[[1;34mINFO[m] 
[[1;34mINFO[m] [1m---------------------< [0;36mnet.lukyanets:market-rest[0;1m >----------------------[m
[[1;34mINFO[m] [1mBuilding market-rest 0.1.2[m
[[1;34mINFO[m] [1m--------------------------------[ jar ]---------------------------------[m
[[1;33mWARNING[m] The POM for com.sun.xml.bind:jaxb-osgi:jar:2.2.10 is invalid, transitive dependencies (if any) will not be available, enable debug logging for more details
[[1;34mINFO[m] 
[[1;34mINFO[m] [1m--- [0;32mmaven-clean-plugin:2.5:clean[m [1m(default-clean)[m @ [36mmarket-rest[0;1m ---[m
[[1;34mINFO[m] Deleting /media/rincon/63999417195/eclipse-workspace/EMB-master/jdk_11_maven/cs/rest-gui/market/market-rest/target
[[1;34mINFO[m] 
[[1;34mINFO[m] [1m--- [0;32mjacoco-maven-plugin:0.8.7:prepare-agent[m [1m(default)[m @ [36mmarket-rest[0;1m ---[m
[[1;34mINFO[m] argLine set to -javaagent:/home/rincon/.m2/repository/org/jacoco/org.jacoco.agent/0.8.7/org.jacoco.agent-0.8.7-runtime.jar=destfile=/media/rincon/63999417195/eclipse-workspace/EMB-master/jdk_11_maven/cs/rest-gui/market/market-rest/target/jacoco.exec
[[1;34mINFO[m] 
[[1;34mINFO[m] [1m--- [0;32mspring-boot-maven-plugin:2.4.3:build-info[m [1m(default)[m @ [36mmarket-rest[0;1m ---[m
[[1;34mINFO[m] 
[[1;34mINFO[m] [1m--- [0;32mmaven-resources-plugin:2.6:resources[m [1m(default-resources)[m @ [36mmarket-rest[0;1m ---[m
[[1;34mINFO[m] Using 'UTF-8' encoding to copy filtered resources.
[[1;34mINFO[m] Copying 3 resources
[[1;34mINFO[m] 
[[1;34mINFO[m] [1m--- [0;32mmaven-compiler-plugin:3.8.0:compile[m [1m(default-compile)[m @ [36mmarket-rest[0;1m ---[m
[[1;34mINFO[m] Changes detected - recompiling the module!
[[1;34mINFO[m] Compiling 11 source files to /media/rincon/63999417195/eclipse-workspace/EMB-master/jdk_11_maven/cs/rest-gui/market/market-rest/target/classes
[[1;34mINFO[m] 
[[1;34mINFO[m] [1m--- [0;32mjacoco-maven-plugin:0.8.7:prepare-agent[m [1m(default)[m @ [36mmarket-rest[0;1m ---[m
[[1;34mINFO[m] argLine set to -javaagent:/home/rincon/.m2/repository/org/jacoco/org.jacoco.agent/0.8.7/org.jacoco.agent-0.8.7-runtime.jar=destfile=/media/rincon/63999417195/eclipse-workspace/EMB-master/jdk_11_maven/cs/rest-gui/market/market-rest/target/jacoco.exec
[[1;34mINFO[m] 
[[1;34mINFO[m] [1m--- [0;32mspring-boot-maven-plugin:2.4.3:build-info[m [1m(default)[m @ [36mmarket-rest[0;1m ---[m
[[1;34mINFO[m] 
[[1;34mINFO[m] [1m--- [0;32mmaven-resources-plugin:2.6:resources[m [1m(default-resources)[m @ [36mmarket-rest[0;1m ---[m
[[1;34mINFO[m] Using 'UTF-8' encoding to copy filtered resources.
[[1;34mINFO[m] Copying 3 resources
[[1;34mINFO[m] 
[[1;34mINFO[m] [1m--- [0;32mmaven-compiler-plugin:3.8.0:compile[m [1m(default-compile)[m @ [36mmarket-rest[0;1m ---[m
[[1;34mINFO[m] Nothing to compile - all classes are up to date
[[1;34mINFO[m] 
[[1;34mINFO[m] [1m--- [0;32mmaven-resources-plugin:2.6:testResources[m [1m(default-testResources)[m @ [36mmarket-rest[0;1m ---[m
[[1;34mINFO[m] Using 'UTF-8' encoding to copy filtered resources.
[[1;34mINFO[m] skip non existing resourceDirectory /media/rincon/63999417195/eclipse-workspace/EMB-master/jdk_11_maven/cs/rest-gui/market/market-rest/src/test/resources
[[1;34mINFO[m] 
[[1;34mINFO[m] [1m--- [0;32mmaven-compiler-plugin:3.8.0:testCompile[m [1m(default-testCompile)[m @ [36mmarket-rest[0;1m ---[m
[[1;34mINFO[m] Changes detected - recompiling the module!
[[1;34mINFO[m] Compiling 1 source file to /media/rincon/63999417195/eclipse-workspace/EMB-master/jdk_11_maven/cs/rest-gui/market/market-rest/target/test-classes
[[1;34mINFO[m] 
[[1;34mINFO[m] [1m--- [0;32mjacoco-maven-plugin:0.8.7:prepare-agent[m [1m(default)[m @ [36mmarket-rest[0;1m ---[m
[[1;34mINFO[m] argLine set to -javaagent:/home/rincon/.m2/repository/org/jacoco/org.jacoco.agent/0.8.7/org.jacoco.agent-0.8.7-runtime.jar=destfile=/media/rincon/63999417195/eclipse-workspace/EMB-master/jdk_11_maven/cs/rest-gui/market/market-rest/target/jacoco.exec
[[1;34mINFO[m] 
[[1;34mINFO[m] [1m--- [0;32mspring-boot-maven-plugin:2.4.3:build-info[m [1m(default)[m @ [36mmarket-rest[0;1m ---[m
[[1;34mINFO[m] 
[[1;34mINFO[m] [1m--- [0;32mmaven-resources-plugin:2.6:resources[m [1m(default-resources)[m @ [36mmarket-rest[0;1m ---[m
[[1;34mINFO[m] Using 'UTF-8' encoding to copy filtered resources.
[[1;34mINFO[m] Copying 3 resources
[[1;34mINFO[m] 
[[1;34mINFO[m] [1m--- [0;32mmaven-compiler-plugin:3.8.0:compile[m [1m(default-compile)[m @ [36mmarket-rest[0;1m ---[m
[[1;34mINFO[m] Nothing to compile - all classes are up to date
[[1;34mINFO[m] 
[[1;34mINFO[m] [1m--- [0;32mmaven-resources-plugin:2.6:testResources[m [1m(default-testResources)[m @ [36mmarket-rest[0;1m ---[m
[[1;34mINFO[m] Using 'UTF-8' encoding to copy filtered resources.
[[1;34mINFO[m] skip non existing resourceDirectory /media/rincon/63999417195/eclipse-workspace/EMB-master/jdk_11_maven/cs/rest-gui/market/market-rest/src/test/resources
[[1;34mINFO[m] 
[[1;34mINFO[m] [1m--- [0;32mmaven-compiler-plugin:3.8.0:testCompile[m [1m(default-testCompile)[m @ [36mmarket-rest[0;1m ---[m
[[1;34mINFO[m] Nothing to compile - all classes are up to date
[[1;34mINFO[m] 
[[1;34mINFO[m] [1m--- [0;32mmaven-surefire-plugin:2.22.0:test[m [1m(default-test)[m @ [36mmarket-rest[0;1m ---[m
[[1;34mINFO[m] 
[[1;34mINFO[m] -------------------------------------------------------
[[1;34mINFO[m]  T E S T S
[[1;34mINFO[m] -------------------------------------------------------
[[1;34mINFO[m] Running market.[1mrun01_ContactsRestControllerTest[m

  .   ____          _            __ _ _
 /\\ / ___'_ __ _ _(_)_ __  __ _ \ \ \ \
( ( )\___ | '_ | '_| | '_ \/ _` | \ \ \ \
 \\/  ___)| |_)| | | | | || (_| |  ) ) ) )
  '  |____| .__|_| |_|_| |_\__, | / / / /
 =========|_|==============|___/=/_/_/_/
 :: Spring Boot ::                (v2.4.3)

2024-08-23 12:20:17,304 INFO  [background-preinit] o.h.v.i.u.Version - HV000001: Hibernate Validator 6.1.7.Final
2024-08-23 12:20:17,419 INFO  [main] o.a.m.s.b.ForkedBooter - Starting ForkedBooter v2.22.0 using Java 11.0.20 on IFTO-PROBOOK with PID 12934 (started by rincon in /media/rincon/63999417195/eclipse-workspace/EMB-master/jdk_11_maven/cs/rest-gui/market/market-rest)
2024-08-23 12:20:17,427 INFO  [main] o.a.m.s.b.ForkedBooter - No active profile set, falling back to default profiles: default
2024-08-23 12:20:18,053 WARN  [main] o.s.b.c.c.ConfigDataEnvironment - Property 'spring.profiles' imported from location 'class path resource [application.yml]' is invalid and should be replaced with 'spring.config.activate.on-profile' [origin: class path resource [application.yml] - 34:13]
2024-08-23 12:20:18,053 WARN  [main] o.s.b.c.c.ConfigDataEnvironment - Property 'spring.profiles' imported from location 'class path resource [application.yml]' is invalid and should be replaced with 'spring.config.activate.on-profile' [origin: class path resource [application.yml] - 24:13]
2024-08-23 12:20:19,664 INFO  [main] o.s.d.r.c.RepositoryConfigurationDelegate - Bootstrapping Spring Data JPA repositories in DEFAULT mode.
2024-08-23 12:20:19,794 INFO  [main] o.s.d.r.c.RepositoryConfigurationDelegate - Finished Spring Data repository scanning in 118 ms. Found 8 JPA repository interfaces.
2024-08-23 12:20:20,325 INFO  [main] o.s.c.s.PostProcessorRegistrationDelegate$BeanPostProcessorChecker - Bean 'market.DataConfig' of type [market.DataConfig$$EnhancerBySpringCGLIB$$3e1a1608] is not eligible for getting processed by all BeanPostProcessors (for example: not eligible for auto-proxying)
2024-08-23 12:20:20,544 INFO  [main] o.s.c.s.PostProcessorRegistrationDelegate$BeanPostProcessorChecker - Bean 'org.springframework.security.access.expression.method.DefaultMethodSecurityExpressionHandler@42a1fbbe' of type [org.springframework.security.access.expression.method.DefaultMethodSecurityExpressionHandler] is not eligible for getting processed by all BeanPostProcessors (for example: not eligible for auto-proxying)
2024-08-23 12:20:20,554 INFO  [main] o.s.c.s.PostProcessorRegistrationDelegate$BeanPostProcessorChecker - Bean 'methodSecurityMetadataSource' of type [org.springframework.security.access.method.DelegatingMethodSecurityMetadataSource] is not eligible for getting processed by all BeanPostProcessors (for example: not eligible for auto-proxying)
2024-08-23 12:20:21,089 INFO  [main] o.s.b.w.e.t.TomcatWebServer - Tomcat initialized with port(s): 0 (http)
2024-08-23 12:20:21,113 INFO  [main] o.a.c.h.Http11NioProtocol - Initializing ProtocolHandler ["http-nio-auto-1"]
2024-08-23 12:20:21,114 INFO  [main] o.a.c.c.StandardService - Starting service [Tomcat]
2024-08-23 12:20:21,114 INFO  [main] o.a.c.c.StandardEngine - Starting Servlet engine: [Apache Tomcat/9.0.43]
2024-08-23 12:20:21,271 INFO  [main] o.a.c.c.C.[.[.[/] - Initializing Spring embedded WebApplicationContext
2024-08-23 12:20:21,272 INFO  [main] o.s.b.w.s.c.ServletWebServerApplicationContext - Root WebApplicationContext: initialization completed in 3214 ms
2024-08-23 12:20:21,475 INFO  [main] c.z.h.HikariDataSource - HikariPool-1 - Starting...
2024-08-23 12:20:21,955 INFO  [main] c.z.h.HikariDataSource - HikariPool-1 - Start completed.
2024-08-23 12:20:22,165 INFO  [main] o.h.j.i.u.LogHelper - HHH000204: Processing PersistenceUnitInfo [name: default]
2024-08-23 12:20:22,248 INFO  [main] o.h.Version - HHH000412: Hibernate ORM core version 5.4.28.Final
2024-08-23 12:20:22,463 INFO  [main] o.h.a.c.Version - HCANN000001: Hibernate Commons Annotations {5.1.2.Final}
2024-08-23 12:20:22,773 INFO  [main] o.h.d.Dialect - HHH000400: Using dialect: org.hibernate.dialect.H2Dialect
2024-08-23 12:20:23,137 WARN  [main] o.h.b.i.InFlightMetadataCollectorImpl - HHH000069: Duplicate generator name gen
2024-08-23 12:20:23,140 WARN  [main] o.h.b.i.InFlightMetadataCollectorImpl - HHH000069: Duplicate generator name gen
2024-08-23 12:20:24,043 INFO  [main] o.h.e.t.j.p.i.JtaPlatformInitiator - HHH000490: Using JtaPlatform implementation: [org.hibernate.engine.transaction.jta.platform.internal.NoJtaPlatform]
2024-08-23 12:20:24,055 INFO  [main] o.s.o.j.LocalContainerEntityManagerFactoryBean - Initialized JPA EntityManagerFactory for persistence unit 'default'
2024-08-23 12:20:25,196 WARN  [main] o.s.b.a.o.j.JpaBaseConfiguration$JpaWebConfiguration - spring.jpa.open-in-view is enabled by default. Therefore, database queries may be performed during view rendering. Explicitly configure spring.jpa.open-in-view to disable this warning
2024-08-23 12:20:26,310 INFO  [main] o.s.s.w.DefaultSecurityFilterChain - Will secure any request with [org.springframework.security.web.context.request.async.WebAsyncManagerIntegrationFilter@581c4ae2, org.springframework.security.web.context.SecurityContextPersistenceFilter@39877d2e, org.springframework.security.web.header.HeaderWriterFilter@2fccce14, org.springframework.security.web.authentication.logout.LogoutFilter@49a4e2f7, org.springframework.security.web.authentication.www.BasicAuthenticationFilter@213a24ac, org.springframework.security.web.savedrequest.RequestCacheAwareFilter@2b6fbca5, org.springframework.security.web.servletapi.SecurityContextHolderAwareRequestFilter@6951d19d, org.springframework.security.web.authentication.AnonymousAuthenticationFilter@5dd03c5e, org.springframework.security.web.session.SessionManagementFilter@60e0c160, org.springframework.security.web.access.ExceptionTranslationFilter@7073a667, org.springframework.security.web.access.intercept.FilterSecurityInterceptor@650688e0]
2024-08-23 12:20:26,484 INFO  [main] o.s.s.c.ThreadPoolTaskExecutor - Initializing ExecutorService 'applicationTaskExecutor'
2024-08-23 12:20:26,977 INFO  [main] o.a.c.h.Http11NioProtocol - Starting ProtocolHandler ["http-nio-auto-1"]
2024-08-23 12:20:27,009 INFO  [main] o.s.b.w.e.t.TomcatWebServer - Tomcat started on port(s): 35355 (http) with context path ''
2024-08-23 12:20:27,657 INFO  [main] o.a.m.s.b.ForkedBooter - Started ForkedBooter in 11.126 seconds (JVM running for 13.415)
2024-08-23 12:20:29,730 INFO  [http-nio-auto-1-exec-1] o.a.c.c.C.[.[.[/] - Initializing Spring DispatcherServlet 'dispatcherServlet'
2024-08-23 12:20:29,730 INFO  [http-nio-auto-1-exec-1] o.s.w.s.DispatcherServlet - Initializing Servlet 'dispatcherServlet'
2024-08-23 12:20:29,732 INFO  [http-nio-auto-1-exec-1] o.s.w.s.DispatcherServlet - Completed initialization in 2 ms
2024-08-23 12:20:29,977 WARN  [http-nio-auto-1-exec-1] m.r.e.RestExceptionHandler - RestErrorResponse{message='Argument validation error', entityName='contactsDTO', description='uri=/customer/contacts', fieldErrors=[{field='address', message='Pattern.contactsDTO.address'}, {field='phone', message='Shall consist of a + sign, a country code, a region code (1-4 digits), and a number (6-7 digits)'}]}
Request method:	PUT
Request URI:	http://localhost:35355/customer/contacts
Proxy:			<none>
Request params:	<none>
Query params:	<none>
Form params:	<none>
Path params:	<none>
Headers:		Accept=*/*
				Content-Type=application/json; charset=UTF-8
Cookies:		<none>
Multiparts:		<none>
Body:
{
    "address": "Invalid#Address",
    "phone": "InvalidPhoneNumber"
}

HTTP/1.1 406 
X-Content-Type-Options: nosniff
X-XSS-Protection: 1; mode=block
Cache-Control: no-cache, no-store, max-age=0, must-revalidate
Pragma: no-cache
Expires: 0
Content-Type: application/json
Transfer-Encoding: chunked
Date: Fri, 23 Aug 2024 15:20:30 GMT
Keep-Alive: timeout=60
Connection: keep-alive

{
    "message": "Argument validation error",
    "description": "uri=/customer/contacts",
    "entityName": "contactsDTO",
    "fieldErrors": [
        {
            "field": "address",
            "message": "Pattern.contactsDTO.address"
        },
        {
            "field": "phone",
            "message": "Shall consist of a + sign, a country code, a region code (1-4 digits), and a number (6-7 digits)"
        }
    ]
}
2024-08-23 12:20:30,224 WARN  [http-nio-auto-1-exec-2] m.r.e.RestExceptionHandler - RestErrorResponse{message='Acesso negado', entityName='null', description='uri=/customer/contacts', fieldErrors=[]}
Request method:	GET
Request URI:	http://localhost:35355/customer/contacts
Proxy:			<none>
Request params:	<none>
Query params:	<none>
Form params:	<none>
Path params:	<none>
Headers:		Accept=*/*
Cookies:		<none>
Multiparts:		<none>
Body:			<none>

HTTP/1.1 401 
X-Content-Type-Options: nosniff
X-XSS-Protection: 1; mode=block
Cache-Control: no-cache, no-store, max-age=0, must-revalidate
Pragma: no-cache
Expires: 0
Content-Type: application/json
Transfer-Encoding: chunked
Date: Fri, 23 Aug 2024 15:20:30 GMT
Keep-Alive: timeout=60
Connection: keep-alive

{
    "message": "Acesso negado",
    "description": "uri=/customer/contacts",
    "entityName": null,
    "fieldErrors": [
        
    ]
}
2024-08-23 12:20:30,274 WARN  [http-nio-auto-1-exec-3] m.r.e.RestExceptionHandler - RestErrorResponse{message='Acesso negado', entityName='null', description='uri=/customer/contacts', fieldErrors=[]}
Request method:	PUT
Request URI:	http://localhost:35355/customer/contacts
Proxy:			<none>
Request params:	<none>
Query params:	<none>
Form params:	<none>
Path params:	<none>
Headers:		Accept=*/*
				Content-Type=application/json; charset=UTF-8
Cookies:		<none>
Multiparts:		<none>
Body:
{
    "address": "New Address",
    "phone": "+7 123 456 78 90"
}

HTTP/1.1 401 
X-Content-Type-Options: nosniff
X-XSS-Protection: 1; mode=block
Cache-Control: no-cache, no-store, max-age=0, must-revalidate
Pragma: no-cache
Expires: 0
Content-Type: application/json
Transfer-Encoding: chunked
Date: Fri, 23 Aug 2024 15:20:30 GMT
Keep-Alive: timeout=60
Connection: keep-alive

{
    "message": "Acesso negado",
    "description": "uri=/customer/contacts",
    "entityName": null,
    "fieldErrors": [
        
    ]
}
2024-08-23 12:20:30,310 WARN  [http-nio-auto-1-exec-4] m.r.e.RestExceptionHandler - RestErrorResponse{message='Acesso negado', entityName='null', description='uri=/customer/contacts', fieldErrors=[]}
Request method:	GET
Request URI:	http://localhost:35355/customer/contacts
Proxy:			<none>
Request params:	<none>
Query params:	<none>
Form params:	<none>
Path params:	<none>
Headers:		Accept=*/*
Cookies:		<none>
Multiparts:		<none>
Body:			<none>

HTTP/1.1 401 
X-Content-Type-Options: nosniff
X-XSS-Protection: 1; mode=block
Cache-Control: no-cache, no-store, max-age=0, must-revalidate
Pragma: no-cache
Expires: 0
Content-Type: application/json
Transfer-Encoding: chunked
Date: Fri, 23 Aug 2024 15:20:30 GMT
Keep-Alive: timeout=60
Connection: keep-alive

{
    "message": "Acesso negado",
    "description": "uri=/customer/contacts",
    "entityName": null,
    "fieldErrors": [
        
    ]
}
2024-08-23 12:20:30,342 WARN  [http-nio-auto-1-exec-5] m.r.e.RestExceptionHandler - RestErrorResponse{message='Acesso negado', entityName='null', description='uri=/customer/contacts', fieldErrors=[]}
2024-08-23 12:20:30,381 WARN  [http-nio-auto-1-exec-6] m.r.e.RestExceptionHandler - RestErrorResponse{message='Acesso negado', entityName='null', description='uri=/customer/contacts', fieldErrors=[]}
2024-08-23 12:20:30,408 INFO  [main] o.a.c.h.Http11NioProtocol - Pausing ProtocolHandler ["http-nio-auto-1"]
2024-08-23 12:20:30,408 INFO  [main] o.a.c.c.StandardService - Stopping service [Tomcat]
2024-08-23 12:20:30,410 INFO  [main] o.a.c.c.C.[.[.[/] - Destroying Spring FrameworkServlet 'dispatcherServlet'
2024-08-23 12:20:30,414 INFO  [main] o.a.c.h.Http11NioProtocol - Stopping ProtocolHandler ["http-nio-auto-1"]
2024-08-23 12:20:30,418 INFO  [main] o.a.c.h.Http11NioProtocol - Destroying ProtocolHandler ["http-nio-auto-1"]
[[1;31mERROR[m] [1;31mTests [0;1mrun: [0;1m8[m, [1;31mFailures: [0;1;31m4[m, [1;31mErrors: [0;1;31m2[m, Skipped: 0, Time elapsed: 15.214 s[1;31m <<< FAILURE![m - in market.[1mrun01_ContactsRestControllerTest[m
[[1;31mERROR[m] testUpdateContactsInvalidData  Time elapsed: 1.759 s  <<< FAILURE!
java.lang.AssertionError: 
1 expectation failed.
Expected status code <400> but was <406>.

	at market.run01_ContactsRestControllerTest.testUpdateContactsInvalidData(run01_ContactsRestControllerTest.java:135)

[[1;31mERROR[m] testGetContactsNotFound  Time elapsed: 0.055 s  <<< FAILURE!
java.lang.AssertionError: 
1 expectation failed.
Expected status code <404> but was <401>.

	at market.run01_ContactsRestControllerTest.testGetContactsNotFound(run01_ContactsRestControllerTest.java:88)

[[1;31mERROR[m] testUpdateContactsValidData  Time elapsed: 0.048 s  <<< FAILURE!
java.lang.AssertionError: 
1 expectation failed.
Expected status code <200> but was <401>.

	at market.run01_ContactsRestControllerTest.testUpdateContactsValidData(run01_ContactsRestControllerTest.java:151)

[[1;31mERROR[m] testGetContactsForbidden  Time elapsed: 0.037 s  <<< FAILURE!
java.lang.AssertionError: 
1 expectation failed.
Expected status code <403> but was <401>.

	at market.run01_ContactsRestControllerTest.testGetContactsForbidden(run01_ContactsRestControllerTest.java:78)

[[1;31mERROR[m] testUpdateContactsInternalServerError  Time elapsed: 0.052 s  <<< ERROR!
java.net.ConnectException: Conexão recusada (Connection refused)
	at market.run01_ContactsRestControllerTest.testUpdateContactsInternalServerError(run01_ContactsRestControllerTest.java:170)

[[1;31mERROR[m] testUpdateContactsForbidden  Time elapsed: 0.049 s  <<< ERROR!
java.net.ConnectException: Conexão recusada (Connection refused)
	at market.run01_ContactsRestControllerTest.testUpdateContactsForbidden(run01_ContactsRestControllerTest.java:117)

2024-08-23 12:20:30,545 INFO  [SpringContextShutdownHook] o.s.s.c.ThreadPoolTaskExecutor - Shutting down ExecutorService 'applicationTaskExecutor'
2024-08-23 12:20:30,559 INFO  [SpringContextShutdownHook] o.s.o.j.LocalContainerEntityManagerFactoryBean - Closing JPA EntityManagerFactory for persistence unit 'default'
2024-08-23 12:20:30,561 INFO  [SpringContextShutdownHook] c.z.h.HikariDataSource - HikariPool-1 - Shutdown initiated...
2024-08-23 12:20:30,564 INFO  [SpringContextShutdownHook] c.z.h.HikariDataSource - HikariPool-1 - Shutdown completed.
[[1;34mINFO[m] 
[[1;34mINFO[m] Results:
[[1;34mINFO[m] 
[[1;31mERROR[m] [1;31mFailures: [m
[[1;31mERROR[m] [1;31m  run01_ContactsRestControllerTest.testGetContactsForbidden:78 1 expectation failed.
Expected status code <403> but was <401>.
[m
[[1;31mERROR[m] [1;31m  run01_ContactsRestControllerTest.testGetContactsNotFound:88 1 expectation failed.
Expected status code <404> but was <401>.
[m
[[1;31mERROR[m] [1;31m  run01_ContactsRestControllerTest.testUpdateContactsInvalidData:135 1 expectation failed.
Expected status code <400> but was <406>.
[m
[[1;31mERROR[m] [1;31m  run01_ContactsRestControllerTest.testUpdateContactsValidData:151 1 expectation failed.
Expected status code <200> but was <401>.
[m
[[1;31mERROR[m] [1;31mErrors: [m
[[1;31mERROR[m] [1;31m  run01_ContactsRestControllerTest.testUpdateContactsForbidden:117 » Connect Con...[m
[[1;31mERROR[m] [1;31m  run01_ContactsRestControllerTest.testUpdateContactsInternalServerError:170 » Connect[m
[[1;34mINFO[m] 
[[1;31mERROR[m] [1;31mTests run: 8, Failures: 4, Errors: 2, Skipped: 0[m
[[1;34mINFO[m] 
[[1;34mINFO[m] [1m------------------------------------------------------------------------[m
[[1;34mINFO[m] [1;31mBUILD FAILURE[m
[[1;34mINFO[m] [1m------------------------------------------------------------------------[m
[[1;34mINFO[m] Total time:  20.501 s
[[1;34mINFO[m] Finished at: 2024-08-23T12:20:31-03:00
[[1;34mINFO[m] [1m------------------------------------------------------------------------[m
[[1;31mERROR[m] Failed to execute goal [32morg.apache.maven.plugins:maven-surefire-plugin:2.22.0:test[m [1m(default-test)[m on project [36mmarket-rest[m: [1;31mThere are test failures.[m
[[1;31mERROR[m] [1;31m[m
[[1;31mERROR[m] [1;31mPlease refer to /media/rincon/63999417195/eclipse-workspace/EMB-master/jdk_11_maven/cs/rest-gui/market/market-rest/target/surefire-reports for the individual test results.[m
[[1;31mERROR[m] [1;31mPlease refer to dump files (if any exist) [date]-jvmRun[N].dump, [date].dumpstream and [date]-jvmRun[N].dumpstream.[m
[[1;31mERROR[m] -> [1m[Help 1][m
[[1;31mERROR[m] 
[[1;31mERROR[m] To see the full stack trace of the errors, re-run Maven with the [1m-e[m switch.
[[1;31mERROR[m] Re-run Maven using the [1m-X[m switch to enable full debug logging.
[[1;31mERROR[m] 
[[1;31mERROR[m] For more information about the errors and possible solutions, please read the following articles:
[[1;31mERROR[m] [1m[Help 1][m http://cwiki.apache.org/confluence/display/MAVEN/MojoFailureException
