Correct the test code delimited by ***** according to the error messages delimited by ##### and generate another complete code in JUnit 5 format. The response must contain only Java code in JUnit 5 format.

Keep these five instructions for this generated test code:

Instruction 1: Keet this package line to generated test code file:
package market;

Instruction 2: Keep the following Java imports to generated test code file:
import  org.junit.jupiter.api.AfterAll;
import  org.junit.jupiter.api.BeforeAll;
import  org.junit.jupiter.api.BeforeEach;
import  org.junit.jupiter.api.Test;
import  org.junit.jupiter.api.Timeout;
import static org.junit.jupiter.api.Assertions.*;
import  java.util.Map;
import  java.util.List;
import static org.evomaster.client.java.controller.api.EMTestUtils.*;
import  org.evomaster.client.java.controller.SutHandler;
import  io.restassured.RestAssured;
import static io.restassured.RestAssured.given;
import  io.restassured.response.ValidatableResponse;
import static org.evomaster.client.java.sql.dsl.SqlDsl.sql;
import  org.evomaster.client.java.controller.api.dto.database.operations.InsertionResultsDto;
import  org.evomaster.client.java.controller.api.dto.database.operations.InsertionDto;
import static org.hamcrest.Matchers.*;
import  io.restassured.config.JsonConfig;
import  io.restassured.path.json.config.JsonPathConfig;
import static io.restassured.config.RedirectConfig.redirectConfig;
import static org.evomaster.client.java.controller.contentMatchers.NumberMatcher.*;
import static org.evomaster.client.java.controller.contentMatchers.StringMatcher.*;
import static org.evomaster.client.java.controller.contentMatchers.SubStringMatcher.*;
import static org.evomaster.client.java.controller.expect.ExpectationHandler.expectationHandler;
import  org.evomaster.client.java.controller.expect.ExpectationHandler;
import  io.restassured.path.json.JsonPath;
import  java.util.Arrays;

Instruction 3: Keep the class name in this point (between the imports at instruction 2 and instruction 4)

Instruction 4: Keep these variables in the generated test code:
private static final SutHandler controller = new em.embedded.market.EmbeddedEvoMasterController();
private static String baseUrlOfSut;

Instruction 5: Keep the following setup and teardown methods in generated test code file:
@BeforeAll
public static void initClass() {
    controller.setupForGeneratedTest();
    baseUrlOfSut = controller.startSut();
    controller.registerOrExecuteInitSqlCommandsIfNeeded();
    assertNotNull(baseUrlOfSut);
    RestAssured.enableLoggingOfRequestAndResponseIfValidationFails();
    RestAssured.useRelaxedHTTPSValidation();
    RestAssured.urlEncodingEnabled = false;
    RestAssured.config = RestAssured.config()
        .jsonConfig(JsonConfig.jsonConfig().numberReturnType(JsonPathConfig.NumberReturnType.DOUBLE))
        .redirect(redirectConfig().followRedirects(false));
}


@AfterAll
public static void tearDown() {
    controller.stopSut();
}


@BeforeEach
public void initTest() {
    controller.resetDatabase(Arrays.asList("USER_ROLE","CUSTOMER_ORDER","CART_ITEM","PRODUCT","CART","CONTACTS"));
    controller.resetStateOfSUT();
}

*****

package market;

import org.junit.jupiter.api.AfterAll;
import org.junit.jupiter.api.BeforeAll;
import org.junit.jupiter.api.BeforeEach;
import org.junit.jupiter.api.Test;
import org.junit.jupiter.api.Timeout;
import static org.junit.jupiter.api.Assertions.*;
import java.util.Map;
import java.util.List;
import static org.evomaster.client.java.controller.api.EMTestUtils.*;
import org.evomaster.client.java.controller.SutHandler;
import io.restassured.RestAssured;
import static io.restassured.RestAssured.given;
import io.restassured.response.ValidatableResponse;
import static org.evomaster.client.java.sql.dsl.SqlDsl.sql;
import org.evomaster.client.java.controller.api.dto.database.operations.InsertionResultsDto;
import org.evomaster.client.java.controller.api.dto.database.operations.InsertionDto;
import static org.hamcrest.Matchers.*;
import io.restassured.config.JsonConfig;
import io.restassured.path.json.config.JsonPathConfig;
import static io.restassured.config.RedirectConfig.redirectConfig;
import static org.evomaster.client.java.controller.contentMatchers.NumberMatcher.*;
import static org.evomaster.client.java.controller.contentMatchers.StringMatcher.*;
import static org.evomaster.client.java.controller.contentMatchers.SubStringMatcher.*;
import java.util.Arrays;

public class run01_RestExceptionHandlerTest {
    private static final SutHandler controller = new em.embedded.market.EmbeddedEvoMasterController();
    private static String baseUrlOfSut;

    @BeforeAll
    public static void initClass() {
        controller.setupForGeneratedTest();
        baseUrlOfSut = controller.startSut();
        controller.registerOrExecuteInitSqlCommandsIfNeeded();
        assertNotNull(baseUrlOfSut);
        RestAssured.enableLoggingOfRequestAndResponseIfValidationFails();
        RestAssured.useRelaxedHTTPSValidation();
        RestAssured.urlEncodingEnabled = false;
        RestAssured.config = RestAssured.config()
            .jsonConfig(JsonConfig.jsonConfig().numberReturnType(JsonPathConfig.NumberReturnType.DOUBLE))
            .redirect(redirectConfig().followRedirects(false));
    }

    @AfterAll
    public static void tearDown() {
        controller.stopSut();
    }

    @BeforeEach
    public void initTest() {
        controller.resetDatabase(Arrays.asList("USER_ROLE", "CUSTOMER_ORDER", "CART_ITEM", "PRODUCT", "CART", "CONTACTS"));
        controller.resetStateOfSUT();
    }

    @Test
    @Timeout(60)
    public void testGetCustomerNotFound() {
        given().baseUri(baseUrlOfSut)
               .when().get("/customer")
               .then()
               .statusCode(404);
    }

    @Test
    @Timeout(60)
    public void testGetCustomerUnauthorized() {
        given().baseUri(baseUrlOfSut)
               .when().get("/customer")
               .then()
               .statusCode(401);
    }

    @Test
    @Timeout(60)
    public void testAddItemToCartWithoutAuth() {
        given().baseUri(baseUrlOfSut)
               .contentType("application/json")
               .body("{\"productId\":1, \"quantity\":1}")
               .when().put("/customer/cart")
               .then()
               .statusCode(401);
    }

    @Test
    @Timeout(60)
    public void testClearCartWithoutAuth() {
        given().baseUri(baseUrlOfSut)
               .when().delete("/customer/cart")
               .then()
               .statusCode(401);
    }

    @Test
    @Timeout(60)
    public void testSetDeliveryWithoutAuth() {
        given().baseUri(baseUrlOfSut)
               .queryParam("included", true)
               .when().put("/customer/cart/delivery")
               .then()
               .statusCode(401);
    }

    @Test
    @Timeout(60)
    public void testPayByCardWithoutAuth() {
        given().baseUri(baseUrlOfSut)
               .contentType("application/json")
               .body("{\"ccNumber\":\"1234-5678-9876-5432\"}")
               .when().post("/customer/cart/pay")
               .then()
               .statusCode(401);
    }

    @Test
    @Timeout(60)
    public void testGetContactsNotFound() {
        given().baseUri(baseUrlOfSut)
               .when().get("/customer/contacts")
               .then()
               .statusCode(404);
    }

    @Test
    @Timeout(60)
    public void testUpdateContactsWithInvalidData() {
        given().baseUri(baseUrlOfSut)
               .contentType("application/json")
               .body("{\"address\":\"Invalid#Address\", \"phone\":\"invalid-phone\"}")
               .when().put("/customer/contacts")
               .then()
               .statusCode(406);
    }

    @Test
    @Timeout(60)
    public void testGetOrdersWithoutAuth() {
        given().baseUri(baseUrlOfSut)
               .when().get("/customer/orders")
               .then()
               .statusCode(401);
    }

    @Test
    @Timeout(60)
    public void testGetOrderNotFound() {
        given().baseUri(baseUrlOfSut)
               .pathParam("orderId", 9999)
               .when().get("/customer/orders/{orderId}")
               .then()
               .statusCode(404);
    }

    @Test
    @Timeout(60)
    public void testGetProductsUnauthorized() {
        given().baseUri(baseUrlOfSut)
               .when().get("/products")
               .then()
               .statusCode(401);
    }

    @Test
    @Timeout(60)
    public void testGetProductNotFound() {
        given().baseUri(baseUrlOfSut)
               .pathParam("productId", 9999)
               .when().get("/products/{productId}")
               .then()
               .statusCode(404);
    }

    @Test
    @Timeout(60)
    public void testCreateCustomerInvalidData() {
        given().baseUri(baseUrlOfSut)
               .contentType("application/json")
               .body("{\"email\":\"invalid-email\", \"password\":\"123\", \"name\":\"Invalid#Name\", \"phone\":\"invalid-phone\", \"address\":\"Invalid#Address\"}")
               .when().post("/register")
               .then()
               .statusCode(406);
    }

    @Test
    @Timeout(60)
    public void testInternalServerError() {
        given().baseUri(baseUrlOfSut)
               .when().get("/trigger-internal-server-error")
               .then()
               .statusCode(500);
    }
}

*****
#####
[[1;34mINFO[m] Scanning for projects...
[[1;34mINFO[m] 
[[1;34mINFO[m] [1m---------------------< [0;36mnet.lukyanets:market-rest[0;1m >----------------------[m
[[1;34mINFO[m] [1mBuilding market-rest 0.1.2[m
[[1;34mINFO[m] [1m--------------------------------[ jar ]---------------------------------[m
[[1;33mWARNING[m] The POM for com.sun.xml.bind:jaxb-osgi:jar:2.2.10 is invalid, transitive dependencies (if any) will not be available, enable debug logging for more details
[[1;34mINFO[m] 
[[1;34mINFO[m] [1m--- [0;32mmaven-clean-plugin:2.5:clean[m [1m(default-clean)[m @ [36mmarket-rest[0;1m ---[m
[[1;34mINFO[m] Deleting /media/rincon/63999417195/eclipse-workspace/EMB-master/jdk_11_maven/cs/rest-gui/market/market-rest/target
[[1;34mINFO[m] 
[[1;34mINFO[m] [1m--- [0;32mjacoco-maven-plugin:0.8.7:prepare-agent[m [1m(default)[m @ [36mmarket-rest[0;1m ---[m
[[1;34mINFO[m] argLine set to -javaagent:/home/rincon/.m2/repository/org/jacoco/org.jacoco.agent/0.8.7/org.jacoco.agent-0.8.7-runtime.jar=destfile=/media/rincon/63999417195/eclipse-workspace/EMB-master/jdk_11_maven/cs/rest-gui/market/market-rest/target/jacoco.exec
[[1;34mINFO[m] 
[[1;34mINFO[m] [1m--- [0;32mspring-boot-maven-plugin:2.4.3:build-info[m [1m(default)[m @ [36mmarket-rest[0;1m ---[m
[[1;34mINFO[m] 
[[1;34mINFO[m] [1m--- [0;32mmaven-resources-plugin:2.6:resources[m [1m(default-resources)[m @ [36mmarket-rest[0;1m ---[m
[[1;34mINFO[m] Using 'UTF-8' encoding to copy filtered resources.
[[1;34mINFO[m] Copying 3 resources
[[1;34mINFO[m] 
[[1;34mINFO[m] [1m--- [0;32mmaven-compiler-plugin:3.8.0:compile[m [1m(default-compile)[m @ [36mmarket-rest[0;1m ---[m
[[1;34mINFO[m] Changes detected - recompiling the module!
[[1;34mINFO[m] Compiling 11 source files to /media/rincon/63999417195/eclipse-workspace/EMB-master/jdk_11_maven/cs/rest-gui/market/market-rest/target/classes
[[1;34mINFO[m] 
[[1;34mINFO[m] [1m--- [0;32mjacoco-maven-plugin:0.8.7:prepare-agent[m [1m(default)[m @ [36mmarket-rest[0;1m ---[m
[[1;34mINFO[m] argLine set to -javaagent:/home/rincon/.m2/repository/org/jacoco/org.jacoco.agent/0.8.7/org.jacoco.agent-0.8.7-runtime.jar=destfile=/media/rincon/63999417195/eclipse-workspace/EMB-master/jdk_11_maven/cs/rest-gui/market/market-rest/target/jacoco.exec
[[1;34mINFO[m] 
[[1;34mINFO[m] [1m--- [0;32mspring-boot-maven-plugin:2.4.3:build-info[m [1m(default)[m @ [36mmarket-rest[0;1m ---[m
[[1;34mINFO[m] 
[[1;34mINFO[m] [1m--- [0;32mmaven-resources-plugin:2.6:resources[m [1m(default-resources)[m @ [36mmarket-rest[0;1m ---[m
[[1;34mINFO[m] Using 'UTF-8' encoding to copy filtered resources.
[[1;34mINFO[m] Copying 3 resources
[[1;34mINFO[m] 
[[1;34mINFO[m] [1m--- [0;32mmaven-compiler-plugin:3.8.0:compile[m [1m(default-compile)[m @ [36mmarket-rest[0;1m ---[m
[[1;34mINFO[m] Nothing to compile - all classes are up to date
[[1;34mINFO[m] 
[[1;34mINFO[m] [1m--- [0;32mmaven-resources-plugin:2.6:testResources[m [1m(default-testResources)[m @ [36mmarket-rest[0;1m ---[m
[[1;34mINFO[m] Using 'UTF-8' encoding to copy filtered resources.
[[1;34mINFO[m] skip non existing resourceDirectory /media/rincon/63999417195/eclipse-workspace/EMB-master/jdk_11_maven/cs/rest-gui/market/market-rest/src/test/resources
[[1;34mINFO[m] 
[[1;34mINFO[m] [1m--- [0;32mmaven-compiler-plugin:3.8.0:testCompile[m [1m(default-testCompile)[m @ [36mmarket-rest[0;1m ---[m
[[1;34mINFO[m] Changes detected - recompiling the module!
[[1;34mINFO[m] Compiling 1 source file to /media/rincon/63999417195/eclipse-workspace/EMB-master/jdk_11_maven/cs/rest-gui/market/market-rest/target/test-classes
[[1;34mINFO[m] 
[[1;34mINFO[m] [1m--- [0;32mjacoco-maven-plugin:0.8.7:prepare-agent[m [1m(default)[m @ [36mmarket-rest[0;1m ---[m
[[1;34mINFO[m] argLine set to -javaagent:/home/rincon/.m2/repository/org/jacoco/org.jacoco.agent/0.8.7/org.jacoco.agent-0.8.7-runtime.jar=destfile=/media/rincon/63999417195/eclipse-workspace/EMB-master/jdk_11_maven/cs/rest-gui/market/market-rest/target/jacoco.exec
[[1;34mINFO[m] 
[[1;34mINFO[m] [1m--- [0;32mspring-boot-maven-plugin:2.4.3:build-info[m [1m(default)[m @ [36mmarket-rest[0;1m ---[m
[[1;34mINFO[m] 
[[1;34mINFO[m] [1m--- [0;32mmaven-resources-plugin:2.6:resources[m [1m(default-resources)[m @ [36mmarket-rest[0;1m ---[m
[[1;34mINFO[m] Using 'UTF-8' encoding to copy filtered resources.
[[1;34mINFO[m] Copying 3 resources
[[1;34mINFO[m] 
[[1;34mINFO[m] [1m--- [0;32mmaven-compiler-plugin:3.8.0:compile[m [1m(default-compile)[m @ [36mmarket-rest[0;1m ---[m
[[1;34mINFO[m] Nothing to compile - all classes are up to date
[[1;34mINFO[m] 
[[1;34mINFO[m] [1m--- [0;32mmaven-resources-plugin:2.6:testResources[m [1m(default-testResources)[m @ [36mmarket-rest[0;1m ---[m
[[1;34mINFO[m] Using 'UTF-8' encoding to copy filtered resources.
[[1;34mINFO[m] skip non existing resourceDirectory /media/rincon/63999417195/eclipse-workspace/EMB-master/jdk_11_maven/cs/rest-gui/market/market-rest/src/test/resources
[[1;34mINFO[m] 
[[1;34mINFO[m] [1m--- [0;32mmaven-compiler-plugin:3.8.0:testCompile[m [1m(default-testCompile)[m @ [36mmarket-rest[0;1m ---[m
[[1;34mINFO[m] Nothing to compile - all classes are up to date
[[1;34mINFO[m] 
[[1;34mINFO[m] [1m--- [0;32mmaven-surefire-plugin:2.22.0:test[m [1m(default-test)[m @ [36mmarket-rest[0;1m ---[m
[[1;34mINFO[m] 
[[1;34mINFO[m] -------------------------------------------------------
[[1;34mINFO[m]  T E S T S
[[1;34mINFO[m] -------------------------------------------------------
[[1;34mINFO[m] Running market.[1mrun01_RestExceptionHandlerTest[m

  .   ____          _            __ _ _
 /\\ / ___'_ __ _ _(_)_ __  __ _ \ \ \ \
( ( )\___ | '_ | '_| | '_ \/ _` | \ \ \ \
 \\/  ___)| |_)| | | | | || (_| |  ) ) ) )
  '  |____| .__|_| |_|_| |_\__, | / / / /
 =========|_|==============|___/=/_/_/_/
 :: Spring Boot ::                (v2.4.3)

2024-09-02 17:30:58,919 INFO  [background-preinit] o.h.v.i.u.Version - HV000001: Hibernate Validator 6.1.7.Final
2024-09-02 17:30:59,030 INFO  [main] o.a.m.s.b.ForkedBooter - Starting ForkedBooter v2.22.0 using Java 11.0.20 on IFTO-PROBOOK with PID 62308 (started by rincon in /media/rincon/63999417195/eclipse-workspace/EMB-master/jdk_11_maven/cs/rest-gui/market/market-rest)
2024-09-02 17:30:59,038 INFO  [main] o.a.m.s.b.ForkedBooter - No active profile set, falling back to default profiles: default
2024-09-02 17:30:59,705 WARN  [main] o.s.b.c.c.ConfigDataEnvironment - Property 'spring.profiles' imported from location 'class path resource [application.yml]' is invalid and should be replaced with 'spring.config.activate.on-profile' [origin: class path resource [application.yml] - 34:13]
2024-09-02 17:30:59,705 WARN  [main] o.s.b.c.c.ConfigDataEnvironment - Property 'spring.profiles' imported from location 'class path resource [application.yml]' is invalid and should be replaced with 'spring.config.activate.on-profile' [origin: class path resource [application.yml] - 24:13]
2024-09-02 17:31:01,374 INFO  [main] o.s.d.r.c.RepositoryConfigurationDelegate - Bootstrapping Spring Data JPA repositories in DEFAULT mode.
2024-09-02 17:31:01,502 INFO  [main] o.s.d.r.c.RepositoryConfigurationDelegate - Finished Spring Data repository scanning in 116 ms. Found 8 JPA repository interfaces.
2024-09-02 17:31:01,984 INFO  [main] o.s.c.s.PostProcessorRegistrationDelegate$BeanPostProcessorChecker - Bean 'market.DataConfig' of type [market.DataConfig$$EnhancerBySpringCGLIB$$7cdf1770] is not eligible for getting processed by all BeanPostProcessors (for example: not eligible for auto-proxying)
2024-09-02 17:31:02,146 INFO  [main] o.s.c.s.PostProcessorRegistrationDelegate$BeanPostProcessorChecker - Bean 'org.springframework.security.access.expression.method.DefaultMethodSecurityExpressionHandler@6c9fee67' of type [org.springframework.security.access.expression.method.DefaultMethodSecurityExpressionHandler] is not eligible for getting processed by all BeanPostProcessors (for example: not eligible for auto-proxying)
2024-09-02 17:31:02,155 INFO  [main] o.s.c.s.PostProcessorRegistrationDelegate$BeanPostProcessorChecker - Bean 'methodSecurityMetadataSource' of type [org.springframework.security.access.method.DelegatingMethodSecurityMetadataSource] is not eligible for getting processed by all BeanPostProcessors (for example: not eligible for auto-proxying)
2024-09-02 17:31:02,693 INFO  [main] o.s.b.w.e.t.TomcatWebServer - Tomcat initialized with port(s): 0 (http)
2024-09-02 17:31:02,714 INFO  [main] o.a.c.h.Http11NioProtocol - Initializing ProtocolHandler ["http-nio-auto-1"]
2024-09-02 17:31:02,715 INFO  [main] o.a.c.c.StandardService - Starting service [Tomcat]
2024-09-02 17:31:02,715 INFO  [main] o.a.c.c.StandardEngine - Starting Servlet engine: [Apache Tomcat/9.0.43]
2024-09-02 17:31:02,850 INFO  [main] o.a.c.c.C.[.[.[/] - Initializing Spring embedded WebApplicationContext
2024-09-02 17:31:02,850 INFO  [main] o.s.b.w.s.c.ServletWebServerApplicationContext - Root WebApplicationContext: initialization completed in 3139 ms
2024-09-02 17:31:03,058 INFO  [main] c.z.h.HikariDataSource - HikariPool-1 - Starting...
2024-09-02 17:31:03,437 INFO  [main] c.z.h.HikariDataSource - HikariPool-1 - Start completed.
2024-09-02 17:31:03,715 INFO  [main] o.h.j.i.u.LogHelper - HHH000204: Processing PersistenceUnitInfo [name: default]
2024-09-02 17:31:03,844 INFO  [main] o.h.Version - HHH000412: Hibernate ORM core version 5.4.28.Final
2024-09-02 17:31:04,068 INFO  [main] o.h.a.c.Version - HCANN000001: Hibernate Commons Annotations {5.1.2.Final}
2024-09-02 17:31:04,382 INFO  [main] o.h.d.Dialect - HHH000400: Using dialect: org.hibernate.dialect.H2Dialect
2024-09-02 17:31:04,708 WARN  [main] o.h.b.i.InFlightMetadataCollectorImpl - HHH000069: Duplicate generator name gen
2024-09-02 17:31:04,711 WARN  [main] o.h.b.i.InFlightMetadataCollectorImpl - HHH000069: Duplicate generator name gen
2024-09-02 17:31:05,567 INFO  [main] o.h.e.t.j.p.i.JtaPlatformInitiator - HHH000490: Using JtaPlatform implementation: [org.hibernate.engine.transaction.jta.platform.internal.NoJtaPlatform]
2024-09-02 17:31:05,579 INFO  [main] o.s.o.j.LocalContainerEntityManagerFactoryBean - Initialized JPA EntityManagerFactory for persistence unit 'default'
2024-09-02 17:31:06,823 WARN  [main] o.s.b.a.o.j.JpaBaseConfiguration$JpaWebConfiguration - spring.jpa.open-in-view is enabled by default. Therefore, database queries may be performed during view rendering. Explicitly configure spring.jpa.open-in-view to disable this warning
2024-09-02 17:31:07,836 INFO  [main] o.s.s.w.DefaultSecurityFilterChain - Will secure any request with [org.springframework.security.web.context.request.async.WebAsyncManagerIntegrationFilter@414b8b11, org.springframework.security.web.context.SecurityContextPersistenceFilter@10bfc911, org.springframework.security.web.header.HeaderWriterFilter@4720731f, org.springframework.security.web.authentication.logout.LogoutFilter@62a2ede6, org.springframework.security.web.authentication.www.BasicAuthenticationFilter@457ab87b, org.springframework.security.web.savedrequest.RequestCacheAwareFilter@135e1fdf, org.springframework.security.web.servletapi.SecurityContextHolderAwareRequestFilter@70dc9b5, org.springframework.security.web.authentication.AnonymousAuthenticationFilter@3d9e1074, org.springframework.security.web.session.SessionManagementFilter@55075a4c, org.springframework.security.web.access.ExceptionTranslationFilter@4655e6b8, org.springframework.security.web.access.intercept.FilterSecurityInterceptor@50c9c9b2]
2024-09-02 17:31:08,017 INFO  [main] o.s.s.c.ThreadPoolTaskExecutor - Initializing ExecutorService 'applicationTaskExecutor'
2024-09-02 17:31:08,585 INFO  [main] o.a.c.h.Http11NioProtocol - Starting ProtocolHandler ["http-nio-auto-1"]
2024-09-02 17:31:08,618 INFO  [main] o.s.b.w.e.t.TomcatWebServer - Tomcat started on port(s): 38633 (http) with context path ''
2024-09-02 17:31:09,262 INFO  [main] o.a.m.s.b.ForkedBooter - Started ForkedBooter in 11.212 seconds (JVM running for 13.489)
2024-09-02 17:31:11,033 INFO  [http-nio-auto-1-exec-1] o.a.c.c.C.[.[.[/] - Initializing Spring DispatcherServlet 'dispatcherServlet'
2024-09-02 17:31:11,033 INFO  [http-nio-auto-1-exec-1] o.s.w.s.DispatcherServlet - Initializing Servlet 'dispatcherServlet'
2024-09-02 17:31:11,035 INFO  [http-nio-auto-1-exec-1] o.s.w.s.DispatcherServlet - Completed initialization in 2 ms
Request method:	GET
Request URI:	http://localhost:38633/customer
Proxy:			<none>
Request params:	<none>
Query params:	<none>
Form params:	<none>
Path params:	<none>
Headers:		Accept=*/*
Cookies:		<none>
Multiparts:		<none>
Body:			<none>

HTTP/1.1 401 
Set-Cookie: JSESSIONID=E4D5A7B755B8C9EAFF9290B157AEAA6C; Path=/; HttpOnly
WWW-Authenticate: Basic realm="Realm"
X-Content-Type-Options: nosniff
X-XSS-Protection: 1; mode=block
Cache-Control: no-cache, no-store, max-age=0, must-revalidate
Pragma: no-cache
Expires: 0
Content-Type: application/json
Transfer-Encoding: chunked
Date: Mon, 02 Sep 2024 20:31:11 GMT
Keep-Alive: timeout=60
Connection: keep-alive

{
    "timestamp": "2024-09-02T20:31:11.132+00:00",
    "status": 401,
    "error": "Unauthorized",
    "message": "",
    "path": "/customer"
}
2024-09-02 17:31:11,568 WARN  [http-nio-auto-1-exec-3] m.r.e.RestExceptionHandler - RestErrorResponse{message='Acesso negado', entityName='null', description='uri=/customer/contacts', fieldErrors=[]}
Request method:	GET
Request URI:	http://localhost:38633/customer/contacts
Proxy:			<none>
Request params:	<none>
Query params:	<none>
Form params:	<none>
Path params:	<none>
Headers:		Accept=*/*
Cookies:		<none>
Multiparts:		<none>
Body:			<none>

HTTP/1.1 401 
X-Content-Type-Options: nosniff
X-XSS-Protection: 1; mode=block
Cache-Control: no-cache, no-store, max-age=0, must-revalidate
Pragma: no-cache
Expires: 0
Content-Type: application/json
Transfer-Encoding: chunked
Date: Mon, 02 Sep 2024 20:31:11 GMT
Keep-Alive: timeout=60
Connection: keep-alive

{
    "message": "Acesso negado",
    "description": "uri=/customer/contacts",
    "entityName": null,
    "fieldErrors": [
        
    ]
}
Request method:	GET
Request URI:	http://localhost:38633/trigger-internal-server-error
Proxy:			<none>
Request params:	<none>
Query params:	<none>
Form params:	<none>
Path params:	<none>
Headers:		Accept=*/*
Cookies:		<none>
Multiparts:		<none>
Body:			<none>

HTTP/1.1 404 
Vary: Origin
Vary: Access-Control-Request-Method
Vary: Access-Control-Request-Headers
X-Content-Type-Options: nosniff
X-XSS-Protection: 1; mode=block
Cache-Control: no-cache, no-store, max-age=0, must-revalidate
Pragma: no-cache
Expires: 0
Content-Type: application/json
Transfer-Encoding: chunked
Date: Mon, 02 Sep 2024 20:31:11 GMT
Keep-Alive: timeout=60
Connection: keep-alive

{
    "timestamp": "2024-09-02T20:31:11.642+00:00",
    "status": 404,
    "error": "Not Found",
    "message": "",
    "path": "/trigger-internal-server-error"
}
Request method:	GET
Request URI:	http://localhost:38633/products
Proxy:			<none>
Request params:	<none>
Query params:	<none>
Form params:	<none>
Path params:	<none>
Headers:		Accept=*/*
Cookies:		<none>
Multiparts:		<none>
Body:			<none>

HTTP/1.1 200 
X-Content-Type-Options: nosniff
X-XSS-Protection: 1; mode=block
Cache-Control: no-cache, no-store, max-age=0, must-revalidate
Pragma: no-cache
Expires: 0
Content-Type: application/json
Transfer-Encoding: chunked
Date: Mon, 02 Sep 2024 20:31:11 GMT
Keep-Alive: timeout=60
Connection: keep-alive

[
    {
        "productId": 1,
        "distillery": "Ardbeg",
        "name": "Ten",
        "price": 4420.0,
        "age": 10,
        "volume": 700,
        "alcohol": 46.0,
        "description": "Ten Years Old is the basis of the Ardbeg range. After 10 years of maturation in ex-bourbon casks, the whiskey bottled at 46% ABV without cold filtering. The characteristic peat, although clearly present but in perfect balance with the natural sweetness and not predominant in the taste.",
        "available": false,
        "links": [
            {
                "rel": "self",
                "href": "http://localhost:38633/products/1"
            }
        ]
    },
    {
        "productId": 2,
        "distillery": "Ardbeg",
        "name": "Uigeadail",
        "price": 7020.0,
        "age": 0,
        "volume": 700,
        "alcohol": 54.2,
        "description": "Ardbeg Uigedael is named after Loch Uigedael, the lake in the grounds of the distillery Ardbeg which are the water is an important factor in the distilling process. The Uigedael a vatted malt, bottled at 54.2% ABV without cold filtering. Ardbeg Uigedael has no age indication for the expression consists of various malts of different ages. Malts are used partly matured in ex-bourbon and partly on ex-sherry casks.",
        "available": true,
        "links": [
            {
                "rel": "self",
                "href": "http://localhost:38633/products/2"
            }
        ]
    },
    {
        "productId": 3,
        "distillery": "Balvenie",
        "name": "12 y.o. Doublewood",
        "price": 5403.0,
        "age": 12,
        "volume": 700,
        "alcohol": 40.0,
        "description": "Has clear influences from both bourbon and sherry wood. This malt has only 12 years aged in bourbon casks and then 3 months in young Oloroso casks. The peppery character from the bourbon barrels, penetrates, as it were by the rich and full aroma of Oloroso casks it. The Balvenie Double Wood is therefore a very complex malt.",
        "available": true,
        "links": [
            {
                "rel": "self",
                "href": "http://localhost:38633/products/3"
            }
        ]
    },
    {
        "productId": 4,
        "distillery": "Caol Ila",
        "name": "12 y.o.",
        "price": 4913.0,
        "age": 12,
        "volume": 700,
        "alcohol": 43.0,
        "description": "Smoked ham comes across delicately with citrus and cigar leaves. Fresh and smoky, probably the best part of this whisky. With an almost full body, oil and tar meet subtle smoke. Hints of sweet tastes like honey. Some spices like pepper combined with little sweetness.",
        "available": true,
        "links": [
            {
                "rel": "self",
                "href": "http://localhost:38633/products/4"
            }
        ]
    },
    {
        "productId": 5,
        "distillery": "Dalwhinnie",
        "name": "15 y.o.",
        "price": 6517.0,
        "age": 15,
        "volume": 750,
        "alcohol": 43.0,
        "description": "A good introduction to the delights of single malt whisky – elegant, smooth and medium-bodied, with a light, fruity palate and a whiff of heather on the finish. Part of Diageo's Classic Malt range. ",
        "available": true,
        "links": [
            {
                "rel": "self",
                "href": "http://localhost:38633/products/5"
            }
        ]
    },
    {
        "productId": 6,
        "distillery": "Lagavulin",
        "name": "16 y.o.",
        "price": 6620.0,
        "age": 16,
        "volume": 750,
        "alcohol": 43.0,
        "description": "The Islay representative in the 'Classic Malts' series is a deep, dry and exceptionally peaty bruiser. Probably the most pungent of all Islay malts, Lagavulin is not for the faint-hearted but inspires fanatical devotion in its many followers.",
        "available": true,
        "links": [
            {
                "rel": "self",
                "href": "http://localhost:38633/products/6"
            }
        ]
    },
    {
        "productId": 7,
        "distillery": "Laphroaig",
        "name": "Quarter Cask",
        "price": 5100.0,
        "age": 0,
        "volume": 700,
        "alcohol": 48.0,
        "description": "A vibrant young Laphroaig whose maturation has been accelerated by ageing in quarter casks. This shows soft sweetness and a velvety feel when first tasted, then the intense peatiness so unique to Laphroaig comes bursting through. A terrific whisky and great value.",
        "available": true,
        "links": [
            {
                "rel": "self",
                "href": "http://localhost:38633/products/7"
            }
        ]
    },
    {
        "productId": 8,
        "distillery": "Springbank",
        "name": "12 y.o. Cask Strength Batch 6",
        "price": 8127.0,
        "age": 12,
        "volume": 700,
        "alcohol": 53.1,
        "description": "Like a storm gathering of the Kintyre coast, dark and ominous, yet tastes so good. The richness comes from the high percentage of sherry casks used in maturation. This is a truly classic Springbank, best enjoyed after dinner, or with your favourite cigar.",
        "available": true,
        "links": [
            {
                "rel": "self",
                "href": "http://localhost:38633/products/8"
            }
        ]
    },
    {
        "productId": 9,
        "distillery": "Springbank",
        "name": "18 y.o.",
        "price": 14490.0,
        "age": 18,
        "volume": 700,
        "alcohol": 46.0,
        "description": "This heavily sherried 18-year-old Springbank has been bottled by Mark Reynier as part of his Renegade series. Distilled in 1995, this sherry hogshead was aged for 10 years in Campbeltown and then moved to Bruichladdich for a further eight years.",
        "available": true,
        "links": [
            {
                "rel": "self",
                "href": "http://localhost:38633/products/9"
            }
        ]
    },
    {
        "productId": 10,
        "distillery": "Talisker",
        "name": "10 y.o.",
        "price": 4683.0,
        "age": 10,
        "volume": 750,
        "alcohol": 45.8,
        "description": "Powerful peat smoke with the salinity of sea water and the moisture of fresh oysters. Full sweetness of dried fruit with smoke and strong aromas of malted barley, warm and intense. Peppery in the mouth. Big, long, warming and peppery on the finish with an attractive sweetness.",
        "available": true,
        "links": [
            {
                "rel": "self",
                "href": "http://localhost:38633/products/10"
            }
        ]
    },
    {
        "productId": 11,
        "distillery": "Glenkinchie",
        "name": "12 y.o.",
        "price": 4547.0,
        "age": 12,
        "volume": 700,
        "alcohol": 43.0,
        "description": "A light, delicate whiskey; sweet and creamy with a subtle floral aroma. This subtle, refined Lowland is ideal as an aperitif; try it straight from the fridge or freezer.",
        "available": false,
        "links": [
            {
                "rel": "self",
                "href": "http://localhost:38633/products/11"
            }
        ]
    }
]
2024-09-02 17:31:12,086 WARN  [http-nio-auto-1-exec-10] m.r.e.RestExceptionHandler - RestErrorResponse{message='Requested entity doesn't exist', entityName='ProductDTO', description='uri=/products/9999', fieldErrors=[{field='id', message='No instance with this id'}]}
2024-09-02 17:31:12,124 WARN  [http-nio-auto-1-exec-1] m.r.e.RestExceptionHandler - RestErrorResponse{message='Acesso negado', entityName='null', description='uri=/customer/orders', fieldErrors=[]}
2024-09-02 17:31:12,174 WARN  [http-nio-auto-1-exec-2] m.r.e.RestExceptionHandler - RestErrorResponse{message='Acesso negado', entityName='null', description='uri=/customer/cart', fieldErrors=[]}
2024-09-02 17:31:12,217 WARN  [http-nio-auto-1-exec-3] m.r.e.RestExceptionHandler - RestErrorResponse{message='Acesso negado', entityName='null', description='uri=/customer/orders/9999', fieldErrors=[]}
Request method:	GET
Request URI:	http://localhost:38633/customer/orders/9999
Proxy:			<none>
Request params:	<none>
Query params:	<none>
Form params:	<none>
Path params:	orderId=9999
Headers:		Accept=*/*
Cookies:		<none>
Multiparts:		<none>
Body:			<none>

HTTP/1.1 401 
X-Content-Type-Options: nosniff
X-XSS-Protection: 1; mode=block
Cache-Control: no-cache, no-store, max-age=0, must-revalidate
Pragma: no-cache
Expires: 0
Content-Type: application/json
Transfer-Encoding: chunked
Date: Mon, 02 Sep 2024 20:31:12 GMT
Keep-Alive: timeout=60
Connection: keep-alive

{
    "message": "Acesso negado",
    "description": "uri=/customer/orders/9999",
    "entityName": null,
    "fieldErrors": [
        
    ]
}
2024-09-02 17:31:12,426 WARN  [http-nio-auto-1-exec-4] m.r.e.RestExceptionHandler - RestErrorResponse{message='Acesso negado', entityName='null', description='uri=/customer/cart', fieldErrors=[]}
2024-09-02 17:31:12,472 WARN  [http-nio-auto-1-exec-7] m.r.e.RestExceptionHandler - RestErrorResponse{message='Acesso negado', entityName='null', description='uri=/customer/cart/delivery', fieldErrors=[]}
2024-09-02 17:31:12,582 WARN  [http-nio-auto-1-exec-6] m.r.e.RestExceptionHandler - RestErrorResponse{message='Argument validation error', entityName='userDTO', description='uri=/register', fieldErrors=[{field='phone', message='Shall consist of a + sign, a country code, a region code (1-4 digits), and a number (6-7 digits)'}, {field='email', message='The value shall be in the format of an email address'}, {field='name', message='Only letters, whitespace, hyphen and apostrophe are allowed'}, {field='password', message='Length shall be between 6 and 50 characters'}, {field='address', message='Special characters are not allowed'}]}
2024-09-02 17:31:12,631 WARN  [http-nio-auto-1-exec-9] m.r.e.RestExceptionHandler - RestErrorResponse{message='Argument validation error', entityName='contactsDTO', description='uri=/customer/contacts', fieldErrors=[{field='address', message='Pattern.contactsDTO.address'}, {field='phone', message='Shall consist of a + sign, a country code, a region code (1-4 digits), and a number (6-7 digits)'}]}
2024-09-02 17:31:12,681 WARN  [http-nio-auto-1-exec-8] m.r.e.RestExceptionHandler - RestErrorResponse{message='Argument validation error', entityName='creditCardDTO', description='uri=/customer/cart/pay', fieldErrors=[{field='ccNumber', message='Not a valid credit card number'}]}
Request method:	POST
Request URI:	http://localhost:38633/customer/cart/pay
Proxy:			<none>
Request params:	<none>
Query params:	<none>
Form params:	<none>
Path params:	<none>
Headers:		Accept=*/*
				Content-Type=application/json; charset=UTF-8
Cookies:		<none>
Multiparts:		<none>
Body:
{
    "ccNumber": "1234-5678-9876-5432"
}

HTTP/1.1 406 
X-Content-Type-Options: nosniff
X-XSS-Protection: 1; mode=block
Cache-Control: no-cache, no-store, max-age=0, must-revalidate
Pragma: no-cache
Expires: 0
Content-Type: application/json
Transfer-Encoding: chunked
Date: Mon, 02 Sep 2024 20:31:12 GMT
Keep-Alive: timeout=60
Connection: keep-alive

{
    "message": "Argument validation error",
    "description": "uri=/customer/cart/pay",
    "entityName": "creditCardDTO",
    "fieldErrors": [
        {
            "field": "ccNumber",
            "message": "Not a valid credit card number"
        }
    ]
}
2024-09-02 17:31:12,701 INFO  [main] o.a.c.h.Http11NioProtocol - Pausing ProtocolHandler ["http-nio-auto-1"]
2024-09-02 17:31:12,702 INFO  [main] o.a.c.c.StandardService - Stopping service [Tomcat]
2024-09-02 17:31:12,704 INFO  [main] o.a.c.c.C.[.[.[/] - Destroying Spring FrameworkServlet 'dispatcherServlet'
2024-09-02 17:31:12,707 INFO  [main] o.a.c.h.Http11NioProtocol - Stopping ProtocolHandler ["http-nio-auto-1"]
2024-09-02 17:31:12,711 INFO  [main] o.a.c.h.Http11NioProtocol - Destroying ProtocolHandler ["http-nio-auto-1"]
[[1;31mERROR[m] [1;31mTests [0;1mrun: [0;1m14[m, [1;31mFailures: [0;1;31m6[m, Errors: 0, Skipped: 0, Time elapsed: 15.89 s[1;31m <<< FAILURE![m - in market.[1mrun01_RestExceptionHandlerTest[m
[[1;31mERROR[m] testGetCustomerNotFound  Time elapsed: 1.412 s  <<< FAILURE!
java.lang.AssertionError: 
1 expectation failed.
Expected status code <404> but was <401>.

	at market.run01_RestExceptionHandlerTest.testGetCustomerNotFound(run01_RestExceptionHandlerTest.java:64)

[[1;31mERROR[m] testGetContactsNotFound  Time elapsed: 0.103 s  <<< FAILURE!
java.lang.AssertionError: 
1 expectation failed.
Expected status code <404> but was <401>.

	at market.run01_RestExceptionHandlerTest.testGetContactsNotFound(run01_RestExceptionHandlerTest.java:123)

[[1;31mERROR[m] testInternalServerError  Time elapsed: 0.046 s  <<< FAILURE!
java.lang.AssertionError: 
1 expectation failed.
Expected status code <500> but was <404>.

	at market.run01_RestExceptionHandlerTest.testInternalServerError(run01_RestExceptionHandlerTest.java:192)

[[1;31mERROR[m] testGetProductsUnauthorized  Time elapsed: 0.376 s  <<< FAILURE!
java.lang.AssertionError: 
1 expectation failed.
Expected status code <401> but was <200>.

	at market.run01_RestExceptionHandlerTest.testGetProductsUnauthorized(run01_RestExceptionHandlerTest.java:162)

[[1;31mERROR[m] testGetOrderNotFound  Time elapsed: 0.041 s  <<< FAILURE!
java.lang.AssertionError: 
1 expectation failed.
Expected status code <404> but was <401>.

	at market.run01_RestExceptionHandlerTest.testGetOrderNotFound(run01_RestExceptionHandlerTest.java:153)

[[1;31mERROR[m] testPayByCardWithoutAuth  Time elapsed: 0.053 s  <<< FAILURE!
java.lang.AssertionError: 
1 expectation failed.
Expected status code <401> but was <406>.

	at market.run01_RestExceptionHandlerTest.testPayByCardWithoutAuth(run01_RestExceptionHandlerTest.java:114)

2024-09-02 17:31:12,942 INFO  [SpringContextShutdownHook] o.s.s.c.ThreadPoolTaskExecutor - Shutting down ExecutorService 'applicationTaskExecutor'
2024-09-02 17:31:12,954 INFO  [SpringContextShutdownHook] o.s.o.j.LocalContainerEntityManagerFactoryBean - Closing JPA EntityManagerFactory for persistence unit 'default'
2024-09-02 17:31:12,956 INFO  [SpringContextShutdownHook] c.z.h.HikariDataSource - HikariPool-1 - Shutdown initiated...
2024-09-02 17:31:12,959 INFO  [SpringContextShutdownHook] c.z.h.HikariDataSource - HikariPool-1 - Shutdown completed.
[[1;34mINFO[m] 
[[1;34mINFO[m] Results:
[[1;34mINFO[m] 
[[1;31mERROR[m] [1;31mFailures: [m
[[1;31mERROR[m] [1;31m  run01_RestExceptionHandlerTest.testGetContactsNotFound:123 1 expectation failed.
Expected status code <404> but was <401>.
[m
[[1;31mERROR[m] [1;31m  run01_RestExceptionHandlerTest.testGetCustomerNotFound:64 1 expectation failed.
Expected status code <404> but was <401>.
[m
[[1;31mERROR[m] [1;31m  run01_RestExceptionHandlerTest.testGetOrderNotFound:153 1 expectation failed.
Expected status code <404> but was <401>.
[m
[[1;31mERROR[m] [1;31m  run01_RestExceptionHandlerTest.testGetProductsUnauthorized:162 1 expectation failed.
Expected status code <401> but was <200>.
[m
[[1;31mERROR[m] [1;31m  run01_RestExceptionHandlerTest.testInternalServerError:192 1 expectation failed.
Expected status code <500> but was <404>.
[m
[[1;31mERROR[m] [1;31m  run01_RestExceptionHandlerTest.testPayByCardWithoutAuth:114 1 expectation failed.
Expected status code <401> but was <406>.
[m
[[1;34mINFO[m] 
[[1;31mERROR[m] [1;31mTests run: 14, Failures: 6, Errors: 0, Skipped: 0[m
[[1;34mINFO[m] 
[[1;34mINFO[m] [1m------------------------------------------------------------------------[m
[[1;34mINFO[m] [1;31mBUILD FAILURE[m
[[1;34mINFO[m] [1m------------------------------------------------------------------------[m
[[1;34mINFO[m] Total time:  21.108 s
[[1;34mINFO[m] Finished at: 2024-09-02T17:31:13-03:00
[[1;34mINFO[m] [1m------------------------------------------------------------------------[m
[[1;31mERROR[m] Failed to execute goal [32morg.apache.maven.plugins:maven-surefire-plugin:2.22.0:test[m [1m(default-test)[m on project [36mmarket-rest[m: [1;31mThere are test failures.[m
[[1;31mERROR[m] [1;31m[m
[[1;31mERROR[m] [1;31mPlease refer to /media/rincon/63999417195/eclipse-workspace/EMB-master/jdk_11_maven/cs/rest-gui/market/market-rest/target/surefire-reports for the individual test results.[m
[[1;31mERROR[m] [1;31mPlease refer to dump files (if any exist) [date]-jvmRun[N].dump, [date].dumpstream and [date]-jvmRun[N].dumpstream.[m
[[1;31mERROR[m] -> [1m[Help 1][m
[[1;31mERROR[m] 
[[1;31mERROR[m] To see the full stack trace of the errors, re-run Maven with the [1m-e[m switch.
[[1;31mERROR[m] Re-run Maven using the [1m-X[m switch to enable full debug logging.
[[1;31mERROR[m] 
[[1;31mERROR[m] For more information about the errors and possible solutions, please read the following articles:
[[1;31mERROR[m] [1m[Help 1][m http://cwiki.apache.org/confluence/display/MAVEN/MojoFailureException

#####
