[[1;34mINFO[m] Scanning for projects...
[[1;34mINFO[m] 
[[1;34mINFO[m] [1m---------------------< [0;36mnet.lukyanets:market-rest[0;1m >----------------------[m
[[1;34mINFO[m] [1mBuilding market-rest 0.1.2[m
[[1;34mINFO[m] [1m--------------------------------[ jar ]---------------------------------[m
[[1;33mWARNING[m] The POM for com.sun.xml.bind:jaxb-osgi:jar:2.2.10 is invalid, transitive dependencies (if any) will not be available, enable debug logging for more details
[[1;34mINFO[m] 
[[1;34mINFO[m] [1m--- [0;32mmaven-clean-plugin:2.5:clean[m [1m(default-clean)[m @ [36mmarket-rest[0;1m ---[m
[[1;34mINFO[m] Deleting /media/rincon/63999417195/eclipse-workspace/EMB-master/jdk_11_maven/cs/rest-gui/market/market-rest/target
[[1;34mINFO[m] 
[[1;34mINFO[m] [1m--- [0;32mjacoco-maven-plugin:0.8.7:prepare-agent[m [1m(default)[m @ [36mmarket-rest[0;1m ---[m
[[1;34mINFO[m] argLine set to -javaagent:/home/rincon/.m2/repository/org/jacoco/org.jacoco.agent/0.8.7/org.jacoco.agent-0.8.7-runtime.jar=destfile=/media/rincon/63999417195/eclipse-workspace/EMB-master/jdk_11_maven/cs/rest-gui/market/market-rest/target/jacoco.exec
[[1;34mINFO[m] 
[[1;34mINFO[m] [1m--- [0;32mspring-boot-maven-plugin:2.4.3:build-info[m [1m(default)[m @ [36mmarket-rest[0;1m ---[m
[[1;34mINFO[m] 
[[1;34mINFO[m] [1m--- [0;32mmaven-resources-plugin:2.6:resources[m [1m(default-resources)[m @ [36mmarket-rest[0;1m ---[m
[[1;34mINFO[m] Using 'UTF-8' encoding to copy filtered resources.
[[1;34mINFO[m] Copying 3 resources
[[1;34mINFO[m] 
[[1;34mINFO[m] [1m--- [0;32mmaven-compiler-plugin:3.8.0:compile[m [1m(default-compile)[m @ [36mmarket-rest[0;1m ---[m
[[1;34mINFO[m] Changes detected - recompiling the module!
[[1;34mINFO[m] Compiling 11 source files to /media/rincon/63999417195/eclipse-workspace/EMB-master/jdk_11_maven/cs/rest-gui/market/market-rest/target/classes
[[1;34mINFO[m] 
[[1;34mINFO[m] [1m--- [0;32mjacoco-maven-plugin:0.8.7:prepare-agent[m [1m(default)[m @ [36mmarket-rest[0;1m ---[m
[[1;34mINFO[m] argLine set to -javaagent:/home/rincon/.m2/repository/org/jacoco/org.jacoco.agent/0.8.7/org.jacoco.agent-0.8.7-runtime.jar=destfile=/media/rincon/63999417195/eclipse-workspace/EMB-master/jdk_11_maven/cs/rest-gui/market/market-rest/target/jacoco.exec
[[1;34mINFO[m] 
[[1;34mINFO[m] [1m--- [0;32mspring-boot-maven-plugin:2.4.3:build-info[m [1m(default)[m @ [36mmarket-rest[0;1m ---[m
[[1;34mINFO[m] 
[[1;34mINFO[m] [1m--- [0;32mmaven-resources-plugin:2.6:resources[m [1m(default-resources)[m @ [36mmarket-rest[0;1m ---[m
[[1;34mINFO[m] Using 'UTF-8' encoding to copy filtered resources.
[[1;34mINFO[m] Copying 3 resources
[[1;34mINFO[m] 
[[1;34mINFO[m] [1m--- [0;32mmaven-compiler-plugin:3.8.0:compile[m [1m(default-compile)[m @ [36mmarket-rest[0;1m ---[m
[[1;34mINFO[m] Nothing to compile - all classes are up to date
[[1;34mINFO[m] 
[[1;34mINFO[m] [1m--- [0;32mmaven-resources-plugin:2.6:testResources[m [1m(default-testResources)[m @ [36mmarket-rest[0;1m ---[m
[[1;34mINFO[m] Using 'UTF-8' encoding to copy filtered resources.
[[1;34mINFO[m] skip non existing resourceDirectory /media/rincon/63999417195/eclipse-workspace/EMB-master/jdk_11_maven/cs/rest-gui/market/market-rest/src/test/resources
[[1;34mINFO[m] 
[[1;34mINFO[m] [1m--- [0;32mmaven-compiler-plugin:3.8.0:testCompile[m [1m(default-testCompile)[m @ [36mmarket-rest[0;1m ---[m
[[1;34mINFO[m] Changes detected - recompiling the module!
[[1;34mINFO[m] Compiling 1 source file to /media/rincon/63999417195/eclipse-workspace/EMB-master/jdk_11_maven/cs/rest-gui/market/market-rest/target/test-classes
[[1;34mINFO[m] 
[[1;34mINFO[m] [1m--- [0;32mjacoco-maven-plugin:0.8.7:prepare-agent[m [1m(default)[m @ [36mmarket-rest[0;1m ---[m
[[1;34mINFO[m] argLine set to -javaagent:/home/rincon/.m2/repository/org/jacoco/org.jacoco.agent/0.8.7/org.jacoco.agent-0.8.7-runtime.jar=destfile=/media/rincon/63999417195/eclipse-workspace/EMB-master/jdk_11_maven/cs/rest-gui/market/market-rest/target/jacoco.exec
[[1;34mINFO[m] 
[[1;34mINFO[m] [1m--- [0;32mspring-boot-maven-plugin:2.4.3:build-info[m [1m(default)[m @ [36mmarket-rest[0;1m ---[m
[[1;34mINFO[m] 
[[1;34mINFO[m] [1m--- [0;32mmaven-resources-plugin:2.6:resources[m [1m(default-resources)[m @ [36mmarket-rest[0;1m ---[m
[[1;34mINFO[m] Using 'UTF-8' encoding to copy filtered resources.
[[1;34mINFO[m] Copying 3 resources
[[1;34mINFO[m] 
[[1;34mINFO[m] [1m--- [0;32mmaven-compiler-plugin:3.8.0:compile[m [1m(default-compile)[m @ [36mmarket-rest[0;1m ---[m
[[1;34mINFO[m] Nothing to compile - all classes are up to date
[[1;34mINFO[m] 
[[1;34mINFO[m] [1m--- [0;32mmaven-resources-plugin:2.6:testResources[m [1m(default-testResources)[m @ [36mmarket-rest[0;1m ---[m
[[1;34mINFO[m] Using 'UTF-8' encoding to copy filtered resources.
[[1;34mINFO[m] skip non existing resourceDirectory /media/rincon/63999417195/eclipse-workspace/EMB-master/jdk_11_maven/cs/rest-gui/market/market-rest/src/test/resources
[[1;34mINFO[m] 
[[1;34mINFO[m] [1m--- [0;32mmaven-compiler-plugin:3.8.0:testCompile[m [1m(default-testCompile)[m @ [36mmarket-rest[0;1m ---[m
[[1;34mINFO[m] Nothing to compile - all classes are up to date
[[1;34mINFO[m] 
[[1;34mINFO[m] [1m--- [0;32mmaven-surefire-plugin:2.22.0:test[m [1m(default-test)[m @ [36mmarket-rest[0;1m ---[m
[[1;34mINFO[m] 
[[1;34mINFO[m] -------------------------------------------------------
[[1;34mINFO[m]  T E S T S
[[1;34mINFO[m] -------------------------------------------------------
[[1;34mINFO[m] Running market.[1mv1_gpt4o_run03_RestExceptionHandlerTest[m

  .   ____          _            __ _ _
 /\\ / ___'_ __ _ _(_)_ __  __ _ \ \ \ \
( ( )\___ | '_ | '_| | '_ \/ _` | \ \ \ \
 \\/  ___)| |_)| | | | | || (_| |  ) ) ) )
  '  |____| .__|_| |_|_| |_\__, | / / / /
 =========|_|==============|___/=/_/_/_/
 :: Spring Boot ::                (v2.4.3)

2024-09-12 16:31:10,808 INFO  [background-preinit] o.h.v.i.u.Version - HV000001: Hibernate Validator 6.1.7.Final
2024-09-12 16:31:10,923 INFO  [main] o.a.m.s.b.ForkedBooter - Starting ForkedBooter v2.22.0 using Java 11.0.20 on IFTO-PROBOOK with PID 21668 (started by rincon in /media/rincon/63999417195/eclipse-workspace/EMB-master/jdk_11_maven/cs/rest-gui/market/market-rest)
2024-09-12 16:31:10,931 INFO  [main] o.a.m.s.b.ForkedBooter - No active profile set, falling back to default profiles: default
2024-09-12 16:31:11,562 WARN  [main] o.s.b.c.c.ConfigDataEnvironment - Property 'spring.profiles' imported from location 'class path resource [application.yml]' is invalid and should be replaced with 'spring.config.activate.on-profile' [origin: class path resource [application.yml] - 34:13]
2024-09-12 16:31:11,562 WARN  [main] o.s.b.c.c.ConfigDataEnvironment - Property 'spring.profiles' imported from location 'class path resource [application.yml]' is invalid and should be replaced with 'spring.config.activate.on-profile' [origin: class path resource [application.yml] - 24:13]
2024-09-12 16:31:12,974 INFO  [main] o.s.d.r.c.RepositoryConfigurationDelegate - Bootstrapping Spring Data JPA repositories in DEFAULT mode.
2024-09-12 16:31:13,097 INFO  [main] o.s.d.r.c.RepositoryConfigurationDelegate - Finished Spring Data repository scanning in 111 ms. Found 8 JPA repository interfaces.
2024-09-12 16:31:13,643 INFO  [main] o.s.c.s.PostProcessorRegistrationDelegate$BeanPostProcessorChecker - Bean 'market.DataConfig' of type [market.DataConfig$$EnhancerBySpringCGLIB$$e9408a7e] is not eligible for getting processed by all BeanPostProcessors (for example: not eligible for auto-proxying)
2024-09-12 16:31:13,865 INFO  [main] o.s.c.s.PostProcessorRegistrationDelegate$BeanPostProcessorChecker - Bean 'org.springframework.security.access.expression.method.DefaultMethodSecurityExpressionHandler@8cb69b2' of type [org.springframework.security.access.expression.method.DefaultMethodSecurityExpressionHandler] is not eligible for getting processed by all BeanPostProcessors (for example: not eligible for auto-proxying)
2024-09-12 16:31:13,876 INFO  [main] o.s.c.s.PostProcessorRegistrationDelegate$BeanPostProcessorChecker - Bean 'methodSecurityMetadataSource' of type [org.springframework.security.access.method.DelegatingMethodSecurityMetadataSource] is not eligible for getting processed by all BeanPostProcessors (for example: not eligible for auto-proxying)
2024-09-12 16:31:14,480 INFO  [main] o.s.b.w.e.t.TomcatWebServer - Tomcat initialized with port(s): 0 (http)
2024-09-12 16:31:14,500 INFO  [main] o.a.c.h.Http11NioProtocol - Initializing ProtocolHandler ["http-nio-auto-1"]
2024-09-12 16:31:14,501 INFO  [main] o.a.c.c.StandardService - Starting service [Tomcat]
2024-09-12 16:31:14,501 INFO  [main] o.a.c.c.StandardEngine - Starting Servlet engine: [Apache Tomcat/9.0.43]
2024-09-12 16:31:14,645 INFO  [main] o.a.c.c.C.[.[.[/] - Initializing Spring embedded WebApplicationContext
2024-09-12 16:31:14,645 INFO  [main] o.s.b.w.s.c.ServletWebServerApplicationContext - Root WebApplicationContext: initialization completed in 3079 ms
2024-09-12 16:31:14,856 INFO  [main] c.z.h.HikariDataSource - HikariPool-1 - Starting...
2024-09-12 16:31:15,300 INFO  [main] c.z.h.HikariDataSource - HikariPool-1 - Start completed.
2024-09-12 16:31:15,566 INFO  [main] o.h.j.i.u.LogHelper - HHH000204: Processing PersistenceUnitInfo [name: default]
2024-09-12 16:31:15,665 INFO  [main] o.h.Version - HHH000412: Hibernate ORM core version 5.4.28.Final
2024-09-12 16:31:15,867 INFO  [main] o.h.a.c.Version - HCANN000001: Hibernate Commons Annotations {5.1.2.Final}
2024-09-12 16:31:16,264 INFO  [main] o.h.d.Dialect - HHH000400: Using dialect: org.hibernate.dialect.H2Dialect
2024-09-12 16:31:16,643 WARN  [main] o.h.b.i.InFlightMetadataCollectorImpl - HHH000069: Duplicate generator name gen
2024-09-12 16:31:16,646 WARN  [main] o.h.b.i.InFlightMetadataCollectorImpl - HHH000069: Duplicate generator name gen
2024-09-12 16:31:17,477 INFO  [main] o.h.e.t.j.p.i.JtaPlatformInitiator - HHH000490: Using JtaPlatform implementation: [org.hibernate.engine.transaction.jta.platform.internal.NoJtaPlatform]
2024-09-12 16:31:17,489 INFO  [main] o.s.o.j.LocalContainerEntityManagerFactoryBean - Initialized JPA EntityManagerFactory for persistence unit 'default'
2024-09-12 16:31:18,739 WARN  [main] o.s.b.a.o.j.JpaBaseConfiguration$JpaWebConfiguration - spring.jpa.open-in-view is enabled by default. Therefore, database queries may be performed during view rendering. Explicitly configure spring.jpa.open-in-view to disable this warning
2024-09-12 16:31:19,761 INFO  [main] o.s.s.w.DefaultSecurityFilterChain - Will secure any request with [org.springframework.security.web.context.request.async.WebAsyncManagerIntegrationFilter@3c8677b2, org.springframework.security.web.context.SecurityContextPersistenceFilter@11dd23c8, org.springframework.security.web.header.HeaderWriterFilter@16bd7428, org.springframework.security.web.authentication.logout.LogoutFilter@60c9d0a3, org.springframework.security.web.authentication.www.BasicAuthenticationFilter@51b0e667, org.springframework.security.web.savedrequest.RequestCacheAwareFilter@7cee1726, org.springframework.security.web.servletapi.SecurityContextHolderAwareRequestFilter@1be92690, org.springframework.security.web.authentication.AnonymousAuthenticationFilter@207618f0, org.springframework.security.web.session.SessionManagementFilter@68fc4fe2, org.springframework.security.web.access.ExceptionTranslationFilter@6f9166e3, org.springframework.security.web.access.intercept.FilterSecurityInterceptor@7d106730]
2024-09-12 16:31:19,932 INFO  [main] o.s.s.c.ThreadPoolTaskExecutor - Initializing ExecutorService 'applicationTaskExecutor'
2024-09-12 16:31:20,456 INFO  [main] o.a.c.h.Http11NioProtocol - Starting ProtocolHandler ["http-nio-auto-1"]
2024-09-12 16:31:20,494 INFO  [main] o.s.b.w.e.t.TomcatWebServer - Tomcat started on port(s): 45153 (http) with context path ''
2024-09-12 16:31:21,140 INFO  [main] o.a.m.s.b.ForkedBooter - Started ForkedBooter in 11.198 seconds (JVM running for 13.565)
2024-09-12 16:31:23,227 INFO  [http-nio-auto-1-exec-1] o.a.c.c.C.[.[.[/] - Initializing Spring DispatcherServlet 'dispatcherServlet'
2024-09-12 16:31:23,227 INFO  [http-nio-auto-1-exec-1] o.s.w.s.DispatcherServlet - Initializing Servlet 'dispatcherServlet'
2024-09-12 16:31:23,229 INFO  [http-nio-auto-1-exec-1] o.s.w.s.DispatcherServlet - Completed initialization in 1 ms
2024-09-12 16:31:24,312 WARN  [http-nio-auto-1-exec-3] m.r.e.RestExceptionHandler - RestErrorResponse{message='Argument validation error', entityName='UserAccount', description='uri=/register', fieldErrors=[{field='email', message='Account with this email already exists'}]}
Request method:	POST
Request URI:	http://localhost:45153/register
Proxy:			<none>
Request params:	<none>
Query params:	<none>
Form params:	<none>
Path params:	<none>
Headers:		Accept=*/*
				Content-Type=application/json; charset=UTF-8
Cookies:		<none>
Multiparts:		<none>
Body:
{
    "email": "ivan.petrov@yandex.ru",
    "password": "petrov",
    "name": "Ivan Petrov",
    "phone": "+7 123 456 78 90",
    "address": "Riesstrasse 18"
}

HTTP/1.1 406 
X-Content-Type-Options: nosniff
X-XSS-Protection: 1; mode=block
Cache-Control: no-cache, no-store, max-age=0, must-revalidate
Pragma: no-cache
Expires: 0
Content-Type: application/json
Transfer-Encoding: chunked
Date: Thu, 12 Sep 2024 19:31:23 GMT
Keep-Alive: timeout=60
Connection: keep-alive

{
    "message": "Argument validation error",
    "description": "uri=/register",
    "entityName": "UserAccount",
    "fieldErrors": [
        {
            "field": "email",
            "message": "Account with this email already exists"
        }
    ]
}
2024-09-12 16:31:24,524 INFO  [main] o.a.c.h.Http11NioProtocol - Pausing ProtocolHandler ["http-nio-auto-1"]
2024-09-12 16:31:24,525 INFO  [main] o.a.c.c.StandardService - Stopping service [Tomcat]
2024-09-12 16:31:24,526 INFO  [main] o.a.c.c.C.[.[.[/] - Destroying Spring FrameworkServlet 'dispatcherServlet'
2024-09-12 16:31:24,530 INFO  [main] o.a.c.h.Http11NioProtocol - Stopping ProtocolHandler ["http-nio-auto-1"]
2024-09-12 16:31:24,534 INFO  [main] o.a.c.h.Http11NioProtocol - Destroying ProtocolHandler ["http-nio-auto-1"]
[[1;31mERROR[m] [1;31mTests [0;1mrun: [0;1m15[m, [1;31mFailures: [0;1;31m1[m, [1;31mErrors: [0;1;31m11[m, Skipped: 0, Time elapsed: 15.864 s[1;31m <<< FAILURE![m - in market.[1mv1_gpt4o_run03_RestExceptionHandlerTest[m
[[1;31mERROR[m] testSetDelivery  Time elapsed: 0.547 s  <<< ERROR!
java.lang.IllegalArgumentException: Illegal character in query at index 47: /customer/cart/delivery?included=true&name=Ivan Petrov
	at market.v1_gpt4o_run03_RestExceptionHandlerTest.testSetDelivery(v1_gpt4o_run03_RestExceptionHandlerTest.java:131)
Caused by: java.net.URISyntaxException: Illegal character in query at index 47: /customer/cart/delivery?included=true&name=Ivan Petrov
	at market.v1_gpt4o_run03_RestExceptionHandlerTest.testSetDelivery(v1_gpt4o_run03_RestExceptionHandlerTest.java:131)

[[1;31mERROR[m] testGetCustomerNotFound  Time elapsed: 0.016 s  <<< ERROR!
java.lang.IllegalArgumentException: Illegal character in query at index 26: /customer?name=NonExistent User
	at market.v1_gpt4o_run03_RestExceptionHandlerTest.testGetCustomerNotFound(v1_gpt4o_run03_RestExceptionHandlerTest.java:86)
Caused by: java.net.URISyntaxException: Illegal character in query at index 26: /customer?name=NonExistent User
	at market.v1_gpt4o_run03_RestExceptionHandlerTest.testGetCustomerNotFound(v1_gpt4o_run03_RestExceptionHandlerTest.java:86)

[[1;31mERROR[m] testGetOrder  Time elapsed: 0.025 s  <<< ERROR!
java.lang.IllegalArgumentException: Illegal character in query at index 28: /customer/orders/1?name=Ivan Petrov
	at market.v1_gpt4o_run03_RestExceptionHandlerTest.testGetOrder(v1_gpt4o_run03_RestExceptionHandlerTest.java:188)
Caused by: java.net.URISyntaxException: Illegal character in query at index 28: /customer/orders/1?name=Ivan Petrov
	at market.v1_gpt4o_run03_RestExceptionHandlerTest.testGetOrder(v1_gpt4o_run03_RestExceptionHandlerTest.java:188)

[[1;31mERROR[m] testUpdateContacts  Time elapsed: 0.019 s  <<< ERROR!
java.lang.IllegalArgumentException: Illegal character in query at index 28: /customer/contacts?name=Ivan Petrov
	at market.v1_gpt4o_run03_RestExceptionHandlerTest.testUpdateContacts(v1_gpt4o_run03_RestExceptionHandlerTest.java:167)
Caused by: java.net.URISyntaxException: Illegal character in query at index 28: /customer/contacts?name=Ivan Petrov
	at market.v1_gpt4o_run03_RestExceptionHandlerTest.testUpdateContacts(v1_gpt4o_run03_RestExceptionHandlerTest.java:167)

[[1;31mERROR[m] testPayByCard  Time elapsed: 0.027 s  <<< ERROR!
java.lang.IllegalArgumentException: Illegal character in query at index 28: /customer/cart/pay?name=Ivan Petrov
	at market.v1_gpt4o_run03_RestExceptionHandlerTest.testPayByCard(v1_gpt4o_run03_RestExceptionHandlerTest.java:144)
Caused by: java.net.URISyntaxException: Illegal character in query at index 28: /customer/cart/pay?name=Ivan Petrov
	at market.v1_gpt4o_run03_RestExceptionHandlerTest.testPayByCard(v1_gpt4o_run03_RestExceptionHandlerTest.java:144)

[[1;31mERROR[m] testClearCart  Time elapsed: 0.018 s  <<< ERROR!
java.lang.IllegalArgumentException: Illegal character in query at index 24: /customer/cart?name=Ivan Petrov
	at market.v1_gpt4o_run03_RestExceptionHandlerTest.testClearCart(v1_gpt4o_run03_RestExceptionHandlerTest.java:119)
Caused by: java.net.URISyntaxException: Illegal character in query at index 24: /customer/cart?name=Ivan Petrov
	at market.v1_gpt4o_run03_RestExceptionHandlerTest.testClearCart(v1_gpt4o_run03_RestExceptionHandlerTest.java:119)

[[1;31mERROR[m] testGetCart  Time elapsed: 0.025 s  <<< ERROR!
java.lang.IllegalArgumentException: Illegal character in query at index 24: /customer/cart?name=Ivan Petrov
	at market.v1_gpt4o_run03_RestExceptionHandlerTest.testGetCart(v1_gpt4o_run03_RestExceptionHandlerTest.java:96)
Caused by: java.net.URISyntaxException: Illegal character in query at index 24: /customer/cart?name=Ivan Petrov
	at market.v1_gpt4o_run03_RestExceptionHandlerTest.testGetCart(v1_gpt4o_run03_RestExceptionHandlerTest.java:96)

[[1;31mERROR[m] testAddItemToCart  Time elapsed: 0.025 s  <<< ERROR!
java.lang.IllegalArgumentException: Illegal character in query at index 24: /customer/cart?name=Ivan Petrov
	at market.v1_gpt4o_run03_RestExceptionHandlerTest.testAddItemToCart(v1_gpt4o_run03_RestExceptionHandlerTest.java:109)
Caused by: java.net.URISyntaxException: Illegal character in query at index 24: /customer/cart?name=Ivan Petrov
	at market.v1_gpt4o_run03_RestExceptionHandlerTest.testAddItemToCart(v1_gpt4o_run03_RestExceptionHandlerTest.java:109)

[[1;31mERROR[m] testCreateCustomer  Time elapsed: 0.395 s  <<< FAILURE!
java.lang.AssertionError: 
1 expectation failed.
Expected status code <201> but was <406>.

	at market.v1_gpt4o_run03_RestExceptionHandlerTest.testCreateCustomer(v1_gpt4o_run03_RestExceptionHandlerTest.java:221)

[[1;31mERROR[m] testGetContacts  Time elapsed: 0.011 s  <<< ERROR!
java.lang.IllegalArgumentException: Illegal character in query at index 28: /customer/contacts?name=Ivan Petrov
	at market.v1_gpt4o_run03_RestExceptionHandlerTest.testGetContacts(v1_gpt4o_run03_RestExceptionHandlerTest.java:154)
Caused by: java.net.URISyntaxException: Illegal character in query at index 28: /customer/contacts?name=Ivan Petrov
	at market.v1_gpt4o_run03_RestExceptionHandlerTest.testGetContacts(v1_gpt4o_run03_RestExceptionHandlerTest.java:154)

[[1;31mERROR[m] testGetOrders  Time elapsed: 0.013 s  <<< ERROR!
java.lang.IllegalArgumentException: Illegal character in query at index 26: /customer/orders?name=Ivan Petrov
	at market.v1_gpt4o_run03_RestExceptionHandlerTest.testGetOrders(v1_gpt4o_run03_RestExceptionHandlerTest.java:177)
Caused by: java.net.URISyntaxException: Illegal character in query at index 26: /customer/orders?name=Ivan Petrov
	at market.v1_gpt4o_run03_RestExceptionHandlerTest.testGetOrders(v1_gpt4o_run03_RestExceptionHandlerTest.java:177)

[[1;31mERROR[m] testGetCustomer  Time elapsed: 0.012 s  <<< ERROR!
java.lang.IllegalArgumentException: Illegal character in query at index 19: /customer?name=Ivan Petrov
	at market.v1_gpt4o_run03_RestExceptionHandlerTest.testGetCustomer(v1_gpt4o_run03_RestExceptionHandlerTest.java:67)
Caused by: java.net.URISyntaxException: Illegal character in query at index 19: /customer?name=Ivan Petrov
	at market.v1_gpt4o_run03_RestExceptionHandlerTest.testGetCustomer(v1_gpt4o_run03_RestExceptionHandlerTest.java:67)

2024-09-12 16:31:24,616 INFO  [SpringContextShutdownHook] o.s.s.c.ThreadPoolTaskExecutor - Shutting down ExecutorService 'applicationTaskExecutor'
2024-09-12 16:31:24,630 INFO  [SpringContextShutdownHook] o.s.o.j.LocalContainerEntityManagerFactoryBean - Closing JPA EntityManagerFactory for persistence unit 'default'
2024-09-12 16:31:24,631 INFO  [SpringContextShutdownHook] c.z.h.HikariDataSource - HikariPool-1 - Shutdown initiated...
2024-09-12 16:31:24,643 INFO  [SpringContextShutdownHook] c.z.h.HikariDataSource - HikariPool-1 - Shutdown completed.
[[1;34mINFO[m] 
[[1;34mINFO[m] Results:
[[1;34mINFO[m] 
[[1;31mERROR[m] [1;31mFailures: [m
[[1;31mERROR[m] [1;31m  v1_gpt4o_run03_RestExceptionHandlerTest.testCreateCustomer:221 1 expectation failed.
Expected status code <201> but was <406>.
[m
[[1;31mERROR[m] [1;31mErrors: [m
[[1;31mERROR[m] [1;31m  v1_gpt4o_run03_RestExceptionHandlerTest.testAddItemToCart:109 » IllegalArgument[m
[[1;31mERROR[m] [1;31m  v1_gpt4o_run03_RestExceptionHandlerTest.testClearCart:119 » IllegalArgument Il...[m
[[1;31mERROR[m] [1;31m  v1_gpt4o_run03_RestExceptionHandlerTest.testGetCart:96 » IllegalArgument Illeg...[m
[[1;31mERROR[m] [1;31m  v1_gpt4o_run03_RestExceptionHandlerTest.testGetContacts:154 » IllegalArgument ...[m
[[1;31mERROR[m] [1;31m  v1_gpt4o_run03_RestExceptionHandlerTest.testGetCustomer:67 » IllegalArgument I...[m
[[1;31mERROR[m] [1;31m  v1_gpt4o_run03_RestExceptionHandlerTest.testGetCustomerNotFound:86 » IllegalArgument[m
[[1;31mERROR[m] [1;31m  v1_gpt4o_run03_RestExceptionHandlerTest.testGetOrder:188 » IllegalArgument Ill...[m
[[1;31mERROR[m] [1;31m  v1_gpt4o_run03_RestExceptionHandlerTest.testGetOrders:177 » IllegalArgument Il...[m
[[1;31mERROR[m] [1;31m  v1_gpt4o_run03_RestExceptionHandlerTest.testPayByCard:144 » IllegalArgument Il...[m
[[1;31mERROR[m] [1;31m  v1_gpt4o_run03_RestExceptionHandlerTest.testSetDelivery:131 » IllegalArgument ...[m
[[1;31mERROR[m] [1;31m  v1_gpt4o_run03_RestExceptionHandlerTest.testUpdateContacts:167 » IllegalArgument[m
[[1;34mINFO[m] 
[[1;31mERROR[m] [1;31mTests run: 15, Failures: 1, Errors: 11, Skipped: 0[m
[[1;34mINFO[m] 
[[1;34mINFO[m] [1m------------------------------------------------------------------------[m
[[1;34mINFO[m] [1;31mBUILD FAILURE[m
[[1;34mINFO[m] [1m------------------------------------------------------------------------[m
[[1;34mINFO[m] Total time:  21.216 s
[[1;34mINFO[m] Finished at: 2024-09-12T16:31:25-03:00
[[1;34mINFO[m] [1m------------------------------------------------------------------------[m
[[1;31mERROR[m] Failed to execute goal [32morg.apache.maven.plugins:maven-surefire-plugin:2.22.0:test[m [1m(default-test)[m on project [36mmarket-rest[m: [1;31mThere are test failures.[m
[[1;31mERROR[m] [1;31m[m
[[1;31mERROR[m] [1;31mPlease refer to /media/rincon/63999417195/eclipse-workspace/EMB-master/jdk_11_maven/cs/rest-gui/market/market-rest/target/surefire-reports for the individual test results.[m
[[1;31mERROR[m] [1;31mPlease refer to dump files (if any exist) [date]-jvmRun[N].dump, [date].dumpstream and [date]-jvmRun[N].dumpstream.[m
[[1;31mERROR[m] -> [1m[Help 1][m
[[1;31mERROR[m] 
[[1;31mERROR[m] To see the full stack trace of the errors, re-run Maven with the [1m-e[m switch.
[[1;31mERROR[m] Re-run Maven using the [1m-X[m switch to enable full debug logging.
[[1;31mERROR[m] 
[[1;31mERROR[m] For more information about the errors and possible solutions, please read the following articles:
[[1;31mERROR[m] [1m[Help 1][m http://cwiki.apache.org/confluence/display/MAVEN/MojoFailureException
