Correct the test code delimited by ***** according to the error messages delimited by ##### and generate another complete code in JUnit 5 format. The response must contain only Java code in JUnit 5 format.

Keep these five instructions for this generated test code:

Instruction 1: Keet this package line to generated test code file:
package market;

Instruction 2: Keep the following Java imports to generated test code file:
import  org.junit.jupiter.api.AfterAll;
import  org.junit.jupiter.api.BeforeAll;
import  org.junit.jupiter.api.BeforeEach;
import  org.junit.jupiter.api.Test;
import  org.junit.jupiter.api.Timeout;
import static org.junit.jupiter.api.Assertions.*;
import  java.util.Map;
import  java.util.List;
import static org.evomaster.client.java.controller.api.EMTestUtils.*;
import  org.evomaster.client.java.controller.SutHandler;
import  io.restassured.RestAssured;
import static io.restassured.RestAssured.given;
import  io.restassured.response.ValidatableResponse;
import static org.evomaster.client.java.sql.dsl.SqlDsl.sql;
import  org.evomaster.client.java.controller.api.dto.database.operations.InsertionResultsDto;
import  org.evomaster.client.java.controller.api.dto.database.operations.InsertionDto;
import static org.hamcrest.Matchers.*;
import  io.restassured.config.JsonConfig;
import  io.restassured.path.json.config.JsonPathConfig;
import static io.restassured.config.RedirectConfig.redirectConfig;
import static org.evomaster.client.java.controller.contentMatchers.NumberMatcher.*;
import static org.evomaster.client.java.controller.contentMatchers.StringMatcher.*;
import static org.evomaster.client.java.controller.contentMatchers.SubStringMatcher.*;
import static org.evomaster.client.java.controller.expect.ExpectationHandler.expectationHandler;
import  org.evomaster.client.java.controller.expect.ExpectationHandler;
import  io.restassured.path.json.JsonPath;
import  java.util.Arrays;

Instruction 3: Keep the class name in this point (between the imports at instruction 2 and instruction 4)

Instruction 4: Keep these variables in the generated test code:
private static final SutHandler controller = new em.embedded.market.EmbeddedEvoMasterController();
private static String baseUrlOfSut;

Instruction 5: Keep the following setup and teardown methods in generated test code file:
@BeforeAll
public static void initClass() {
    controller.setupForGeneratedTest();
    baseUrlOfSut = controller.startSut();
    controller.registerOrExecuteInitSqlCommandsIfNeeded();
    assertNotNull(baseUrlOfSut);
    RestAssured.enableLoggingOfRequestAndResponseIfValidationFails();
    RestAssured.useRelaxedHTTPSValidation();
    RestAssured.urlEncodingEnabled = false;
    RestAssured.config = RestAssured.config()
        .jsonConfig(JsonConfig.jsonConfig().numberReturnType(JsonPathConfig.NumberReturnType.DOUBLE))
        .redirect(redirectConfig().followRedirects(false));
}


@AfterAll
public static void tearDown() {
    controller.stopSut();
}


@BeforeEach
public void initTest() {
    controller.resetDatabase(Arrays.asList("USER_ROLE","CUSTOMER_ORDER","CART_ITEM","PRODUCT","CART","CONTACTS"));
    controller.resetStateOfSUT();
}

*****

package market;

import org.junit.jupiter.api.AfterAll;
import org.junit.jupiter.api.BeforeAll;
import org.junit.jupiter.api.BeforeEach;
import org.junit.jupiter.api.Test;
import org.junit.jupiter.api.Timeout;
import static org.junit.jupiter.api.Assertions.*;
import java.util.Map;
import java.util.List;
import static org.evomaster.client.java.controller.api.EMTestUtils.*;
import org.evomaster.client.java.controller.SutHandler;
import io.restassured.RestAssured;
import static io.restassured.RestAssured.given;
import io.restassured.response.ValidatableResponse;
import static org.hamcrest.Matchers.*;
import io.restassured.config.JsonConfig;
import io.restassured.path.json.config.JsonPathConfig;
import static io.restassured.config.RedirectConfig.redirectConfig;
import static org.evomaster.client.java.sql.dsl.SqlDsl.sql;
import org.evomaster.client.java.controller.api.dto.database.operations.InsertionResultsDto;
import org.evomaster.client.java.controller.api.dto.database.operations.InsertionDto;
import io.restassured.path.json.JsonPath;
import java.util.Arrays;
import io.restassured.module.jsv.JsonSchemaValidator;

public class run01_ContactsRestControllerTest {

    private static final SutHandler controller = new em.embedded.market.EmbeddedEvoMasterController();
    private static String baseUrlOfSut;

    @BeforeAll
    public static void initClass() {
        controller.setupForGeneratedTest();
        baseUrlOfSut = controller.startSut();
        controller.registerOrExecuteInitSqlCommandsIfNeeded();
        assertNotNull(baseUrlOfSut);
        RestAssured.enableLoggingOfRequestAndResponseIfValidationFails();
        RestAssured.useRelaxedHTTPSValidation();
        RestAssured.urlEncodingEnabled = false;
        RestAssured.config = RestAssured.config()
            .jsonConfig(JsonConfig.jsonConfig().numberReturnType(JsonPathConfig.NumberReturnType.DOUBLE))
            .redirect(redirectConfig().followRedirects(false));
    }

    @AfterAll
    public static void tearDown() {
        controller.stopSut();
    }

    @BeforeEach
    public void initTest() {
        controller.resetDatabase(Arrays.asList("USER_ROLE", "CUSTOMER_ORDER", "CART_ITEM", "PRODUCT", "CART", "CONTACTS"));
        controller.resetStateOfSUT();
    }

    @Test
    public void testGetContacts() {
        given().auth().preemptive().basic("ivan.petrov@yandex.ru", "petrov")
            .when().get(baseUrlOfSut + "/customer/contacts")
            .then().statusCode(200)
            .body("address", equalTo("Riesstrasse 18"))
            .body("phone", equalTo("+7 123 456 78 90"));
    }

    @Test
    public void testUpdateContacts() {
        String updatedContactsJson = "{ \"address\": \"New address 123\", \"phone\": \"+7 987 654 32 10\" }";

        given().auth().preemptive().basic("ivan.petrov@yandex.ru", "petrov")
            .contentType("application/json")
            .body(updatedContactsJson)
            .when().put(baseUrlOfSut + "/customer/contacts")
            .then().statusCode(200)
            .body("address", equalTo("New address 123"))
            .body("phone", equalTo("+7 987 654 32 10"));
    }

    @Test
    public void testUpdateContactsInvalidPhone() {
        String invalidContactsJson = "{ \"address\": \"New address 123\", \"phone\": \"invalid-phone\" }";

        given().auth().preemptive().basic("ivan.petrov@yandex.ru", "petrov")
            .contentType("application/json")
            .body(invalidContactsJson)
            .when().put(baseUrlOfSut + "/customer/contacts")
            .then().statusCode(400); // Assuming validation will fail and return 400 Bad Request
    }

    @Test
    public void testUpdateContactsInternalServerError() {
        String contactsJson = "{ \"address\": \"New address 123\", \"phone\": \"+7 987 654 32 10\" }";

        // Simulate server error by shutting down the controller
        controller.stopSut();
        
        given().auth().preemptive().basic("ivan.petrov@yandex.ru", "petrov")
            .contentType("application/json")
            .body(contactsJson)
            .when().put(baseUrlOfSut + "/customer/contacts")
            .then().statusCode(500);

        // Restart the controller for further tests
        baseUrlOfSut = controller.startSut();
    }

    @Test
    public void testGetContactsUnauthorized() {
        given().when().get(baseUrlOfSut + "/customer/contacts")
            .then().statusCode(401);
    }

    @Test
    public void testUpdateContactsUnauthorized() {
        String contactsJson = "{ \"address\": \"New address 123\", \"phone\": \"+7 987 654 32 10\" }";

        given().contentType("application/json")
            .body(contactsJson)
            .when().put(baseUrlOfSut + "/customer/contacts")
            .then().statusCode(401);
    }

    @Test
    public void testSchemaValidationOnGetContacts() {
        given().auth().preemptive().basic("ivan.petrov@yandex.ru", "petrov")
            .when().get(baseUrlOfSut + "/customer/contacts")
            .then().statusCode(200)
            .body(JsonSchemaValidator.matchesJsonSchemaInClasspath("schemas/ContactsDTORes.json"));
    }
}

*****
#####
[[1;34mINFO[m] Scanning for projects...
[[1;34mINFO[m] 
[[1;34mINFO[m] [1m---------------------< [0;36mnet.lukyanets:market-rest[0;1m >----------------------[m
[[1;34mINFO[m] [1mBuilding market-rest 0.1.2[m
[[1;34mINFO[m] [1m--------------------------------[ jar ]---------------------------------[m
[[1;33mWARNING[m] The POM for com.sun.xml.bind:jaxb-osgi:jar:2.2.10 is invalid, transitive dependencies (if any) will not be available, enable debug logging for more details
[[1;34mINFO[m] 
[[1;34mINFO[m] [1m--- [0;32mmaven-clean-plugin:2.5:clean[m [1m(default-clean)[m @ [36mmarket-rest[0;1m ---[m
[[1;34mINFO[m] Deleting /media/rincon/63999417195/eclipse-workspace/EMB-master/jdk_11_maven/cs/rest-gui/market/market-rest/target
[[1;34mINFO[m] 
[[1;34mINFO[m] [1m--- [0;32mjacoco-maven-plugin:0.8.7:prepare-agent[m [1m(default)[m @ [36mmarket-rest[0;1m ---[m
[[1;34mINFO[m] argLine set to -javaagent:/home/rincon/.m2/repository/org/jacoco/org.jacoco.agent/0.8.7/org.jacoco.agent-0.8.7-runtime.jar=destfile=/media/rincon/63999417195/eclipse-workspace/EMB-master/jdk_11_maven/cs/rest-gui/market/market-rest/target/jacoco.exec
[[1;34mINFO[m] 
[[1;34mINFO[m] [1m--- [0;32mspring-boot-maven-plugin:2.4.3:build-info[m [1m(default)[m @ [36mmarket-rest[0;1m ---[m
[[1;34mINFO[m] 
[[1;34mINFO[m] [1m--- [0;32mmaven-resources-plugin:2.6:resources[m [1m(default-resources)[m @ [36mmarket-rest[0;1m ---[m
[[1;34mINFO[m] Using 'UTF-8' encoding to copy filtered resources.
[[1;34mINFO[m] Copying 3 resources
[[1;34mINFO[m] 
[[1;34mINFO[m] [1m--- [0;32mmaven-compiler-plugin:3.8.0:compile[m [1m(default-compile)[m @ [36mmarket-rest[0;1m ---[m
[[1;34mINFO[m] Changes detected - recompiling the module!
[[1;34mINFO[m] Compiling 11 source files to /media/rincon/63999417195/eclipse-workspace/EMB-master/jdk_11_maven/cs/rest-gui/market/market-rest/target/classes
[[1;34mINFO[m] 
[[1;34mINFO[m] [1m--- [0;32mjacoco-maven-plugin:0.8.7:prepare-agent[m [1m(default)[m @ [36mmarket-rest[0;1m ---[m
[[1;34mINFO[m] argLine set to -javaagent:/home/rincon/.m2/repository/org/jacoco/org.jacoco.agent/0.8.7/org.jacoco.agent-0.8.7-runtime.jar=destfile=/media/rincon/63999417195/eclipse-workspace/EMB-master/jdk_11_maven/cs/rest-gui/market/market-rest/target/jacoco.exec
[[1;34mINFO[m] 
[[1;34mINFO[m] [1m--- [0;32mspring-boot-maven-plugin:2.4.3:build-info[m [1m(default)[m @ [36mmarket-rest[0;1m ---[m
[[1;34mINFO[m] 
[[1;34mINFO[m] [1m--- [0;32mmaven-resources-plugin:2.6:resources[m [1m(default-resources)[m @ [36mmarket-rest[0;1m ---[m
[[1;34mINFO[m] Using 'UTF-8' encoding to copy filtered resources.
[[1;34mINFO[m] Copying 3 resources
[[1;34mINFO[m] 
[[1;34mINFO[m] [1m--- [0;32mmaven-compiler-plugin:3.8.0:compile[m [1m(default-compile)[m @ [36mmarket-rest[0;1m ---[m
[[1;34mINFO[m] Nothing to compile - all classes are up to date
[[1;34mINFO[m] 
[[1;34mINFO[m] [1m--- [0;32mmaven-resources-plugin:2.6:testResources[m [1m(default-testResources)[m @ [36mmarket-rest[0;1m ---[m
[[1;34mINFO[m] Using 'UTF-8' encoding to copy filtered resources.
[[1;34mINFO[m] skip non existing resourceDirectory /media/rincon/63999417195/eclipse-workspace/EMB-master/jdk_11_maven/cs/rest-gui/market/market-rest/src/test/resources
[[1;34mINFO[m] 
[[1;34mINFO[m] [1m--- [0;32mmaven-compiler-plugin:3.8.0:testCompile[m [1m(default-testCompile)[m @ [36mmarket-rest[0;1m ---[m
[[1;34mINFO[m] Changes detected - recompiling the module!
[[1;34mINFO[m] Compiling 1 source file to /media/rincon/63999417195/eclipse-workspace/EMB-master/jdk_11_maven/cs/rest-gui/market/market-rest/target/test-classes
[[1;34mINFO[m] 
[[1;34mINFO[m] [1m--- [0;32mjacoco-maven-plugin:0.8.7:prepare-agent[m [1m(default)[m @ [36mmarket-rest[0;1m ---[m
[[1;34mINFO[m] argLine set to -javaagent:/home/rincon/.m2/repository/org/jacoco/org.jacoco.agent/0.8.7/org.jacoco.agent-0.8.7-runtime.jar=destfile=/media/rincon/63999417195/eclipse-workspace/EMB-master/jdk_11_maven/cs/rest-gui/market/market-rest/target/jacoco.exec
[[1;34mINFO[m] 
[[1;34mINFO[m] [1m--- [0;32mspring-boot-maven-plugin:2.4.3:build-info[m [1m(default)[m @ [36mmarket-rest[0;1m ---[m
[[1;34mINFO[m] 
[[1;34mINFO[m] [1m--- [0;32mmaven-resources-plugin:2.6:resources[m [1m(default-resources)[m @ [36mmarket-rest[0;1m ---[m
[[1;34mINFO[m] Using 'UTF-8' encoding to copy filtered resources.
[[1;34mINFO[m] Copying 3 resources
[[1;34mINFO[m] 
[[1;34mINFO[m] [1m--- [0;32mmaven-compiler-plugin:3.8.0:compile[m [1m(default-compile)[m @ [36mmarket-rest[0;1m ---[m
[[1;34mINFO[m] Nothing to compile - all classes are up to date
[[1;34mINFO[m] 
[[1;34mINFO[m] [1m--- [0;32mmaven-resources-plugin:2.6:testResources[m [1m(default-testResources)[m @ [36mmarket-rest[0;1m ---[m
[[1;34mINFO[m] Using 'UTF-8' encoding to copy filtered resources.
[[1;34mINFO[m] skip non existing resourceDirectory /media/rincon/63999417195/eclipse-workspace/EMB-master/jdk_11_maven/cs/rest-gui/market/market-rest/src/test/resources
[[1;34mINFO[m] 
[[1;34mINFO[m] [1m--- [0;32mmaven-compiler-plugin:3.8.0:testCompile[m [1m(default-testCompile)[m @ [36mmarket-rest[0;1m ---[m
[[1;34mINFO[m] Nothing to compile - all classes are up to date
[[1;34mINFO[m] 
[[1;34mINFO[m] [1m--- [0;32mmaven-surefire-plugin:2.22.0:test[m [1m(default-test)[m @ [36mmarket-rest[0;1m ---[m
[[1;34mINFO[m] 
[[1;34mINFO[m] -------------------------------------------------------
[[1;34mINFO[m]  T E S T S
[[1;34mINFO[m] -------------------------------------------------------
[[1;34mINFO[m] Running market.[1mrun01_ContactsRestControllerTest[m

  .   ____          _            __ _ _
 /\\ / ___'_ __ _ _(_)_ __  __ _ \ \ \ \
( ( )\___ | '_ | '_| | '_ \/ _` | \ \ \ \
 \\/  ___)| |_)| | | | | || (_| |  ) ) ) )
  '  |____| .__|_| |_|_| |_\__, | / / / /
 =========|_|==============|___/=/_/_/_/
 :: Spring Boot ::                (v2.4.3)

2024-08-31 11:35:24,688 INFO  [background-preinit] o.h.v.i.u.Version - HV000001: Hibernate Validator 6.1.7.Final
2024-08-31 11:35:24,771 INFO  [main] o.a.m.s.b.ForkedBooter - Starting ForkedBooter v2.22.0 using Java 11.0.20 on IFTO-PROBOOK with PID 13587 (started by rincon in /media/rincon/63999417195/eclipse-workspace/EMB-master/jdk_11_maven/cs/rest-gui/market/market-rest)
2024-08-31 11:35:24,778 INFO  [main] o.a.m.s.b.ForkedBooter - No active profile set, falling back to default profiles: default
2024-08-31 11:35:25,402 WARN  [main] o.s.b.c.c.ConfigDataEnvironment - Property 'spring.profiles' imported from location 'class path resource [application.yml]' is invalid and should be replaced with 'spring.config.activate.on-profile' [origin: class path resource [application.yml] - 34:13]
2024-08-31 11:35:25,403 WARN  [main] o.s.b.c.c.ConfigDataEnvironment - Property 'spring.profiles' imported from location 'class path resource [application.yml]' is invalid and should be replaced with 'spring.config.activate.on-profile' [origin: class path resource [application.yml] - 24:13]
2024-08-31 11:35:27,080 INFO  [main] o.s.d.r.c.RepositoryConfigurationDelegate - Bootstrapping Spring Data JPA repositories in DEFAULT mode.
2024-08-31 11:35:27,242 INFO  [main] o.s.d.r.c.RepositoryConfigurationDelegate - Finished Spring Data repository scanning in 149 ms. Found 8 JPA repository interfaces.
2024-08-31 11:35:27,716 INFO  [main] o.s.c.s.PostProcessorRegistrationDelegate$BeanPostProcessorChecker - Bean 'market.DataConfig' of type [market.DataConfig$$EnhancerBySpringCGLIB$$30a541cb] is not eligible for getting processed by all BeanPostProcessors (for example: not eligible for auto-proxying)
2024-08-31 11:35:27,891 INFO  [main] o.s.c.s.PostProcessorRegistrationDelegate$BeanPostProcessorChecker - Bean 'org.springframework.security.access.expression.method.DefaultMethodSecurityExpressionHandler@151a8228' of type [org.springframework.security.access.expression.method.DefaultMethodSecurityExpressionHandler] is not eligible for getting processed by all BeanPostProcessors (for example: not eligible for auto-proxying)
2024-08-31 11:35:27,900 INFO  [main] o.s.c.s.PostProcessorRegistrationDelegate$BeanPostProcessorChecker - Bean 'methodSecurityMetadataSource' of type [org.springframework.security.access.method.DelegatingMethodSecurityMetadataSource] is not eligible for getting processed by all BeanPostProcessors (for example: not eligible for auto-proxying)
2024-08-31 11:35:28,418 INFO  [main] o.s.b.w.e.t.TomcatWebServer - Tomcat initialized with port(s): 0 (http)
2024-08-31 11:35:28,440 INFO  [main] o.a.c.h.Http11NioProtocol - Initializing ProtocolHandler ["http-nio-auto-1"]
2024-08-31 11:35:28,441 INFO  [main] o.a.c.c.StandardService - Starting service [Tomcat]
2024-08-31 11:35:28,442 INFO  [main] o.a.c.c.StandardEngine - Starting Servlet engine: [Apache Tomcat/9.0.43]
2024-08-31 11:35:28,570 INFO  [main] o.a.c.c.C.[.[.[/] - Initializing Spring embedded WebApplicationContext
2024-08-31 11:35:28,570 INFO  [main] o.s.b.w.s.c.ServletWebServerApplicationContext - Root WebApplicationContext: initialization completed in 3163 ms
2024-08-31 11:35:28,796 INFO  [main] c.z.h.HikariDataSource - HikariPool-1 - Starting...
2024-08-31 11:35:29,286 INFO  [main] c.z.h.HikariDataSource - HikariPool-1 - Start completed.
2024-08-31 11:35:29,535 INFO  [main] o.h.j.i.u.LogHelper - HHH000204: Processing PersistenceUnitInfo [name: default]
2024-08-31 11:35:29,644 INFO  [main] o.h.Version - HHH000412: Hibernate ORM core version 5.4.28.Final
2024-08-31 11:35:29,865 INFO  [main] o.h.a.c.Version - HCANN000001: Hibernate Commons Annotations {5.1.2.Final}
2024-08-31 11:35:30,148 INFO  [main] o.h.d.Dialect - HHH000400: Using dialect: org.hibernate.dialect.H2Dialect
2024-08-31 11:35:30,508 WARN  [main] o.h.b.i.InFlightMetadataCollectorImpl - HHH000069: Duplicate generator name gen
2024-08-31 11:35:30,511 WARN  [main] o.h.b.i.InFlightMetadataCollectorImpl - HHH000069: Duplicate generator name gen
2024-08-31 11:35:31,375 INFO  [main] o.h.e.t.j.p.i.JtaPlatformInitiator - HHH000490: Using JtaPlatform implementation: [org.hibernate.engine.transaction.jta.platform.internal.NoJtaPlatform]
2024-08-31 11:35:31,389 INFO  [main] o.s.o.j.LocalContainerEntityManagerFactoryBean - Initialized JPA EntityManagerFactory for persistence unit 'default'
2024-08-31 11:35:32,640 WARN  [main] o.s.b.a.o.j.JpaBaseConfiguration$JpaWebConfiguration - spring.jpa.open-in-view is enabled by default. Therefore, database queries may be performed during view rendering. Explicitly configure spring.jpa.open-in-view to disable this warning
2024-08-31 11:35:33,639 INFO  [main] o.s.s.w.DefaultSecurityFilterChain - Will secure any request with [org.springframework.security.web.context.request.async.WebAsyncManagerIntegrationFilter@798413e9, org.springframework.security.web.context.SecurityContextPersistenceFilter@1fce46f6, org.springframework.security.web.header.HeaderWriterFilter@5eacb6d, org.springframework.security.web.authentication.logout.LogoutFilter@1a3a046, org.springframework.security.web.authentication.www.BasicAuthenticationFilter@3afd8563, org.springframework.security.web.savedrequest.RequestCacheAwareFilter@73810825, org.springframework.security.web.servletapi.SecurityContextHolderAwareRequestFilter@2497095c, org.springframework.security.web.authentication.AnonymousAuthenticationFilter@47ff67dc, org.springframework.security.web.session.SessionManagementFilter@683729c5, org.springframework.security.web.access.ExceptionTranslationFilter@4a5c6e7, org.springframework.security.web.access.intercept.FilterSecurityInterceptor@5f753ad8]
2024-08-31 11:35:33,823 INFO  [main] o.s.s.c.ThreadPoolTaskExecutor - Initializing ExecutorService 'applicationTaskExecutor'
2024-08-31 11:35:34,304 INFO  [main] o.a.c.h.Http11NioProtocol - Starting ProtocolHandler ["http-nio-auto-1"]
2024-08-31 11:35:34,346 INFO  [main] o.s.b.w.e.t.TomcatWebServer - Tomcat started on port(s): 37783 (http) with context path ''
2024-08-31 11:35:34,941 INFO  [main] o.a.m.s.b.ForkedBooter - Started ForkedBooter in 11.056 seconds (JVM running for 13.352)
2024-08-31 11:35:36,971 INFO  [http-nio-auto-1-exec-1] o.a.c.c.C.[.[.[/] - Initializing Spring DispatcherServlet 'dispatcherServlet'
2024-08-31 11:35:36,971 INFO  [http-nio-auto-1-exec-1] o.s.w.s.DispatcherServlet - Initializing Servlet 'dispatcherServlet'
2024-08-31 11:35:36,974 INFO  [http-nio-auto-1-exec-1] o.s.w.s.DispatcherServlet - Completed initialization in 2 ms
2024-08-31 11:35:39,067 WARN  [http-nio-auto-1-exec-5] m.r.e.RestExceptionHandler - RestErrorResponse{message='Acesso negado', entityName='null', description='uri=/customer/contacts', fieldErrors=[]}
2024-08-31 11:35:39,237 WARN  [http-nio-auto-1-exec-6] m.r.e.RestExceptionHandler - RestErrorResponse{message='Argument validation error', entityName='contactsDTO', description='uri=/customer/contacts', fieldErrors=[{field='phone', message='Shall consist of a + sign, a country code, a region code (1-4 digits), and a number (6-7 digits)'}]}
Request method:	PUT
Request URI:	http://localhost:37783/customer/contacts
Proxy:			<none>
Request params:	<none>
Query params:	<none>
Form params:	<none>
Path params:	<none>
Headers:		Authorization=Basic aXZhbi5wZXRyb3ZAeWFuZGV4LnJ1OnBldHJvdg==
				Accept=*/*
				Content-Type=application/json; charset=UTF-8
Cookies:		<none>
Multiparts:		<none>
Body:
{
    "address": "New address 123",
    "phone": "invalid-phone"
}

HTTP/1.1 406 
Set-Cookie: JSESSIONID=8FE1A081A2F8DC8488BFA201EB76FF35; Path=/; HttpOnly
X-Content-Type-Options: nosniff
X-XSS-Protection: 1; mode=block
Cache-Control: no-cache, no-store, max-age=0, must-revalidate
Pragma: no-cache
Expires: 0
Content-Type: application/json
Transfer-Encoding: chunked
Date: Sat, 31 Aug 2024 14:35:38 GMT
Keep-Alive: timeout=60
Connection: keep-alive

{
    "message": "Argument validation error",
    "description": "uri=/customer/contacts",
    "entityName": "contactsDTO",
    "fieldErrors": [
        {
            "field": "phone",
            "message": "Shall consist of a + sign, a country code, a region code (1-4 digits), and a number (6-7 digits)"
        }
    ]
}
2024-08-31 11:35:39,297 WARN  [http-nio-auto-1-exec-7] m.r.e.RestExceptionHandler - RestErrorResponse{message='Acesso negado', entityName='null', description='uri=/customer/contacts', fieldErrors=[]}
2024-08-31 11:35:39,323 INFO  [main] o.a.c.h.Http11NioProtocol - Pausing ProtocolHandler ["http-nio-auto-1"]
2024-08-31 11:35:39,323 INFO  [main] o.a.c.c.StandardService - Stopping service [Tomcat]
2024-08-31 11:35:39,325 INFO  [main] o.a.c.c.C.[.[.[/] - Destroying Spring FrameworkServlet 'dispatcherServlet'
2024-08-31 11:35:39,329 INFO  [main] o.a.c.h.Http11NioProtocol - Stopping ProtocolHandler ["http-nio-auto-1"]
2024-08-31 11:35:39,333 INFO  [main] o.a.c.h.Http11NioProtocol - Destroying ProtocolHandler ["http-nio-auto-1"]
[[1;31mERROR[m] [1;31mTests [0;1mrun: [0;1m7[m, [1;31mFailures: [0;1;31m1[m, [1;31mErrors: [0;1;31m2[m, Skipped: 0, Time elapsed: 16.758 s[1;31m <<< FAILURE![m - in market.[1mrun01_ContactsRestControllerTest[m
[[1;31mERROR[m] testSchemaValidationOnGetContacts  Time elapsed: 1.881 s  <<< ERROR!
java.lang.IllegalArgumentException: Schema to use cannot be null
	at market.run01_ContactsRestControllerTest.testSchemaValidationOnGetContacts(run01_ContactsRestControllerTest.java:129)

[[1;31mERROR[m] testUpdateContactsInvalidPhone  Time elapsed: 0.189 s  <<< FAILURE!
java.lang.AssertionError: 
1 expectation failed.
Expected status code <400> but was <406>.

	at market.run01_ContactsRestControllerTest.testUpdateContactsInvalidPhone(run01_ContactsRestControllerTest.java:88)

[[1;31mERROR[m] testUpdateContactsInternalServerError  Time elapsed: 0.049 s  <<< ERROR!
java.net.ConnectException: Conexão recusada (Connection refused)
	at market.run01_ContactsRestControllerTest.testUpdateContactsInternalServerError(run01_ContactsRestControllerTest.java:101)

2024-08-31 11:35:39,398 INFO  [SpringContextShutdownHook] o.s.s.c.ThreadPoolTaskExecutor - Shutting down ExecutorService 'applicationTaskExecutor'
2024-08-31 11:35:39,412 INFO  [SpringContextShutdownHook] o.s.o.j.LocalContainerEntityManagerFactoryBean - Closing JPA EntityManagerFactory for persistence unit 'default'
2024-08-31 11:35:39,413 INFO  [SpringContextShutdownHook] c.z.h.HikariDataSource - HikariPool-1 - Shutdown initiated...
2024-08-31 11:35:39,422 INFO  [SpringContextShutdownHook] c.z.h.HikariDataSource - HikariPool-1 - Shutdown completed.
[[1;34mINFO[m] 
[[1;34mINFO[m] Results:
[[1;34mINFO[m] 
[[1;31mERROR[m] [1;31mFailures: [m
[[1;31mERROR[m] [1;31m  run01_ContactsRestControllerTest.testUpdateContactsInvalidPhone:88 1 expectation failed.
Expected status code <400> but was <406>.
[m
[[1;31mERROR[m] [1;31mErrors: [m
[[1;31mERROR[m] [1;31m  run01_ContactsRestControllerTest.testSchemaValidationOnGetContacts:129 » IllegalArgument[m
[[1;31mERROR[m] [1;31m  run01_ContactsRestControllerTest.testUpdateContactsInternalServerError:101 » Connect[m
[[1;34mINFO[m] 
[[1;31mERROR[m] [1;31mTests run: 7, Failures: 1, Errors: 2, Skipped: 0[m
[[1;34mINFO[m] 
[[1;34mINFO[m] [1m------------------------------------------------------------------------[m
[[1;34mINFO[m] [1;31mBUILD FAILURE[m
[[1;34mINFO[m] [1m------------------------------------------------------------------------[m
[[1;34mINFO[m] Total time:  21.953 s
[[1;34mINFO[m] Finished at: 2024-08-31T11:35:40-03:00
[[1;34mINFO[m] [1m------------------------------------------------------------------------[m
[[1;31mERROR[m] Failed to execute goal [32morg.apache.maven.plugins:maven-surefire-plugin:2.22.0:test[m [1m(default-test)[m on project [36mmarket-rest[m: [1;31mThere are test failures.[m
[[1;31mERROR[m] [1;31m[m
[[1;31mERROR[m] [1;31mPlease refer to /media/rincon/63999417195/eclipse-workspace/EMB-master/jdk_11_maven/cs/rest-gui/market/market-rest/target/surefire-reports for the individual test results.[m
[[1;31mERROR[m] [1;31mPlease refer to dump files (if any exist) [date]-jvmRun[N].dump, [date].dumpstream and [date]-jvmRun[N].dumpstream.[m
[[1;31mERROR[m] -> [1m[Help 1][m
[[1;31mERROR[m] 
[[1;31mERROR[m] To see the full stack trace of the errors, re-run Maven with the [1m-e[m switch.
[[1;31mERROR[m] Re-run Maven using the [1m-X[m switch to enable full debug logging.
[[1;31mERROR[m] 
[[1;31mERROR[m] For more information about the errors and possible solutions, please read the following articles:
[[1;31mERROR[m] [1m[Help 1][m http://cwiki.apache.org/confluence/display/MAVEN/MojoFailureException

#####
