Correct the test code delimited by ***** according to the error messages delimited by ##### and generate another complete code in JUnit 4 format. The response must contain only Java code in JUnit 4 format.

Keep these five instructions for this generated test code:

Instruction 1: Keet this package line to generated test code file:
package org.restncs;

Instruction 2: Keep the following Java imports to generated test code file:
import org.junit.AfterClass;
import org.junit.BeforeClass;
import org.junit.Before;
import org.junit.Test;
import static org.junit.Assert.*;
import java.util.Map;
import java.util.List;
import static org.evomaster.client.java.controller.api.EMTestUtils.*;
import org.evomaster.client.java.controller.SutHandler;
import io.restassured.RestAssured;
import static io.restassured.RestAssured.given;
import io.restassured.response.ValidatableResponse;
import static org.hamcrest.Matchers.*;
import io.restassured.config.JsonConfig;
import io.restassured.path.json.config.JsonPathConfig;
import static io.restassured.config.RedirectConfig.redirectConfig;
import static org.evomaster.client.java.controller.contentMatchers.NumberMatcher.*;
import static org.evomaster.client.java.controller.contentMatchers.StringMatcher.*;
import static org.evomaster.client.java.controller.contentMatchers.SubStringMatcher.*;
import static org.evomaster.client.java.controller.expect.ExpectationHandler.expectationHandler;
import org.evomaster.client.java.controller.expect.ExpectationHandler;
import io.restassured.path.json.JsonPath;
import java.util.Arrays;

Instruction 3: Keep the same class name in this point (between the imports at instruction 2 and instruction 4)

Instruction 4: Keep these variables in the generated test code:
private static final SutHandler controller = new em.embedded.org.restncs.EmbeddedEvoMasterController();
private static String baseUrlOfSut;

Instruction 5: Keep the following setup and teardown methods in generated test code file:
@BeforeClass
public static void initClass() {
    controller.setupForGeneratedTest();
    baseUrlOfSut = controller.startSut();
    controller.registerOrExecuteInitSqlCommandsIfNeeded();
    assertNotNull(baseUrlOfSut);
    RestAssured.enableLoggingOfRequestAndResponseIfValidationFails();
    RestAssured.useRelaxedHTTPSValidation();
    RestAssured.urlEncodingEnabled = false;
    RestAssured.config = RestAssured.config()
        .jsonConfig(JsonConfig.jsonConfig().numberReturnType(JsonPathConfig.NumberReturnType.DOUBLE))
        .redirect(redirectConfig().followRedirects(false));
}

@AfterClass
public static void tearDown() {
    controller.stopSut();
}

@Before
public void initTest() {
    controller.resetStateOfSUT();
}


*****

package org.restncs;

import org.junit.AfterClass;
import org.junit.BeforeClass;
import org.junit.Before;
import org.junit.Test;
import static org.junit.Assert.*;
import java.util.Map;
import java.util.List;
import static org.evomaster.client.java.controller.api.EMTestUtils.*;
import org.evomaster.client.java.controller.SutHandler;
import io.restassured.RestAssured;
import static io.restassured.RestAssured.given;
import io.restassured.response.ValidatableResponse;
import static org.hamcrest.Matchers.*;
import io.restassured.config.JsonConfig;
import io.restassured.path.json.config.JsonPathConfig;
import static io.restassured.config.RedirectConfig.redirectConfig;
import static org.evomaster.client.java.controller.contentMatchers.NumberMatcher.*;
import static org.evomaster.client.java.controller.contentMatchers.StringMatcher.*;
import static org.evomaster.client.java.controller.contentMatchers.SubStringMatcher.*;
import static org.evomaster.client.java.controller.expect.ExpectationHandler.expectationHandler;
import org.evomaster.client.java.controller.expect.ExpectationHandler;
import io.restassured.path.json.JsonPath;
import java.util.Arrays;

public class v3_gpt4turbo_run03_BessjTest {

    private static final SutHandler controller = new em.embedded.org.restncs.EmbeddedEvoMasterController();
    private static String baseUrlOfSut;

    @BeforeClass
    public static void initClass() {
        controller.setupForGeneratedTest();
        baseUrlOfSut = controller.startSut();
        controller.registerOrExecuteInitSqlCommandsIfNeeded();
        assertNotNull(baseUrlOfSut);
        RestAssured.enableLoggingOfRequestAndResponseIfValidationFails();
        RestAssured.useRelaxedHTTPSValidation();
        RestAssured.urlEncodingEnabled = false;
        RestAssured.config = RestAssured.config()
            .jsonConfig(JsonConfig.jsonConfig().numberReturnType(JsonPathConfig.NumberReturnType.DOUBLE))
            .redirect(redirectConfig().followRedirects(false));
    }

    @AfterClass
    public static void tearDown() {
        controller.stopSut();
    }

    @Before
    public void initTest() {
        controller.resetStateOfSUT();
    }

    @Test
    public void testBessjValidInput() {
        int n = 3;
        double x = 5.0;

        ValidatableResponse response = given().basePath(baseUrlOfSut)
            .when().get("/api/bessj/{n}/{x}", n, x)
            .then().statusCode(200);

        double result = response.extract().jsonPath().getDouble("resultAsDouble");
        assertTrue(result > -1e10 && result < 1e10); // Expected range of results
    }

    @Test
    public void testBessjNLessThan2ThrowsError() {
        int n = 1;
        double x = 5.0;

        given().basePath(baseUrlOfSut)
            .when().get("/api/bessj/{n}/{x}", n, x)
            .then().statusCode(500); // Expecting Internal Server Error due to invalid input
    }

    @Test
    public void testBessjZeroXReturnsZero() {
        int n = 3;
        double x = 0.0;

        ValidatableResponse response = given().basePath(baseUrlOfSut)
            .when().get("/api/bessj/{n}/{x}", n, x)
            .then().statusCode(200);

        double result = response.extract().jsonPath().getDouble("resultAsDouble");
        assertEquals(0.0, result, 0.0);
    }

    @Test
    public void testBessjXGreaterThanN() {
        int n = 3;
        double x = 10.0;

        ValidatableResponse response = given().basePath(baseUrlOfSut)
            .when().get("/api/bessj/{n}/{x}", n, x)
            .then().statusCode(200);

        double result = response.extract().jsonPath().getDouble("resultAsDouble");
        assertTrue(result > -1e10 && result < 1e10); // Expected range of results
    }

    @Test
    public void testBessjXLessThanN() {
        int n = 10;
        double x = 5.0;

        ValidatableResponse response = given().basePath(baseUrlOfSut)
            .when().get("/api/bessj/{n}/{x}", n, x)
            .then().statusCode(200);

        double result = response.extract().jsonPath().getDouble("resultAsDouble");
        assertTrue(result > -1e10 && result < 1e10); // Expected range of results
    }
}

*****
#####
[[1;34mINFO[m] Scanning for projects...
[[1;34mINFO[m] 
[[1;34mINFO[m] [1m------< [0;36morg.evomaster:evomaster-benchmark-cs-rest-artificial-ncs[0;1m >------[m
[[1;34mINFO[m] [1mBuilding evomaster-benchmark-cs-rest-artificial-ncs 3.0.0[m
[[1;34mINFO[m] [1m--------------------------------[ jar ]---------------------------------[m
[[1;34mINFO[m] 
[[1;34mINFO[m] [1m--- [0;32mmaven-clean-plugin:2.5:clean[m [1m(default-clean)[m @ [36mevomaster-benchmark-cs-rest-artificial-ncs[0;1m ---[m
[[1;34mINFO[m] Deleting /media/rincon/63999417195/eclipse-workspace/EMB-master/jdk_8_maven/cs/rest/artificial/ncs/target
[[1;34mINFO[m] 
[[1;34mINFO[m] [1m--- [0;32mjacoco-maven-plugin:0.8.7:prepare-agent[m [1m(default)[m @ [36mevomaster-benchmark-cs-rest-artificial-ncs[0;1m ---[m
[[1;34mINFO[m] argLine set to -javaagent:/home/rincon/.m2/repository/org/jacoco/org.jacoco.agent/0.8.7/org.jacoco.agent-0.8.7-runtime.jar=destfile=/media/rincon/63999417195/eclipse-workspace/EMB-master/jdk_8_maven/cs/rest/artificial/ncs/target/jacoco.exec
[[1;34mINFO[m] 
[[1;34mINFO[m] [1m--- [0;32mmaven-resources-plugin:2.6:resources[m [1m(default-resources)[m @ [36mevomaster-benchmark-cs-rest-artificial-ncs[0;1m ---[m
[[1;34mINFO[m] Using 'UTF-8' encoding to copy filtered resources.
[[1;34mINFO[m] skip non existing resourceDirectory /media/rincon/63999417195/eclipse-workspace/EMB-master/jdk_8_maven/cs/rest/artificial/ncs/src/main/resources
[[1;34mINFO[m] 
[[1;34mINFO[m] [1m--- [0;32mmaven-compiler-plugin:3.8.0:compile[m [1m(default-compile)[m @ [36mevomaster-benchmark-cs-rest-artificial-ncs[0;1m ---[m
[[1;34mINFO[m] Changes detected - recompiling the module!
[[1;34mINFO[m] Compiling 10 source files to /media/rincon/63999417195/eclipse-workspace/EMB-master/jdk_8_maven/cs/rest/artificial/ncs/target/classes
[[1;34mINFO[m] 
[[1;34mINFO[m] [1m--- [0;32mjacoco-maven-plugin:0.8.7:prepare-agent[m [1m(default)[m @ [36mevomaster-benchmark-cs-rest-artificial-ncs[0;1m ---[m
[[1;34mINFO[m] argLine set to -javaagent:/home/rincon/.m2/repository/org/jacoco/org.jacoco.agent/0.8.7/org.jacoco.agent-0.8.7-runtime.jar=destfile=/media/rincon/63999417195/eclipse-workspace/EMB-master/jdk_8_maven/cs/rest/artificial/ncs/target/jacoco.exec
[[1;34mINFO[m] 
[[1;34mINFO[m] [1m--- [0;32mmaven-resources-plugin:2.6:resources[m [1m(default-resources)[m @ [36mevomaster-benchmark-cs-rest-artificial-ncs[0;1m ---[m
[[1;34mINFO[m] Using 'UTF-8' encoding to copy filtered resources.
[[1;34mINFO[m] skip non existing resourceDirectory /media/rincon/63999417195/eclipse-workspace/EMB-master/jdk_8_maven/cs/rest/artificial/ncs/src/main/resources
[[1;34mINFO[m] 
[[1;34mINFO[m] [1m--- [0;32mmaven-compiler-plugin:3.8.0:compile[m [1m(default-compile)[m @ [36mevomaster-benchmark-cs-rest-artificial-ncs[0;1m ---[m
[[1;34mINFO[m] Changes detected - recompiling the module!
[[1;34mINFO[m] Compiling 10 source files to /media/rincon/63999417195/eclipse-workspace/EMB-master/jdk_8_maven/cs/rest/artificial/ncs/target/classes
[[1;34mINFO[m] 
[[1;34mINFO[m] [1m--- [0;32mmaven-resources-plugin:2.6:testResources[m [1m(default-testResources)[m @ [36mevomaster-benchmark-cs-rest-artificial-ncs[0;1m ---[m
[[1;34mINFO[m] Using 'UTF-8' encoding to copy filtered resources.
[[1;34mINFO[m] skip non existing resourceDirectory /media/rincon/63999417195/eclipse-workspace/EMB-master/jdk_8_maven/cs/rest/artificial/ncs/src/test/resources
[[1;34mINFO[m] 
[[1;34mINFO[m] [1m--- [0;32mmaven-compiler-plugin:3.8.0:testCompile[m [1m(default-testCompile)[m @ [36mevomaster-benchmark-cs-rest-artificial-ncs[0;1m ---[m
[[1;34mINFO[m] Changes detected - recompiling the module!
[[1;34mINFO[m] Compiling 1 source file to /media/rincon/63999417195/eclipse-workspace/EMB-master/jdk_8_maven/cs/rest/artificial/ncs/target/test-classes
[[1;34mINFO[m] 
[[1;34mINFO[m] [1m--- [0;32mjacoco-maven-plugin:0.8.7:prepare-agent[m [1m(default)[m @ [36mevomaster-benchmark-cs-rest-artificial-ncs[0;1m ---[m
[[1;34mINFO[m] argLine set to -javaagent:/home/rincon/.m2/repository/org/jacoco/org.jacoco.agent/0.8.7/org.jacoco.agent-0.8.7-runtime.jar=destfile=/media/rincon/63999417195/eclipse-workspace/EMB-master/jdk_8_maven/cs/rest/artificial/ncs/target/jacoco.exec
[[1;34mINFO[m] 
[[1;34mINFO[m] [1m--- [0;32mmaven-resources-plugin:2.6:resources[m [1m(default-resources)[m @ [36mevomaster-benchmark-cs-rest-artificial-ncs[0;1m ---[m
[[1;34mINFO[m] Using 'UTF-8' encoding to copy filtered resources.
[[1;34mINFO[m] skip non existing resourceDirectory /media/rincon/63999417195/eclipse-workspace/EMB-master/jdk_8_maven/cs/rest/artificial/ncs/src/main/resources
[[1;34mINFO[m] 
[[1;34mINFO[m] [1m--- [0;32mmaven-compiler-plugin:3.8.0:compile[m [1m(default-compile)[m @ [36mevomaster-benchmark-cs-rest-artificial-ncs[0;1m ---[m
[[1;34mINFO[m] Changes detected - recompiling the module!
[[1;34mINFO[m] Compiling 10 source files to /media/rincon/63999417195/eclipse-workspace/EMB-master/jdk_8_maven/cs/rest/artificial/ncs/target/classes
[[1;34mINFO[m] 
[[1;34mINFO[m] [1m--- [0;32mmaven-resources-plugin:2.6:testResources[m [1m(default-testResources)[m @ [36mevomaster-benchmark-cs-rest-artificial-ncs[0;1m ---[m
[[1;34mINFO[m] Using 'UTF-8' encoding to copy filtered resources.
[[1;34mINFO[m] skip non existing resourceDirectory /media/rincon/63999417195/eclipse-workspace/EMB-master/jdk_8_maven/cs/rest/artificial/ncs/src/test/resources
[[1;34mINFO[m] 
[[1;34mINFO[m] [1m--- [0;32mmaven-compiler-plugin:3.8.0:testCompile[m [1m(default-testCompile)[m @ [36mevomaster-benchmark-cs-rest-artificial-ncs[0;1m ---[m
[[1;34mINFO[m] Nothing to compile - all classes are up to date
[[1;34mINFO[m] 
[[1;34mINFO[m] [1m--- [0;32mmaven-surefire-plugin:2.22.0:test[m [1m(default-test)[m @ [36mevomaster-benchmark-cs-rest-artificial-ncs[0;1m ---[m
[[1;34mINFO[m] 
[[1;34mINFO[m] -------------------------------------------------------
[[1;34mINFO[m]  T E S T S
[[1;34mINFO[m] -------------------------------------------------------
[[1;34mINFO[m] Running org.restncs.[1mv3_gpt4turbo_run03_BessjTest[m

  .   ____          _            __ _ _
 /\\ / ___'_ __ _ _(_)_ __  __ _ \ \ \ \
( ( )\___ | '_ | '_| | '_ \/ _` | \ \ \ \
 \\/  ___)| |_)| | | | | || (_| |  ) ) ) )
  '  |____| .__|_| |_|_| |_\__, | / / / /
 =========|_|==============|___/=/_/_/_/
 :: Spring Boot ::        (v2.0.3.RELEASE)

2024-09-10 15:06:27.631  INFO 30558 --- [           main] o.a.maven.surefire.booter.ForkedBooter   : Starting ForkedBooter v2.22.0 on IFTO-PROBOOK with PID 30558 (started by rincon in /media/rincon/63999417195/eclipse-workspace/EMB-master/jdk_8_maven/cs/rest/artificial/ncs)
2024-09-10 15:06:27.638  INFO 30558 --- [           main] o.a.maven.surefire.booter.ForkedBooter   : No active profile set, falling back to default profiles: default
2024-09-10 15:06:28.359  INFO 30558 --- [           main] ConfigServletWebServerApplicationContext : Refreshing org.springframework.boot.web.servlet.context.AnnotationConfigServletWebServerApplicationContext@5980fa73: startup date [Tue Sep 10 15:06:28 BRT 2024]; root of context hierarchy
2024-09-10 15:06:29.996  INFO 30558 --- [           main] f.a.AutowiredAnnotationBeanPostProcessor : JSR-330 'javax.inject.Inject' annotation found and supported for autowiring
2024-09-10 15:06:30.586  INFO 30558 --- [           main] o.s.b.w.embedded.tomcat.TomcatWebServer  : Tomcat initialized with port(s): 0 (http)
2024-09-10 15:06:30.656  INFO 30558 --- [           main] o.apache.catalina.core.StandardService   : Starting service [Tomcat]
2024-09-10 15:06:30.657  INFO 30558 --- [           main] org.apache.catalina.core.StandardEngine  : Starting Servlet Engine: Apache Tomcat/8.5.31
2024-09-10 15:06:30.672  INFO 30558 --- [ost-startStop-1] o.a.catalina.core.AprLifecycleListener   : The APR based Apache Tomcat Native library which allows optimal performance in production environments was not found on the java.library.path: [/usr/java/packages/lib/amd64:/usr/lib64:/lib64:/lib:/usr/lib]
2024-09-10 15:06:30.801  INFO 30558 --- [ost-startStop-1] o.a.c.c.C.[Tomcat].[localhost].[/]       : Initializing Spring embedded WebApplicationContext
2024-09-10 15:06:30.801  INFO 30558 --- [ost-startStop-1] o.s.web.context.ContextLoader            : Root WebApplicationContext: initialization completed in 2447 ms
2024-09-10 15:06:30.947  INFO 30558 --- [ost-startStop-1] o.s.b.w.servlet.ServletRegistrationBean  : Servlet dispatcherServlet mapped to [/]
2024-09-10 15:06:30.954  INFO 30558 --- [ost-startStop-1] o.s.b.w.servlet.FilterRegistrationBean   : Mapping filter: 'characterEncodingFilter' to: [/*]
2024-09-10 15:06:30.955  INFO 30558 --- [ost-startStop-1] o.s.b.w.servlet.FilterRegistrationBean   : Mapping filter: 'hiddenHttpMethodFilter' to: [/*]
2024-09-10 15:06:30.955  INFO 30558 --- [ost-startStop-1] o.s.b.w.servlet.FilterRegistrationBean   : Mapping filter: 'httpPutFormContentFilter' to: [/*]
2024-09-10 15:06:30.955  INFO 30558 --- [ost-startStop-1] o.s.b.w.servlet.FilterRegistrationBean   : Mapping filter: 'requestContextFilter' to: [/*]
2024-09-10 15:06:31.527  INFO 30558 --- [           main] s.w.s.m.m.a.RequestMappingHandlerMapping : Mapped "{[/api/triangle/{a}/{b}/{c}],methods=[GET],produces=[application/json]}" onto public org.springframework.http.ResponseEntity<org.restncs.Dto> org.restncs.NcsRest.checkTriangle(java.lang.Integer,java.lang.Integer,java.lang.Integer)
2024-09-10 15:06:31.528  INFO 30558 --- [           main] s.w.s.m.m.a.RequestMappingHandlerMapping : Mapped "{[/api/bessj/{n}/{x}],methods=[GET],produces=[application/json]}" onto public org.springframework.http.ResponseEntity<org.restncs.Dto> org.restncs.NcsRest.bessj(java.lang.Integer,java.lang.Double)
2024-09-10 15:06:31.529  INFO 30558 --- [           main] s.w.s.m.m.a.RequestMappingHandlerMapping : Mapped "{[/api/expint/{n}/{x}],methods=[GET],produces=[application/json]}" onto public org.springframework.http.ResponseEntity<org.restncs.Dto> org.restncs.NcsRest.expint(java.lang.Integer,java.lang.Double)
2024-09-10 15:06:31.530  INFO 30558 --- [           main] s.w.s.m.m.a.RequestMappingHandlerMapping : Mapped "{[/api/fisher/{m}/{n}/{x}],methods=[GET],produces=[application/json]}" onto public org.springframework.http.ResponseEntity<org.restncs.Dto> org.restncs.NcsRest.fisher(java.lang.Integer,java.lang.Integer,java.lang.Double)
2024-09-10 15:06:31.531  INFO 30558 --- [           main] s.w.s.m.m.a.RequestMappingHandlerMapping : Mapped "{[/api/gammq/{a}/{x}],methods=[GET],produces=[application/json]}" onto public org.springframework.http.ResponseEntity<org.restncs.Dto> org.restncs.NcsRest.gammq(java.lang.Double,java.lang.Double)
2024-09-10 15:06:31.532  INFO 30558 --- [           main] s.w.s.m.m.a.RequestMappingHandlerMapping : Mapped "{[/api/remainder/{a}/{b}],methods=[GET],produces=[application/json]}" onto public org.springframework.http.ResponseEntity<org.restncs.Dto> org.restncs.NcsRest.remainder(java.lang.Integer,java.lang.Integer)
2024-09-10 15:06:31.538  INFO 30558 --- [           main] s.w.s.m.m.a.RequestMappingHandlerMapping : Mapped "{[/swagger-resources/configuration/ui]}" onto public org.springframework.http.ResponseEntity<springfox.documentation.swagger.web.UiConfiguration> springfox.documentation.swagger.web.ApiResourceController.uiConfiguration()
2024-09-10 15:06:31.539  INFO 30558 --- [           main] s.w.s.m.m.a.RequestMappingHandlerMapping : Mapped "{[/swagger-resources]}" onto public org.springframework.http.ResponseEntity<java.util.List<springfox.documentation.swagger.web.SwaggerResource>> springfox.documentation.swagger.web.ApiResourceController.swaggerResources()
2024-09-10 15:06:31.541  INFO 30558 --- [           main] s.w.s.m.m.a.RequestMappingHandlerMapping : Mapped "{[/swagger-resources/configuration/security]}" onto public org.springframework.http.ResponseEntity<springfox.documentation.swagger.web.SecurityConfiguration> springfox.documentation.swagger.web.ApiResourceController.securityConfiguration()
2024-09-10 15:06:31.547  INFO 30558 --- [           main] s.w.s.m.m.a.RequestMappingHandlerMapping : Mapped "{[/error],produces=[text/html]}" onto public org.springframework.web.servlet.ModelAndView org.springframework.boot.autoconfigure.web.servlet.error.BasicErrorController.errorHtml(javax.servlet.http.HttpServletRequest,javax.servlet.http.HttpServletResponse)
2024-09-10 15:06:31.548  INFO 30558 --- [           main] s.w.s.m.m.a.RequestMappingHandlerMapping : Mapped "{[/error]}" onto public org.springframework.http.ResponseEntity<java.util.Map<java.lang.String, java.lang.Object>> org.springframework.boot.autoconfigure.web.servlet.error.BasicErrorController.error(javax.servlet.http.HttpServletRequest)
2024-09-10 15:06:31.714  INFO 30558 --- [           main] pertySourcedRequestMappingHandlerMapping : Mapped URL path [/v2/api-docs] onto method [public org.springframework.http.ResponseEntity<springfox.documentation.spring.web.json.Json> springfox.documentation.swagger2.web.Swagger2Controller.getDocumentation(java.lang.String,javax.servlet.http.HttpServletRequest)]
2024-09-10 15:06:31.818  INFO 30558 --- [           main] o.s.w.s.handler.SimpleUrlHandlerMapping  : Mapped URL path [/**/favicon.ico] onto handler of type [class org.springframework.web.servlet.resource.ResourceHttpRequestHandler]
2024-09-10 15:06:32.014  INFO 30558 --- [           main] s.w.s.m.m.a.RequestMappingHandlerAdapter : Looking for @ControllerAdvice: org.springframework.boot.web.servlet.context.AnnotationConfigServletWebServerApplicationContext@5980fa73: startup date [Tue Sep 10 15:06:28 BRT 2024]; root of context hierarchy
2024-09-10 15:06:32.100  INFO 30558 --- [           main] o.s.w.s.handler.SimpleUrlHandlerMapping  : Mapped URL path [/webjars/**] onto handler of type [class org.springframework.web.servlet.resource.ResourceHttpRequestHandler]
2024-09-10 15:06:32.101  INFO 30558 --- [           main] o.s.w.s.handler.SimpleUrlHandlerMapping  : Mapped URL path [/**] onto handler of type [class org.springframework.web.servlet.resource.ResourceHttpRequestHandler]
2024-09-10 15:06:32.385  INFO 30558 --- [           main] o.s.j.e.a.AnnotationMBeanExporter        : Registering beans for JMX exposure on startup
2024-09-10 15:06:32.400  INFO 30558 --- [           main] o.s.c.support.DefaultLifecycleProcessor  : Starting beans in phase 2147483647
2024-09-10 15:06:32.401  INFO 30558 --- [           main] d.s.w.p.DocumentationPluginsBootstrapper : Context refreshed
2024-09-10 15:06:32.448  INFO 30558 --- [           main] d.s.w.p.DocumentationPluginsBootstrapper : Found 1 custom documentation plugin(s)
2024-09-10 15:06:32.512  INFO 30558 --- [           main] s.d.s.w.s.ApiListingReferenceScanner     : Scanning for api listing references
2024-09-10 15:06:32.769  INFO 30558 --- [           main] o.s.b.w.embedded.tomcat.TomcatWebServer  : Tomcat started on port(s): 44973 (http) with context path ''
2024-09-10 15:06:32.774  INFO 30558 --- [           main] o.a.maven.surefire.booter.ForkedBooter   : Started ForkedBooter in 5.918 seconds (JVM running for 7.024)
2024-09-10 15:06:34.467  INFO 30558 --- [           main] o.s.c.support.DefaultLifecycleProcessor  : Stopping beans in phase 2147483647
[[1;31mERROR[m] [1;31mTests [0;1mrun: [0;1m5[m, Failures: 0, [1;31mErrors: [0;1;31m5[m, Skipped: 0, Time elapsed: 8.082 s[1;31m <<< FAILURE![m - in org.restncs.[1mv3_gpt4turbo_run03_BessjTest[m
[[1;31mERROR[m] testBessjValidInput(org.restncs.v3_gpt4turbo_run03_BessjTest)  Time elapsed: 1.034 s  <<< ERROR!
java.net.ConnectException: Conexão recusada (Connection refused)
	at org.restncs.v3_gpt4turbo_run03_BessjTest.testBessjValidInput(v3_gpt4turbo_run03_BessjTest.java:63)

[[1;31mERROR[m] testBessjNLessThan2ThrowsError(org.restncs.v3_gpt4turbo_run03_BessjTest)  Time elapsed: 0.026 s  <<< ERROR!
java.net.ConnectException: Conexão recusada (Connection refused)
	at org.restncs.v3_gpt4turbo_run03_BessjTest.testBessjNLessThan2ThrowsError(v3_gpt4turbo_run03_BessjTest.java:76)

[[1;31mERROR[m] testBessjZeroXReturnsZero(org.restncs.v3_gpt4turbo_run03_BessjTest)  Time elapsed: 0.024 s  <<< ERROR!
java.net.ConnectException: Conexão recusada (Connection refused)
	at org.restncs.v3_gpt4turbo_run03_BessjTest.testBessjZeroXReturnsZero(v3_gpt4turbo_run03_BessjTest.java:86)

[[1;31mERROR[m] testBessjXGreaterThanN(org.restncs.v3_gpt4turbo_run03_BessjTest)  Time elapsed: 0.024 s  <<< ERROR!
java.net.ConnectException: Conexão recusada (Connection refused)
	at org.restncs.v3_gpt4turbo_run03_BessjTest.testBessjXGreaterThanN(v3_gpt4turbo_run03_BessjTest.java:99)

[[1;31mERROR[m] testBessjXLessThanN(org.restncs.v3_gpt4turbo_run03_BessjTest)  Time elapsed: 0.02 s  <<< ERROR!
java.net.ConnectException: Conexão recusada (Connection refused)
	at org.restncs.v3_gpt4turbo_run03_BessjTest.testBessjXLessThanN(v3_gpt4turbo_run03_BessjTest.java:112)

2024-09-10 15:06:34.527  INFO 30558 --- [       Thread-4] ConfigServletWebServerApplicationContext : Closing org.springframework.boot.web.servlet.context.AnnotationConfigServletWebServerApplicationContext@5980fa73: startup date [Tue Sep 10 15:06:28 BRT 2024]; root of context hierarchy
2024-09-10 15:06:34.530  INFO 30558 --- [       Thread-4] o.s.c.support.DefaultLifecycleProcessor  : Stopping beans in phase 2147483647
2024-09-10 15:06:34.531  INFO 30558 --- [       Thread-4] o.s.j.e.a.AnnotationMBeanExporter        : Unregistering JMX-exposed beans on shutdown
[[1;34mINFO[m] 
[[1;34mINFO[m] Results:
[[1;34mINFO[m] 
[[1;31mERROR[m] [1;31mErrors: [m
[[1;31mERROR[m] [1;31m  v3_gpt4turbo_run03_BessjTest.testBessjNLessThan2ThrowsError:76 » Connect Conex...[m
[[1;31mERROR[m] [1;31m  v3_gpt4turbo_run03_BessjTest.testBessjValidInput:63 » Connect Conexão recusada...[m
[[1;31mERROR[m] [1;31m  v3_gpt4turbo_run03_BessjTest.testBessjXGreaterThanN:99 » Connect Conexão recus...[m
[[1;31mERROR[m] [1;31m  v3_gpt4turbo_run03_BessjTest.testBessjXLessThanN:112 » Connect Conexão recusad...[m
[[1;31mERROR[m] [1;31m  v3_gpt4turbo_run03_BessjTest.testBessjZeroXReturnsZero:86 » Connect Conexão re...[m
[[1;34mINFO[m] 
[[1;31mERROR[m] [1;31mTests run: 5, Failures: 0, Errors: 5, Skipped: 0[m
[[1;34mINFO[m] 
[[1;34mINFO[m] [1m------------------------------------------------------------------------[m
[[1;34mINFO[m] [1;31mBUILD FAILURE[m
[[1;34mINFO[m] [1m------------------------------------------------------------------------[m
[[1;34mINFO[m] Total time:  12.544 s
[[1;34mINFO[m] Finished at: 2024-09-10T15:06:35-03:00
[[1;34mINFO[m] [1m------------------------------------------------------------------------[m
[[1;31mERROR[m] Failed to execute goal [32morg.apache.maven.plugins:maven-surefire-plugin:2.22.0:test[m [1m(default-test)[m on project [36mevomaster-benchmark-cs-rest-artificial-ncs[m: [1;31mThere are test failures.[m
[[1;31mERROR[m] [1;31m[m
[[1;31mERROR[m] [1;31mPlease refer to /media/rincon/63999417195/eclipse-workspace/EMB-master/jdk_8_maven/cs/rest/artificial/ncs/target/surefire-reports for the individual test results.[m
[[1;31mERROR[m] [1;31mPlease refer to dump files (if any exist) [date]-jvmRun[N].dump, [date].dumpstream and [date]-jvmRun[N].dumpstream.[m
[[1;31mERROR[m] -> [1m[Help 1][m
[[1;31mERROR[m] 
[[1;31mERROR[m] To see the full stack trace of the errors, re-run Maven with the [1m-e[m switch.
[[1;31mERROR[m] Re-run Maven using the [1m-X[m switch to enable full debug logging.
[[1;31mERROR[m] 
[[1;31mERROR[m] For more information about the errors and possible solutions, please read the following articles:
[[1;31mERROR[m] [1m[Help 1][m http://cwiki.apache.org/confluence/display/MAVEN/MojoFailureException

#####
