[[1;34mINFO[m] Scanning for projects...
[[1;34mINFO[m] 
[[1;34mINFO[m] [1m------< [0;36morg.evomaster:evomaster-benchmark-cs-rest-artificial-ncs[0;1m >------[m
[[1;34mINFO[m] [1mBuilding evomaster-benchmark-cs-rest-artificial-ncs 3.0.0[m
[[1;34mINFO[m] [1m--------------------------------[ jar ]---------------------------------[m
[[1;34mINFO[m] 
[[1;34mINFO[m] [1m--- [0;32mmaven-clean-plugin:2.5:clean[m [1m(default-clean)[m @ [36mevomaster-benchmark-cs-rest-artificial-ncs[0;1m ---[m
[[1;34mINFO[m] Deleting /media/rincon/63999417195/eclipse-workspace/EMB-master/jdk_8_maven/cs/rest/artificial/ncs/target
[[1;34mINFO[m] 
[[1;34mINFO[m] [1m--- [0;32mjacoco-maven-plugin:0.8.7:prepare-agent[m [1m(default)[m @ [36mevomaster-benchmark-cs-rest-artificial-ncs[0;1m ---[m
[[1;34mINFO[m] argLine set to -javaagent:/home/rincon/.m2/repository/org/jacoco/org.jacoco.agent/0.8.7/org.jacoco.agent-0.8.7-runtime.jar=destfile=/media/rincon/63999417195/eclipse-workspace/EMB-master/jdk_8_maven/cs/rest/artificial/ncs/target/jacoco.exec
[[1;34mINFO[m] 
[[1;34mINFO[m] [1m--- [0;32mmaven-resources-plugin:2.6:resources[m [1m(default-resources)[m @ [36mevomaster-benchmark-cs-rest-artificial-ncs[0;1m ---[m
[[1;34mINFO[m] Using 'UTF-8' encoding to copy filtered resources.
[[1;34mINFO[m] skip non existing resourceDirectory /media/rincon/63999417195/eclipse-workspace/EMB-master/jdk_8_maven/cs/rest/artificial/ncs/src/main/resources
[[1;34mINFO[m] 
[[1;34mINFO[m] [1m--- [0;32mmaven-compiler-plugin:3.8.0:compile[m [1m(default-compile)[m @ [36mevomaster-benchmark-cs-rest-artificial-ncs[0;1m ---[m
[[1;34mINFO[m] Changes detected - recompiling the module!
[[1;34mINFO[m] Compiling 10 source files to /media/rincon/63999417195/eclipse-workspace/EMB-master/jdk_8_maven/cs/rest/artificial/ncs/target/classes
[[1;34mINFO[m] 
[[1;34mINFO[m] [1m--- [0;32mjacoco-maven-plugin:0.8.7:prepare-agent[m [1m(default)[m @ [36mevomaster-benchmark-cs-rest-artificial-ncs[0;1m ---[m
[[1;34mINFO[m] argLine set to -javaagent:/home/rincon/.m2/repository/org/jacoco/org.jacoco.agent/0.8.7/org.jacoco.agent-0.8.7-runtime.jar=destfile=/media/rincon/63999417195/eclipse-workspace/EMB-master/jdk_8_maven/cs/rest/artificial/ncs/target/jacoco.exec
[[1;34mINFO[m] 
[[1;34mINFO[m] [1m--- [0;32mmaven-resources-plugin:2.6:resources[m [1m(default-resources)[m @ [36mevomaster-benchmark-cs-rest-artificial-ncs[0;1m ---[m
[[1;34mINFO[m] Using 'UTF-8' encoding to copy filtered resources.
[[1;34mINFO[m] skip non existing resourceDirectory /media/rincon/63999417195/eclipse-workspace/EMB-master/jdk_8_maven/cs/rest/artificial/ncs/src/main/resources
[[1;34mINFO[m] 
[[1;34mINFO[m] [1m--- [0;32mmaven-compiler-plugin:3.8.0:compile[m [1m(default-compile)[m @ [36mevomaster-benchmark-cs-rest-artificial-ncs[0;1m ---[m
[[1;34mINFO[m] Changes detected - recompiling the module!
[[1;34mINFO[m] Compiling 10 source files to /media/rincon/63999417195/eclipse-workspace/EMB-master/jdk_8_maven/cs/rest/artificial/ncs/target/classes
[[1;34mINFO[m] 
[[1;34mINFO[m] [1m--- [0;32mmaven-resources-plugin:2.6:testResources[m [1m(default-testResources)[m @ [36mevomaster-benchmark-cs-rest-artificial-ncs[0;1m ---[m
[[1;34mINFO[m] Using 'UTF-8' encoding to copy filtered resources.
[[1;34mINFO[m] skip non existing resourceDirectory /media/rincon/63999417195/eclipse-workspace/EMB-master/jdk_8_maven/cs/rest/artificial/ncs/src/test/resources
[[1;34mINFO[m] 
[[1;34mINFO[m] [1m--- [0;32mmaven-compiler-plugin:3.8.0:testCompile[m [1m(default-testCompile)[m @ [36mevomaster-benchmark-cs-rest-artificial-ncs[0;1m ---[m
[[1;34mINFO[m] Changes detected - recompiling the module!
[[1;34mINFO[m] Compiling 1 source file to /media/rincon/63999417195/eclipse-workspace/EMB-master/jdk_8_maven/cs/rest/artificial/ncs/target/test-classes
[[1;34mINFO[m] 
[[1;34mINFO[m] [1m--- [0;32mjacoco-maven-plugin:0.8.7:prepare-agent[m [1m(default)[m @ [36mevomaster-benchmark-cs-rest-artificial-ncs[0;1m ---[m
[[1;34mINFO[m] argLine set to -javaagent:/home/rincon/.m2/repository/org/jacoco/org.jacoco.agent/0.8.7/org.jacoco.agent-0.8.7-runtime.jar=destfile=/media/rincon/63999417195/eclipse-workspace/EMB-master/jdk_8_maven/cs/rest/artificial/ncs/target/jacoco.exec
[[1;34mINFO[m] 
[[1;34mINFO[m] [1m--- [0;32mmaven-resources-plugin:2.6:resources[m [1m(default-resources)[m @ [36mevomaster-benchmark-cs-rest-artificial-ncs[0;1m ---[m
[[1;34mINFO[m] Using 'UTF-8' encoding to copy filtered resources.
[[1;34mINFO[m] skip non existing resourceDirectory /media/rincon/63999417195/eclipse-workspace/EMB-master/jdk_8_maven/cs/rest/artificial/ncs/src/main/resources
[[1;34mINFO[m] 
[[1;34mINFO[m] [1m--- [0;32mmaven-compiler-plugin:3.8.0:compile[m [1m(default-compile)[m @ [36mevomaster-benchmark-cs-rest-artificial-ncs[0;1m ---[m
[[1;34mINFO[m] Changes detected - recompiling the module!
[[1;34mINFO[m] Compiling 10 source files to /media/rincon/63999417195/eclipse-workspace/EMB-master/jdk_8_maven/cs/rest/artificial/ncs/target/classes
[[1;34mINFO[m] 
[[1;34mINFO[m] [1m--- [0;32mmaven-resources-plugin:2.6:testResources[m [1m(default-testResources)[m @ [36mevomaster-benchmark-cs-rest-artificial-ncs[0;1m ---[m
[[1;34mINFO[m] Using 'UTF-8' encoding to copy filtered resources.
[[1;34mINFO[m] skip non existing resourceDirectory /media/rincon/63999417195/eclipse-workspace/EMB-master/jdk_8_maven/cs/rest/artificial/ncs/src/test/resources
[[1;34mINFO[m] 
[[1;34mINFO[m] [1m--- [0;32mmaven-compiler-plugin:3.8.0:testCompile[m [1m(default-testCompile)[m @ [36mevomaster-benchmark-cs-rest-artificial-ncs[0;1m ---[m
[[1;34mINFO[m] Nothing to compile - all classes are up to date
[[1;34mINFO[m] 
[[1;34mINFO[m] [1m--- [0;32mmaven-surefire-plugin:2.22.0:test[m [1m(default-test)[m @ [36mevomaster-benchmark-cs-rest-artificial-ncs[0;1m ---[m
[[1;34mINFO[m] 
[[1;34mINFO[m] -------------------------------------------------------
[[1;34mINFO[m]  T E S T S
[[1;34mINFO[m] -------------------------------------------------------
[[1;34mINFO[m] Running org.restncs.[1mv2_gpt4o_run02_TriangleClassificationTest[m

  .   ____          _            __ _ _
 /\\ / ___'_ __ _ _(_)_ __  __ _ \ \ \ \
( ( )\___ | '_ | '_| | '_ \/ _` | \ \ \ \
 \\/  ___)| |_)| | | | | || (_| |  ) ) ) )
  '  |____| .__|_| |_|_| |_\__, | / / / /
 =========|_|==============|___/=/_/_/_/
 :: Spring Boot ::        (v2.0.3.RELEASE)

2024-09-09 16:24:24.317  INFO 40866 --- [           main] o.a.maven.surefire.booter.ForkedBooter   : Starting ForkedBooter v2.22.0 on IFTO-PROBOOK with PID 40866 (started by rincon in /media/rincon/63999417195/eclipse-workspace/EMB-master/jdk_8_maven/cs/rest/artificial/ncs)
2024-09-09 16:24:24.325  INFO 40866 --- [           main] o.a.maven.surefire.booter.ForkedBooter   : No active profile set, falling back to default profiles: default
2024-09-09 16:24:24.850  INFO 40866 --- [           main] ConfigServletWebServerApplicationContext : Refreshing org.springframework.boot.web.servlet.context.AnnotationConfigServletWebServerApplicationContext@6a8a551e: startup date [Mon Sep 09 16:24:24 BRT 2024]; root of context hierarchy
2024-09-09 16:24:26.617  INFO 40866 --- [           main] f.a.AutowiredAnnotationBeanPostProcessor : JSR-330 'javax.inject.Inject' annotation found and supported for autowiring
2024-09-09 16:24:27.226  INFO 40866 --- [           main] o.s.b.w.embedded.tomcat.TomcatWebServer  : Tomcat initialized with port(s): 0 (http)
2024-09-09 16:24:27.290  INFO 40866 --- [           main] o.apache.catalina.core.StandardService   : Starting service [Tomcat]
2024-09-09 16:24:27.291  INFO 40866 --- [           main] org.apache.catalina.core.StandardEngine  : Starting Servlet Engine: Apache Tomcat/8.5.31
2024-09-09 16:24:27.307  INFO 40866 --- [ost-startStop-1] o.a.catalina.core.AprLifecycleListener   : The APR based Apache Tomcat Native library which allows optimal performance in production environments was not found on the java.library.path: [/usr/java/packages/lib/amd64:/usr/lib64:/lib64:/lib:/usr/lib]
2024-09-09 16:24:27.446  INFO 40866 --- [ost-startStop-1] o.a.c.c.C.[Tomcat].[localhost].[/]       : Initializing Spring embedded WebApplicationContext
2024-09-09 16:24:27.446  INFO 40866 --- [ost-startStop-1] o.s.web.context.ContextLoader            : Root WebApplicationContext: initialization completed in 2599 ms
2024-09-09 16:24:27.583  INFO 40866 --- [ost-startStop-1] o.s.b.w.servlet.ServletRegistrationBean  : Servlet dispatcherServlet mapped to [/]
2024-09-09 16:24:27.588  INFO 40866 --- [ost-startStop-1] o.s.b.w.servlet.FilterRegistrationBean   : Mapping filter: 'characterEncodingFilter' to: [/*]
2024-09-09 16:24:27.588  INFO 40866 --- [ost-startStop-1] o.s.b.w.servlet.FilterRegistrationBean   : Mapping filter: 'hiddenHttpMethodFilter' to: [/*]
2024-09-09 16:24:27.589  INFO 40866 --- [ost-startStop-1] o.s.b.w.servlet.FilterRegistrationBean   : Mapping filter: 'httpPutFormContentFilter' to: [/*]
2024-09-09 16:24:27.589  INFO 40866 --- [ost-startStop-1] o.s.b.w.servlet.FilterRegistrationBean   : Mapping filter: 'requestContextFilter' to: [/*]
2024-09-09 16:24:28.159  INFO 40866 --- [           main] s.w.s.m.m.a.RequestMappingHandlerMapping : Mapped "{[/api/triangle/{a}/{b}/{c}],methods=[GET],produces=[application/json]}" onto public org.springframework.http.ResponseEntity<org.restncs.Dto> org.restncs.NcsRest.checkTriangle(java.lang.Integer,java.lang.Integer,java.lang.Integer)
2024-09-09 16:24:28.161  INFO 40866 --- [           main] s.w.s.m.m.a.RequestMappingHandlerMapping : Mapped "{[/api/expint/{n}/{x}],methods=[GET],produces=[application/json]}" onto public org.springframework.http.ResponseEntity<org.restncs.Dto> org.restncs.NcsRest.expint(java.lang.Integer,java.lang.Double)
2024-09-09 16:24:28.162  INFO 40866 --- [           main] s.w.s.m.m.a.RequestMappingHandlerMapping : Mapped "{[/api/fisher/{m}/{n}/{x}],methods=[GET],produces=[application/json]}" onto public org.springframework.http.ResponseEntity<org.restncs.Dto> org.restncs.NcsRest.fisher(java.lang.Integer,java.lang.Integer,java.lang.Double)
2024-09-09 16:24:28.163  INFO 40866 --- [           main] s.w.s.m.m.a.RequestMappingHandlerMapping : Mapped "{[/api/gammq/{a}/{x}],methods=[GET],produces=[application/json]}" onto public org.springframework.http.ResponseEntity<org.restncs.Dto> org.restncs.NcsRest.gammq(java.lang.Double,java.lang.Double)
2024-09-09 16:24:28.164  INFO 40866 --- [           main] s.w.s.m.m.a.RequestMappingHandlerMapping : Mapped "{[/api/bessj/{n}/{x}],methods=[GET],produces=[application/json]}" onto public org.springframework.http.ResponseEntity<org.restncs.Dto> org.restncs.NcsRest.bessj(java.lang.Integer,java.lang.Double)
2024-09-09 16:24:28.165  INFO 40866 --- [           main] s.w.s.m.m.a.RequestMappingHandlerMapping : Mapped "{[/api/remainder/{a}/{b}],methods=[GET],produces=[application/json]}" onto public org.springframework.http.ResponseEntity<org.restncs.Dto> org.restncs.NcsRest.remainder(java.lang.Integer,java.lang.Integer)
2024-09-09 16:24:28.172  INFO 40866 --- [           main] s.w.s.m.m.a.RequestMappingHandlerMapping : Mapped "{[/swagger-resources/configuration/security]}" onto public org.springframework.http.ResponseEntity<springfox.documentation.swagger.web.SecurityConfiguration> springfox.documentation.swagger.web.ApiResourceController.securityConfiguration()
2024-09-09 16:24:28.174  INFO 40866 --- [           main] s.w.s.m.m.a.RequestMappingHandlerMapping : Mapped "{[/swagger-resources/configuration/ui]}" onto public org.springframework.http.ResponseEntity<springfox.documentation.swagger.web.UiConfiguration> springfox.documentation.swagger.web.ApiResourceController.uiConfiguration()
2024-09-09 16:24:28.175  INFO 40866 --- [           main] s.w.s.m.m.a.RequestMappingHandlerMapping : Mapped "{[/swagger-resources]}" onto public org.springframework.http.ResponseEntity<java.util.List<springfox.documentation.swagger.web.SwaggerResource>> springfox.documentation.swagger.web.ApiResourceController.swaggerResources()
2024-09-09 16:24:28.181  INFO 40866 --- [           main] s.w.s.m.m.a.RequestMappingHandlerMapping : Mapped "{[/error],produces=[text/html]}" onto public org.springframework.web.servlet.ModelAndView org.springframework.boot.autoconfigure.web.servlet.error.BasicErrorController.errorHtml(javax.servlet.http.HttpServletRequest,javax.servlet.http.HttpServletResponse)
2024-09-09 16:24:28.182  INFO 40866 --- [           main] s.w.s.m.m.a.RequestMappingHandlerMapping : Mapped "{[/error]}" onto public org.springframework.http.ResponseEntity<java.util.Map<java.lang.String, java.lang.Object>> org.springframework.boot.autoconfigure.web.servlet.error.BasicErrorController.error(javax.servlet.http.HttpServletRequest)
2024-09-09 16:24:28.391  INFO 40866 --- [           main] pertySourcedRequestMappingHandlerMapping : Mapped URL path [/v2/api-docs] onto method [public org.springframework.http.ResponseEntity<springfox.documentation.spring.web.json.Json> springfox.documentation.swagger2.web.Swagger2Controller.getDocumentation(java.lang.String,javax.servlet.http.HttpServletRequest)]
2024-09-09 16:24:28.495  INFO 40866 --- [           main] o.s.w.s.handler.SimpleUrlHandlerMapping  : Mapped URL path [/**/favicon.ico] onto handler of type [class org.springframework.web.servlet.resource.ResourceHttpRequestHandler]
2024-09-09 16:24:28.686  INFO 40866 --- [           main] s.w.s.m.m.a.RequestMappingHandlerAdapter : Looking for @ControllerAdvice: org.springframework.boot.web.servlet.context.AnnotationConfigServletWebServerApplicationContext@6a8a551e: startup date [Mon Sep 09 16:24:24 BRT 2024]; root of context hierarchy
2024-09-09 16:24:28.767  INFO 40866 --- [           main] o.s.w.s.handler.SimpleUrlHandlerMapping  : Mapped URL path [/webjars/**] onto handler of type [class org.springframework.web.servlet.resource.ResourceHttpRequestHandler]
2024-09-09 16:24:28.767  INFO 40866 --- [           main] o.s.w.s.handler.SimpleUrlHandlerMapping  : Mapped URL path [/**] onto handler of type [class org.springframework.web.servlet.resource.ResourceHttpRequestHandler]
2024-09-09 16:24:29.038  INFO 40866 --- [           main] o.s.j.e.a.AnnotationMBeanExporter        : Registering beans for JMX exposure on startup
2024-09-09 16:24:29.050  INFO 40866 --- [           main] o.s.c.support.DefaultLifecycleProcessor  : Starting beans in phase 2147483647
2024-09-09 16:24:29.051  INFO 40866 --- [           main] d.s.w.p.DocumentationPluginsBootstrapper : Context refreshed
2024-09-09 16:24:29.089  INFO 40866 --- [           main] d.s.w.p.DocumentationPluginsBootstrapper : Found 1 custom documentation plugin(s)
2024-09-09 16:24:29.161  INFO 40866 --- [           main] s.d.s.w.s.ApiListingReferenceScanner     : Scanning for api listing references
2024-09-09 16:24:29.410  INFO 40866 --- [           main] o.s.b.w.embedded.tomcat.TomcatWebServer  : Tomcat started on port(s): 45631 (http) with context path ''
2024-09-09 16:24:29.417  INFO 40866 --- [           main] o.a.maven.surefire.booter.ForkedBooter   : Started ForkedBooter in 5.912 seconds (JVM running for 7.03)
2024-09-09 16:24:31.426  INFO 40866 --- [o-auto-1-exec-1] o.a.c.c.C.[Tomcat].[localhost].[/]       : Initializing Spring FrameworkServlet 'dispatcherServlet'
2024-09-09 16:24:31.426  INFO 40866 --- [o-auto-1-exec-1] o.s.web.servlet.DispatcherServlet        : FrameworkServlet 'dispatcherServlet': initialization started
2024-09-09 16:24:31.444  INFO 40866 --- [o-auto-1-exec-1] o.s.web.servlet.DispatcherServlet        : FrameworkServlet 'dispatcherServlet': initialization completed in 18 ms
Request method:	GET
Request URI:	http://localhost:45631/api/triangle/2147483647/2147483647/2147483647
Proxy:			<none>
Request params:	<none>
Query params:	<none>
Form params:	<none>
Path params:	a=2147483647
				b=2147483647
				c=2147483647
Headers:		Accept=*/*
Cookies:		<none>
Multiparts:		<none>
Body:			<none>

HTTP/1.1 200 
Content-Type: application/json;charset=UTF-8
Transfer-Encoding: chunked
Date: Mon, 09 Sep 2024 19:24:32 GMT

{
    "resultAsInt": 3,
    "resultAsDouble": null
}
2024-09-09 16:24:33.083  WARN 40866 --- [o-auto-1-exec-9] .w.s.m.s.DefaultHandlerExceptionResolver : Failed to bind request element: org.springframework.web.method.annotation.MethodArgumentTypeMismatchException: Failed to convert value of type 'java.lang.String' to required type 'java.lang.Integer'; nested exception is java.lang.NumberFormatException: For input string: "invalid"
2024-09-09 16:24:33.118  INFO 40866 --- [           main] o.s.c.support.DefaultLifecycleProcessor  : Stopping beans in phase 2147483647
[[1;31mERROR[m] [1;31mTests [0;1mrun: [0;1m10[m, [1;31mFailures: [0;1;31m2[m, [1;31mErrors: [0;1;31m1[m, Skipped: 0, Time elapsed: 10.087 s[1;31m <<< FAILURE![m - in org.restncs.[1mv2_gpt4o_run02_TriangleClassificationTest[m
[[1;31mERROR[m] testTriangleClassificationServerError(org.restncs.v2_gpt4o_run02_TriangleClassificationTest)  Time elapsed: 0.067 s  <<< FAILURE!
java.lang.AssertionError: 
1 expectation failed.
Expected status code <500> but was <200>.

	at org.restncs.v2_gpt4o_run02_TriangleClassificationTest.testTriangleClassificationServerError(v2_gpt4o_run02_TriangleClassificationTest.java:123)

[[1;31mERROR[m] testTriangleClassificationSchemaValidation(org.restncs.v2_gpt4o_run02_TriangleClassificationTest)  Time elapsed: 0.07 s  <<< FAILURE!
java.lang.AssertionError: 

Expected: an instance of java.lang.Double
     got: null

	at org.restncs.v2_gpt4o_run02_TriangleClassificationTest.testTriangleClassificationSchemaValidation(v2_gpt4o_run02_TriangleClassificationTest.java:139)

[[1;31mERROR[m] testTriangleClassificationMissingParams(org.restncs.v2_gpt4o_run02_TriangleClassificationTest)  Time elapsed: 0.004 s  <<< ERROR!
java.lang.IllegalArgumentException: parameterValue cannot be null
	at org.restncs.v2_gpt4o_run02_TriangleClassificationTest.testTriangleClassificationMissingParams(v2_gpt4o_run02_TriangleClassificationTest.java:146)

2024-09-09 16:24:33.162  INFO 40866 --- [       Thread-4] ConfigServletWebServerApplicationContext : Closing org.springframework.boot.web.servlet.context.AnnotationConfigServletWebServerApplicationContext@6a8a551e: startup date [Mon Sep 09 16:24:24 BRT 2024]; root of context hierarchy
2024-09-09 16:24:33.167  INFO 40866 --- [       Thread-4] o.s.c.support.DefaultLifecycleProcessor  : Stopping beans in phase 2147483647
2024-09-09 16:24:33.168  INFO 40866 --- [       Thread-4] o.s.j.e.a.AnnotationMBeanExporter        : Unregistering JMX-exposed beans on shutdown
[[1;34mINFO[m] 
[[1;34mINFO[m] Results:
[[1;34mINFO[m] 
[[1;31mERROR[m] [1;31mFailures: [m
[[1;31mERROR[m] [1;31m  v2_gpt4o_run02_TriangleClassificationTest.testTriangleClassificationSchemaValidation:139 
Expected: an instance of java.lang.Double
     got: null
[m
[[1;31mERROR[m] [1;31m  v2_gpt4o_run02_TriangleClassificationTest.testTriangleClassificationServerError:123 1 expectation failed.
Expected status code <500> but was <200>.
[m
[[1;31mERROR[m] [1;31mErrors: [m
[[1;31mERROR[m] [1;31m  v2_gpt4o_run02_TriangleClassificationTest.testTriangleClassificationMissingParams:146 » IllegalArgument[m
[[1;34mINFO[m] 
[[1;31mERROR[m] [1;31mTests run: 10, Failures: 2, Errors: 1, Skipped: 0[m
[[1;34mINFO[m] 
[[1;34mINFO[m] [1m------------------------------------------------------------------------[m
[[1;34mINFO[m] [1;31mBUILD FAILURE[m
[[1;34mINFO[m] [1m------------------------------------------------------------------------[m
[[1;34mINFO[m] Total time:  14.463 s
[[1;34mINFO[m] Finished at: 2024-09-09T16:24:33-03:00
[[1;34mINFO[m] [1m------------------------------------------------------------------------[m
[[1;31mERROR[m] Failed to execute goal [32morg.apache.maven.plugins:maven-surefire-plugin:2.22.0:test[m [1m(default-test)[m on project [36mevomaster-benchmark-cs-rest-artificial-ncs[m: [1;31mThere are test failures.[m
[[1;31mERROR[m] [1;31m[m
[[1;31mERROR[m] [1;31mPlease refer to /media/rincon/63999417195/eclipse-workspace/EMB-master/jdk_8_maven/cs/rest/artificial/ncs/target/surefire-reports for the individual test results.[m
[[1;31mERROR[m] [1;31mPlease refer to dump files (if any exist) [date]-jvmRun[N].dump, [date].dumpstream and [date]-jvmRun[N].dumpstream.[m
[[1;31mERROR[m] -> [1m[Help 1][m
[[1;31mERROR[m] 
[[1;31mERROR[m] To see the full stack trace of the errors, re-run Maven with the [1m-e[m switch.
[[1;31mERROR[m] Re-run Maven using the [1m-X[m switch to enable full debug logging.
[[1;31mERROR[m] 
[[1;31mERROR[m] For more information about the errors and possible solutions, please read the following articles:
[[1;31mERROR[m] [1m[Help 1][m http://cwiki.apache.org/confluence/display/MAVEN/MojoFailureException
