Correct the test code delimited by ***** according to the error messages delimited by ##### and generate another complete code in JUnit 4 format. The response must contain only Java code in JUnit 4 format.

Keep these five instructions for this generated test code:

Instruction 1: Keet this package line to generated test code file:
package org.restscs;

Instruction 2: Keep the following Java imports to generated test code file:
import  org.junit.AfterClass;
import  org.junit.BeforeClass;
import  org.junit.Before;
import  org.junit.Test;
import static org.junit.Assert.*;
import  java.util.Map;
import  java.util.List;
import static org.evomaster.client.java.controller.api.EMTestUtils.*;
import  org.evomaster.client.java.controller.SutHandler;
import  io.restassured.RestAssured;
import static io.restassured.RestAssured.given;
import  io.restassured.response.ValidatableResponse;
import static org.hamcrest.Matchers.*;
import  io.restassured.config.JsonConfig;
import  io.restassured.path.json.config.JsonPathConfig;
import static io.restassured.config.RedirectConfig.redirectConfig;
import static org.evomaster.client.java.controller.contentMatchers.NumberMatcher.*;
import static org.evomaster.client.java.controller.contentMatchers.StringMatcher.*;
import static org.evomaster.client.java.controller.contentMatchers.SubStringMatcher.*;
import static org.evomaster.client.java.controller.expect.ExpectationHandler.expectationHandler;
import  org.evomaster.client.java.controller.expect.ExpectationHandler;
import  io.restassured.path.json.JsonPath;
import  java.util.Arrays;

Instruction 3: Keep the same class name in this point (between the imports at instruction 2 and instruction 4)

Instruction 4: Keep these variables in the generated test code:
private static final SutHandler controller = new em.embedded.org.restscs.EmbeddedEvoMasterController();
private static String baseUrlOfSut;

Instruction 5: Keep the following setup and teardown methods in generated test code file:
@BeforeClass
public static void initClass() {
    controller.setupForGeneratedTest();
    baseUrlOfSut = controller.startSut();
    controller.registerOrExecuteInitSqlCommandsIfNeeded();
    assertNotNull(baseUrlOfSut);
    RestAssured.enableLoggingOfRequestAndResponseIfValidationFails();
    RestAssured.useRelaxedHTTPSValidation();
    RestAssured.urlEncodingEnabled = false;
    RestAssured.config = RestAssured.config()
        .jsonConfig(JsonConfig.jsonConfig().numberReturnType(JsonPathConfig.NumberReturnType.DOUBLE))
        .redirect(redirectConfig().followRedirects(false));
}


@AfterClass
public static void tearDown() {
    controller.stopSut();
}


@Before
public void initTest() {
    controller.resetStateOfSUT();
}


*****

package org.restscs;

import org.junit.AfterClass;
import org.junit.BeforeClass;
import org.junit.Before;
import org.junit.Test;
import static org.junit.Assert.*;
import java.util.Map;
import java.util.List;
import static org.evomaster.client.java.controller.api.EMTestUtils.*;
import org.evomaster.client.java.controller.SutHandler;
import io.restassured.RestAssured;
import static io.restassured.RestAssured.given;
import io.restassured.response.ValidatableResponse;
import static org.hamcrest.Matchers.*;
import io.restassured.config.JsonConfig;
import io.restassured.path.json.config.JsonPathConfig;
import static io.restassured.config.RedirectConfig.redirectConfig;
import static org.evomaster.client.java.controller.contentMatchers.NumberMatcher.*;
import static org.evomaster.client.java.controller.contentMatchers.StringMatcher.*;
import static org.evomaster.client.java.controller.contentMatchers.SubStringMatcher.*;
import static org.evomaster.client.java.controller.expect.ExpectationHandler.expectationHandler;
import org.evomaster.client.java.controller.expect.ExpectationHandler;
import io.restassured.path.json.JsonPath;
import java.util.Arrays;

public class v3_gpt4turbo_run03_RegexTest {
    private static final SutHandler controller = new em.embedded.org.restscs.EmbeddedEvoMasterController();
    private static String baseUrlOfSut;

    @BeforeClass
    public static void initClass() {
        controller.setupForGeneratedTest();
        baseUrlOfSut = controller.startSut();
        controller.registerOrExecuteInitSqlCommandsIfNeeded();
        assertNotNull(baseUrlOfSut);
        RestAssured.enableLoggingOfRequestAndResponseIfValidationFails();
        RestAssured.useRelaxedHTTPSValidation();
        RestAssured.urlEncodingEnabled = false;
        RestAssured.config = RestAssured.config()
            .jsonConfig(JsonConfig.jsonConfig().numberReturnType(JsonPathConfig.NumberReturnType.DOUBLE))
            .redirect(redirectConfig().followRedirects(false));
    }

    @AfterClass
    public static void tearDown() {
        controller.stopSut();
    }

    @Before
    public void initTest() {
        controller.resetStateOfSUT();
    }

    @Test
    public void testSubject_withValidUrl() {
        String input = "http://example.com/path";
        ValidatableResponse response = given().basePath(baseUrlOfSut)
            .pathParam("txt", input)
            .when().get("/api/pat/{txt}")
            .then().statusCode(200)
            .body(equalTo("url"));
    }

    @Test
    public void testSubject_withValidDate() {
        String input = "mon01jan";
        ValidatableResponse response = given().basePath(baseUrlOfSut)
            .pathParam("txt", input)
            .when().get("/api/pat/{txt}")
            .then().statusCode(200)
            .body(equalTo("date"));
    }

    @Test
    public void testSubject_withValidFpe() {
        String input = "12.34e+56";
        ValidatableResponse response = given().basePath(baseUrlOfSut)
            .pathParam("txt", input)
            .when().get("/api/pat/{txt}")
            .then().statusCode(200)
            .body(equalTo("fpe"));
    }

    @Test
    public void testSubject_withInvalidInput() {
        String input = "invalid_string";
        ValidatableResponse response = given().basePath(baseUrlOfSut)
            .pathParam("txt", input)
            .when().get("/api/pat/{txt}")
            .then().statusCode(200)
            .body(equalTo("none"));
    }

    @Test
    public void testSubject_withServerErrorSimulation() {
        String input = "simulateServerError";
        ValidatableResponse response = given().basePath(baseUrlOfSut)
            .pathParam("txt", input)
            .when().get("/api/pat/{txt}")
            .then().statusCode(500); // Expecting a 500 server error status
    }
}

*****
#####
[[1;34mINFO[m] Scanning for projects...
[[1;34mINFO[m] 
[[1;34mINFO[m] [1m------< [0;36morg.evomaster:evomaster-benchmark-cs-rest-artificial-scs[0;1m >------[m
[[1;34mINFO[m] [1mBuilding evomaster-benchmark-cs-rest-artificial-scs 3.0.0[m
[[1;34mINFO[m] [1m--------------------------------[ jar ]---------------------------------[m
[[1;34mINFO[m] 
[[1;34mINFO[m] [1m--- [0;32mmaven-clean-plugin:2.5:clean[m [1m(default-clean)[m @ [36mevomaster-benchmark-cs-rest-artificial-scs[0;1m ---[m
[[1;34mINFO[m] Deleting /media/rincon/63999417195/eclipse-workspace/EMB-master/jdk_8_maven/cs/rest/artificial/scs/target
[[1;34mINFO[m] 
[[1;34mINFO[m] [1m--- [0;32mjacoco-maven-plugin:0.8.7:prepare-agent[m [1m(default)[m @ [36mevomaster-benchmark-cs-rest-artificial-scs[0;1m ---[m
[[1;34mINFO[m] argLine set to -javaagent:/home/rincon/.m2/repository/org/jacoco/org.jacoco.agent/0.8.7/org.jacoco.agent-0.8.7-runtime.jar=destfile=/media/rincon/63999417195/eclipse-workspace/EMB-master/jdk_8_maven/cs/rest/artificial/scs/target/jacoco.exec
[[1;34mINFO[m] 
[[1;34mINFO[m] [1m--- [0;32mmaven-resources-plugin:2.6:resources[m [1m(default-resources)[m @ [36mevomaster-benchmark-cs-rest-artificial-scs[0;1m ---[m
[[1;34mINFO[m] Using 'UTF-8' encoding to copy filtered resources.
[[1;34mINFO[m] skip non existing resourceDirectory /media/rincon/63999417195/eclipse-workspace/EMB-master/jdk_8_maven/cs/rest/artificial/scs/src/main/resources
[[1;34mINFO[m] 
[[1;34mINFO[m] [1m--- [0;32mmaven-compiler-plugin:3.8.0:compile[m [1m(default-compile)[m @ [36mevomaster-benchmark-cs-rest-artificial-scs[0;1m ---[m
[[1;34mINFO[m] Changes detected - recompiling the module!
[[1;34mINFO[m] Compiling 14 source files to /media/rincon/63999417195/eclipse-workspace/EMB-master/jdk_8_maven/cs/rest/artificial/scs/target/classes
[[1;34mINFO[m] 
[[1;34mINFO[m] [1m--- [0;32mjacoco-maven-plugin:0.8.7:prepare-agent[m [1m(default)[m @ [36mevomaster-benchmark-cs-rest-artificial-scs[0;1m ---[m
[[1;34mINFO[m] argLine set to -javaagent:/home/rincon/.m2/repository/org/jacoco/org.jacoco.agent/0.8.7/org.jacoco.agent-0.8.7-runtime.jar=destfile=/media/rincon/63999417195/eclipse-workspace/EMB-master/jdk_8_maven/cs/rest/artificial/scs/target/jacoco.exec
[[1;34mINFO[m] 
[[1;34mINFO[m] [1m--- [0;32mmaven-resources-plugin:2.6:resources[m [1m(default-resources)[m @ [36mevomaster-benchmark-cs-rest-artificial-scs[0;1m ---[m
[[1;34mINFO[m] Using 'UTF-8' encoding to copy filtered resources.
[[1;34mINFO[m] skip non existing resourceDirectory /media/rincon/63999417195/eclipse-workspace/EMB-master/jdk_8_maven/cs/rest/artificial/scs/src/main/resources
[[1;34mINFO[m] 
[[1;34mINFO[m] [1m--- [0;32mmaven-compiler-plugin:3.8.0:compile[m [1m(default-compile)[m @ [36mevomaster-benchmark-cs-rest-artificial-scs[0;1m ---[m
[[1;34mINFO[m] Changes detected - recompiling the module!
[[1;34mINFO[m] Compiling 14 source files to /media/rincon/63999417195/eclipse-workspace/EMB-master/jdk_8_maven/cs/rest/artificial/scs/target/classes
[[1;34mINFO[m] 
[[1;34mINFO[m] [1m--- [0;32mmaven-resources-plugin:2.6:testResources[m [1m(default-testResources)[m @ [36mevomaster-benchmark-cs-rest-artificial-scs[0;1m ---[m
[[1;34mINFO[m] Using 'UTF-8' encoding to copy filtered resources.
[[1;34mINFO[m] skip non existing resourceDirectory /media/rincon/63999417195/eclipse-workspace/EMB-master/jdk_8_maven/cs/rest/artificial/scs/src/test/resources
[[1;34mINFO[m] 
[[1;34mINFO[m] [1m--- [0;32mmaven-compiler-plugin:3.8.0:testCompile[m [1m(default-testCompile)[m @ [36mevomaster-benchmark-cs-rest-artificial-scs[0;1m ---[m
[[1;34mINFO[m] Changes detected - recompiling the module!
[[1;34mINFO[m] Compiling 1 source file to /media/rincon/63999417195/eclipse-workspace/EMB-master/jdk_8_maven/cs/rest/artificial/scs/target/test-classes
[[1;34mINFO[m] 
[[1;34mINFO[m] [1m--- [0;32mjacoco-maven-plugin:0.8.7:prepare-agent[m [1m(default)[m @ [36mevomaster-benchmark-cs-rest-artificial-scs[0;1m ---[m
[[1;34mINFO[m] argLine set to -javaagent:/home/rincon/.m2/repository/org/jacoco/org.jacoco.agent/0.8.7/org.jacoco.agent-0.8.7-runtime.jar=destfile=/media/rincon/63999417195/eclipse-workspace/EMB-master/jdk_8_maven/cs/rest/artificial/scs/target/jacoco.exec
[[1;34mINFO[m] 
[[1;34mINFO[m] [1m--- [0;32mmaven-resources-plugin:2.6:resources[m [1m(default-resources)[m @ [36mevomaster-benchmark-cs-rest-artificial-scs[0;1m ---[m
[[1;34mINFO[m] Using 'UTF-8' encoding to copy filtered resources.
[[1;34mINFO[m] skip non existing resourceDirectory /media/rincon/63999417195/eclipse-workspace/EMB-master/jdk_8_maven/cs/rest/artificial/scs/src/main/resources
[[1;34mINFO[m] 
[[1;34mINFO[m] [1m--- [0;32mmaven-compiler-plugin:3.8.0:compile[m [1m(default-compile)[m @ [36mevomaster-benchmark-cs-rest-artificial-scs[0;1m ---[m
[[1;34mINFO[m] Changes detected - recompiling the module!
[[1;34mINFO[m] Compiling 14 source files to /media/rincon/63999417195/eclipse-workspace/EMB-master/jdk_8_maven/cs/rest/artificial/scs/target/classes
[[1;34mINFO[m] 
[[1;34mINFO[m] [1m--- [0;32mmaven-resources-plugin:2.6:testResources[m [1m(default-testResources)[m @ [36mevomaster-benchmark-cs-rest-artificial-scs[0;1m ---[m
[[1;34mINFO[m] Using 'UTF-8' encoding to copy filtered resources.
[[1;34mINFO[m] skip non existing resourceDirectory /media/rincon/63999417195/eclipse-workspace/EMB-master/jdk_8_maven/cs/rest/artificial/scs/src/test/resources
[[1;34mINFO[m] 
[[1;34mINFO[m] [1m--- [0;32mmaven-compiler-plugin:3.8.0:testCompile[m [1m(default-testCompile)[m @ [36mevomaster-benchmark-cs-rest-artificial-scs[0;1m ---[m
[[1;34mINFO[m] Nothing to compile - all classes are up to date
[[1;34mINFO[m] 
[[1;34mINFO[m] [1m--- [0;32mmaven-surefire-plugin:2.22.0:test[m [1m(default-test)[m @ [36mevomaster-benchmark-cs-rest-artificial-scs[0;1m ---[m
[[1;34mINFO[m] 
[[1;34mINFO[m] -------------------------------------------------------
[[1;34mINFO[m]  T E S T S
[[1;34mINFO[m] -------------------------------------------------------
[[1;34mINFO[m] Running org.restscs.[1mv3_gpt4turbo_run03_RegexTest[m

  .   ____          _            __ _ _
 /\\ / ___'_ __ _ _(_)_ __  __ _ \ \ \ \
( ( )\___ | '_ | '_| | '_ \/ _` | \ \ \ \
 \\/  ___)| |_)| | | | | || (_| |  ) ) ) )
  '  |____| .__|_| |_|_| |_\__, | / / / /
 =========|_|==============|___/=/_/_/_/
 :: Spring Boot ::        (v2.0.3.RELEASE)

2024-09-11 15:42:14.216  INFO 5631 --- [           main] o.a.maven.surefire.booter.ForkedBooter   : Starting ForkedBooter v2.22.0 on IFTO-PROBOOK with PID 5631 (started by rincon in /media/rincon/63999417195/eclipse-workspace/EMB-master/jdk_8_maven/cs/rest/artificial/scs)
2024-09-11 15:42:14.225  INFO 5631 --- [           main] o.a.maven.surefire.booter.ForkedBooter   : No active profile set, falling back to default profiles: default
2024-09-11 15:42:15.054  INFO 5631 --- [           main] ConfigServletWebServerApplicationContext : Refreshing org.springframework.boot.web.servlet.context.AnnotationConfigServletWebServerApplicationContext@4899799b: startup date [Wed Sep 11 15:42:15 BRT 2024]; root of context hierarchy
2024-09-11 15:42:16.867  INFO 5631 --- [           main] f.a.AutowiredAnnotationBeanPostProcessor : JSR-330 'javax.inject.Inject' annotation found and supported for autowiring
2024-09-11 15:42:17.474  INFO 5631 --- [           main] o.s.b.w.embedded.tomcat.TomcatWebServer  : Tomcat initialized with port(s): 0 (http)
2024-09-11 15:42:17.543  INFO 5631 --- [           main] o.apache.catalina.core.StandardService   : Starting service [Tomcat]
2024-09-11 15:42:17.544  INFO 5631 --- [           main] org.apache.catalina.core.StandardEngine  : Starting Servlet Engine: Apache Tomcat/8.5.31
2024-09-11 15:42:17.562  INFO 5631 --- [ost-startStop-1] o.a.catalina.core.AprLifecycleListener   : The APR based Apache Tomcat Native library which allows optimal performance in production environments was not found on the java.library.path: [/usr/java/packages/lib/amd64:/usr/lib64:/lib64:/lib:/usr/lib]
2024-09-11 15:42:17.715  INFO 5631 --- [ost-startStop-1] o.a.c.c.C.[Tomcat].[localhost].[/]       : Initializing Spring embedded WebApplicationContext
2024-09-11 15:42:17.715  INFO 5631 --- [ost-startStop-1] o.s.web.context.ContextLoader            : Root WebApplicationContext: initialization completed in 2666 ms
2024-09-11 15:42:17.889  INFO 5631 --- [ost-startStop-1] o.s.b.w.servlet.ServletRegistrationBean  : Servlet dispatcherServlet mapped to [/]
2024-09-11 15:42:17.897  INFO 5631 --- [ost-startStop-1] o.s.b.w.servlet.FilterRegistrationBean   : Mapping filter: 'characterEncodingFilter' to: [/*]
2024-09-11 15:42:17.898  INFO 5631 --- [ost-startStop-1] o.s.b.w.servlet.FilterRegistrationBean   : Mapping filter: 'hiddenHttpMethodFilter' to: [/*]
2024-09-11 15:42:17.898  INFO 5631 --- [ost-startStop-1] o.s.b.w.servlet.FilterRegistrationBean   : Mapping filter: 'httpPutFormContentFilter' to: [/*]
2024-09-11 15:42:17.899  INFO 5631 --- [ost-startStop-1] o.s.b.w.servlet.FilterRegistrationBean   : Mapping filter: 'requestContextFilter' to: [/*]
2024-09-11 15:42:18.569  INFO 5631 --- [           main] s.w.s.m.m.a.RequestMappingHandlerMapping : Mapped "{[/api/pat/{txt}],methods=[GET]}" onto public org.springframework.http.ResponseEntity<java.lang.String> org.restscs.ScsRest.regex(java.lang.String)
2024-09-11 15:42:18.571  INFO 5631 --- [           main] s.w.s.m.m.a.RequestMappingHandlerMapping : Mapped "{[/api/title/{sex}/{title}],methods=[GET]}" onto public org.springframework.http.ResponseEntity<java.lang.String> org.restscs.ScsRest.title(java.lang.String,java.lang.String)
2024-09-11 15:42:18.571  INFO 5631 --- [           main] s.w.s.m.m.a.RequestMappingHandlerMapping : Mapped "{[/api/calc/{op}/{arg1}/{arg2}],methods=[GET]}" onto public org.springframework.http.ResponseEntity<java.lang.String> org.restscs.ScsRest.calc(java.lang.String,double,double)
2024-09-11 15:42:18.572  INFO 5631 --- [           main] s.w.s.m.m.a.RequestMappingHandlerMapping : Mapped "{[/api/cookie/{name}/{val}/{site}],methods=[GET]}" onto public org.springframework.http.ResponseEntity<java.lang.String> org.restscs.ScsRest.cookie(java.lang.String,java.lang.String,java.lang.String)
2024-09-11 15:42:18.573  INFO 5631 --- [           main] s.w.s.m.m.a.RequestMappingHandlerMapping : Mapped "{[/api/costfuns/{i}/{s}],methods=[GET]}" onto public org.springframework.http.ResponseEntity<java.lang.String> org.restscs.ScsRest.costfuns(java.lang.Integer,java.lang.String)
2024-09-11 15:42:18.573  INFO 5631 --- [           main] s.w.s.m.m.a.RequestMappingHandlerMapping : Mapped "{[/api/dateparse/{dayname}/{monthname}],methods=[GET]}" onto public org.springframework.http.ResponseEntity<java.lang.String> org.restscs.ScsRest.dateParse(java.lang.String,java.lang.String)
2024-09-11 15:42:18.574  INFO 5631 --- [           main] s.w.s.m.m.a.RequestMappingHandlerMapping : Mapped "{[/api/filesuffix/{directory}/{file}],methods=[GET]}" onto public org.springframework.http.ResponseEntity<java.lang.String> org.restscs.ScsRest.fileSuffix(java.lang.String,java.lang.String)
2024-09-11 15:42:18.574  INFO 5631 --- [           main] s.w.s.m.m.a.RequestMappingHandlerMapping : Mapped "{[/api/notypevar/{i}/{s}],methods=[GET]}" onto public org.springframework.http.ResponseEntity<java.lang.String> org.restscs.ScsRest.notyPevar(java.lang.Integer,java.lang.String)
2024-09-11 15:42:18.574  INFO 5631 --- [           main] s.w.s.m.m.a.RequestMappingHandlerMapping : Mapped "{[/api/ordered4/{w}/{x}/{z}/{y}],methods=[GET]}" onto public org.springframework.http.ResponseEntity<java.lang.String> org.restscs.ScsRest.ordered4(java.lang.String,java.lang.String,java.lang.String,java.lang.String)
2024-09-11 15:42:18.575  INFO 5631 --- [           main] s.w.s.m.m.a.RequestMappingHandlerMapping : Mapped "{[/api/pat/{txt}/{pat}],methods=[GET]}" onto public org.springframework.http.ResponseEntity<java.lang.String> org.restscs.ScsRest.pat(java.lang.String,java.lang.String)
2024-09-11 15:42:18.576  INFO 5631 --- [           main] s.w.s.m.m.a.RequestMappingHandlerMapping : Mapped "{[/api/text2txt/{word1}/{word2}/{word3}],methods=[GET]}" onto public org.springframework.http.ResponseEntity<java.lang.String> org.restscs.ScsRest.text2txt(java.lang.String,java.lang.String,java.lang.String)
2024-09-11 15:42:18.582  INFO 5631 --- [           main] s.w.s.m.m.a.RequestMappingHandlerMapping : Mapped "{[/swagger-resources/configuration/ui]}" onto public org.springframework.http.ResponseEntity<springfox.documentation.swagger.web.UiConfiguration> springfox.documentation.swagger.web.ApiResourceController.uiConfiguration()
2024-09-11 15:42:18.584  INFO 5631 --- [           main] s.w.s.m.m.a.RequestMappingHandlerMapping : Mapped "{[/swagger-resources]}" onto public org.springframework.http.ResponseEntity<java.util.List<springfox.documentation.swagger.web.SwaggerResource>> springfox.documentation.swagger.web.ApiResourceController.swaggerResources()
2024-09-11 15:42:18.585  INFO 5631 --- [           main] s.w.s.m.m.a.RequestMappingHandlerMapping : Mapped "{[/swagger-resources/configuration/security]}" onto public org.springframework.http.ResponseEntity<springfox.documentation.swagger.web.SecurityConfiguration> springfox.documentation.swagger.web.ApiResourceController.securityConfiguration()
2024-09-11 15:42:18.591  INFO 5631 --- [           main] s.w.s.m.m.a.RequestMappingHandlerMapping : Mapped "{[/error],produces=[text/html]}" onto public org.springframework.web.servlet.ModelAndView org.springframework.boot.autoconfigure.web.servlet.error.BasicErrorController.errorHtml(javax.servlet.http.HttpServletRequest,javax.servlet.http.HttpServletResponse)
2024-09-11 15:42:18.592  INFO 5631 --- [           main] s.w.s.m.m.a.RequestMappingHandlerMapping : Mapped "{[/error]}" onto public org.springframework.http.ResponseEntity<java.util.Map<java.lang.String, java.lang.Object>> org.springframework.boot.autoconfigure.web.servlet.error.BasicErrorController.error(javax.servlet.http.HttpServletRequest)
2024-09-11 15:42:18.766  INFO 5631 --- [           main] pertySourcedRequestMappingHandlerMapping : Mapped URL path [/v2/api-docs] onto method [public org.springframework.http.ResponseEntity<springfox.documentation.spring.web.json.Json> springfox.documentation.swagger2.web.Swagger2Controller.getDocumentation(java.lang.String,javax.servlet.http.HttpServletRequest)]
2024-09-11 15:42:18.876  INFO 5631 --- [           main] o.s.w.s.handler.SimpleUrlHandlerMapping  : Mapped URL path [/**/favicon.ico] onto handler of type [class org.springframework.web.servlet.resource.ResourceHttpRequestHandler]
2024-09-11 15:42:19.097  INFO 5631 --- [           main] s.w.s.m.m.a.RequestMappingHandlerAdapter : Looking for @ControllerAdvice: org.springframework.boot.web.servlet.context.AnnotationConfigServletWebServerApplicationContext@4899799b: startup date [Wed Sep 11 15:42:15 BRT 2024]; root of context hierarchy
2024-09-11 15:42:19.204  INFO 5631 --- [           main] o.s.w.s.handler.SimpleUrlHandlerMapping  : Mapped URL path [/webjars/**] onto handler of type [class org.springframework.web.servlet.resource.ResourceHttpRequestHandler]
2024-09-11 15:42:19.204  INFO 5631 --- [           main] o.s.w.s.handler.SimpleUrlHandlerMapping  : Mapped URL path [/**] onto handler of type [class org.springframework.web.servlet.resource.ResourceHttpRequestHandler]
2024-09-11 15:42:19.533  INFO 5631 --- [           main] o.s.j.e.a.AnnotationMBeanExporter        : Registering beans for JMX exposure on startup
2024-09-11 15:42:19.552  INFO 5631 --- [           main] o.s.c.support.DefaultLifecycleProcessor  : Starting beans in phase 2147483647
2024-09-11 15:42:19.553  INFO 5631 --- [           main] d.s.w.p.DocumentationPluginsBootstrapper : Context refreshed
2024-09-11 15:42:19.594  INFO 5631 --- [           main] d.s.w.p.DocumentationPluginsBootstrapper : Found 1 custom documentation plugin(s)
2024-09-11 15:42:19.667  INFO 5631 --- [           main] s.d.s.w.s.ApiListingReferenceScanner     : Scanning for api listing references
2024-09-11 15:42:19.942  INFO 5631 --- [           main] o.s.b.w.embedded.tomcat.TomcatWebServer  : Tomcat started on port(s): 40081 (http) with context path ''
2024-09-11 15:42:19.950  INFO 5631 --- [           main] o.a.maven.surefire.booter.ForkedBooter   : Started ForkedBooter in 6.486 seconds (JVM running for 7.465)
2024-09-11 15:42:21.583  INFO 5631 --- [           main] o.s.c.support.DefaultLifecycleProcessor  : Stopping beans in phase 2147483647
[[1;31mERROR[m] [1;31mTests [0;1mrun: [0;1m5[m, Failures: 0, [1;31mErrors: [0;1;31m5[m, Skipped: 0, Time elapsed: 8.52 s[1;31m <<< FAILURE![m - in org.restscs.[1mv3_gpt4turbo_run03_RegexTest[m
[[1;31mERROR[m] testSubject_withValidUrl(org.restscs.v3_gpt4turbo_run03_RegexTest)  Time elapsed: 0.97 s  <<< ERROR!
java.net.ConnectException: Conexão recusada (Connection refused)
	at org.restscs.v3_gpt4turbo_run03_RegexTest.testSubject_withValidUrl(v3_gpt4turbo_run03_RegexTest.java:61)

[[1;31mERROR[m] testSubject_withValidDate(org.restscs.v3_gpt4turbo_run03_RegexTest)  Time elapsed: 0.02 s  <<< ERROR!
java.net.ConnectException: Conexão recusada (Connection refused)
	at org.restscs.v3_gpt4turbo_run03_RegexTest.testSubject_withValidDate(v3_gpt4turbo_run03_RegexTest.java:71)

[[1;31mERROR[m] testSubject_withValidFpe(org.restscs.v3_gpt4turbo_run03_RegexTest)  Time elapsed: 0.022 s  <<< ERROR!
java.net.ConnectException: Conexão recusada (Connection refused)
	at org.restscs.v3_gpt4turbo_run03_RegexTest.testSubject_withValidFpe(v3_gpt4turbo_run03_RegexTest.java:81)

[[1;31mERROR[m] testSubject_withInvalidInput(org.restscs.v3_gpt4turbo_run03_RegexTest)  Time elapsed: 0.018 s  <<< ERROR!
java.net.ConnectException: Conexão recusada (Connection refused)
	at org.restscs.v3_gpt4turbo_run03_RegexTest.testSubject_withInvalidInput(v3_gpt4turbo_run03_RegexTest.java:91)

[[1;31mERROR[m] testSubject_withServerErrorSimulation(org.restscs.v3_gpt4turbo_run03_RegexTest)  Time elapsed: 0.014 s  <<< ERROR!
java.net.ConnectException: Conexão recusada (Connection refused)
	at org.restscs.v3_gpt4turbo_run03_RegexTest.testSubject_withServerErrorSimulation(v3_gpt4turbo_run03_RegexTest.java:101)

2024-09-11 15:42:21.634  INFO 5631 --- [       Thread-4] ConfigServletWebServerApplicationContext : Closing org.springframework.boot.web.servlet.context.AnnotationConfigServletWebServerApplicationContext@4899799b: startup date [Wed Sep 11 15:42:15 BRT 2024]; root of context hierarchy
2024-09-11 15:42:21.638  INFO 5631 --- [       Thread-4] o.s.c.support.DefaultLifecycleProcessor  : Stopping beans in phase 2147483647
2024-09-11 15:42:21.638  INFO 5631 --- [       Thread-4] o.s.j.e.a.AnnotationMBeanExporter        : Unregistering JMX-exposed beans on shutdown
[[1;34mINFO[m] 
[[1;34mINFO[m] Results:
[[1;34mINFO[m] 
[[1;31mERROR[m] [1;31mErrors: [m
[[1;31mERROR[m] [1;31m  v3_gpt4turbo_run03_RegexTest.testSubject_withInvalidInput:91 » Connect Conexão...[m
[[1;31mERROR[m] [1;31m  v3_gpt4turbo_run03_RegexTest.testSubject_withServerErrorSimulation:101 » Connect[m
[[1;31mERROR[m] [1;31m  v3_gpt4turbo_run03_RegexTest.testSubject_withValidDate:71 » Connect Conexão re...[m
[[1;31mERROR[m] [1;31m  v3_gpt4turbo_run03_RegexTest.testSubject_withValidFpe:81 » Connect Conexão rec...[m
[[1;31mERROR[m] [1;31m  v3_gpt4turbo_run03_RegexTest.testSubject_withValidUrl:61 » Connect Conexão rec...[m
[[1;34mINFO[m] 
[[1;31mERROR[m] [1;31mTests run: 5, Failures: 0, Errors: 5, Skipped: 0[m
[[1;34mINFO[m] 
[[1;34mINFO[m] [1m------------------------------------------------------------------------[m
[[1;34mINFO[m] [1;31mBUILD FAILURE[m
[[1;34mINFO[m] [1m------------------------------------------------------------------------[m
[[1;34mINFO[m] Total time:  12.782 s
[[1;34mINFO[m] Finished at: 2024-09-11T15:42:22-03:00
[[1;34mINFO[m] [1m------------------------------------------------------------------------[m
[[1;31mERROR[m] Failed to execute goal [32morg.apache.maven.plugins:maven-surefire-plugin:2.22.0:test[m [1m(default-test)[m on project [36mevomaster-benchmark-cs-rest-artificial-scs[m: [1;31mThere are test failures.[m
[[1;31mERROR[m] [1;31m[m
[[1;31mERROR[m] [1;31mPlease refer to /media/rincon/63999417195/eclipse-workspace/EMB-master/jdk_8_maven/cs/rest/artificial/scs/target/surefire-reports for the individual test results.[m
[[1;31mERROR[m] [1;31mPlease refer to dump files (if any exist) [date]-jvmRun[N].dump, [date].dumpstream and [date]-jvmRun[N].dumpstream.[m
[[1;31mERROR[m] -> [1m[Help 1][m
[[1;31mERROR[m] 
[[1;31mERROR[m] To see the full stack trace of the errors, re-run Maven with the [1m-e[m switch.
[[1;31mERROR[m] Re-run Maven using the [1m-X[m switch to enable full debug logging.
[[1;31mERROR[m] 
[[1;31mERROR[m] For more information about the errors and possible solutions, please read the following articles:
[[1;31mERROR[m] [1m[Help 1][m http://cwiki.apache.org/confluence/display/MAVEN/MojoFailureException

#####
