Correct the test code delimited by ***** according to the error messages delimited by ##### and generate another complete code in JUnit 5 format. The response must contain only Java code in JUnit 5 format.

Keep these five instructions for this generated test code:

Instruction 1: Keet this package line to generated test code file:
package market;

Instruction 2: Keep the following Java imports to generated test code file:
import  org.junit.jupiter.api.AfterAll;
import  org.junit.jupiter.api.BeforeAll;
import  org.junit.jupiter.api.BeforeEach;
import  org.junit.jupiter.api.Test;
import  org.junit.jupiter.api.Timeout;
import static org.junit.jupiter.api.Assertions.*;
import  java.util.Map;
import  java.util.List;
import static org.evomaster.client.java.controller.api.EMTestUtils.*;
import  org.evomaster.client.java.controller.SutHandler;
import  io.restassured.RestAssured;
import static io.restassured.RestAssured.given;
import  io.restassured.response.ValidatableResponse;
import static org.evomaster.client.java.sql.dsl.SqlDsl.sql;
import  org.evomaster.client.java.controller.api.dto.database.operations.InsertionResultsDto;
import  org.evomaster.client.java.controller.api.dto.database.operations.InsertionDto;
import static org.hamcrest.Matchers.*;
import  io.restassured.config.JsonConfig;
import  io.restassured.path.json.config.JsonPathConfig;
import static io.restassured.config.RedirectConfig.redirectConfig;
import static org.evomaster.client.java.controller.contentMatchers.NumberMatcher.*;
import static org.evomaster.client.java.controller.contentMatchers.StringMatcher.*;
import static org.evomaster.client.java.controller.contentMatchers.SubStringMatcher.*;
import static org.evomaster.client.java.controller.expect.ExpectationHandler.expectationHandler;
import  org.evomaster.client.java.controller.expect.ExpectationHandler;
import  io.restassured.path.json.JsonPath;
import  java.util.Arrays;

Instruction 3: Keep the class name in this point (between the imports at instruction 2 and instruction 4)

Instruction 4: Keep these variables in the generated test code:
private static final SutHandler controller = new em.embedded.market.EmbeddedEvoMasterController();
private static String baseUrlOfSut;

Instruction 5: Keep the following setup and teardown methods in generated test code file:
@BeforeAll
public static void initClass() {
    controller.setupForGeneratedTest();
    baseUrlOfSut = controller.startSut();
    controller.registerOrExecuteInitSqlCommandsIfNeeded();
    assertNotNull(baseUrlOfSut);
    RestAssured.enableLoggingOfRequestAndResponseIfValidationFails();
    RestAssured.useRelaxedHTTPSValidation();
    RestAssured.urlEncodingEnabled = false;
    RestAssured.config = RestAssured.config()
        .jsonConfig(JsonConfig.jsonConfig().numberReturnType(JsonPathConfig.NumberReturnType.DOUBLE))
        .redirect(redirectConfig().followRedirects(false));
}


@AfterAll
public static void tearDown() {
    controller.stopSut();
}


@BeforeEach
public void initTest() {
    controller.resetDatabase(Arrays.asList("USER_ROLE","CUSTOMER_ORDER","CART_ITEM","PRODUCT","CART","CONTACTS"));
    controller.resetStateOfSUT();
}

*****

package market;

import org.junit.jupiter.api.AfterAll;
import org.junit.jupiter.api.BeforeAll;
import org.junit.jupiter.api.BeforeEach;
import org.junit.jupiter.api.Test;
import org.junit.jupiter.api.Timeout;
import static org.junit.jupiter.api.Assertions.*;
import java.util.Map;
import java.util.List;
import static org.evomaster.client.java.controller.api.EMTestUtils.*;
import org.evomaster.client.java.controller.SutHandler;
import io.restassured.RestAssured;
import static io.restassured.RestAssured.given;
import io.restassured.response.ValidatableResponse;
import static org.hamcrest.Matchers.*;
import io.restassured.config.JsonConfig;
import io.restassured.path.json.config.JsonPathConfig;
import static io.restassured.config.RedirectConfig.redirectConfig;
import static org.evomaster.client.java.controller.contentMatchers.NumberMatcher.*;
import static org.evomaster.client.java.controller.contentMatchers.StringMatcher.*;
import static org.evomaster.client.java.controller.contentMatchers.SubStringMatcher.*;
import static org.evomaster.client.java.controller.expect.ExpectationHandler.expectationHandler;
import org.evomaster.client.java.controller.expect.ExpectationHandler;
import io.restassured.path.json.JsonPath;
import java.util.Arrays;

public class run08_CustomerRestControllerTest {
    private static final SutHandler controller = new em.embedded.market.EmbeddedEvoMasterController();
    private static String baseUrlOfSut;

    @BeforeAll
    public static void initClass() {
        controller.setupForGeneratedTest();
        baseUrlOfSut = controller.startSut();
        controller.registerOrExecuteInitSqlCommandsIfNeeded();
        assertNotNull(baseUrlOfSut);
        RestAssured.enableLoggingOfRequestAndResponseIfValidationFails();
        RestAssured.useRelaxedHTTPSValidation();
        RestAssured.urlEncodingEnabled = false;
        RestAssured.config = RestAssured.config()
            .jsonConfig(JsonConfig.jsonConfig().numberReturnType(JsonPathConfig.NumberReturnType.DOUBLE))
            .redirect(redirectConfig().followRedirects(false));
    }

    @AfterAll
    public static void tearDown() {
        controller.stopSut();
    }

    @BeforeEach
    public void initTest() {
        controller.resetDatabase(Arrays.asList("USER_ROLE","CUSTOMER_ORDER","CART_ITEM","PRODUCT","CART","CONTACTS"));
        controller.resetStateOfSUT();
    }

    @Test
    void testGetCustomer_200() {
        given().auth().preemptive().basic("ivan.petrov@yandex.ru", "petrov")
            .when().get(baseUrlOfSut + "/customer")
            .then().statusCode(200)
            .body("email", equalTo("ivan.petrov@yandex.ru"))
            .body("name", equalTo("Ivan Petrov"));
    }

    @Test
    void testGetCustomer_401() {
        given()
            .when().get(baseUrlOfSut + "/customer")
            .then().statusCode(401);
    }

    @Test
    void testGetCustomer_403() {
        given().auth().preemptive().basic("unauthorized@mail.com", "wrongpassword")
            .when().get(baseUrlOfSut + "/customer")
            .then().statusCode(403);
    }

    @Test
    void testCreateCustomer_201() {
        UserDTO user = new UserDTO("ivan.petrov@yandex.ru", "petrov", "Ivan Petrov", "+7 123 456 78 90", "Riesstrasse 18");
        given().contentType("application/json")
            .body(user)
            .when().post(baseUrlOfSut + "/register")
            .then().statusCode(201)
            .body("email", equalTo("ivan.petrov@yandex.ru"))
            .body("phone", equalTo("+7 123 456 78 90"))
            .body("address", equalTo("Riesstrasse 18"));
    }

    @Test
    void testCreateCustomer_400() {
        UserDTO user = new UserDTO("invalidemail", "123", "", "", "");
        given().contentType("application/json")
            .body(user)
            .when().post(baseUrlOfSut + "/register")
            .then().statusCode(400);
    }

    @Test
    void testCreateCustomer_409() {
        UserDTO user = new UserDTO("ivan.petrov@yandex.ru", "petrov", "Ivan Petrov", "+7 123 456 78 90", "Riesstrasse 18");
        given().contentType("application/json")
            .body(user)
            .when().post(baseUrlOfSut + "/register")
            .then().statusCode(409);
    }

    static class UserDTO {
        private String email;
        private String password;
        private String name;
        private String phone;
        private String address;

        public UserDTO(String email, String password, String name, String phone, String address) {
            this.email = email;
            this.password = password;
            this.name = name;
            this.phone = phone;
            this.address = address;
        }

        // Getters and Setters
    }
}

*****
#####
[[1;34mINFO[m] Scanning for projects...
[[1;34mINFO[m] 
[[1;34mINFO[m] [1m---------------------< [0;36mnet.lukyanets:market-rest[0;1m >----------------------[m
[[1;34mINFO[m] [1mBuilding market-rest 0.1.2[m
[[1;34mINFO[m] [1m--------------------------------[ jar ]---------------------------------[m
[[1;33mWARNING[m] The POM for com.sun.xml.bind:jaxb-osgi:jar:2.2.10 is invalid, transitive dependencies (if any) will not be available, enable debug logging for more details
[[1;34mINFO[m] 
[[1;34mINFO[m] [1m--- [0;32mmaven-clean-plugin:2.5:clean[m [1m(default-clean)[m @ [36mmarket-rest[0;1m ---[m
[[1;34mINFO[m] Deleting /media/rincon/63999417195/eclipse-workspace/EMB-master/jdk_11_maven/cs/rest-gui/market/market-rest/target
[[1;34mINFO[m] 
[[1;34mINFO[m] [1m--- [0;32mjacoco-maven-plugin:0.8.7:prepare-agent[m [1m(default)[m @ [36mmarket-rest[0;1m ---[m
[[1;34mINFO[m] argLine set to -javaagent:/home/rincon/.m2/repository/org/jacoco/org.jacoco.agent/0.8.7/org.jacoco.agent-0.8.7-runtime.jar=destfile=/media/rincon/63999417195/eclipse-workspace/EMB-master/jdk_11_maven/cs/rest-gui/market/market-rest/target/jacoco.exec
[[1;34mINFO[m] 
[[1;34mINFO[m] [1m--- [0;32mspring-boot-maven-plugin:2.4.3:build-info[m [1m(default)[m @ [36mmarket-rest[0;1m ---[m
[[1;34mINFO[m] 
[[1;34mINFO[m] [1m--- [0;32mmaven-resources-plugin:2.6:resources[m [1m(default-resources)[m @ [36mmarket-rest[0;1m ---[m
[[1;34mINFO[m] Using 'UTF-8' encoding to copy filtered resources.
[[1;34mINFO[m] Copying 3 resources
[[1;34mINFO[m] 
[[1;34mINFO[m] [1m--- [0;32mmaven-compiler-plugin:3.8.0:compile[m [1m(default-compile)[m @ [36mmarket-rest[0;1m ---[m
[[1;34mINFO[m] Changes detected - recompiling the module!
[[1;34mINFO[m] Compiling 11 source files to /media/rincon/63999417195/eclipse-workspace/EMB-master/jdk_11_maven/cs/rest-gui/market/market-rest/target/classes
[[1;34mINFO[m] 
[[1;34mINFO[m] [1m--- [0;32mjacoco-maven-plugin:0.8.7:prepare-agent[m [1m(default)[m @ [36mmarket-rest[0;1m ---[m
[[1;34mINFO[m] argLine set to -javaagent:/home/rincon/.m2/repository/org/jacoco/org.jacoco.agent/0.8.7/org.jacoco.agent-0.8.7-runtime.jar=destfile=/media/rincon/63999417195/eclipse-workspace/EMB-master/jdk_11_maven/cs/rest-gui/market/market-rest/target/jacoco.exec
[[1;34mINFO[m] 
[[1;34mINFO[m] [1m--- [0;32mspring-boot-maven-plugin:2.4.3:build-info[m [1m(default)[m @ [36mmarket-rest[0;1m ---[m
[[1;34mINFO[m] 
[[1;34mINFO[m] [1m--- [0;32mmaven-resources-plugin:2.6:resources[m [1m(default-resources)[m @ [36mmarket-rest[0;1m ---[m
[[1;34mINFO[m] Using 'UTF-8' encoding to copy filtered resources.
[[1;34mINFO[m] Copying 3 resources
[[1;34mINFO[m] 
[[1;34mINFO[m] [1m--- [0;32mmaven-compiler-plugin:3.8.0:compile[m [1m(default-compile)[m @ [36mmarket-rest[0;1m ---[m
[[1;34mINFO[m] Nothing to compile - all classes are up to date
[[1;34mINFO[m] 
[[1;34mINFO[m] [1m--- [0;32mmaven-resources-plugin:2.6:testResources[m [1m(default-testResources)[m @ [36mmarket-rest[0;1m ---[m
[[1;34mINFO[m] Using 'UTF-8' encoding to copy filtered resources.
[[1;34mINFO[m] skip non existing resourceDirectory /media/rincon/63999417195/eclipse-workspace/EMB-master/jdk_11_maven/cs/rest-gui/market/market-rest/src/test/resources
[[1;34mINFO[m] 
[[1;34mINFO[m] [1m--- [0;32mmaven-compiler-plugin:3.8.0:testCompile[m [1m(default-testCompile)[m @ [36mmarket-rest[0;1m ---[m
[[1;34mINFO[m] Changes detected - recompiling the module!
[[1;34mINFO[m] Compiling 1 source file to /media/rincon/63999417195/eclipse-workspace/EMB-master/jdk_11_maven/cs/rest-gui/market/market-rest/target/test-classes
[[1;34mINFO[m] 
[[1;34mINFO[m] [1m--- [0;32mjacoco-maven-plugin:0.8.7:prepare-agent[m [1m(default)[m @ [36mmarket-rest[0;1m ---[m
[[1;34mINFO[m] argLine set to -javaagent:/home/rincon/.m2/repository/org/jacoco/org.jacoco.agent/0.8.7/org.jacoco.agent-0.8.7-runtime.jar=destfile=/media/rincon/63999417195/eclipse-workspace/EMB-master/jdk_11_maven/cs/rest-gui/market/market-rest/target/jacoco.exec
[[1;34mINFO[m] 
[[1;34mINFO[m] [1m--- [0;32mspring-boot-maven-plugin:2.4.3:build-info[m [1m(default)[m @ [36mmarket-rest[0;1m ---[m
[[1;34mINFO[m] 
[[1;34mINFO[m] [1m--- [0;32mmaven-resources-plugin:2.6:resources[m [1m(default-resources)[m @ [36mmarket-rest[0;1m ---[m
[[1;34mINFO[m] Using 'UTF-8' encoding to copy filtered resources.
[[1;34mINFO[m] Copying 3 resources
[[1;34mINFO[m] 
[[1;34mINFO[m] [1m--- [0;32mmaven-compiler-plugin:3.8.0:compile[m [1m(default-compile)[m @ [36mmarket-rest[0;1m ---[m
[[1;34mINFO[m] Nothing to compile - all classes are up to date
[[1;34mINFO[m] 
[[1;34mINFO[m] [1m--- [0;32mmaven-resources-plugin:2.6:testResources[m [1m(default-testResources)[m @ [36mmarket-rest[0;1m ---[m
[[1;34mINFO[m] Using 'UTF-8' encoding to copy filtered resources.
[[1;34mINFO[m] skip non existing resourceDirectory /media/rincon/63999417195/eclipse-workspace/EMB-master/jdk_11_maven/cs/rest-gui/market/market-rest/src/test/resources
[[1;34mINFO[m] 
[[1;34mINFO[m] [1m--- [0;32mmaven-compiler-plugin:3.8.0:testCompile[m [1m(default-testCompile)[m @ [36mmarket-rest[0;1m ---[m
[[1;34mINFO[m] Nothing to compile - all classes are up to date
[[1;34mINFO[m] 
[[1;34mINFO[m] [1m--- [0;32mmaven-surefire-plugin:2.22.0:test[m [1m(default-test)[m @ [36mmarket-rest[0;1m ---[m
[[1;34mINFO[m] 
[[1;34mINFO[m] -------------------------------------------------------
[[1;34mINFO[m]  T E S T S
[[1;34mINFO[m] -------------------------------------------------------
[[1;34mINFO[m] Running market.[1mrun08_CustomerRestControllerTest[m

  .   ____          _            __ _ _
 /\\ / ___'_ __ _ _(_)_ __  __ _ \ \ \ \
( ( )\___ | '_ | '_| | '_ \/ _` | \ \ \ \
 \\/  ___)| |_)| | | | | || (_| |  ) ) ) )
  '  |____| .__|_| |_|_| |_\__, | / / / /
 =========|_|==============|___/=/_/_/_/
 :: Spring Boot ::                (v2.4.3)

2024-07-31 17:12:01,027 INFO  [background-preinit] o.h.v.i.u.Version - HV000001: Hibernate Validator 6.1.7.Final
2024-07-31 17:12:01,158 INFO  [main] o.a.m.s.b.ForkedBooter - Starting ForkedBooter v2.22.0 using Java 11.0.20 on IFTO-PROBOOK with PID 41122 (started by rincon in /media/rincon/63999417195/eclipse-workspace/EMB-master/jdk_11_maven/cs/rest-gui/market/market-rest)
2024-07-31 17:12:01,165 INFO  [main] o.a.m.s.b.ForkedBooter - No active profile set, falling back to default profiles: default
2024-07-31 17:12:01,923 WARN  [main] o.s.b.c.c.ConfigDataEnvironment - Property 'spring.profiles' imported from location 'class path resource [application.yml]' is invalid and should be replaced with 'spring.config.activate.on-profile' [origin: class path resource [application.yml] - 34:13]
2024-07-31 17:12:01,923 WARN  [main] o.s.b.c.c.ConfigDataEnvironment - Property 'spring.profiles' imported from location 'class path resource [application.yml]' is invalid and should be replaced with 'spring.config.activate.on-profile' [origin: class path resource [application.yml] - 24:13]
2024-07-31 17:12:03,959 INFO  [main] o.s.d.r.c.RepositoryConfigurationDelegate - Bootstrapping Spring Data JPA repositories in DEFAULT mode.
2024-07-31 17:12:04,132 INFO  [main] o.s.d.r.c.RepositoryConfigurationDelegate - Finished Spring Data repository scanning in 158 ms. Found 8 JPA repository interfaces.
2024-07-31 17:12:04,739 INFO  [main] o.s.c.s.PostProcessorRegistrationDelegate$BeanPostProcessorChecker - Bean 'market.DataConfig' of type [market.DataConfig$$EnhancerBySpringCGLIB$$95828d5c] is not eligible for getting processed by all BeanPostProcessors (for example: not eligible for auto-proxying)
2024-07-31 17:12:04,950 INFO  [main] o.s.c.s.PostProcessorRegistrationDelegate$BeanPostProcessorChecker - Bean 'org.springframework.security.access.expression.method.DefaultMethodSecurityExpressionHandler@7e709c9' of type [org.springframework.security.access.expression.method.DefaultMethodSecurityExpressionHandler] is not eligible for getting processed by all BeanPostProcessors (for example: not eligible for auto-proxying)
2024-07-31 17:12:04,960 INFO  [main] o.s.c.s.PostProcessorRegistrationDelegate$BeanPostProcessorChecker - Bean 'methodSecurityMetadataSource' of type [org.springframework.security.access.method.DelegatingMethodSecurityMetadataSource] is not eligible for getting processed by all BeanPostProcessors (for example: not eligible for auto-proxying)
2024-07-31 17:12:05,603 INFO  [main] o.s.b.w.e.t.TomcatWebServer - Tomcat initialized with port(s): 0 (http)
2024-07-31 17:12:05,631 INFO  [main] o.a.c.h.Http11NioProtocol - Initializing ProtocolHandler ["http-nio-auto-1"]
2024-07-31 17:12:05,632 INFO  [main] o.a.c.c.StandardService - Starting service [Tomcat]
2024-07-31 17:12:05,632 INFO  [main] o.a.c.c.StandardEngine - Starting Servlet engine: [Apache Tomcat/9.0.43]
2024-07-31 17:12:05,808 INFO  [main] o.a.c.c.C.[.[.[/] - Initializing Spring embedded WebApplicationContext
2024-07-31 17:12:05,808 INFO  [main] o.s.b.w.s.c.ServletWebServerApplicationContext - Root WebApplicationContext: initialization completed in 3880 ms
2024-07-31 17:12:06,080 INFO  [main] c.z.h.HikariDataSource - HikariPool-1 - Starting...
2024-07-31 17:12:06,628 INFO  [main] c.z.h.HikariDataSource - HikariPool-1 - Start completed.
2024-07-31 17:12:06,868 INFO  [main] o.h.j.i.u.LogHelper - HHH000204: Processing PersistenceUnitInfo [name: default]
2024-07-31 17:12:07,003 INFO  [main] o.h.Version - HHH000412: Hibernate ORM core version 5.4.28.Final
2024-07-31 17:12:07,266 INFO  [main] o.h.a.c.Version - HCANN000001: Hibernate Commons Annotations {5.1.2.Final}
2024-07-31 17:12:07,658 INFO  [main] o.h.d.Dialect - HHH000400: Using dialect: org.hibernate.dialect.H2Dialect
2024-07-31 17:12:08,040 WARN  [main] o.h.b.i.InFlightMetadataCollectorImpl - HHH000069: Duplicate generator name gen
2024-07-31 17:12:08,044 WARN  [main] o.h.b.i.InFlightMetadataCollectorImpl - HHH000069: Duplicate generator name gen
2024-07-31 17:12:09,045 INFO  [main] o.h.e.t.j.p.i.JtaPlatformInitiator - HHH000490: Using JtaPlatform implementation: [org.hibernate.engine.transaction.jta.platform.internal.NoJtaPlatform]
2024-07-31 17:12:09,060 INFO  [main] o.s.o.j.LocalContainerEntityManagerFactoryBean - Initialized JPA EntityManagerFactory for persistence unit 'default'
2024-07-31 17:12:10,536 WARN  [main] o.s.b.a.o.j.JpaBaseConfiguration$JpaWebConfiguration - spring.jpa.open-in-view is enabled by default. Therefore, database queries may be performed during view rendering. Explicitly configure spring.jpa.open-in-view to disable this warning
2024-07-31 17:12:11,838 INFO  [main] o.s.s.w.DefaultSecurityFilterChain - Will secure any request with [org.springframework.security.web.context.request.async.WebAsyncManagerIntegrationFilter@3aa5b57f, org.springframework.security.web.context.SecurityContextPersistenceFilter@7073a667, org.springframework.security.web.header.HeaderWriterFilter@3801e08c, org.springframework.security.web.authentication.logout.LogoutFilter@26e8b51a, org.springframework.security.web.authentication.www.BasicAuthenticationFilter@81a32ef, org.springframework.security.web.savedrequest.RequestCacheAwareFilter@2fccce14, org.springframework.security.web.servletapi.SecurityContextHolderAwareRequestFilter@2fc0b417, org.springframework.security.web.authentication.AnonymousAuthenticationFilter@1338e0eb, org.springframework.security.web.session.SessionManagementFilter@50f61a50, org.springframework.security.web.access.ExceptionTranslationFilter@18a8ed9d, org.springframework.security.web.access.intercept.FilterSecurityInterceptor@286b1cb4]
2024-07-31 17:12:12,018 INFO  [main] o.s.s.c.ThreadPoolTaskExecutor - Initializing ExecutorService 'applicationTaskExecutor'
2024-07-31 17:12:12,550 INFO  [main] o.a.c.h.Http11NioProtocol - Starting ProtocolHandler ["http-nio-auto-1"]
2024-07-31 17:12:12,588 INFO  [main] o.s.b.w.e.t.TomcatWebServer - Tomcat started on port(s): 34189 (http) with context path ''
2024-07-31 17:12:13,254 INFO  [main] o.a.m.s.b.ForkedBooter - Started ForkedBooter in 13.222 seconds (JVM running for 15.952)
2024-07-31 17:12:15,828 INFO  [http-nio-auto-1-exec-1] o.a.c.c.C.[.[.[/] - Initializing Spring DispatcherServlet 'dispatcherServlet'
2024-07-31 17:12:15,828 INFO  [http-nio-auto-1-exec-1] o.s.w.s.DispatcherServlet - Initializing Servlet 'dispatcherServlet'
2024-07-31 17:12:15,830 INFO  [http-nio-auto-1-exec-1] o.s.w.s.DispatcherServlet - Completed initialization in 2 ms
Request method:	GET
Request URI:	http://localhost:34189/customer
Proxy:			<none>
Request params:	<none>
Query params:	<none>
Form params:	<none>
Path params:	<none>
Headers:		Authorization=Basic dW5hdXRob3JpemVkQG1haWwuY29tOndyb25ncGFzc3dvcmQ=
				Accept=*/*
Cookies:		<none>
Multiparts:		<none>
Body:			<none>

HTTP/1.1 401 
WWW-Authenticate: Basic realm="Realm"
X-Content-Type-Options: nosniff
X-XSS-Protection: 1; mode=block
Cache-Control: no-cache, no-store, max-age=0, must-revalidate
Pragma: no-cache
Expires: 0
Content-Type: application/json
Transfer-Encoding: chunked
Date: Wed, 31 Jul 2024 20:12:17 GMT
Keep-Alive: timeout=60
Connection: keep-alive

{
    "timestamp": "2024-07-31T20:12:17.922+00:00",
    "status": 401,
    "error": "Unauthorized",
    "message": "",
    "path": "/customer"
}
2024-07-31 17:12:18,136 INFO  [main] o.a.c.h.Http11NioProtocol - Pausing ProtocolHandler ["http-nio-auto-1"]
2024-07-31 17:12:18,137 INFO  [main] o.a.c.c.StandardService - Stopping service [Tomcat]
2024-07-31 17:12:18,140 INFO  [main] o.a.c.c.C.[.[.[/] - Destroying Spring FrameworkServlet 'dispatcherServlet'
2024-07-31 17:12:18,145 INFO  [main] o.a.c.h.Http11NioProtocol - Stopping ProtocolHandler ["http-nio-auto-1"]
2024-07-31 17:12:18,150 INFO  [main] o.a.c.h.Http11NioProtocol - Destroying ProtocolHandler ["http-nio-auto-1"]
[[1;31mERROR[m] [1;31mTests [0;1mrun: [0;1m6[m, [1;31mFailures: [0;1;31m1[m, [1;31mErrors: [0;1;31m3[m, Skipped: 0, Time elapsed: 19.534 s[1;31m <<< FAILURE![m - in market.[1mrun08_CustomerRestControllerTest[m
[[1;31mERROR[m] testGetCustomer_403  Time elapsed: 0.223 s  <<< FAILURE!
java.lang.AssertionError: 
1 expectation failed.
Expected status code <403> but was <401>.

	at market.run08_CustomerRestControllerTest.testGetCustomer_403(run08_CustomerRestControllerTest.java:78)

[[1;31mERROR[m] testCreateCustomer_201  Time elapsed: 0.116 s  <<< ERROR!
com.fasterxml.jackson.databind.exc.InvalidDefinitionException: No serializer found for class market.run08_CustomerRestControllerTest$UserDTO and no properties discovered to create BeanSerializer (to avoid exception, disable SerializationFeature.FAIL_ON_EMPTY_BEANS)
	at market.run08_CustomerRestControllerTest.testCreateCustomer_201(run08_CustomerRestControllerTest.java:85)

[[1;31mERROR[m] testCreateCustomer_400  Time elapsed: 0.018 s  <<< ERROR!
com.fasterxml.jackson.databind.exc.InvalidDefinitionException: No serializer found for class market.run08_CustomerRestControllerTest$UserDTO and no properties discovered to create BeanSerializer (to avoid exception, disable SerializationFeature.FAIL_ON_EMPTY_BEANS)
	at market.run08_CustomerRestControllerTest.testCreateCustomer_400(run08_CustomerRestControllerTest.java:97)

[[1;31mERROR[m] testCreateCustomer_409  Time elapsed: 0.017 s  <<< ERROR!
com.fasterxml.jackson.databind.exc.InvalidDefinitionException: No serializer found for class market.run08_CustomerRestControllerTest$UserDTO and no properties discovered to create BeanSerializer (to avoid exception, disable SerializationFeature.FAIL_ON_EMPTY_BEANS)
	at market.run08_CustomerRestControllerTest.testCreateCustomer_409(run08_CustomerRestControllerTest.java:106)

2024-07-31 17:12:18,487 INFO  [SpringContextShutdownHook] o.s.s.c.ThreadPoolTaskExecutor - Shutting down ExecutorService 'applicationTaskExecutor'
2024-07-31 17:12:18,497 INFO  [SpringContextShutdownHook] o.s.o.j.LocalContainerEntityManagerFactoryBean - Closing JPA EntityManagerFactory for persistence unit 'default'
2024-07-31 17:12:18,501 INFO  [SpringContextShutdownHook] c.z.h.HikariDataSource - HikariPool-1 - Shutdown initiated...
2024-07-31 17:12:18,505 INFO  [SpringContextShutdownHook] c.z.h.HikariDataSource - HikariPool-1 - Shutdown completed.
[[1;34mINFO[m] 
[[1;34mINFO[m] Results:
[[1;34mINFO[m] 
[[1;31mERROR[m] [1;31mFailures: [m
[[1;31mERROR[m] [1;31m  run08_CustomerRestControllerTest.testGetCustomer_403:78 1 expectation failed.
Expected status code <403> but was <401>.
[m
[[1;31mERROR[m] [1;31mErrors: [m
[[1;31mERROR[m] [1;31m  run08_CustomerRestControllerTest.testCreateCustomer_201:85 » InvalidDefinition[m
[[1;31mERROR[m] [1;31m  run08_CustomerRestControllerTest.testCreateCustomer_400:97 » InvalidDefinition[m
[[1;31mERROR[m] [1;31m  run08_CustomerRestControllerTest.testCreateCustomer_409:106 » InvalidDefinition[m
[[1;34mINFO[m] 
[[1;31mERROR[m] [1;31mTests run: 6, Failures: 1, Errors: 3, Skipped: 0[m
[[1;34mINFO[m] 
[[1;34mINFO[m] [1m------------------------------------------------------------------------[m
[[1;34mINFO[m] [1;31mBUILD FAILURE[m
[[1;34mINFO[m] [1m------------------------------------------------------------------------[m
[[1;34mINFO[m] Total time:  26.355 s
[[1;34mINFO[m] Finished at: 2024-07-31T17:12:18-03:00
[[1;34mINFO[m] [1m------------------------------------------------------------------------[m
[[1;31mERROR[m] Failed to execute goal [32morg.apache.maven.plugins:maven-surefire-plugin:2.22.0:test[m [1m(default-test)[m on project [36mmarket-rest[m: [1;31mThere are test failures.[m
[[1;31mERROR[m] [1;31m[m
[[1;31mERROR[m] [1;31mPlease refer to /media/rincon/63999417195/eclipse-workspace/EMB-master/jdk_11_maven/cs/rest-gui/market/market-rest/target/surefire-reports for the individual test results.[m
[[1;31mERROR[m] [1;31mPlease refer to dump files (if any exist) [date]-jvmRun[N].dump, [date].dumpstream and [date]-jvmRun[N].dumpstream.[m
[[1;31mERROR[m] -> [1m[Help 1][m
[[1;31mERROR[m] 
[[1;31mERROR[m] To see the full stack trace of the errors, re-run Maven with the [1m-e[m switch.
[[1;31mERROR[m] Re-run Maven using the [1m-X[m switch to enable full debug logging.
[[1;31mERROR[m] 
[[1;31mERROR[m] For more information about the errors and possible solutions, please read the following articles:
[[1;31mERROR[m] [1m[Help 1][m http://cwiki.apache.org/confluence/display/MAVEN/MojoFailureException

#####
