Correct the test code delimited by ***** according to the error messages delimited by ##### and generate another complete code in JUnit 5 format. The response must contain only Java code in JUnit 5 format.

Keep these five instructions for this generated test code:

Instruction 1: Keet this package line to generated test code file:
package market;

Instruction 2: Keep the following Java imports to generated test code file:
import  org.junit.jupiter.api.AfterAll;
import  org.junit.jupiter.api.BeforeAll;
import  org.junit.jupiter.api.BeforeEach;
import  org.junit.jupiter.api.Test;
import  org.junit.jupiter.api.Timeout;
import static org.junit.jupiter.api.Assertions.*;
import  java.util.Map;
import  java.util.List;
import static org.evomaster.client.java.controller.api.EMTestUtils.*;
import  org.evomaster.client.java.controller.SutHandler;
import  io.restassured.RestAssured;
import static io.restassured.RestAssured.given;
import  io.restassured.response.ValidatableResponse;
import static org.evomaster.client.java.sql.dsl.SqlDsl.sql;
import  org.evomaster.client.java.controller.api.dto.database.operations.InsertionResultsDto;
import  org.evomaster.client.java.controller.api.dto.database.operations.InsertionDto;
import static org.hamcrest.Matchers.*;
import  io.restassured.config.JsonConfig;
import  io.restassured.path.json.config.JsonPathConfig;
import static io.restassured.config.RedirectConfig.redirectConfig;
import static org.evomaster.client.java.controller.contentMatchers.NumberMatcher.*;
import static org.evomaster.client.java.controller.contentMatchers.StringMatcher.*;
import static org.evomaster.client.java.controller.contentMatchers.SubStringMatcher.*;
import static org.evomaster.client.java.controller.expect.ExpectationHandler.expectationHandler;
import  org.evomaster.client.java.controller.expect.ExpectationHandler;
import  io.restassured.path.json.JsonPath;
import  java.util.Arrays;

Instruction 3: Keep the class name in this point (between the imports at instruction 2 and instruction 4)

Instruction 4: Keep these variables in the generated test code:
private static final SutHandler controller = new em.embedded.market.EmbeddedEvoMasterController();
private static String baseUrlOfSut;

Instruction 5: Keep the following setup and teardown methods in generated test code file:
@BeforeAll
public static void initClass() {
    controller.setupForGeneratedTest();
    baseUrlOfSut = controller.startSut();
    controller.registerOrExecuteInitSqlCommandsIfNeeded();
    assertNotNull(baseUrlOfSut);
    RestAssured.enableLoggingOfRequestAndResponseIfValidationFails();
    RestAssured.useRelaxedHTTPSValidation();
    RestAssured.urlEncodingEnabled = false;
    RestAssured.config = RestAssured.config()
        .jsonConfig(JsonConfig.jsonConfig().numberReturnType(JsonPathConfig.NumberReturnType.DOUBLE))
        .redirect(redirectConfig().followRedirects(false));
}


@AfterAll
public static void tearDown() {
    controller.stopSut();
}


@BeforeEach
public void initTest() {
    controller.resetDatabase(Arrays.asList("USER_ROLE","CUSTOMER_ORDER","CART_ITEM","PRODUCT","CART","CONTACTS"));
    controller.resetStateOfSUT();
}

*****

package market;

import org.junit.jupiter.api.AfterAll;
import org.junit.jupiter.api.BeforeAll;
import org.junit.jupiter.api.BeforeEach;
import org.junit.jupiter.api.Test;
import org.junit.jupiter.api.Timeout;
import static org.junit.jupiter.api.Assertions.*;
import java.util.Map;
import java.util.List;
import static org.evomaster.client.java.controller.api.EMTestUtils.*;
import org.evomaster.client.java.controller.SutHandler;
import io.restassured.RestAssured;
import static io.restassured.RestAssured.given;
import io.restassured.response.ValidatableResponse;
import static org.evomaster.client.java.sql.dsl.SqlDsl.sql;
import org.evomaster.client.java.controller.api.dto.database.operations.InsertionResultsDto;
import org.evomaster.client.java.controller.api.dto.database.operations.InsertionDto;
import static org.hamcrest.Matchers.*;
import io.restassured.config.JsonConfig;
import io.restassured.path.json.config.JsonPathConfig;
import static io.restassured.config.RedirectConfig.redirectConfig;
import static org.evomaster.client.java.controller.contentMatchers.NumberMatcher.*;
import static org.evomaster.client.java.controller.contentMatchers.StringMatcher.*;
import static org.evomaster.client.java.controller.contentMatchers.SubStringMatcher.*;
import static org.evomaster.client.java.controller.expect.ExpectationHandler.expectationHandler;
import org.evomaster.client.java.controller.expect.ExpectationHandler;
import io.restassured.path.json.JsonPath;
import java.util.Arrays;

public class run01_RestErrorResponseTest {

    private static final SutHandler controller = new em.embedded.market.EmbeddedEvoMasterController();
    private static String baseUrlOfSut;

    @BeforeAll
    public static void initClass() {
        controller.setupForGeneratedTest();
        baseUrlOfSut = controller.startSut();
        controller.registerOrExecuteInitSqlCommandsIfNeeded();
        assertNotNull(baseUrlOfSut);
        RestAssured.enableLoggingOfRequestAndResponseIfValidationFails();
        RestAssured.useRelaxedHTTPSValidation();
        RestAssured.urlEncodingEnabled = false;
        RestAssured.config = RestAssured.config()
            .jsonConfig(JsonConfig.jsonConfig().numberReturnType(JsonPathConfig.NumberReturnType.DOUBLE))
            .redirect(redirectConfig().followRedirects(false));
    }

    @AfterAll
    public static void tearDown() {
        controller.stopSut();
    }

    @BeforeEach
    public void initTest() {
        controller.resetDatabase(Arrays.asList("USER_ROLE","CUSTOMER_ORDER","CART_ITEM","PRODUCT","CART","CONTACTS"));
        controller.resetStateOfSUT();
    }

    // Test Cases

    @Test
    public void testGetCustomer() {
        given().queryParam("name", "Ivan Petrov")
            .when().get(baseUrlOfSut + "/customer")
            .then().statusCode(200);
        
        given().queryParam("name", "NonExistentUser")
            .when().get(baseUrlOfSut + "/customer")
            .then().statusCode(404);
    }

    @Test
    public void testGetCart() {
        given().queryParam("name", "Ivan Petrov")
            .when().get(baseUrlOfSut + "/customer/cart")
            .then().statusCode(200);

        given().queryParam("name", "NonExistentUser")
            .when().get(baseUrlOfSut + "/customer/cart")
            .then().statusCode(404);
    }

    @Test
    public void testAddItemToCart() {
        String itemJson = "{ \"productId\": 1, \"quantity\": 2 }";

        given().queryParam("name", "Ivan Petrov")
            .body(itemJson).contentType("application/json")
            .when().put(baseUrlOfSut + "/customer/cart")
            .then().statusCode(200);

        given().queryParam("name", "NonExistentUser")
            .body(itemJson).contentType("application/json")
            .when().put(baseUrlOfSut + "/customer/cart")
            .then().statusCode(404);
    }

    @Test
    public void testClearCart() {
        given().queryParam("name", "Ivan Petrov")
            .when().delete(baseUrlOfSut + "/customer/cart")
            .then().statusCode(200);

        given().queryParam("name", "NonExistentUser")
            .when().delete(baseUrlOfSut + "/customer/cart")
            .then().statusCode(404);
    }

    @Test
    public void testSetDelivery() {
        given().queryParam("name", "Ivan Petrov")
            .queryParam("included", true)
            .when().put(baseUrlOfSut + "/customer/cart/delivery")
            .then().statusCode(200);

        given().queryParam("name", "NonExistentUser")
            .queryParam("included", true)
            .when().put(baseUrlOfSut + "/customer/cart/delivery")
            .then().statusCode(404);
    }

    @Test
    public void testPayByCard() {
        String cardJson = "{ \"ccNumber\": \"4111111111111111\" }";

        given().queryParam("name", "Ivan Petrov")
            .body(cardJson).contentType("application/json")
            .when().post(baseUrlOfSut + "/customer/cart/pay")
            .then().statusCode(201);

        given().queryParam("name", "NonExistentUser")
            .body(cardJson).contentType("application/json")
            .when().post(baseUrlOfSut + "/customer/cart/pay")
            .then().statusCode(404);
    }

    @Test
    public void testGetContacts() {
        given().queryParam("name", "Ivan Petrov")
            .when().get(baseUrlOfSut + "/customer/contacts")
            .then().statusCode(200);

        given().queryParam("name", "NonExistentUser")
            .when().get(baseUrlOfSut + "/customer/contacts")
            .then().statusCode(404);
    }

    @Test
    public void testUpdateContacts() {
        String contactsJson = "{ \"address\": \"New Address\", \"phone\": \"+7 123 456 78 90\" }";

        given().queryParam("name", "Ivan Petrov")
            .body(contactsJson).contentType("application/json")
            .when().put(baseUrlOfSut + "/customer/contacts")
            .then().statusCode(200);

        given().queryParam("name", "NonExistentUser")
            .body(contactsJson).contentType("application/json")
            .when().put(baseUrlOfSut + "/customer/contacts")
            .then().statusCode(404);
    }

    @Test
    public void testGetOrders() {
        given().queryParam("name", "Ivan Petrov")
            .when().get(baseUrlOfSut + "/customer/orders")
            .then().statusCode(200);

        given().queryParam("name", "NonExistentUser")
            .when().get(baseUrlOfSut + "/customer/orders")
            .then().statusCode(404);
    }

    @Test
    public void testGetOrder() {
        given().queryParam("name", "Ivan Petrov")
            .pathParam("orderId", 1)
            .when().get(baseUrlOfSut + "/customer/orders/{orderId}")
            .then().statusCode(200);

        given().queryParam("name", "NonExistentUser")
            .pathParam("orderId", 1)
            .when().get(baseUrlOfSut + "/customer/orders/{orderId}")
            .then().statusCode(404);
    }

    @Test
    public void testGetProducts() {
        given()
            .when().get(baseUrlOfSut + "/products")
            .then().statusCode(200);
    }

    @Test
    public void testGetProduct() {
        given().pathParam("productId", 1)
            .when().get(baseUrlOfSut + "/products/{productId}")
            .then().statusCode(200);

        given().pathParam("productId", 99999)
            .when().get(baseUrlOfSut + "/products/{productId}")
            .then().statusCode(404);
    }

    @Test
    public void testCreateCustomer() {
        String userJson = "{ \"email\":\"ivan.petrov@yandex.ru\", \"password\":\"petrov\", \"name\":\"Ivan Petrov\", \"phone\":\"+7 123 456 78 90\", \"address\":\"Riesstrasse 18\" }";

        given().body(userJson).contentType("application/json")
            .when().post(baseUrlOfSut + "/register")
            .then().statusCode(201);

        String invalidUserJson = "{ \"email\":\"ivan.petrov@yandex.ru\", \"password\":\"\", \"name\":\"Ivan Petrov\", \"phone\":\"+7 123 456 78 90\", \"address\":\"Riesstrasse 18\" }";

        given().body(invalidUserJson).contentType("application/json")
            .when().post(baseUrlOfSut + "/register")
            .then().statusCode(400);
    }
}

*****
#####
[[1;34mINFO[m] Scanning for projects...
[[1;34mINFO[m] 
[[1;34mINFO[m] [1m---------------------< [0;36mnet.lukyanets:market-rest[0;1m >----------------------[m
[[1;34mINFO[m] [1mBuilding market-rest 0.1.2[m
[[1;34mINFO[m] [1m--------------------------------[ jar ]---------------------------------[m
[[1;33mWARNING[m] The POM for com.sun.xml.bind:jaxb-osgi:jar:2.2.10 is invalid, transitive dependencies (if any) will not be available, enable debug logging for more details
[[1;34mINFO[m] 
[[1;34mINFO[m] [1m--- [0;32mmaven-clean-plugin:2.5:clean[m [1m(default-clean)[m @ [36mmarket-rest[0;1m ---[m
[[1;34mINFO[m] Deleting /media/rincon/63999417195/eclipse-workspace/EMB-master/jdk_11_maven/cs/rest-gui/market/market-rest/target
[[1;34mINFO[m] 
[[1;34mINFO[m] [1m--- [0;32mjacoco-maven-plugin:0.8.7:prepare-agent[m [1m(default)[m @ [36mmarket-rest[0;1m ---[m
[[1;34mINFO[m] argLine set to -javaagent:/home/rincon/.m2/repository/org/jacoco/org.jacoco.agent/0.8.7/org.jacoco.agent-0.8.7-runtime.jar=destfile=/media/rincon/63999417195/eclipse-workspace/EMB-master/jdk_11_maven/cs/rest-gui/market/market-rest/target/jacoco.exec
[[1;34mINFO[m] 
[[1;34mINFO[m] [1m--- [0;32mspring-boot-maven-plugin:2.4.3:build-info[m [1m(default)[m @ [36mmarket-rest[0;1m ---[m
[[1;34mINFO[m] 
[[1;34mINFO[m] [1m--- [0;32mmaven-resources-plugin:2.6:resources[m [1m(default-resources)[m @ [36mmarket-rest[0;1m ---[m
[[1;34mINFO[m] Using 'UTF-8' encoding to copy filtered resources.
[[1;34mINFO[m] Copying 3 resources
[[1;34mINFO[m] 
[[1;34mINFO[m] [1m--- [0;32mmaven-compiler-plugin:3.8.0:compile[m [1m(default-compile)[m @ [36mmarket-rest[0;1m ---[m
[[1;34mINFO[m] Changes detected - recompiling the module!
[[1;34mINFO[m] Compiling 11 source files to /media/rincon/63999417195/eclipse-workspace/EMB-master/jdk_11_maven/cs/rest-gui/market/market-rest/target/classes
[[1;34mINFO[m] 
[[1;34mINFO[m] [1m--- [0;32mjacoco-maven-plugin:0.8.7:prepare-agent[m [1m(default)[m @ [36mmarket-rest[0;1m ---[m
[[1;34mINFO[m] argLine set to -javaagent:/home/rincon/.m2/repository/org/jacoco/org.jacoco.agent/0.8.7/org.jacoco.agent-0.8.7-runtime.jar=destfile=/media/rincon/63999417195/eclipse-workspace/EMB-master/jdk_11_maven/cs/rest-gui/market/market-rest/target/jacoco.exec
[[1;34mINFO[m] 
[[1;34mINFO[m] [1m--- [0;32mspring-boot-maven-plugin:2.4.3:build-info[m [1m(default)[m @ [36mmarket-rest[0;1m ---[m
[[1;34mINFO[m] 
[[1;34mINFO[m] [1m--- [0;32mmaven-resources-plugin:2.6:resources[m [1m(default-resources)[m @ [36mmarket-rest[0;1m ---[m
[[1;34mINFO[m] Using 'UTF-8' encoding to copy filtered resources.
[[1;34mINFO[m] Copying 3 resources
[[1;34mINFO[m] 
[[1;34mINFO[m] [1m--- [0;32mmaven-compiler-plugin:3.8.0:compile[m [1m(default-compile)[m @ [36mmarket-rest[0;1m ---[m
[[1;34mINFO[m] Nothing to compile - all classes are up to date
[[1;34mINFO[m] 
[[1;34mINFO[m] [1m--- [0;32mmaven-resources-plugin:2.6:testResources[m [1m(default-testResources)[m @ [36mmarket-rest[0;1m ---[m
[[1;34mINFO[m] Using 'UTF-8' encoding to copy filtered resources.
[[1;34mINFO[m] skip non existing resourceDirectory /media/rincon/63999417195/eclipse-workspace/EMB-master/jdk_11_maven/cs/rest-gui/market/market-rest/src/test/resources
[[1;34mINFO[m] 
[[1;34mINFO[m] [1m--- [0;32mmaven-compiler-plugin:3.8.0:testCompile[m [1m(default-testCompile)[m @ [36mmarket-rest[0;1m ---[m
[[1;34mINFO[m] Changes detected - recompiling the module!
[[1;34mINFO[m] Compiling 1 source file to /media/rincon/63999417195/eclipse-workspace/EMB-master/jdk_11_maven/cs/rest-gui/market/market-rest/target/test-classes
[[1;34mINFO[m] 
[[1;34mINFO[m] [1m--- [0;32mjacoco-maven-plugin:0.8.7:prepare-agent[m [1m(default)[m @ [36mmarket-rest[0;1m ---[m
[[1;34mINFO[m] argLine set to -javaagent:/home/rincon/.m2/repository/org/jacoco/org.jacoco.agent/0.8.7/org.jacoco.agent-0.8.7-runtime.jar=destfile=/media/rincon/63999417195/eclipse-workspace/EMB-master/jdk_11_maven/cs/rest-gui/market/market-rest/target/jacoco.exec
[[1;34mINFO[m] 
[[1;34mINFO[m] [1m--- [0;32mspring-boot-maven-plugin:2.4.3:build-info[m [1m(default)[m @ [36mmarket-rest[0;1m ---[m
[[1;34mINFO[m] 
[[1;34mINFO[m] [1m--- [0;32mmaven-resources-plugin:2.6:resources[m [1m(default-resources)[m @ [36mmarket-rest[0;1m ---[m
[[1;34mINFO[m] Using 'UTF-8' encoding to copy filtered resources.
[[1;34mINFO[m] Copying 3 resources
[[1;34mINFO[m] 
[[1;34mINFO[m] [1m--- [0;32mmaven-compiler-plugin:3.8.0:compile[m [1m(default-compile)[m @ [36mmarket-rest[0;1m ---[m
[[1;34mINFO[m] Nothing to compile - all classes are up to date
[[1;34mINFO[m] 
[[1;34mINFO[m] [1m--- [0;32mmaven-resources-plugin:2.6:testResources[m [1m(default-testResources)[m @ [36mmarket-rest[0;1m ---[m
[[1;34mINFO[m] Using 'UTF-8' encoding to copy filtered resources.
[[1;34mINFO[m] skip non existing resourceDirectory /media/rincon/63999417195/eclipse-workspace/EMB-master/jdk_11_maven/cs/rest-gui/market/market-rest/src/test/resources
[[1;34mINFO[m] 
[[1;34mINFO[m] [1m--- [0;32mmaven-compiler-plugin:3.8.0:testCompile[m [1m(default-testCompile)[m @ [36mmarket-rest[0;1m ---[m
[[1;34mINFO[m] Nothing to compile - all classes are up to date
[[1;34mINFO[m] 
[[1;34mINFO[m] [1m--- [0;32mmaven-surefire-plugin:2.22.0:test[m [1m(default-test)[m @ [36mmarket-rest[0;1m ---[m
[[1;34mINFO[m] 
[[1;34mINFO[m] -------------------------------------------------------
[[1;34mINFO[m]  T E S T S
[[1;34mINFO[m] -------------------------------------------------------
[[1;34mINFO[m] Running market.[1mrun01_RestErrorResponseTest[m

  .   ____          _            __ _ _
 /\\ / ___'_ __ _ _(_)_ __  __ _ \ \ \ \
( ( )\___ | '_ | '_| | '_ \/ _` | \ \ \ \
 \\/  ___)| |_)| | | | | || (_| |  ) ) ) )
  '  |____| .__|_| |_|_| |_\__, | / / / /
 =========|_|==============|___/=/_/_/_/
 :: Spring Boot ::                (v2.4.3)

2024-08-29 15:50:18,739 INFO  [background-preinit] o.h.v.i.u.Version - HV000001: Hibernate Validator 6.1.7.Final
2024-08-29 15:50:18,847 INFO  [main] o.a.m.s.b.ForkedBooter - Starting ForkedBooter v2.22.0 using Java 11.0.20 on IFTO-PROBOOK with PID 11507 (started by rincon in /media/rincon/63999417195/eclipse-workspace/EMB-master/jdk_11_maven/cs/rest-gui/market/market-rest)
2024-08-29 15:50:18,854 INFO  [main] o.a.m.s.b.ForkedBooter - No active profile set, falling back to default profiles: default
2024-08-29 15:50:19,537 WARN  [main] o.s.b.c.c.ConfigDataEnvironment - Property 'spring.profiles' imported from location 'class path resource [application.yml]' is invalid and should be replaced with 'spring.config.activate.on-profile' [origin: class path resource [application.yml] - 34:13]
2024-08-29 15:50:19,537 WARN  [main] o.s.b.c.c.ConfigDataEnvironment - Property 'spring.profiles' imported from location 'class path resource [application.yml]' is invalid and should be replaced with 'spring.config.activate.on-profile' [origin: class path resource [application.yml] - 24:13]
2024-08-29 15:50:21,029 INFO  [main] o.s.d.r.c.RepositoryConfigurationDelegate - Bootstrapping Spring Data JPA repositories in DEFAULT mode.
2024-08-29 15:50:21,186 INFO  [main] o.s.d.r.c.RepositoryConfigurationDelegate - Finished Spring Data repository scanning in 144 ms. Found 8 JPA repository interfaces.
2024-08-29 15:50:21,777 INFO  [main] o.s.c.s.PostProcessorRegistrationDelegate$BeanPostProcessorChecker - Bean 'market.DataConfig' of type [market.DataConfig$$EnhancerBySpringCGLIB$$9834c5ca] is not eligible for getting processed by all BeanPostProcessors (for example: not eligible for auto-proxying)
2024-08-29 15:50:21,968 INFO  [main] o.s.c.s.PostProcessorRegistrationDelegate$BeanPostProcessorChecker - Bean 'org.springframework.security.access.expression.method.DefaultMethodSecurityExpressionHandler@7dab2d9e' of type [org.springframework.security.access.expression.method.DefaultMethodSecurityExpressionHandler] is not eligible for getting processed by all BeanPostProcessors (for example: not eligible for auto-proxying)
2024-08-29 15:50:21,978 INFO  [main] o.s.c.s.PostProcessorRegistrationDelegate$BeanPostProcessorChecker - Bean 'methodSecurityMetadataSource' of type [org.springframework.security.access.method.DelegatingMethodSecurityMetadataSource] is not eligible for getting processed by all BeanPostProcessors (for example: not eligible for auto-proxying)
2024-08-29 15:50:22,532 INFO  [main] o.s.b.w.e.t.TomcatWebServer - Tomcat initialized with port(s): 0 (http)
2024-08-29 15:50:22,550 INFO  [main] o.a.c.h.Http11NioProtocol - Initializing ProtocolHandler ["http-nio-auto-1"]
2024-08-29 15:50:22,550 INFO  [main] o.a.c.c.StandardService - Starting service [Tomcat]
2024-08-29 15:50:22,551 INFO  [main] o.a.c.c.StandardEngine - Starting Servlet engine: [Apache Tomcat/9.0.43]
2024-08-29 15:50:22,689 INFO  [main] o.a.c.c.C.[.[.[/] - Initializing Spring embedded WebApplicationContext
2024-08-29 15:50:22,690 INFO  [main] o.s.b.w.s.c.ServletWebServerApplicationContext - Root WebApplicationContext: initialization completed in 3148 ms
2024-08-29 15:50:22,915 INFO  [main] c.z.h.HikariDataSource - HikariPool-1 - Starting...
2024-08-29 15:50:23,368 INFO  [main] c.z.h.HikariDataSource - HikariPool-1 - Start completed.
2024-08-29 15:50:23,584 INFO  [main] o.h.j.i.u.LogHelper - HHH000204: Processing PersistenceUnitInfo [name: default]
2024-08-29 15:50:23,678 INFO  [main] o.h.Version - HHH000412: Hibernate ORM core version 5.4.28.Final
2024-08-29 15:50:23,899 INFO  [main] o.h.a.c.Version - HCANN000001: Hibernate Commons Annotations {5.1.2.Final}
2024-08-29 15:50:24,274 INFO  [main] o.h.d.Dialect - HHH000400: Using dialect: org.hibernate.dialect.H2Dialect
2024-08-29 15:50:24,615 WARN  [main] o.h.b.i.InFlightMetadataCollectorImpl - HHH000069: Duplicate generator name gen
2024-08-29 15:50:24,619 WARN  [main] o.h.b.i.InFlightMetadataCollectorImpl - HHH000069: Duplicate generator name gen
2024-08-29 15:50:25,459 INFO  [main] o.h.e.t.j.p.i.JtaPlatformInitiator - HHH000490: Using JtaPlatform implementation: [org.hibernate.engine.transaction.jta.platform.internal.NoJtaPlatform]
2024-08-29 15:50:25,473 INFO  [main] o.s.o.j.LocalContainerEntityManagerFactoryBean - Initialized JPA EntityManagerFactory for persistence unit 'default'
2024-08-29 15:50:26,525 WARN  [main] o.s.b.a.o.j.JpaBaseConfiguration$JpaWebConfiguration - spring.jpa.open-in-view is enabled by default. Therefore, database queries may be performed during view rendering. Explicitly configure spring.jpa.open-in-view to disable this warning
2024-08-29 15:50:27,538 INFO  [main] o.s.s.w.DefaultSecurityFilterChain - Will secure any request with [org.springframework.security.web.context.request.async.WebAsyncManagerIntegrationFilter@476560c6, org.springframework.security.web.context.SecurityContextPersistenceFilter@1889818b, org.springframework.security.web.header.HeaderWriterFilter@3e57ff7a, org.springframework.security.web.authentication.logout.LogoutFilter@5632e8d5, org.springframework.security.web.authentication.www.BasicAuthenticationFilter@4426e23, org.springframework.security.web.savedrequest.RequestCacheAwareFilter@42696a68, org.springframework.security.web.servletapi.SecurityContextHolderAwareRequestFilter@6db6bfeb, org.springframework.security.web.authentication.AnonymousAuthenticationFilter@e356c35, org.springframework.security.web.session.SessionManagementFilter@62a2ede6, org.springframework.security.web.access.ExceptionTranslationFilter@5f91442d, org.springframework.security.web.access.intercept.FilterSecurityInterceptor@7ba93b04]
2024-08-29 15:50:27,707 INFO  [main] o.s.s.c.ThreadPoolTaskExecutor - Initializing ExecutorService 'applicationTaskExecutor'
2024-08-29 15:50:28,227 INFO  [main] o.a.c.h.Http11NioProtocol - Starting ProtocolHandler ["http-nio-auto-1"]
2024-08-29 15:50:28,260 INFO  [main] o.s.b.w.e.t.TomcatWebServer - Tomcat started on port(s): 43275 (http) with context path ''
2024-08-29 15:50:28,921 INFO  [main] o.a.m.s.b.ForkedBooter - Started ForkedBooter in 11.025 seconds (JVM running for 13.254)
2024-08-29 15:50:30,935 INFO  [http-nio-auto-1-exec-1] o.a.c.c.C.[.[.[/] - Initializing Spring DispatcherServlet 'dispatcherServlet'
2024-08-29 15:50:30,935 INFO  [http-nio-auto-1-exec-1] o.s.w.s.DispatcherServlet - Initializing Servlet 'dispatcherServlet'
2024-08-29 15:50:30,938 INFO  [http-nio-auto-1-exec-1] o.s.w.s.DispatcherServlet - Completed initialization in 2 ms
2024-08-29 15:50:31,478 WARN  [http-nio-auto-1-exec-2] m.r.e.RestExceptionHandler - RestErrorResponse{message='Requested entity doesn't exist', entityName='ProductDTO', description='uri=/products/99999', fieldErrors=[{field='id', message='No instance with this id'}]}
2024-08-29 15:50:31,780 WARN  [http-nio-auto-1-exec-3] m.r.e.RestExceptionHandler - RestErrorResponse{message='Argument validation error', entityName='UserAccount', description='uri=/register', fieldErrors=[{field='email', message='Account with this email already exists'}]}
Request method:	POST
Request URI:	http://localhost:43275/register
Proxy:			<none>
Request params:	<none>
Query params:	<none>
Form params:	<none>
Path params:	<none>
Headers:		Accept=*/*
				Content-Type=application/json; charset=UTF-8
Cookies:		<none>
Multiparts:		<none>
Body:
{
    "email": "ivan.petrov@yandex.ru",
    "password": "petrov",
    "name": "Ivan Petrov",
    "phone": "+7 123 456 78 90",
    "address": "Riesstrasse 18"
}

HTTP/1.1 406 
X-Content-Type-Options: nosniff
X-XSS-Protection: 1; mode=block
Cache-Control: no-cache, no-store, max-age=0, must-revalidate
Pragma: no-cache
Expires: 0
Content-Type: application/json
Transfer-Encoding: chunked
Date: Thu, 29 Aug 2024 18:50:31 GMT
Keep-Alive: timeout=60
Connection: keep-alive

{
    "message": "Argument validation error",
    "description": "uri=/register",
    "entityName": "UserAccount",
    "fieldErrors": [
        {
            "field": "email",
            "message": "Account with this email already exists"
        }
    ]
}
2024-08-29 15:50:31,956 INFO  [main] o.a.c.h.Http11NioProtocol - Pausing ProtocolHandler ["http-nio-auto-1"]
2024-08-29 15:50:31,956 INFO  [main] o.a.c.c.StandardService - Stopping service [Tomcat]
2024-08-29 15:50:31,958 INFO  [main] o.a.c.c.C.[.[.[/] - Destroying Spring FrameworkServlet 'dispatcherServlet'
2024-08-29 15:50:31,961 INFO  [main] o.a.c.h.Http11NioProtocol - Stopping ProtocolHandler ["http-nio-auto-1"]
2024-08-29 15:50:31,965 INFO  [main] o.a.c.h.Http11NioProtocol - Destroying ProtocolHandler ["http-nio-auto-1"]
[[1;31mERROR[m] [1;31mTests [0;1mrun: [0;1m13[m, [1;31mFailures: [0;1;31m1[m, [1;31mErrors: [0;1;31m10[m, Skipped: 0, Time elapsed: 15.241 s[1;31m <<< FAILURE![m - in market.[1mrun01_RestErrorResponseTest[m
[[1;31mERROR[m] testSetDelivery  Time elapsed: 0.485 s  <<< ERROR!
java.lang.IllegalArgumentException: Illegal character in query at index 33: /customer/cart/delivery?name=Ivan Petrov&included=true
	at market.run01_RestErrorResponseTest.testSetDelivery(run01_RestErrorResponseTest.java:116)
Caused by: java.net.URISyntaxException: Illegal character in query at index 33: /customer/cart/delivery?name=Ivan Petrov&included=true
	at market.run01_RestErrorResponseTest.testSetDelivery(run01_RestErrorResponseTest.java:116)

[[1;31mERROR[m] testGetOrder  Time elapsed: 0.036 s  <<< ERROR!
java.lang.IllegalArgumentException: Illegal character in query at index 28: /customer/orders/1?name=Ivan Petrov
	at market.run01_RestErrorResponseTest.testGetOrder(run01_RestErrorResponseTest.java:181)
Caused by: java.net.URISyntaxException: Illegal character in query at index 28: /customer/orders/1?name=Ivan Petrov
	at market.run01_RestErrorResponseTest.testGetOrder(run01_RestErrorResponseTest.java:181)

[[1;31mERROR[m] testUpdateContacts  Time elapsed: 0.05 s  <<< ERROR!
java.lang.IllegalArgumentException: Illegal character in query at index 28: /customer/contacts?name=Ivan Petrov
	at market.run01_RestErrorResponseTest.testUpdateContacts(run01_RestErrorResponseTest.java:157)
Caused by: java.net.URISyntaxException: Illegal character in query at index 28: /customer/contacts?name=Ivan Petrov
	at market.run01_RestErrorResponseTest.testUpdateContacts(run01_RestErrorResponseTest.java:157)

[[1;31mERROR[m] testPayByCard  Time elapsed: 0.027 s  <<< ERROR!
java.lang.IllegalArgumentException: Illegal character in query at index 28: /customer/cart/pay?name=Ivan Petrov
	at market.run01_RestErrorResponseTest.testPayByCard(run01_RestErrorResponseTest.java:131)
Caused by: java.net.URISyntaxException: Illegal character in query at index 28: /customer/cart/pay?name=Ivan Petrov
	at market.run01_RestErrorResponseTest.testPayByCard(run01_RestErrorResponseTest.java:131)

[[1;31mERROR[m] testClearCart  Time elapsed: 0.022 s  <<< ERROR!
java.lang.IllegalArgumentException: Illegal character in query at index 24: /customer/cart?name=Ivan Petrov
	at market.run01_RestErrorResponseTest.testClearCart(run01_RestErrorResponseTest.java:104)
Caused by: java.net.URISyntaxException: Illegal character in query at index 24: /customer/cart?name=Ivan Petrov
	at market.run01_RestErrorResponseTest.testClearCart(run01_RestErrorResponseTest.java:104)

[[1;31mERROR[m] testGetCart  Time elapsed: 0.019 s  <<< ERROR!
java.lang.IllegalArgumentException: Illegal character in query at index 24: /customer/cart?name=Ivan Petrov
	at market.run01_RestErrorResponseTest.testGetCart(run01_RestErrorResponseTest.java:78)
Caused by: java.net.URISyntaxException: Illegal character in query at index 24: /customer/cart?name=Ivan Petrov
	at market.run01_RestErrorResponseTest.testGetCart(run01_RestErrorResponseTest.java:78)

[[1;31mERROR[m] testAddItemToCart  Time elapsed: 0.035 s  <<< ERROR!
java.lang.IllegalArgumentException: Illegal character in query at index 24: /customer/cart?name=Ivan Petrov
	at market.run01_RestErrorResponseTest.testAddItemToCart(run01_RestErrorResponseTest.java:92)
Caused by: java.net.URISyntaxException: Illegal character in query at index 24: /customer/cart?name=Ivan Petrov
	at market.run01_RestErrorResponseTest.testAddItemToCart(run01_RestErrorResponseTest.java:92)

[[1;31mERROR[m] testCreateCustomer  Time elapsed: 0.324 s  <<< FAILURE!
java.lang.AssertionError: 
1 expectation failed.
Expected status code <201> but was <406>.

	at market.run01_RestErrorResponseTest.testCreateCustomer(run01_RestErrorResponseTest.java:214)

[[1;31mERROR[m] testGetContacts  Time elapsed: 0.012 s  <<< ERROR!
java.lang.IllegalArgumentException: Illegal character in query at index 28: /customer/contacts?name=Ivan Petrov
	at market.run01_RestErrorResponseTest.testGetContacts(run01_RestErrorResponseTest.java:143)
Caused by: java.net.URISyntaxException: Illegal character in query at index 28: /customer/contacts?name=Ivan Petrov
	at market.run01_RestErrorResponseTest.testGetContacts(run01_RestErrorResponseTest.java:143)

[[1;31mERROR[m] testGetOrders  Time elapsed: 0.011 s  <<< ERROR!
java.lang.IllegalArgumentException: Illegal character in query at index 26: /customer/orders?name=Ivan Petrov
	at market.run01_RestErrorResponseTest.testGetOrders(run01_RestErrorResponseTest.java:169)
Caused by: java.net.URISyntaxException: Illegal character in query at index 26: /customer/orders?name=Ivan Petrov
	at market.run01_RestErrorResponseTest.testGetOrders(run01_RestErrorResponseTest.java:169)

[[1;31mERROR[m] testGetCustomer  Time elapsed: 0.01 s  <<< ERROR!
java.lang.IllegalArgumentException: Illegal character in query at index 19: /customer?name=Ivan Petrov
	at market.run01_RestErrorResponseTest.testGetCustomer(run01_RestErrorResponseTest.java:67)
Caused by: java.net.URISyntaxException: Illegal character in query at index 19: /customer?name=Ivan Petrov
	at market.run01_RestErrorResponseTest.testGetCustomer(run01_RestErrorResponseTest.java:67)

2024-08-29 15:50:32,210 INFO  [SpringContextShutdownHook] o.s.s.c.ThreadPoolTaskExecutor - Shutting down ExecutorService 'applicationTaskExecutor'
2024-08-29 15:50:32,222 INFO  [SpringContextShutdownHook] o.s.o.j.LocalContainerEntityManagerFactoryBean - Closing JPA EntityManagerFactory for persistence unit 'default'
2024-08-29 15:50:32,223 INFO  [SpringContextShutdownHook] c.z.h.HikariDataSource - HikariPool-1 - Shutdown initiated...
2024-08-29 15:50:32,226 INFO  [SpringContextShutdownHook] c.z.h.HikariDataSource - HikariPool-1 - Shutdown completed.
[[1;34mINFO[m] 
[[1;34mINFO[m] Results:
[[1;34mINFO[m] 
[[1;31mERROR[m] [1;31mFailures: [m
[[1;31mERROR[m] [1;31m  run01_RestErrorResponseTest.testCreateCustomer:214 1 expectation failed.
Expected status code <201> but was <406>.
[m
[[1;31mERROR[m] [1;31mErrors: [m
[[1;31mERROR[m] [1;31m  run01_RestErrorResponseTest.testAddItemToCart:92 » IllegalArgument Illegal cha...[m
[[1;31mERROR[m] [1;31m  run01_RestErrorResponseTest.testClearCart:104 » IllegalArgument Illegal charac...[m
[[1;31mERROR[m] [1;31m  run01_RestErrorResponseTest.testGetCart:78 » IllegalArgument Illegal character...[m
[[1;31mERROR[m] [1;31m  run01_RestErrorResponseTest.testGetContacts:143 » IllegalArgument Illegal char...[m
[[1;31mERROR[m] [1;31m  run01_RestErrorResponseTest.testGetCustomer:67 » IllegalArgument Illegal chara...[m
[[1;31mERROR[m] [1;31m  run01_RestErrorResponseTest.testGetOrder:181 » IllegalArgument Illegal charact...[m
[[1;31mERROR[m] [1;31m  run01_RestErrorResponseTest.testGetOrders:169 » IllegalArgument Illegal charac...[m
[[1;31mERROR[m] [1;31m  run01_RestErrorResponseTest.testPayByCard:131 » IllegalArgument Illegal charac...[m
[[1;31mERROR[m] [1;31m  run01_RestErrorResponseTest.testSetDelivery:116 » IllegalArgument Illegal char...[m
[[1;31mERROR[m] [1;31m  run01_RestErrorResponseTest.testUpdateContacts:157 » IllegalArgument Illegal c...[m
[[1;34mINFO[m] 
[[1;31mERROR[m] [1;31mTests run: 13, Failures: 1, Errors: 10, Skipped: 0[m
[[1;34mINFO[m] 
[[1;34mINFO[m] [1m------------------------------------------------------------------------[m
[[1;34mINFO[m] [1;31mBUILD FAILURE[m
[[1;34mINFO[m] [1m------------------------------------------------------------------------[m
[[1;34mINFO[m] Total time:  20.517 s
[[1;34mINFO[m] Finished at: 2024-08-29T15:50:32-03:00
[[1;34mINFO[m] [1m------------------------------------------------------------------------[m
[[1;31mERROR[m] Failed to execute goal [32morg.apache.maven.plugins:maven-surefire-plugin:2.22.0:test[m [1m(default-test)[m on project [36mmarket-rest[m: [1;31mThere are test failures.[m
[[1;31mERROR[m] [1;31m[m
[[1;31mERROR[m] [1;31mPlease refer to /media/rincon/63999417195/eclipse-workspace/EMB-master/jdk_11_maven/cs/rest-gui/market/market-rest/target/surefire-reports for the individual test results.[m
[[1;31mERROR[m] [1;31mPlease refer to dump files (if any exist) [date]-jvmRun[N].dump, [date].dumpstream and [date]-jvmRun[N].dumpstream.[m
[[1;31mERROR[m] -> [1m[Help 1][m
[[1;31mERROR[m] 
[[1;31mERROR[m] To see the full stack trace of the errors, re-run Maven with the [1m-e[m switch.
[[1;31mERROR[m] Re-run Maven using the [1m-X[m switch to enable full debug logging.
[[1;31mERROR[m] 
[[1;31mERROR[m] For more information about the errors and possible solutions, please read the following articles:
[[1;31mERROR[m] [1m[Help 1][m http://cwiki.apache.org/confluence/display/MAVEN/MojoFailureException

#####
