Correct the test code delimited by ***** according to the error messages delimited by ##### and generate another complete code in JUnit 4 format. The response must contain only Java code in JUnit 4 format.

Keep these five instructions for this generated test code:

Instruction 1: Keet this package line to generated test code file:
package org.restscs;

Instruction 2: Keep the following Java imports to generated test code file:
import  org.junit.AfterClass;
import  org.junit.BeforeClass;
import  org.junit.Before;
import  org.junit.Test;
import static org.junit.Assert.*;
import  java.util.Map;
import  java.util.List;
import static org.evomaster.client.java.controller.api.EMTestUtils.*;
import  org.evomaster.client.java.controller.SutHandler;
import  io.restassured.RestAssured;
import static io.restassured.RestAssured.given;
import  io.restassured.response.ValidatableResponse;
import static org.hamcrest.Matchers.*;
import  io.restassured.config.JsonConfig;
import  io.restassured.path.json.config.JsonPathConfig;
import static io.restassured.config.RedirectConfig.redirectConfig;
import static org.evomaster.client.java.controller.contentMatchers.NumberMatcher.*;
import static org.evomaster.client.java.controller.contentMatchers.StringMatcher.*;
import static org.evomaster.client.java.controller.contentMatchers.SubStringMatcher.*;
import static org.evomaster.client.java.controller.expect.ExpectationHandler.expectationHandler;
import  org.evomaster.client.java.controller.expect.ExpectationHandler;
import  io.restassured.path.json.JsonPath;
import  java.util.Arrays;

Instruction 3: Keep the same class name in this point (between the imports at instruction 2 and instruction 4)

Instruction 4: Keep these variables in the generated test code:
private static final SutHandler controller = new em.embedded.org.restscs.EmbeddedEvoMasterController();
private static String baseUrlOfSut;

Instruction 5: Keep the following setup and teardown methods in generated test code file:
@BeforeClass
public static void initClass() {
    controller.setupForGeneratedTest();
    baseUrlOfSut = controller.startSut();
    controller.registerOrExecuteInitSqlCommandsIfNeeded();
    assertNotNull(baseUrlOfSut);
    RestAssured.enableLoggingOfRequestAndResponseIfValidationFails();
    RestAssured.useRelaxedHTTPSValidation();
    RestAssured.urlEncodingEnabled = false;
    RestAssured.config = RestAssured.config()
        .jsonConfig(JsonConfig.jsonConfig().numberReturnType(JsonPathConfig.NumberReturnType.DOUBLE))
        .redirect(redirectConfig().followRedirects(false));
}


@AfterClass
public static void tearDown() {
    controller.stopSut();
}


@Before
public void initTest() {
    controller.resetStateOfSUT();
}


*****

package org.restscs;

import org.junit.AfterClass;
import org.junit.BeforeClass;
import org.junit.Before;
import org.junit.Test;
import static org.junit.Assert.*;
import java.util.Map;
import java.util.List;
import static org.evomaster.client.java.controller.api.EMTestUtils.*;
import org.evomaster.client.java.controller.SutHandler;
import io.restassured.RestAssured;
import static io.restassured.RestAssured.given;
import io.restassured.response.ValidatableResponse;
import static org.hamcrest.Matchers.*;
import io.restassured.config.JsonConfig;
import io.restassured.path.json.config.JsonPathConfig;
import static io.restassured.config.RedirectConfig.redirectConfig;
import static org.evomaster.client.java.controller.contentMatchers.NumberMatcher.*;
import static org.evomaster.client.java.controller.contentMatchers.StringMatcher.*;
import static org.evomaster.client.java.controller.contentMatchers.SubStringMatcher.*;
import static org.evomaster.client.java.controller.expect.ExpectationHandler.expectationHandler;
import org.evomaster.client.java.controller.expect.ExpectationHandler;
import io.restassured.path.json.JsonPath;
import java.util.Arrays;

public class v1_gpt35_run03_CookieTest {

    private static final SutHandler controller = new em.embedded.org.restscs.EmbeddedEvoMasterController();
    private static String baseUrlOfSut;

    @BeforeClass
    public static void initClass() {
        controller.setupForGeneratedTest();
        baseUrlOfSut = controller.startSut();
        controller.registerOrExecuteInitSqlCommandsIfNeeded();
        assertNotNull(baseUrlOfSut);
        RestAssured.enableLoggingOfRequestAndResponseIfValidationFails();
        RestAssured.useRelaxedHTTPSValidation();
        RestAssured.urlEncodingEnabled = false;
        RestAssured.config = RestAssured.config()
            .jsonConfig(JsonConfig.jsonConfig().numberReturnType(JsonPathConfig.NumberReturnType.DOUBLE))
            .redirect(redirectConfig().followRedirects(false));
    }

    @AfterClass
    public static void tearDown() {
        controller.stopSut();
    }

    @Before
    public void initTest() {
        controller.resetStateOfSUT();
    }

    @Test
    public void testCookieEndpoint() {
        given()
            .when()
            .get(baseUrlOfSut + "/api/cookie/{name}/{val}/{site}")
            .then()
            .statusCode(200);
    }

    @Test
    public void testCostFunsEndpoint() {
        given()
            .when()
            .get(baseUrlOfSut + "/api/costfuns/{i}/{s}")
            .then()
            .statusCode(200);
    }

    @Test
    public void testDateParseEndpoint() {
        given()
            .when()
            .get(baseUrlOfSut + "/api/dateparse/{dayname}/{monthname}")
            .then()
            .statusCode(200);
    }

    @Test
    public void testFileSuffixEndpoint() {
        given()
            .when()
            .get(baseUrlOfSut + "/api/filesuffix/{directory}/{file}")
            .then()
            .statusCode(200);
    }

    @Test
    public void testNoTypeVarEndpoint() {
        given()
            .when()
            .get(baseUrlOfSut + "/api/notypevar/{i}/{s}")
            .then()
            .statusCode(200);
    }

    @Test
    public void testOrdered4Endpoint() {
        given()
            .when()
            .get(baseUrlOfSut + "/api/ordered4/{w}/{x}/{z}/{y}")
            .then()
            .statusCode(200);
    }

    @Test
    public void testPatEndpoint() {
        given()
            .when()
            .get(baseUrlOfSut + "/api/pat/{txt}")
            .then()
            .statusCode(200);
    }

    @Test
    public void testText2TxtEndpoint() {
        given()
            .when()
            .get(baseUrlOfSut + "/api/text2txt/{word1}/{word2}/{word3}")
            .then()
            .statusCode(200);
    }

    @Test
    public void testTitleEndpoint() {
        given()
            .when()
            .get(baseUrlOfSut + "/api/title/{sex}/{title}")
            .then()
            .statusCode(200);
    }
}

*****
#####
[[1;34mINFO[m] Scanning for projects...
[[1;34mINFO[m] 
[[1;34mINFO[m] [1m------< [0;36morg.evomaster:evomaster-benchmark-cs-rest-artificial-scs[0;1m >------[m
[[1;34mINFO[m] [1mBuilding evomaster-benchmark-cs-rest-artificial-scs 3.0.0[m
[[1;34mINFO[m] [1m--------------------------------[ jar ]---------------------------------[m
[[1;34mINFO[m] 
[[1;34mINFO[m] [1m--- [0;32mmaven-clean-plugin:2.5:clean[m [1m(default-clean)[m @ [36mevomaster-benchmark-cs-rest-artificial-scs[0;1m ---[m
[[1;34mINFO[m] Deleting /media/rincon/63999417195/eclipse-workspace/EMB-master/jdk_8_maven/cs/rest/artificial/scs/target
[[1;34mINFO[m] 
[[1;34mINFO[m] [1m--- [0;32mjacoco-maven-plugin:0.8.7:prepare-agent[m [1m(default)[m @ [36mevomaster-benchmark-cs-rest-artificial-scs[0;1m ---[m
[[1;34mINFO[m] argLine set to -javaagent:/home/rincon/.m2/repository/org/jacoco/org.jacoco.agent/0.8.7/org.jacoco.agent-0.8.7-runtime.jar=destfile=/media/rincon/63999417195/eclipse-workspace/EMB-master/jdk_8_maven/cs/rest/artificial/scs/target/jacoco.exec
[[1;34mINFO[m] 
[[1;34mINFO[m] [1m--- [0;32mmaven-resources-plugin:2.6:resources[m [1m(default-resources)[m @ [36mevomaster-benchmark-cs-rest-artificial-scs[0;1m ---[m
[[1;34mINFO[m] Using 'UTF-8' encoding to copy filtered resources.
[[1;34mINFO[m] skip non existing resourceDirectory /media/rincon/63999417195/eclipse-workspace/EMB-master/jdk_8_maven/cs/rest/artificial/scs/src/main/resources
[[1;34mINFO[m] 
[[1;34mINFO[m] [1m--- [0;32mmaven-compiler-plugin:3.8.0:compile[m [1m(default-compile)[m @ [36mevomaster-benchmark-cs-rest-artificial-scs[0;1m ---[m
[[1;34mINFO[m] Changes detected - recompiling the module!
[[1;34mINFO[m] Compiling 14 source files to /media/rincon/63999417195/eclipse-workspace/EMB-master/jdk_8_maven/cs/rest/artificial/scs/target/classes
[[1;34mINFO[m] 
[[1;34mINFO[m] [1m--- [0;32mjacoco-maven-plugin:0.8.7:prepare-agent[m [1m(default)[m @ [36mevomaster-benchmark-cs-rest-artificial-scs[0;1m ---[m
[[1;34mINFO[m] argLine set to -javaagent:/home/rincon/.m2/repository/org/jacoco/org.jacoco.agent/0.8.7/org.jacoco.agent-0.8.7-runtime.jar=destfile=/media/rincon/63999417195/eclipse-workspace/EMB-master/jdk_8_maven/cs/rest/artificial/scs/target/jacoco.exec
[[1;34mINFO[m] 
[[1;34mINFO[m] [1m--- [0;32mmaven-resources-plugin:2.6:resources[m [1m(default-resources)[m @ [36mevomaster-benchmark-cs-rest-artificial-scs[0;1m ---[m
[[1;34mINFO[m] Using 'UTF-8' encoding to copy filtered resources.
[[1;34mINFO[m] skip non existing resourceDirectory /media/rincon/63999417195/eclipse-workspace/EMB-master/jdk_8_maven/cs/rest/artificial/scs/src/main/resources
[[1;34mINFO[m] 
[[1;34mINFO[m] [1m--- [0;32mmaven-compiler-plugin:3.8.0:compile[m [1m(default-compile)[m @ [36mevomaster-benchmark-cs-rest-artificial-scs[0;1m ---[m
[[1;34mINFO[m] Changes detected - recompiling the module!
[[1;34mINFO[m] Compiling 14 source files to /media/rincon/63999417195/eclipse-workspace/EMB-master/jdk_8_maven/cs/rest/artificial/scs/target/classes
[[1;34mINFO[m] 
[[1;34mINFO[m] [1m--- [0;32mmaven-resources-plugin:2.6:testResources[m [1m(default-testResources)[m @ [36mevomaster-benchmark-cs-rest-artificial-scs[0;1m ---[m
[[1;34mINFO[m] Using 'UTF-8' encoding to copy filtered resources.
[[1;34mINFO[m] skip non existing resourceDirectory /media/rincon/63999417195/eclipse-workspace/EMB-master/jdk_8_maven/cs/rest/artificial/scs/src/test/resources
[[1;34mINFO[m] 
[[1;34mINFO[m] [1m--- [0;32mmaven-compiler-plugin:3.8.0:testCompile[m [1m(default-testCompile)[m @ [36mevomaster-benchmark-cs-rest-artificial-scs[0;1m ---[m
[[1;34mINFO[m] Changes detected - recompiling the module!
[[1;34mINFO[m] Compiling 1 source file to /media/rincon/63999417195/eclipse-workspace/EMB-master/jdk_8_maven/cs/rest/artificial/scs/target/test-classes
[[1;34mINFO[m] 
[[1;34mINFO[m] [1m--- [0;32mjacoco-maven-plugin:0.8.7:prepare-agent[m [1m(default)[m @ [36mevomaster-benchmark-cs-rest-artificial-scs[0;1m ---[m
[[1;34mINFO[m] argLine set to -javaagent:/home/rincon/.m2/repository/org/jacoco/org.jacoco.agent/0.8.7/org.jacoco.agent-0.8.7-runtime.jar=destfile=/media/rincon/63999417195/eclipse-workspace/EMB-master/jdk_8_maven/cs/rest/artificial/scs/target/jacoco.exec
[[1;34mINFO[m] 
[[1;34mINFO[m] [1m--- [0;32mmaven-resources-plugin:2.6:resources[m [1m(default-resources)[m @ [36mevomaster-benchmark-cs-rest-artificial-scs[0;1m ---[m
[[1;34mINFO[m] Using 'UTF-8' encoding to copy filtered resources.
[[1;34mINFO[m] skip non existing resourceDirectory /media/rincon/63999417195/eclipse-workspace/EMB-master/jdk_8_maven/cs/rest/artificial/scs/src/main/resources
[[1;34mINFO[m] 
[[1;34mINFO[m] [1m--- [0;32mmaven-compiler-plugin:3.8.0:compile[m [1m(default-compile)[m @ [36mevomaster-benchmark-cs-rest-artificial-scs[0;1m ---[m
[[1;34mINFO[m] Changes detected - recompiling the module!
[[1;34mINFO[m] Compiling 14 source files to /media/rincon/63999417195/eclipse-workspace/EMB-master/jdk_8_maven/cs/rest/artificial/scs/target/classes
[[1;34mINFO[m] 
[[1;34mINFO[m] [1m--- [0;32mmaven-resources-plugin:2.6:testResources[m [1m(default-testResources)[m @ [36mevomaster-benchmark-cs-rest-artificial-scs[0;1m ---[m
[[1;34mINFO[m] Using 'UTF-8' encoding to copy filtered resources.
[[1;34mINFO[m] skip non existing resourceDirectory /media/rincon/63999417195/eclipse-workspace/EMB-master/jdk_8_maven/cs/rest/artificial/scs/src/test/resources
[[1;34mINFO[m] 
[[1;34mINFO[m] [1m--- [0;32mmaven-compiler-plugin:3.8.0:testCompile[m [1m(default-testCompile)[m @ [36mevomaster-benchmark-cs-rest-artificial-scs[0;1m ---[m
[[1;34mINFO[m] Nothing to compile - all classes are up to date
[[1;34mINFO[m] 
[[1;34mINFO[m] [1m--- [0;32mmaven-surefire-plugin:2.22.0:test[m [1m(default-test)[m @ [36mevomaster-benchmark-cs-rest-artificial-scs[0;1m ---[m
[[1;34mINFO[m] 
[[1;34mINFO[m] -------------------------------------------------------
[[1;34mINFO[m]  T E S T S
[[1;34mINFO[m] -------------------------------------------------------
[[1;34mINFO[m] Running org.restscs.[1mv1_gpt35_run03_CookieTest[m

  .   ____          _            __ _ _
 /\\ / ___'_ __ _ _(_)_ __  __ _ \ \ \ \
( ( )\___ | '_ | '_| | '_ \/ _` | \ \ \ \
 \\/  ___)| |_)| | | | | || (_| |  ) ) ) )
  '  |____| .__|_| |_|_| |_\__, | / / / /
 =========|_|==============|___/=/_/_/_/
 :: Spring Boot ::        (v2.0.3.RELEASE)

2024-09-06 21:08:34.007  INFO 12294 --- [           main] o.a.maven.surefire.booter.ForkedBooter   : Starting ForkedBooter v2.22.0 on IFTO-PROBOOK with PID 12294 (started by rincon in /media/rincon/63999417195/eclipse-workspace/EMB-master/jdk_8_maven/cs/rest/artificial/scs)
2024-09-06 21:08:34.013  INFO 12294 --- [           main] o.a.maven.surefire.booter.ForkedBooter   : No active profile set, falling back to default profiles: default
2024-09-06 21:08:34.637  INFO 12294 --- [           main] ConfigServletWebServerApplicationContext : Refreshing org.springframework.boot.web.servlet.context.AnnotationConfigServletWebServerApplicationContext@25218a4d: startup date [Fri Sep 06 21:08:34 BRT 2024]; root of context hierarchy
2024-09-06 21:08:36.373  INFO 12294 --- [           main] f.a.AutowiredAnnotationBeanPostProcessor : JSR-330 'javax.inject.Inject' annotation found and supported for autowiring
2024-09-06 21:08:36.935  INFO 12294 --- [           main] o.s.b.w.embedded.tomcat.TomcatWebServer  : Tomcat initialized with port(s): 0 (http)
2024-09-06 21:08:36.997  INFO 12294 --- [           main] o.apache.catalina.core.StandardService   : Starting service [Tomcat]
2024-09-06 21:08:36.998  INFO 12294 --- [           main] org.apache.catalina.core.StandardEngine  : Starting Servlet Engine: Apache Tomcat/8.5.31
2024-09-06 21:08:37.015  INFO 12294 --- [ost-startStop-1] o.a.catalina.core.AprLifecycleListener   : The APR based Apache Tomcat Native library which allows optimal performance in production environments was not found on the java.library.path: [/usr/java/packages/lib/amd64:/usr/lib64:/lib64:/lib:/usr/lib]
2024-09-06 21:08:37.155  INFO 12294 --- [ost-startStop-1] o.a.c.c.C.[Tomcat].[localhost].[/]       : Initializing Spring embedded WebApplicationContext
2024-09-06 21:08:37.156  INFO 12294 --- [ost-startStop-1] o.s.web.context.ContextLoader            : Root WebApplicationContext: initialization completed in 2521 ms
2024-09-06 21:08:37.306  INFO 12294 --- [ost-startStop-1] o.s.b.w.servlet.ServletRegistrationBean  : Servlet dispatcherServlet mapped to [/]
2024-09-06 21:08:37.314  INFO 12294 --- [ost-startStop-1] o.s.b.w.servlet.FilterRegistrationBean   : Mapping filter: 'characterEncodingFilter' to: [/*]
2024-09-06 21:08:37.314  INFO 12294 --- [ost-startStop-1] o.s.b.w.servlet.FilterRegistrationBean   : Mapping filter: 'hiddenHttpMethodFilter' to: [/*]
2024-09-06 21:08:37.315  INFO 12294 --- [ost-startStop-1] o.s.b.w.servlet.FilterRegistrationBean   : Mapping filter: 'httpPutFormContentFilter' to: [/*]
2024-09-06 21:08:37.315  INFO 12294 --- [ost-startStop-1] o.s.b.w.servlet.FilterRegistrationBean   : Mapping filter: 'requestContextFilter' to: [/*]
2024-09-06 21:08:37.868  INFO 12294 --- [           main] s.w.s.m.m.a.RequestMappingHandlerMapping : Mapped "{[/api/pat/{txt}],methods=[GET]}" onto public org.springframework.http.ResponseEntity<java.lang.String> org.restscs.ScsRest.regex(java.lang.String)
2024-09-06 21:08:37.870  INFO 12294 --- [           main] s.w.s.m.m.a.RequestMappingHandlerMapping : Mapped "{[/api/title/{sex}/{title}],methods=[GET]}" onto public org.springframework.http.ResponseEntity<java.lang.String> org.restscs.ScsRest.title(java.lang.String,java.lang.String)
2024-09-06 21:08:37.871  INFO 12294 --- [           main] s.w.s.m.m.a.RequestMappingHandlerMapping : Mapped "{[/api/calc/{op}/{arg1}/{arg2}],methods=[GET]}" onto public org.springframework.http.ResponseEntity<java.lang.String> org.restscs.ScsRest.calc(java.lang.String,double,double)
2024-09-06 21:08:37.871  INFO 12294 --- [           main] s.w.s.m.m.a.RequestMappingHandlerMapping : Mapped "{[/api/cookie/{name}/{val}/{site}],methods=[GET]}" onto public org.springframework.http.ResponseEntity<java.lang.String> org.restscs.ScsRest.cookie(java.lang.String,java.lang.String,java.lang.String)
2024-09-06 21:08:37.872  INFO 12294 --- [           main] s.w.s.m.m.a.RequestMappingHandlerMapping : Mapped "{[/api/filesuffix/{directory}/{file}],methods=[GET]}" onto public org.springframework.http.ResponseEntity<java.lang.String> org.restscs.ScsRest.fileSuffix(java.lang.String,java.lang.String)
2024-09-06 21:08:37.872  INFO 12294 --- [           main] s.w.s.m.m.a.RequestMappingHandlerMapping : Mapped "{[/api/notypevar/{i}/{s}],methods=[GET]}" onto public org.springframework.http.ResponseEntity<java.lang.String> org.restscs.ScsRest.notyPevar(java.lang.Integer,java.lang.String)
2024-09-06 21:08:37.873  INFO 12294 --- [           main] s.w.s.m.m.a.RequestMappingHandlerMapping : Mapped "{[/api/ordered4/{w}/{x}/{z}/{y}],methods=[GET]}" onto public org.springframework.http.ResponseEntity<java.lang.String> org.restscs.ScsRest.ordered4(java.lang.String,java.lang.String,java.lang.String,java.lang.String)
2024-09-06 21:08:37.873  INFO 12294 --- [           main] s.w.s.m.m.a.RequestMappingHandlerMapping : Mapped "{[/api/pat/{txt}/{pat}],methods=[GET]}" onto public org.springframework.http.ResponseEntity<java.lang.String> org.restscs.ScsRest.pat(java.lang.String,java.lang.String)
2024-09-06 21:08:37.874  INFO 12294 --- [           main] s.w.s.m.m.a.RequestMappingHandlerMapping : Mapped "{[/api/text2txt/{word1}/{word2}/{word3}],methods=[GET]}" onto public org.springframework.http.ResponseEntity<java.lang.String> org.restscs.ScsRest.text2txt(java.lang.String,java.lang.String,java.lang.String)
2024-09-06 21:08:37.874  INFO 12294 --- [           main] s.w.s.m.m.a.RequestMappingHandlerMapping : Mapped "{[/api/dateparse/{dayname}/{monthname}],methods=[GET]}" onto public org.springframework.http.ResponseEntity<java.lang.String> org.restscs.ScsRest.dateParse(java.lang.String,java.lang.String)
2024-09-06 21:08:37.875  INFO 12294 --- [           main] s.w.s.m.m.a.RequestMappingHandlerMapping : Mapped "{[/api/costfuns/{i}/{s}],methods=[GET]}" onto public org.springframework.http.ResponseEntity<java.lang.String> org.restscs.ScsRest.costfuns(java.lang.Integer,java.lang.String)
2024-09-06 21:08:37.881  INFO 12294 --- [           main] s.w.s.m.m.a.RequestMappingHandlerMapping : Mapped "{[/swagger-resources/configuration/ui]}" onto public org.springframework.http.ResponseEntity<springfox.documentation.swagger.web.UiConfiguration> springfox.documentation.swagger.web.ApiResourceController.uiConfiguration()
2024-09-06 21:08:37.882  INFO 12294 --- [           main] s.w.s.m.m.a.RequestMappingHandlerMapping : Mapped "{[/swagger-resources]}" onto public org.springframework.http.ResponseEntity<java.util.List<springfox.documentation.swagger.web.SwaggerResource>> springfox.documentation.swagger.web.ApiResourceController.swaggerResources()
2024-09-06 21:08:37.884  INFO 12294 --- [           main] s.w.s.m.m.a.RequestMappingHandlerMapping : Mapped "{[/swagger-resources/configuration/security]}" onto public org.springframework.http.ResponseEntity<springfox.documentation.swagger.web.SecurityConfiguration> springfox.documentation.swagger.web.ApiResourceController.securityConfiguration()
2024-09-06 21:08:37.889  INFO 12294 --- [           main] s.w.s.m.m.a.RequestMappingHandlerMapping : Mapped "{[/error],produces=[text/html]}" onto public org.springframework.web.servlet.ModelAndView org.springframework.boot.autoconfigure.web.servlet.error.BasicErrorController.errorHtml(javax.servlet.http.HttpServletRequest,javax.servlet.http.HttpServletResponse)
2024-09-06 21:08:37.890  INFO 12294 --- [           main] s.w.s.m.m.a.RequestMappingHandlerMapping : Mapped "{[/error]}" onto public org.springframework.http.ResponseEntity<java.util.Map<java.lang.String, java.lang.Object>> org.springframework.boot.autoconfigure.web.servlet.error.BasicErrorController.error(javax.servlet.http.HttpServletRequest)
2024-09-06 21:08:38.057  INFO 12294 --- [           main] pertySourcedRequestMappingHandlerMapping : Mapped URL path [/v2/api-docs] onto method [public org.springframework.http.ResponseEntity<springfox.documentation.spring.web.json.Json> springfox.documentation.swagger2.web.Swagger2Controller.getDocumentation(java.lang.String,javax.servlet.http.HttpServletRequest)]
2024-09-06 21:08:38.187  INFO 12294 --- [           main] o.s.w.s.handler.SimpleUrlHandlerMapping  : Mapped URL path [/**/favicon.ico] onto handler of type [class org.springframework.web.servlet.resource.ResourceHttpRequestHandler]
2024-09-06 21:08:38.392  INFO 12294 --- [           main] s.w.s.m.m.a.RequestMappingHandlerAdapter : Looking for @ControllerAdvice: org.springframework.boot.web.servlet.context.AnnotationConfigServletWebServerApplicationContext@25218a4d: startup date [Fri Sep 06 21:08:34 BRT 2024]; root of context hierarchy
2024-09-06 21:08:38.488  INFO 12294 --- [           main] o.s.w.s.handler.SimpleUrlHandlerMapping  : Mapped URL path [/webjars/**] onto handler of type [class org.springframework.web.servlet.resource.ResourceHttpRequestHandler]
2024-09-06 21:08:38.488  INFO 12294 --- [           main] o.s.w.s.handler.SimpleUrlHandlerMapping  : Mapped URL path [/**] onto handler of type [class org.springframework.web.servlet.resource.ResourceHttpRequestHandler]
2024-09-06 21:08:38.786  INFO 12294 --- [           main] o.s.j.e.a.AnnotationMBeanExporter        : Registering beans for JMX exposure on startup
2024-09-06 21:08:38.800  INFO 12294 --- [           main] o.s.c.support.DefaultLifecycleProcessor  : Starting beans in phase 2147483647
2024-09-06 21:08:38.801  INFO 12294 --- [           main] d.s.w.p.DocumentationPluginsBootstrapper : Context refreshed
2024-09-06 21:08:38.842  INFO 12294 --- [           main] d.s.w.p.DocumentationPluginsBootstrapper : Found 1 custom documentation plugin(s)
2024-09-06 21:08:38.908  INFO 12294 --- [           main] s.d.s.w.s.ApiListingReferenceScanner     : Scanning for api listing references
2024-09-06 21:08:39.190  INFO 12294 --- [           main] o.s.b.w.embedded.tomcat.TomcatWebServer  : Tomcat started on port(s): 36405 (http) with context path ''
2024-09-06 21:08:39.196  INFO 12294 --- [           main] o.a.maven.surefire.booter.ForkedBooter   : Started ForkedBooter in 5.871 seconds (JVM running for 7.123)
2024-09-06 21:08:40.468  INFO 12294 --- [           main] o.s.c.support.DefaultLifecycleProcessor  : Stopping beans in phase 2147483647
[[1;31mERROR[m] [1;31mTests [0;1mrun: [0;1m9[m, Failures: 0, [1;31mErrors: [0;1;31m9[m, Skipped: 0, Time elapsed: 7.749 s[1;31m <<< FAILURE![m - in org.restscs.[1mv1_gpt35_run03_CookieTest[m
[[1;31mERROR[m] testCookieEndpoint(org.restscs.v1_gpt35_run03_CookieTest)  Time elapsed: 0.677 s  <<< ERROR!
java.net.URISyntaxException: Illegal character in path at index 34: http://localhost:36405/api/cookie/{name}/{val}/{site}
	at org.restscs.v1_gpt35_run03_CookieTest.testCookieEndpoint(v1_gpt35_run03_CookieTest.java:61)

[[1;31mERROR[m] testCostFunsEndpoint(org.restscs.v1_gpt35_run03_CookieTest)  Time elapsed: 0.006 s  <<< ERROR!
java.net.URISyntaxException: Illegal character in path at index 36: http://localhost:36405/api/costfuns/{i}/{s}
	at org.restscs.v1_gpt35_run03_CookieTest.testCostFunsEndpoint(v1_gpt35_run03_CookieTest.java:70)

[[1;31mERROR[m] testDateParseEndpoint(org.restscs.v1_gpt35_run03_CookieTest)  Time elapsed: 0.005 s  <<< ERROR!
java.net.URISyntaxException: Illegal character in path at index 37: http://localhost:36405/api/dateparse/{dayname}/{monthname}
	at org.restscs.v1_gpt35_run03_CookieTest.testDateParseEndpoint(v1_gpt35_run03_CookieTest.java:79)

[[1;31mERROR[m] testFileSuffixEndpoint(org.restscs.v1_gpt35_run03_CookieTest)  Time elapsed: 0.006 s  <<< ERROR!
java.net.URISyntaxException: Illegal character in path at index 38: http://localhost:36405/api/filesuffix/{directory}/{file}
	at org.restscs.v1_gpt35_run03_CookieTest.testFileSuffixEndpoint(v1_gpt35_run03_CookieTest.java:88)

[[1;31mERROR[m] testNoTypeVarEndpoint(org.restscs.v1_gpt35_run03_CookieTest)  Time elapsed: 0.005 s  <<< ERROR!
java.net.URISyntaxException: Illegal character in path at index 37: http://localhost:36405/api/notypevar/{i}/{s}
	at org.restscs.v1_gpt35_run03_CookieTest.testNoTypeVarEndpoint(v1_gpt35_run03_CookieTest.java:97)

[[1;31mERROR[m] testOrdered4Endpoint(org.restscs.v1_gpt35_run03_CookieTest)  Time elapsed: 0.005 s  <<< ERROR!
java.net.URISyntaxException: Illegal character in path at index 36: http://localhost:36405/api/ordered4/{w}/{x}/{z}/{y}
	at org.restscs.v1_gpt35_run03_CookieTest.testOrdered4Endpoint(v1_gpt35_run03_CookieTest.java:106)

[[1;31mERROR[m] testPatEndpoint(org.restscs.v1_gpt35_run03_CookieTest)  Time elapsed: 0.005 s  <<< ERROR!
java.net.URISyntaxException: Illegal character in path at index 31: http://localhost:36405/api/pat/{txt}
	at org.restscs.v1_gpt35_run03_CookieTest.testPatEndpoint(v1_gpt35_run03_CookieTest.java:115)

[[1;31mERROR[m] testText2TxtEndpoint(org.restscs.v1_gpt35_run03_CookieTest)  Time elapsed: 0.008 s  <<< ERROR!
java.net.URISyntaxException: Illegal character in path at index 36: http://localhost:36405/api/text2txt/{word1}/{word2}/{word3}
	at org.restscs.v1_gpt35_run03_CookieTest.testText2TxtEndpoint(v1_gpt35_run03_CookieTest.java:124)

[[1;31mERROR[m] testTitleEndpoint(org.restscs.v1_gpt35_run03_CookieTest)  Time elapsed: 0.005 s  <<< ERROR!
java.net.URISyntaxException: Illegal character in path at index 33: http://localhost:36405/api/title/{sex}/{title}
	at org.restscs.v1_gpt35_run03_CookieTest.testTitleEndpoint(v1_gpt35_run03_CookieTest.java:133)

2024-09-06 21:08:40.533  INFO 12294 --- [       Thread-4] ConfigServletWebServerApplicationContext : Closing org.springframework.boot.web.servlet.context.AnnotationConfigServletWebServerApplicationContext@25218a4d: startup date [Fri Sep 06 21:08:34 BRT 2024]; root of context hierarchy
2024-09-06 21:08:40.537  INFO 12294 --- [       Thread-4] o.s.c.support.DefaultLifecycleProcessor  : Stopping beans in phase 2147483647
2024-09-06 21:08:40.538  INFO 12294 --- [       Thread-4] o.s.j.e.a.AnnotationMBeanExporter        : Unregistering JMX-exposed beans on shutdown
[[1;34mINFO[m] 
[[1;34mINFO[m] Results:
[[1;34mINFO[m] 
[[1;31mERROR[m] [1;31mErrors: [m
[[1;31mERROR[m] [1;31m  v1_gpt35_run03_CookieTest.testCookieEndpoint:61 » URISyntax Illegal character ...[m
[[1;31mERROR[m] [1;31m  v1_gpt35_run03_CookieTest.testCostFunsEndpoint:70 » URISyntax Illegal characte...[m
[[1;31mERROR[m] [1;31m  v1_gpt35_run03_CookieTest.testDateParseEndpoint:79 » URISyntax Illegal charact...[m
[[1;31mERROR[m] [1;31m  v1_gpt35_run03_CookieTest.testFileSuffixEndpoint:88 » URISyntax Illegal charac...[m
[[1;31mERROR[m] [1;31m  v1_gpt35_run03_CookieTest.testNoTypeVarEndpoint:97 » URISyntax Illegal charact...[m
[[1;31mERROR[m] [1;31m  v1_gpt35_run03_CookieTest.testOrdered4Endpoint:106 » URISyntax Illegal charact...[m
[[1;31mERROR[m] [1;31m  v1_gpt35_run03_CookieTest.testPatEndpoint:115 » URISyntax Illegal character in...[m
[[1;31mERROR[m] [1;31m  v1_gpt35_run03_CookieTest.testText2TxtEndpoint:124 » URISyntax Illegal charact...[m
[[1;31mERROR[m] [1;31m  v1_gpt35_run03_CookieTest.testTitleEndpoint:133 » URISyntax Illegal character ...[m
[[1;34mINFO[m] 
[[1;31mERROR[m] [1;31mTests run: 9, Failures: 0, Errors: 9, Skipped: 0[m
[[1;34mINFO[m] 
[[1;34mINFO[m] [1m------------------------------------------------------------------------[m
[[1;34mINFO[m] [1;31mBUILD FAILURE[m
[[1;34mINFO[m] [1m------------------------------------------------------------------------[m
[[1;34mINFO[m] Total time:  12.223 s
[[1;34mINFO[m] Finished at: 2024-09-06T21:08:41-03:00
[[1;34mINFO[m] [1m------------------------------------------------------------------------[m
[[1;31mERROR[m] Failed to execute goal [32morg.apache.maven.plugins:maven-surefire-plugin:2.22.0:test[m [1m(default-test)[m on project [36mevomaster-benchmark-cs-rest-artificial-scs[m: [1;31mThere are test failures.[m
[[1;31mERROR[m] [1;31m[m
[[1;31mERROR[m] [1;31mPlease refer to /media/rincon/63999417195/eclipse-workspace/EMB-master/jdk_8_maven/cs/rest/artificial/scs/target/surefire-reports for the individual test results.[m
[[1;31mERROR[m] [1;31mPlease refer to dump files (if any exist) [date]-jvmRun[N].dump, [date].dumpstream and [date]-jvmRun[N].dumpstream.[m
[[1;31mERROR[m] -> [1m[Help 1][m
[[1;31mERROR[m] 
[[1;31mERROR[m] To see the full stack trace of the errors, re-run Maven with the [1m-e[m switch.
[[1;31mERROR[m] Re-run Maven using the [1m-X[m switch to enable full debug logging.
[[1;31mERROR[m] 
[[1;31mERROR[m] For more information about the errors and possible solutions, please read the following articles:
[[1;31mERROR[m] [1m[Help 1][m http://cwiki.apache.org/confluence/display/MAVEN/MojoFailureException

#####
