Correct the test code delimited by ***** according to the error messages delimited by ##### and generate another complete code in JUnit 5 format. The response must contain only Java code in JUnit 5 format.

Keep these five instructions for this generated test code:

Instruction 1: Keet this package line to generated test code file:
package market;

Instruction 2: Keep the following Java imports to generated test code file:
import  org.junit.jupiter.api.AfterAll;
import  org.junit.jupiter.api.BeforeAll;
import  org.junit.jupiter.api.BeforeEach;
import  org.junit.jupiter.api.Test;
import  org.junit.jupiter.api.Timeout;
import static org.junit.jupiter.api.Assertions.*;
import  java.util.Map;
import  java.util.List;
import static org.evomaster.client.java.controller.api.EMTestUtils.*;
import  org.evomaster.client.java.controller.SutHandler;
import  io.restassured.RestAssured;
import static io.restassured.RestAssured.given;
import  io.restassured.response.ValidatableResponse;
import static org.evomaster.client.java.sql.dsl.SqlDsl.sql;
import  org.evomaster.client.java.controller.api.dto.database.operations.InsertionResultsDto;
import  org.evomaster.client.java.controller.api.dto.database.operations.InsertionDto;
import static org.hamcrest.Matchers.*;
import  io.restassured.config.JsonConfig;
import  io.restassured.path.json.config.JsonPathConfig;
import static io.restassured.config.RedirectConfig.redirectConfig;
import static org.evomaster.client.java.controller.contentMatchers.NumberMatcher.*;
import static org.evomaster.client.java.controller.contentMatchers.StringMatcher.*;
import static org.evomaster.client.java.controller.contentMatchers.SubStringMatcher.*;
import static org.evomaster.client.java.controller.expect.ExpectationHandler.expectationHandler;
import  org.evomaster.client.java.controller.expect.ExpectationHandler;
import  io.restassured.path.json.JsonPath;
import  java.util.Arrays;

Instruction 3: Keep the class name in this point (between the imports at instruction 2 and instruction 4)

Instruction 4: Keep these variables in the generated test code:
private static final SutHandler controller = new em.embedded.market.EmbeddedEvoMasterController();
private static String baseUrlOfSut;

Instruction 5: Keep the following setup and teardown methods in generated test code file:
@BeforeAll
public static void initClass() {
    controller.setupForGeneratedTest();
    baseUrlOfSut = controller.startSut();
    controller.registerOrExecuteInitSqlCommandsIfNeeded();
    assertNotNull(baseUrlOfSut);
    RestAssured.enableLoggingOfRequestAndResponseIfValidationFails();
    RestAssured.useRelaxedHTTPSValidation();
    RestAssured.urlEncodingEnabled = false;
    RestAssured.config = RestAssured.config()
        .jsonConfig(JsonConfig.jsonConfig().numberReturnType(JsonPathConfig.NumberReturnType.DOUBLE))
        .redirect(redirectConfig().followRedirects(false));
}


@AfterAll
public static void tearDown() {
    controller.stopSut();
}


@BeforeEach
public void initTest() {
    controller.resetDatabase(Arrays.asList("USER_ROLE","CUSTOMER_ORDER","CART_ITEM","PRODUCT","CART","CONTACTS"));
    controller.resetStateOfSUT();
}

*****

package market;

import org.junit.jupiter.api.AfterAll;
import org.junit.jupiter.api.BeforeAll;
import org.junit.jupiter.api.BeforeEach;
import org.junit.jupiter.api.Test;
import static org.junit.jupiter.api.Assertions.*;
import java.util.Map;
import java.util.List;
import static org.evomaster.client.java.controller.api.EMTestUtils.*;
import org.evomaster.client.java.controller.SutHandler;
import io.restassured.RestAssured;
import static io.restassured.RestAssured.given;
import io.restassured.response.ValidatableResponse;
import static org.hamcrest.Matchers.*;
import io.restassured.config.JsonConfig;
import io.restassured.path.json.config.JsonPathConfig;
import static io.restassured.config.RedirectConfig.redirectConfig;
import static org.evomaster.client.java.controller.contentMatchers.NumberMatcher.*;
import static org.evomaster.client.java.controller.contentMatchers.StringMatcher.*;
import static org.evomaster.client.java.controller.contentMatchers.SubStringMatcher.*;
import static org.evomaster.client.java.controller.expect.ExpectationHandler.expectationHandler;
import org.evomaster.client.java.controller.expect.ExpectationHandler;
import io.restassured.path.json.JsonPath;
import java.util.Arrays;
import static io.restassured.module.jsv.JsonSchemaValidator.matchesJsonSchemaInClasspath;

public class run01_ProductsRestControllerTest {

    private static final SutHandler controller = new em.embedded.market.EmbeddedEvoMasterController();
    private static String baseUrlOfSut;

    @BeforeAll
    public static void initClass() {
        controller.setupForGeneratedTest();
        baseUrlOfSut = controller.startSut();
        controller.registerOrExecuteInitSqlCommandsIfNeeded();
        assertNotNull(baseUrlOfSut);
        RestAssured.enableLoggingOfRequestAndResponseIfValidationFails();
        RestAssured.useRelaxedHTTPSValidation();
        RestAssured.urlEncodingEnabled = false;
        RestAssured.config = RestAssured.config()
            .jsonConfig(JsonConfig.jsonConfig().numberReturnType(JsonPathConfig.NumberReturnType.DOUBLE))
            .redirect(redirectConfig().followRedirects(false));
    }

    @AfterAll
    public static void tearDown() {
        controller.stopSut();
    }

    @BeforeEach
    public void initTest() {
        controller.resetDatabase(Arrays.asList("USER_ROLE","CUSTOMER_ORDER","CART_ITEM","PRODUCT","CART","CONTACTS"));
        controller.resetStateOfSUT();
    }

    @Test
    public void testGetProducts() {
        given()
            .baseUri(baseUrlOfSut)
            .when()
            .get("/products")
            .then()
            .statusCode(200)
            .body("size()", greaterThan(0))
            .body("find { it.productId }.productId", notNullValue())
            .body("find { it.alcohol }.alcohol", allOf(greaterThan(1.0), lessThan(96.0)))
            .body("find { it.price }.price", greaterThan(0.0));
    }

    @Test
    public void testGetProduct() {
        // Assuming there's a product with ID 1 in the database for the purpose of this test
        given()
            .baseUri(baseUrlOfSut)
            .pathParam("productId", 1)
            .when()
            .get("/products/{productId}")
            .then()
            .statusCode(200)
            .body("productId", equalTo(1))
            .body("links.self.href", containsString("/products/1"));
    }

    @Test
    public void testGetProductNotFound() {
        // Testing with a non-existing product ID
        given()
            .baseUri(baseUrlOfSut)
            .pathParam("productId", 9999)  // Assuming 9999 is an invalid product ID
            .when()
            .get("/products/{productId}")
            .then()
            .statusCode(404);
    }

    @Test
    public void testProductSchemaValidation() {
        // Validate schema conformance for the first product returned
        given()
            .baseUri(baseUrlOfSut)
            .when()
            .get("/products")
            .then()
            .statusCode(200)
            .body("size()", greaterThan(0))
            .body("[0]", matchesJsonSchemaInClasspath("product-schema.json"));
    }
}

*****
#####
[[1;34mINFO[m] Scanning for projects...
[[1;34mINFO[m] 
[[1;34mINFO[m] [1m---------------------< [0;36mnet.lukyanets:market-rest[0;1m >----------------------[m
[[1;34mINFO[m] [1mBuilding market-rest 0.1.2[m
[[1;34mINFO[m] [1m--------------------------------[ jar ]---------------------------------[m
[[1;33mWARNING[m] The POM for com.sun.xml.bind:jaxb-osgi:jar:2.2.10 is invalid, transitive dependencies (if any) will not be available, enable debug logging for more details
[[1;34mINFO[m] 
[[1;34mINFO[m] [1m--- [0;32mmaven-clean-plugin:2.5:clean[m [1m(default-clean)[m @ [36mmarket-rest[0;1m ---[m
[[1;34mINFO[m] Deleting /media/rincon/63999417195/eclipse-workspace/EMB-master/jdk_11_maven/cs/rest-gui/market/market-rest/target
[[1;34mINFO[m] 
[[1;34mINFO[m] [1m--- [0;32mjacoco-maven-plugin:0.8.7:prepare-agent[m [1m(default)[m @ [36mmarket-rest[0;1m ---[m
[[1;34mINFO[m] argLine set to -javaagent:/home/rincon/.m2/repository/org/jacoco/org.jacoco.agent/0.8.7/org.jacoco.agent-0.8.7-runtime.jar=destfile=/media/rincon/63999417195/eclipse-workspace/EMB-master/jdk_11_maven/cs/rest-gui/market/market-rest/target/jacoco.exec
[[1;34mINFO[m] 
[[1;34mINFO[m] [1m--- [0;32mspring-boot-maven-plugin:2.4.3:build-info[m [1m(default)[m @ [36mmarket-rest[0;1m ---[m
[[1;34mINFO[m] 
[[1;34mINFO[m] [1m--- [0;32mmaven-resources-plugin:2.6:resources[m [1m(default-resources)[m @ [36mmarket-rest[0;1m ---[m
[[1;34mINFO[m] Using 'UTF-8' encoding to copy filtered resources.
[[1;34mINFO[m] Copying 3 resources
[[1;34mINFO[m] 
[[1;34mINFO[m] [1m--- [0;32mmaven-compiler-plugin:3.8.0:compile[m [1m(default-compile)[m @ [36mmarket-rest[0;1m ---[m
[[1;34mINFO[m] Changes detected - recompiling the module!
[[1;34mINFO[m] Compiling 11 source files to /media/rincon/63999417195/eclipse-workspace/EMB-master/jdk_11_maven/cs/rest-gui/market/market-rest/target/classes
[[1;34mINFO[m] 
[[1;34mINFO[m] [1m--- [0;32mjacoco-maven-plugin:0.8.7:prepare-agent[m [1m(default)[m @ [36mmarket-rest[0;1m ---[m
[[1;34mINFO[m] argLine set to -javaagent:/home/rincon/.m2/repository/org/jacoco/org.jacoco.agent/0.8.7/org.jacoco.agent-0.8.7-runtime.jar=destfile=/media/rincon/63999417195/eclipse-workspace/EMB-master/jdk_11_maven/cs/rest-gui/market/market-rest/target/jacoco.exec
[[1;34mINFO[m] 
[[1;34mINFO[m] [1m--- [0;32mspring-boot-maven-plugin:2.4.3:build-info[m [1m(default)[m @ [36mmarket-rest[0;1m ---[m
[[1;34mINFO[m] 
[[1;34mINFO[m] [1m--- [0;32mmaven-resources-plugin:2.6:resources[m [1m(default-resources)[m @ [36mmarket-rest[0;1m ---[m
[[1;34mINFO[m] Using 'UTF-8' encoding to copy filtered resources.
[[1;34mINFO[m] Copying 3 resources
[[1;34mINFO[m] 
[[1;34mINFO[m] [1m--- [0;32mmaven-compiler-plugin:3.8.0:compile[m [1m(default-compile)[m @ [36mmarket-rest[0;1m ---[m
[[1;34mINFO[m] Nothing to compile - all classes are up to date
[[1;34mINFO[m] 
[[1;34mINFO[m] [1m--- [0;32mmaven-resources-plugin:2.6:testResources[m [1m(default-testResources)[m @ [36mmarket-rest[0;1m ---[m
[[1;34mINFO[m] Using 'UTF-8' encoding to copy filtered resources.
[[1;34mINFO[m] skip non existing resourceDirectory /media/rincon/63999417195/eclipse-workspace/EMB-master/jdk_11_maven/cs/rest-gui/market/market-rest/src/test/resources
[[1;34mINFO[m] 
[[1;34mINFO[m] [1m--- [0;32mmaven-compiler-plugin:3.8.0:testCompile[m [1m(default-testCompile)[m @ [36mmarket-rest[0;1m ---[m
[[1;34mINFO[m] Changes detected - recompiling the module!
[[1;34mINFO[m] Compiling 1 source file to /media/rincon/63999417195/eclipse-workspace/EMB-master/jdk_11_maven/cs/rest-gui/market/market-rest/target/test-classes
[[1;34mINFO[m] 
[[1;34mINFO[m] [1m--- [0;32mjacoco-maven-plugin:0.8.7:prepare-agent[m [1m(default)[m @ [36mmarket-rest[0;1m ---[m
[[1;34mINFO[m] argLine set to -javaagent:/home/rincon/.m2/repository/org/jacoco/org.jacoco.agent/0.8.7/org.jacoco.agent-0.8.7-runtime.jar=destfile=/media/rincon/63999417195/eclipse-workspace/EMB-master/jdk_11_maven/cs/rest-gui/market/market-rest/target/jacoco.exec
[[1;34mINFO[m] 
[[1;34mINFO[m] [1m--- [0;32mspring-boot-maven-plugin:2.4.3:build-info[m [1m(default)[m @ [36mmarket-rest[0;1m ---[m
[[1;34mINFO[m] 
[[1;34mINFO[m] [1m--- [0;32mmaven-resources-plugin:2.6:resources[m [1m(default-resources)[m @ [36mmarket-rest[0;1m ---[m
[[1;34mINFO[m] Using 'UTF-8' encoding to copy filtered resources.
[[1;34mINFO[m] Copying 3 resources
[[1;34mINFO[m] 
[[1;34mINFO[m] [1m--- [0;32mmaven-compiler-plugin:3.8.0:compile[m [1m(default-compile)[m @ [36mmarket-rest[0;1m ---[m
[[1;34mINFO[m] Nothing to compile - all classes are up to date
[[1;34mINFO[m] 
[[1;34mINFO[m] [1m--- [0;32mmaven-resources-plugin:2.6:testResources[m [1m(default-testResources)[m @ [36mmarket-rest[0;1m ---[m
[[1;34mINFO[m] Using 'UTF-8' encoding to copy filtered resources.
[[1;34mINFO[m] skip non existing resourceDirectory /media/rincon/63999417195/eclipse-workspace/EMB-master/jdk_11_maven/cs/rest-gui/market/market-rest/src/test/resources
[[1;34mINFO[m] 
[[1;34mINFO[m] [1m--- [0;32mmaven-compiler-plugin:3.8.0:testCompile[m [1m(default-testCompile)[m @ [36mmarket-rest[0;1m ---[m
[[1;34mINFO[m] Nothing to compile - all classes are up to date
[[1;34mINFO[m] 
[[1;34mINFO[m] [1m--- [0;32mmaven-surefire-plugin:2.22.0:test[m [1m(default-test)[m @ [36mmarket-rest[0;1m ---[m
[[1;34mINFO[m] 
[[1;34mINFO[m] -------------------------------------------------------
[[1;34mINFO[m]  T E S T S
[[1;34mINFO[m] -------------------------------------------------------
[[1;34mINFO[m] Running market.[1mrun01_ProductsRestControllerTest[m

  .   ____          _            __ _ _
 /\\ / ___'_ __ _ _(_)_ __  __ _ \ \ \ \
( ( )\___ | '_ | '_| | '_ \/ _` | \ \ \ \
 \\/  ___)| |_)| | | | | || (_| |  ) ) ) )
  '  |____| .__|_| |_|_| |_\__, | / / / /
 =========|_|==============|___/=/_/_/_/
 :: Spring Boot ::                (v2.4.3)

2024-08-22 16:18:48,394 INFO  [background-preinit] o.h.v.i.u.Version - HV000001: Hibernate Validator 6.1.7.Final
2024-08-22 16:18:48,498 INFO  [main] o.a.m.s.b.ForkedBooter - Starting ForkedBooter v2.22.0 using Java 11.0.20 on IFTO-PROBOOK with PID 8653 (started by rincon in /media/rincon/63999417195/eclipse-workspace/EMB-master/jdk_11_maven/cs/rest-gui/market/market-rest)
2024-08-22 16:18:48,506 INFO  [main] o.a.m.s.b.ForkedBooter - No active profile set, falling back to default profiles: default
2024-08-22 16:18:49,313 WARN  [main] o.s.b.c.c.ConfigDataEnvironment - Property 'spring.profiles' imported from location 'class path resource [application.yml]' is invalid and should be replaced with 'spring.config.activate.on-profile' [origin: class path resource [application.yml] - 34:13]
2024-08-22 16:18:49,313 WARN  [main] o.s.b.c.c.ConfigDataEnvironment - Property 'spring.profiles' imported from location 'class path resource [application.yml]' is invalid and should be replaced with 'spring.config.activate.on-profile' [origin: class path resource [application.yml] - 24:13]
2024-08-22 16:18:51,193 INFO  [main] o.s.d.r.c.RepositoryConfigurationDelegate - Bootstrapping Spring Data JPA repositories in DEFAULT mode.
2024-08-22 16:18:51,351 INFO  [main] o.s.d.r.c.RepositoryConfigurationDelegate - Finished Spring Data repository scanning in 143 ms. Found 8 JPA repository interfaces.
2024-08-22 16:18:51,974 INFO  [main] o.s.c.s.PostProcessorRegistrationDelegate$BeanPostProcessorChecker - Bean 'market.DataConfig' of type [market.DataConfig$$EnhancerBySpringCGLIB$$d1d82224] is not eligible for getting processed by all BeanPostProcessors (for example: not eligible for auto-proxying)
2024-08-22 16:18:52,182 INFO  [main] o.s.c.s.PostProcessorRegistrationDelegate$BeanPostProcessorChecker - Bean 'org.springframework.security.access.expression.method.DefaultMethodSecurityExpressionHandler@578c33ce' of type [org.springframework.security.access.expression.method.DefaultMethodSecurityExpressionHandler] is not eligible for getting processed by all BeanPostProcessors (for example: not eligible for auto-proxying)
2024-08-22 16:18:52,193 INFO  [main] o.s.c.s.PostProcessorRegistrationDelegate$BeanPostProcessorChecker - Bean 'methodSecurityMetadataSource' of type [org.springframework.security.access.method.DelegatingMethodSecurityMetadataSource] is not eligible for getting processed by all BeanPostProcessors (for example: not eligible for auto-proxying)
2024-08-22 16:18:52,786 INFO  [main] o.s.b.w.e.t.TomcatWebServer - Tomcat initialized with port(s): 0 (http)
2024-08-22 16:18:52,811 INFO  [main] o.a.c.h.Http11NioProtocol - Initializing ProtocolHandler ["http-nio-auto-1"]
2024-08-22 16:18:52,812 INFO  [main] o.a.c.c.StandardService - Starting service [Tomcat]
2024-08-22 16:18:52,813 INFO  [main] o.a.c.c.StandardEngine - Starting Servlet engine: [Apache Tomcat/9.0.43]
2024-08-22 16:18:52,974 INFO  [main] o.a.c.c.C.[.[.[/] - Initializing Spring embedded WebApplicationContext
2024-08-22 16:18:52,974 INFO  [main] o.s.b.w.s.c.ServletWebServerApplicationContext - Root WebApplicationContext: initialization completed in 3656 ms
2024-08-22 16:18:53,195 INFO  [main] c.z.h.HikariDataSource - HikariPool-1 - Starting...
2024-08-22 16:18:53,757 INFO  [main] c.z.h.HikariDataSource - HikariPool-1 - Start completed.
2024-08-22 16:18:54,053 INFO  [main] o.h.j.i.u.LogHelper - HHH000204: Processing PersistenceUnitInfo [name: default]
2024-08-22 16:18:54,176 INFO  [main] o.h.Version - HHH000412: Hibernate ORM core version 5.4.28.Final
2024-08-22 16:18:54,421 INFO  [main] o.h.a.c.Version - HCANN000001: Hibernate Commons Annotations {5.1.2.Final}
2024-08-22 16:18:54,766 INFO  [main] o.h.d.Dialect - HHH000400: Using dialect: org.hibernate.dialect.H2Dialect
2024-08-22 16:18:55,230 WARN  [main] o.h.b.i.InFlightMetadataCollectorImpl - HHH000069: Duplicate generator name gen
2024-08-22 16:18:55,234 WARN  [main] o.h.b.i.InFlightMetadataCollectorImpl - HHH000069: Duplicate generator name gen
2024-08-22 16:18:56,238 INFO  [main] o.h.e.t.j.p.i.JtaPlatformInitiator - HHH000490: Using JtaPlatform implementation: [org.hibernate.engine.transaction.jta.platform.internal.NoJtaPlatform]
2024-08-22 16:18:56,251 INFO  [main] o.s.o.j.LocalContainerEntityManagerFactoryBean - Initialized JPA EntityManagerFactory for persistence unit 'default'
2024-08-22 16:18:57,672 WARN  [main] o.s.b.a.o.j.JpaBaseConfiguration$JpaWebConfiguration - spring.jpa.open-in-view is enabled by default. Therefore, database queries may be performed during view rendering. Explicitly configure spring.jpa.open-in-view to disable this warning
2024-08-22 16:18:58,884 INFO  [main] o.s.s.w.DefaultSecurityFilterChain - Will secure any request with [org.springframework.security.web.context.request.async.WebAsyncManagerIntegrationFilter@4b8c4c74, org.springframework.security.web.context.SecurityContextPersistenceFilter@59ca0052, org.springframework.security.web.header.HeaderWriterFilter@636a02d3, org.springframework.security.web.authentication.logout.LogoutFilter@5dbe492a, org.springframework.security.web.authentication.www.BasicAuthenticationFilter@2701c6b6, org.springframework.security.web.savedrequest.RequestCacheAwareFilter@7c64ff25, org.springframework.security.web.servletapi.SecurityContextHolderAwareRequestFilter@16bd7428, org.springframework.security.web.authentication.AnonymousAuthenticationFilter@414b8b11, org.springframework.security.web.session.SessionManagementFilter@38aa83a0, org.springframework.security.web.access.ExceptionTranslationFilter@71677d98, org.springframework.security.web.access.intercept.FilterSecurityInterceptor@3afd8563]
2024-08-22 16:18:59,077 INFO  [main] o.s.s.c.ThreadPoolTaskExecutor - Initializing ExecutorService 'applicationTaskExecutor'
2024-08-22 16:18:59,619 INFO  [main] o.a.c.h.Http11NioProtocol - Starting ProtocolHandler ["http-nio-auto-1"]
2024-08-22 16:18:59,657 INFO  [main] o.s.b.w.e.t.TomcatWebServer - Tomcat started on port(s): 43071 (http) with context path ''
2024-08-22 16:19:00,387 INFO  [main] o.a.m.s.b.ForkedBooter - Started ForkedBooter in 12.971 seconds (JVM running for 15.786)
2024-08-22 16:19:02,618 INFO  [http-nio-auto-1-exec-1] o.a.c.c.C.[.[.[/] - Initializing Spring DispatcherServlet 'dispatcherServlet'
2024-08-22 16:19:02,619 INFO  [http-nio-auto-1-exec-1] o.s.w.s.DispatcherServlet - Initializing Servlet 'dispatcherServlet'
2024-08-22 16:19:02,623 INFO  [http-nio-auto-1-exec-1] o.s.w.s.DispatcherServlet - Completed initialization in 4 ms
2024-08-22 16:19:04,487 WARN  [http-nio-auto-1-exec-2] m.r.e.RestExceptionHandler - RestErrorResponse{message='Requested entity doesn't exist', entityName='ProductDTO', description='uri=/products/9999', fieldErrors=[{field='id', message='No instance with this id'}]}
Request method:	GET
Request URI:	http://localhost:43071/products/1
Proxy:			<none>
Request params:	<none>
Query params:	<none>
Form params:	<none>
Path params:	productId=1
Headers:		Accept=*/*
Cookies:		<none>
Multiparts:		<none>
Body:			<none>

HTTP/1.1 200 
X-Content-Type-Options: nosniff
X-XSS-Protection: 1; mode=block
Cache-Control: no-cache, no-store, max-age=0, must-revalidate
Pragma: no-cache
Expires: 0
Content-Type: application/hal+json
Transfer-Encoding: chunked
Date: Thu, 22 Aug 2024 19:19:04 GMT
Keep-Alive: timeout=60
Connection: keep-alive

{
    "productId": 1,
    "distillery": "Ardbeg",
    "name": "Ten",
    "price": 4420.0,
    "age": 10,
    "volume": 700,
    "alcohol": 46.0,
    "description": "Ten Years Old is the basis of the Ardbeg range. After 10 years of maturation in ex-bourbon casks, the whiskey bottled at 46% ABV without cold filtering. The characteristic peat, although clearly present but in perfect balance with the natural sweetness and not predominant in the taste.",
    "available": false,
    "_links": {
        "All products": {
            "href": "http://localhost:43071/products"
        }
    }
}
2024-08-22 16:19:05,082 INFO  [main] o.a.c.h.Http11NioProtocol - Pausing ProtocolHandler ["http-nio-auto-1"]
2024-08-22 16:19:05,083 INFO  [main] o.a.c.c.StandardService - Stopping service [Tomcat]
2024-08-22 16:19:05,085 INFO  [main] o.a.c.c.C.[.[.[/] - Destroying Spring FrameworkServlet 'dispatcherServlet'
2024-08-22 16:19:05,089 INFO  [main] o.a.c.h.Http11NioProtocol - Stopping ProtocolHandler ["http-nio-auto-1"]
2024-08-22 16:19:05,094 INFO  [main] o.a.c.h.Http11NioProtocol - Destroying ProtocolHandler ["http-nio-auto-1"]
[[1;31mERROR[m] [1;31mTests [0;1mrun: [0;1m4[m, [1;31mFailures: [0;1;31m1[m, [1;31mErrors: [0;1;31m1[m, Skipped: 0, Time elapsed: 19.268 s[1;31m <<< FAILURE![m - in market.[1mrun01_ProductsRestControllerTest[m
[[1;31mERROR[m] testProductSchemaValidation  Time elapsed: 2.957 s  <<< ERROR!
java.lang.IllegalArgumentException: Schema to use cannot be null
	at market.run01_ProductsRestControllerTest.testProductSchemaValidation(run01_ProductsRestControllerTest.java:109)

[[1;31mERROR[m] testGetProduct  Time elapsed: 0.194 s  <<< FAILURE!
java.lang.AssertionError: 
1 expectation failed.
JSON path links.self.href doesn't match.
Expected: a string containing "/products/1"
  Actual: null

	at market.run01_ProductsRestControllerTest.testGetProduct(run01_ProductsRestControllerTest.java:84)

2024-08-22 16:19:05,169 INFO  [SpringContextShutdownHook] o.s.s.c.ThreadPoolTaskExecutor - Shutting down ExecutorService 'applicationTaskExecutor'
2024-08-22 16:19:05,191 INFO  [SpringContextShutdownHook] o.s.o.j.LocalContainerEntityManagerFactoryBean - Closing JPA EntityManagerFactory for persistence unit 'default'
2024-08-22 16:19:05,193 INFO  [SpringContextShutdownHook] c.z.h.HikariDataSource - HikariPool-1 - Shutdown initiated...
2024-08-22 16:19:05,198 INFO  [SpringContextShutdownHook] c.z.h.HikariDataSource - HikariPool-1 - Shutdown completed.
[[1;34mINFO[m] 
[[1;34mINFO[m] Results:
[[1;34mINFO[m] 
[[1;31mERROR[m] [1;31mFailures: [m
[[1;31mERROR[m] [1;31m  run01_ProductsRestControllerTest.testGetProduct:84 1 expectation failed.
JSON path links.self.href doesn't match.
Expected: a string containing "/products/1"
  Actual: null
[m
[[1;31mERROR[m] [1;31mErrors: [m
[[1;31mERROR[m] [1;31m  run01_ProductsRestControllerTest.testProductSchemaValidation:109 » IllegalArgument[m
[[1;34mINFO[m] 
[[1;31mERROR[m] [1;31mTests run: 4, Failures: 1, Errors: 1, Skipped: 0[m
[[1;34mINFO[m] 
[[1;34mINFO[m] [1m------------------------------------------------------------------------[m
[[1;34mINFO[m] [1;31mBUILD FAILURE[m
[[1;34mINFO[m] [1m------------------------------------------------------------------------[m
[[1;34mINFO[m] Total time:  25.874 s
[[1;34mINFO[m] Finished at: 2024-08-22T16:19:05-03:00
[[1;34mINFO[m] [1m------------------------------------------------------------------------[m
[[1;31mERROR[m] Failed to execute goal [32morg.apache.maven.plugins:maven-surefire-plugin:2.22.0:test[m [1m(default-test)[m on project [36mmarket-rest[m: [1;31mThere are test failures.[m
[[1;31mERROR[m] [1;31m[m
[[1;31mERROR[m] [1;31mPlease refer to /media/rincon/63999417195/eclipse-workspace/EMB-master/jdk_11_maven/cs/rest-gui/market/market-rest/target/surefire-reports for the individual test results.[m
[[1;31mERROR[m] [1;31mPlease refer to dump files (if any exist) [date]-jvmRun[N].dump, [date].dumpstream and [date]-jvmRun[N].dumpstream.[m
[[1;31mERROR[m] -> [1m[Help 1][m
[[1;31mERROR[m] 
[[1;31mERROR[m] To see the full stack trace of the errors, re-run Maven with the [1m-e[m switch.
[[1;31mERROR[m] Re-run Maven using the [1m-X[m switch to enable full debug logging.
[[1;31mERROR[m] 
[[1;31mERROR[m] For more information about the errors and possible solutions, please read the following articles:
[[1;31mERROR[m] [1m[Help 1][m http://cwiki.apache.org/confluence/display/MAVEN/MojoFailureException

#####
